105," D. Rifuggiato, G. Cuttone, L. Calabretta, L. Celona, F. Chines, L. Cosentino, P. Finocchiaro, A. Pappalardo, M. Re and A. Rovelli, INFN-LNS","First Radioactive Beam With Excyt: Role Of The K800 Superconducting Cyclotron",
110,"W.L.Zhan, J.W.Xia, H.W.Zhao, Y.J.Yuan, K.D.Man, P.Yuan, D.Q.Gao, X.T.Yang, M.T.Song, G.Q.Xiao,W.M.Qiao, X.H.Cai, X.D.Yang, B.W.Wei, and HIRFL-CSR Group Institute of Modern Physics, CAS, 730000, Lanzhou, China","Commissioning Of Csr In Lanzhou",
116,"A. Denker, P. Arndt, W. Busse, H. Homeyer, W. Pelzer, C. Rethfeldt, J. Röhrich  Hahn-Meitner-Institut, Berlin, Germany"," Status Of Isl: Converting A Multi-Purpose Accelerator To A Dedicated Proton Therapy Facility ",
119,"Bhaskar Mukherjee and Joseph Khachan, Department of Applied and Plasma Physics (A28), University of Sydney, NSW 2006, Australia"," Component Activation Of A High Current Radioisotope Production Medical Cyclotron ",
122,"R. Gebel, R. Brings, O. Felden And R. Maier, Forschungszentrum Jülich GmbH, Germany"," Operation Of The Injector Cyclotron Julic For The Cooler Synchrotron Cosy/Jülich ",
125,"K. Hatanaka, M. Fukuda, M. Kibayashi, S. Morinobu, K. Nagayama, H. Okamura, T. Saito, A. Tamii, H. Tamura And T. Yorita , RCNP, Osaka University, 10-1 Mihogaoka, Ibaraki, Osaka 567-0047, Japan","Development Of The Rcnp Cyclotron Cascade ",
128,"P. Heikkinen, JYFL, Jyväskylä, Finland","New Mcc30/15 Cyclotron For The Jyfl Accelerator Laboratory ",
131,"S. Kurashima, S. Okumura, N. Miyawaki, I. Ishibori, K. Yoshida, T. Satoh, H. Kashiwagi, Y. Yuri, T. Agematsu, T. Nara, T. Kamiya, W. Yokota, M. Oikawa And M. Fukuda,  Japan Atomic Energy Agency, 1233 Watanuki, Takasaki, Gunma 370-1292, Japan","Developments At Jaea Avf Cyclotron Facility For Heavy-Ion Microbeam",
134,"R. Risler, S. Banerian, R.C. Emery, I. Kalet, G.E. Laramore And D. Reid, University of Washington Medical Center, Seattle, WA 98195-6043, USA","Recent Improvements And Operational Status Of The Seattle Clinical Cyclotron Facility ",
137,"T. Honma, S. Hojo, Y. Sakamoto, T. Endo, A. Sugiura, T. Fukumura, T. Kanai,  National Institute of Radiological Science, Japan, T. Okada, K. Komatsu, T. Kamiya, Accelerator Engineering Corporation, Japan, J. Kanakura M. Sano And Y. Fukumoto, Sumitomo Heavy Industries, Japan","Recent Status Of The Nirs Cyclotron Facility",
140,"J.L. Conradie, P.J. Celliers, J.G. De Villiers, J.L.G. Delsink, H. Du Plessis, J.H. Du Toit, R.E.F. Fenemore, D.T. Fourie, I.H. Kohler, C. Lussi, P.T. Mansfield, H. Mostert, G.S. Muller, G.S.Price, P.F. Rohwer, M. Sakildien, R.W. Thomae, M.J. Van Niekerk, P.A. Van Schalkwyk, iThemba LABS, Z. Kormány, ATOMKI, P.O. Box 51, H-4001 Debrecen, Hungary, J. Dietrich, T. Weis, Fachbereich Physik, University Dortmund, D-44221 Dortmund, Germany, S. Adam, D. Goetz And P.A. Schmelzbach Paul Scherrer Institut, CH-5232 Villigen, Switzerland","Improvements To The Ithemba Labs Cyclotron Facilities ",
143,"I. Bylinskii, R.A. Baartman, G. Dutto, K. Fong, A. Hurst, M. Laverty, C. Mark, F. Mammarella, M. Mcdonald, A.K. Mitra, M. Mouat, D. Pearce, K. Reiniger, R. Ruegg, P. Schmor, I. Sekachev, M. Stenning And V.A. Verzilov , TRIUMF, Vancouver, Canada","Triumf 500 Mev Cyclotron Refurbishment ",
146,"Bhaskar Mukherjee And Joseph Khachan   Department of Applied and Plasma Physics (A28), University of Sydney, NSW 2006, Australia","Operational Health Physics During The Maintenance Of A Radioisotope Production Cyclotron ",
15,"Marco Schippers, Jürgen Duppich, Gudrun Goitein, Eugen Hug, Martin Jermann, Anton Mezger And Eros Pedroni , for the PROSCAN team, Paul Scherrer Institut, Villigen, Switzerland","First Year Of Operation Of Psi’s New Sc Cyclotron And Beam Lines For Proton Therapy ",
151,"Y. Jongen, M. Abs, W. Beeckman, A. Blondin, W. Kleeven, D. Vandeplassche, S. Zaremba, IBA, Belgium,  V. Aleksandrov, A. Glazov, S. Gurskiy, G. Karamysheva, N. Kazarinov, S. Kostromin, N. Morozov, E. Samsonov, V. Shevtsov, G. Shirkov, E. Syresi And A. Tuzikov, JINR, Russia","Iba C400 Cyclotron Project For Hadron Therapy ",
157,"M. Seidel And P.A. Schmelzbach Paul Scherrer Insititute, CH-5232 Villigen PSI, Switzerland","Upgrade Of The Psi Cyclotron Facility To 1.8 Mw ",
163,"M. Maggiore, L. Calabretta, D. Campo, L.A.C. Piazza And D. Rifuggiato INFN-LNS"," Progress On The Design Studies Of The 300 AMeV Superconducting Cyclotron",
166,"Ugo Amaldi, University of Milano Bicocca and TERA Foundation, Via Puccini 11, Novara, Italy"," Cyclinacs: Novel Fast-Cycling Accelerators For Hadrontherapy ",
169,"V.Papash, Institute for Nuclear Research, Kiev, Ukraine, V.Parkhomchuk , Budker Institute for Nuclear Physics, Novosibirsk, Russia, And O.Borisov, Joint Institute for Nuclear Research, Dubna, Russia "," Feasibility Study Of 8 Mev H- Cyclotron To Charge The Electron Cooling System For Hesr ",
172,"V. G. Vaccaro, R. Buiano, A.D'Elia, G. De Michele Univ. di Napoli Federico II and INFNNapoli,Italy, M. R. Masullo INFN-Napoli, Italy, F. Alessandria, D. Giove INFN- Milano, Italy, C. De Martinis , E.Di Betta, M.Mauri, Univ. di Milano and INFN- Milano, Italy, A. Rainò Univ.di Bari and INFN- Bari, Italy, V. Variale INFN- Bari, Italy, L. Calabretta INFN-LNS, Catania,Italy, R.J. Rush e2v Technologies, Chelmsford, UK"," Aclip: A 3 Ghz Side Coupled Linac For Protontherapy To Be Used As A Booster For  30 Mev Cyclotrons ",
177,"Y.Mori, Kyoto University, Research Reactor Institute, K.Okabe,  Fukui University, Dept. Engineering","Development Of FFAG Accelerators In Japan ",
18,"H. Okuno, K. Yamada, J. Ohnishi, N. Fukunishi, N. Sakamoto, O. Kamigaito, M. Fujimaki, H. Hasebe, K. Kumagai, T. Maie, M. Nagase, S. Yokouchi, K. Ikegami, M. Kase, A. Goto And Y. Yano, RIKEN Nishina Center, Saitama, Japan","Hardware Commissioning Of The Riken Superconducting Ring Cyclotron ",
183,"N.Bliss, C.D.Beard, J.A.Clarke, S.A.Griffiths, N.Marks, P.A.Mcintosh, B.D.Muratori, B.J.A.Shepherd, S.L.Smith, S.I.Tzenov, STFC Daresbury Laboratory, Warrington, UK, T.R.Edgecock, D.Kelliher And S.Machida , STFC Rutherford Appleton Laboratory, Didcot,UK","Technical Description And Status Of The Emma Nonscaling FFAG",
189,"G.H. Rees STFC Rutherford Appleton Laboratory, Chilton, Oxon OX11 0QX, U.K.","Non-Isochronous & Isochronous, Non-Scaling FFAG Design",
193,"E. Keil, CERN, Geneva, Switzerland, A.M. Sessler,  LBNL, Berkeley CA, USA, D. Trbojevic BNL, Upton NY, USA ","Three-Ring FFAG Complex For H+ And C6+ Therapy",
198,"J. Pasternak, J. Fourrier, E. Froidefond, Laboratoire de Physique Subatomique et de Cosmologie (CNRS/IN2P3-UJF-INPG), Grenoble, France B. Autin, CERN, Geneva, Switzerland, F. Méot, Laboratoire de Physique Subatomique et de Cosmologie (CNRS/IN2P3-UJF-INPG), Grenoble, France and CEA DAPNIA, Saclay, France J.-L. Lancelot, D. Neuvéglise, T. Planche, SIGMAPHI, Vannes, France","Spiral FFAG For Hadrontherapy",
201,"K.Y. Ng, Fermilab , P.O. Box 500, Batavia, IL 60510,  X. Pang, F. Wang, X. Wang And S.Y. Lee  Indiana University, Bloomington, IN 47405","Emittance Growths In Resonance Crossing At FFAGS",
204,"Alessandro G. Ruggiero, Brookhaven National Laboratory, Upton, NY 11973, U.S.A.","High-Power FFAG-Based Heavy-Ion And Proton Drivers ",
207,"Dejan Trbojevic, BNL, Upton, New York 11973, USA, Eberhard Keil, CERN, Geneva, Switzerland, Andrew M. Sessler, LBNL, Berkeley CA, USA","Innovative Design Of The Isocentric Proton/Carbon Ion Gantries",
21,"N. Fukunishi, K. Yamada∗, M. Fujimaki, T. Fujinawa, A. Goto, H. Hasebe, Y. Higurashi, K. Ikegami, E. Ikezawa, N. Inabe, O. Kamigaito, M. Kase, S. Kohara, M. Komiyama, K. Kumagai, T. Maie, M. Nagase, T. Nakagawa, J. Ohnishi, H. Okuno, H. Ryuto, N. Sakamoto, M. Wakasugi, T. Watanabe, Y. Yano, S. Yokouchi, RIKEN Nishina Center, Wako, Saitama 351-0198, Japan","Present Performance And Commissioning Details Of Ribf Accelerator Complex",
210,"K. Okabe University of Fukui, Faculty of Engineering Bunkyo 3-9-1, Fukui 910-8517, Japan Y. Mori Kyoto University, Research Reactor Institute Kumatori, Osaka 590-0494, Japan Y. Sato High Energy Accelerator Research Organization Oho 1-1, Tsukuba, Ibaraki, 305-0801, Japan","Development Of FFAG-Erit System For Bnct ",
215,"J. Martino, On Behalf Of The Nantes Arronax Cyclotron Group ","Arronax, A High Intensity Cyclotron In Nantes ",
219,"A. Montelius, E. Grusell, M. Karlsson, O. Mattsson, S. Mattsson And P. Nilsson , The University Hospitals of Uppsala, Umeå, Göteborg, Malmö and Lund, Sweden","Plans For Particle Therapy In Sweden ",
222,"T. Abe, Y. Kazama, H. Ichida, Y. Hayashi, H. Ryuto And N. Fukunishi , RNC, RIKEN, Saitama, Japan","Plant Breeding Using The Ion Beam Irradiation In Riken",
225,"V. Sabaiduc, J. Burbee, D. Du, K. Erdman, W. Gyles, R.R. Johnson, B. Kovac, A. Manigoda, S. Medianu, I. Popa, L. Popa, A. Terentyev, E. vanLier, R. Watt, B. Wilson, J. Wong, A. Zyuzin, Advanced Cyclotron Systems Inc., Richmond, BC, Canada T. Kuo, Concord, CA 94521, U.S.A., W.H. Uzat, Cyclotron West Inc., South Surrey, BC, Canada","High Current Operation Of The Acsi Tr30 Cyclotron",
228,"K. Abbas, G. Cotogno, N. Gibson, U. Holzwarth, F. Simonelli, Institute for Health and Consumer Protection, Joint Research Centre, I-21020 Ispra (VA), Italy S. Buono, L. Maciocco, Advanced Accelerator Applications (AAA), St. Genis Pouilly, France N. Burgio, FPN Fision ENEA, Casaccia, Italy R. Rocca, European Organisation for Nuclear Research (CERN), France/Switzerland G. Mercurio, ENEA Ispra (VA), Italy ","Design And Test Of An Accelerator Driven Neutron Activator At The Jrc Cyclotron Of The European Commission",
231,"V.A. Anferov, M.S. Ball, J.C. Collins And V. P. Derenchuk , IUCF, Bloomington, IN 47408, U.S.A."," Indiana University Cyclotron Operation For Proton Therapy Facility ",
234,"I. Petrovic, A. Ristic-Fira, L. Koricanac, J. Požega, Vin􀃾a Institute of Nuclear Sciences, Serbia, F. Di Rosa, P. Cirrone And G. Cuttone INFN-LNS"," Comparison Of Radiobiological Effects Of Carbon Ions To Protons On A Resistant Human Melanoma Cell Line",
237,"Yoriko Hayashi, Hinako Takehisa, Yusuke Kazama, Hiroyuki Ichida, Hiromichi Ryuto, Nobuhisa Fukunishi, Tomoko Abe, RIKEN Nishina Center, Saitama, Japan,  Chiaki Kamba And Tadashi Sato, Tohoku University, Miyagi, Japan"," Effects Of Ion Beam Irradiation On Mutation Induction In Rice ",
24,"O.N. Borisov, B.N. Gikal, G.G. Gulbekyan, I.A. Ivanenko, V.N. Melnikov, V.I. Mironov, A.V. Tikhomirov, E.V Samsonov, V.V. Seleznev And A.I. Sidorov , Joint Institute for Nuclear Research, Dubna, Moscow region, Russia","Beam Extraction System From Dc60 Cyclotron",
240,"Yusuke Kazama, Hiroyuki Saito, Yoriko Hayashi, Hiroyuki Ichida, Sumie Ohbu, Hiromichi, Ryuto, Nobuhisa Fukunishi, Tomoko Abe RIKEN Nishina Center, Saitama, Japan,  Yoshiharu Y. Yamamoto, Center for Gene Research, Nagoya University, Nagoya, Japan"," Effects Of Ion Beam Irradiation On Mutation Induction In Arabidopsis Thaliana ",
243,"N.I. Ayzatskiy, N.P. Dikiy, A.N. Dovbnya, Yu.V. Lyashko, V.I.Nikiforov, B.I. Shramenko, A.Eh. Tenishev, A.V. Torgovkin And V.L. Uvarov , NSC “KIPT”, Kharkov, 61108, Ukraine"," Comparison Of Cu-67 Production At Cyclotron And Electron Accelerator ",
246,"Roberto Strangis And Carlos Gonzalez Lepera CYCLOTOPE, Houston, TX 77054, USA"," Production Of 61cu By Deuteron Irradiation Of Natural Ni ",
248,"E. Persico, M.L. Bonardi, F. Groppi, L. Canella, C. Zona, LASA, Università degli Studi di Milano and INFN-Milano, via F.lli Cervi 201, I-20090 Segrate (MI), Italy K. Abbas, U. Holzwarth, N. Gibson, F. Simonelli, JRC-EC, via E. Fermi 1, 21020 Ispra (VA), Italy"," Excitation Functions And Yields For Re-186g Production By Proton Cyclotron Irradiation ",
251,"Roberto Strangis And Carlos Gonzalez Lepera  CYCLOTOPE, Houston, TX 77054, USA","Reliable Fluorine-18 [18f-] Production At High Beam Power ",
254,"M.L. Bonardi, F. Groppi, E. Menapace, L. Canella, E. Persico, C. Zona, Università degli Studi di Milano and INFN, LASA,Via F.lli Cervi 201, I-20090 Segrate (MI), Italy K. Abbas, U. Holzwarth, N. Gibson, F. Simonelli, IHCP, Joint Research Centre, European Commission, Via E. Fermi 1, 21020 Ispra (VA), Italy L. Bergamaschi, M. Gallorini, INRiM, Unit for Radiochemistry and Spectroscopy, Via Taramelli 12, I-27100 Pavia, Italy"," Update On Cyclotron Production Studies Of No-Carrieradded: Copper-64, Astatine-211/Polonium-211g, Rhenium-186g ",
257,"F. M. Nortier, LANL, Los Alamos, NM 875453, U.S.A, J. W. Lenz,  J.W. Lenz & Associates, Waxahachie, TX 751653, U.S.A and P. A. Smith P.A. Smith Concepts & Designs, Los Alamos, NM 875443, U.S.A."," Large-Scale Isotope Production With An Intense 100 Mev Proton Beam: Recent Target Performance Experience ",
260,"J. W. Kim Research Institute and Hospital, National Cancer Center, Kyonggi, Korea, and C. C. Yun  National Center for Inter-University Research Facility, Seoul National University, Seoul Korea "," Uses Of The Experimental Area Of A Proton Therapy Facility For Biomedical Experiments ",
265,"D. Leitner, J.Y. Benitez, M L Galloway, T.J. Loew, C.M. Lyneis And D.S. Todd , LBNL","Progress And Perspective For High Frequency, High Performance Superconducting Ecr Ion Sources ",
27,"B.Gikal, S.Dmitriev, G.Gulbekian, P.Apel’, V.Bashevoi, S.Bogomolov, O.Borisov, V.Buzmakov, A.Cherevatenko, A.Efremov, I.Ivanenko, O.Ivanov, N.Kazarinov, M.Khabarov, I.Kolesov, V.Miro-nov, A.Papash, S.Patschenko, V.Skuratov, A.Tikhomirov, N.Jazvitsky, FLNR JINR, Dubna, Russia"," Cyclotron Based Complex Ic-100 For Scientific And Applied Research ",
271,"H. W. Zhao, L.T. Sun, Y.Cao, H.Y.Zhao, X. Z. Zhang, X. H. Guo, W.Lu, Z. M. Zhang, P.Yuan, M.T. Song, J.Q.Zhang, B.Wang, W.L.Zhan And B. W. Wei  Institute of Modern Physics (IMP), Chinese Academy of Sciences, Lanzhou, 730000, China","An Advanced Superconducting Ecr Ion Source Secral At Imp: First Results And Operation At 18 GHz ",
277,"S. Gammino For The Isibhi Collaboration , INFN - LNS","Ecr Plasma Physics And Production Of Highly Charged Heavy Ion From Ms-Ecris ",
283,"P.A. Závodszky, B. Arend, D. Cole, J. Dekamp, M. Doleans, G. Machicoane, F. Marti, P. Miller, J. Moskalik, W. Nurnberger, J. Ottarson, J. Vincent, X. Wu And A. Zeller  NSCL, Michigan State University, East Lansing, MI 48824, USA","First Commissioning Results Of The Susi Ecris",
286,"M.H. Rashid, C. Mallik And R.K. Bhandari , VECC, Kolkata-700 064, India","Simulated New Cusp Field Created By Permanent Magnet For An 18 Ghz Ecris ",
289,"L. Torrisi, L. Celona, G. Ciavola, F. Consoli, S. Gammino, D. Margarine, INFN-Laboratori  Nazionali del Sud, Via S. Sofia 44, 95123 Catania, Italy, and F. Caridi  Università di Messina, Ctr. Papardo 31, 98166 S. Agata, Messina, Italy","Hybrid Ion Sources For The Production Of Highly Charged Ion Beams   From Metals ",
292,"P. A. Schmelzbach, A. Barchetti, H. Einenkel And D. Goetz , Paul Scherrer Institute, CH-5232 Villigen PSI, Switzerland","A Compact, Permanent Magnet, Ecr Ion Source For The Psi Proton  Accelerator  ",
295,"P. Guarino, S. Rizzo, E. Tomarchio Dipartimento di Ingegneria Nucleare, Università di Palermo,Viale delle Scienze, Parco d’Orleans, Ed. 6, 90128, Palermo , Italy, And D. Greco  Centro di Medicina Nucleare “S.Gaetano”, Via Bagnera 14, 90011, Bagheria, Italy","Gamma-Ray Spectrometric Characterization Of Waste Activated Target Components In A Pet Cyclotron ",
298,"G. Zschornack, Technische Universität Dresden, Institute of Applied Physics, D-01069 Dresden, Germany F. Grossmann, V.P. Ovsyannikov, DREEBIT GmbH, D-01109 Dresden, Germany E. Griesmayer, University of Applied Sciences Wiener Neustadt and Fotec- Forschungs- und Technologietransfer GmbH, A-2700 Wiener Neustadt, Austria","Dresden Ebis-Sc – A New Generation Of Powerful Ion Sources For The Medical Particle Therapy ",
3,"A. Goto, M. Fujimaki, T. Fujinawa, N. Fukunishi, H. Hasebe, Y. Higurashi, K. Ikegami, E. Ikezawa, N. Inabe, T. Kageyama, O. Kamigaito, M. Kase, M. Kidera, S. Kohara, M. Kobayashi-Komiyama, M. Nagase, K. Kumagai, T. Maie, T. Nakagawa, J. Ohnishi, H. Okuno, H. Ryuto,N. Sakamoto, M. Wakasugi, T. Watanabe, K. Yamada, S. Yokouchi And Y. Yano, RIKEN Nishina Center, 2-1 Hirosawa, Wako-shi, Saitama 351-0198, Japan","Commissioning Of Riken Ri Beam Factory ",
300,"Marco Schippers, Damir Anicic, Rudolf Dölling, Anton Mezger, Eros Pedroni And Lisette Stamsnijder, Paul Scherrer Institut, Villigen, Switzerland, Andreas Geisler, Heiner Röcken And Jan Timmer , Varian Medical Systems/ACCEL Instruments, Germany"," Beam Intensity Stability Of A 250 Mev Sc Cyclotron Equipped With An Internal Cold-Cathode Ion Source ",
303,"S. Brandenburg , J.P.M. Beijers, H.R. Kremers, V. Mironov, J. Mulder And S. Saminathan  Kernfysisch Versneller Instituut, University of Groningen, The Netherlands "," Ion Source Development At The Agor Facility ",
308,"G.G. Gulbekyan, O.N. Borisov, V.I. Kazacha And D. Solivaijs, Joint Institute for Nuclear Research, Dubna, Moscow region, Russia ","Extraction By Stripping Of Heavy Ion Beams From Avf Cyclotrons ",
314,"H. Ryuto , H. Hasebe, S. Yokouchi, N. Fukunishi, A. Goto, M. Kase, And Y. Yano, RIKEN Nishina Center, 2-1 Hirosawa, Wako, Saitama 351-0198, Japan  ","Charge Strippers For Acceleration Of Uranium Beam At Riken Ri-Beam Factory ",
319,"M. Doleans, S. Chouhan, D. Cole, G. Machicoane, F. Marti, P. Miller, J. Moskalik, M. Steiner, J. Stetson, X. Wu, P. Zavodszky, A. Zeller And Q. Zhao, NSCL/MSU, East Lansing, MI 48824, U.S.A.","Optics Improvements Of The K500 Axial Injection Line ",
325,"K. Yamada, M. Fujimaki, N. Fukunishi, A. Goto, M. Kase, M. Komiyama, J. Ohnishi, H. Okuno, T. Watanabe, And Y. Yano , RIKEN Nishina Center, Wako, Saitama 351-0198, Japan","Details Of Beam Diagnostic System For Riken Superconducting Ring Cyclotron ",
328,"Wei. Liu, Jian-Hua. Zheng, Yi-Fang. Wang And Hong-Wei Zhao , Institute of modern physics, Chinese Academy of Science, Lanzhou, 730000","A Beam Energy Time-Flying Measurement System ",
33,"Cyciae-100 Project Team, Tianjue Zhang, Zhenguo Li And Chengjie Chu ","Design And Construction Progress Of Cyciae-100, A 100 Mev H- Cyclotron At Ciae ",
331,"V.A. Verzilov, D.T. Gray, R. Potter And W.R. Rawnsley , TRIUMF, 4004 Wesbrook Mall, Vancouver, Canada","A New Beam Position Monitor For The Triumf Cyclotron Beamlines ",
334,"Jun Yang, Bin Qin, Yongqian Xiong, Dong Li, Kaifeng Liu, Tongning Hu, Lei Cao And Tiaoqin Yu , Huazhong University of Science and Technology, Wuhan, China","Hybrid Simulation In Virtual Prototyping Of Cyclotron ",
337,"H. Koivisto, T. Ropponen, J. Ropponen, T. Koponen, M. Savonen, V. Toivanen, P. Heikkinen, JYFL, Jyväskylä, Finland G. Machicoane, J. Stetson, P. Zavodszky, X. Wu, M. Doleans, S. Chouhan, NSCL/MSU, East Lansing, Michigan, USA P. Spädtke, (GSI), Darmstadt, Germany H. Beijers and S. Brandenburg, KVI, Groningen, Netherlands ","Program To Improve The Ion Beam Formation And Transmission At Jyfl Talk ",
340,"Jeffry Stetson, Guillaume Machicoane, Peter Miller, Mathias Steiner And Xiaoyu Wu, NSCL/MSU, East Lansing, MI 48824, USA ","High-Transmission Operation Of The Nscl Accelerators ",
343,"C. Mallik, G.. Pal, S. Bhattacharya, J. Debnath, J. Pradhan, M. K. Dey, T. K. Bhattacharya, U. Bhunia, S. Paul, S. Roy, P. S. Chakraborty, Md. Z.A. Naser, P Bhattacharya, T. Das, D. P. Hazra And R. K. Bhandari , Variable Energy Cyclotron Centre, 1/AF, Bidhan Nagar, Kolkata 700064, INDIA","Extraction System And External Beam Handling System Of Kolkata Superconducting Cyclotron ",
346,"M.K. Dey, J. Debnath, S. Paul, J. Pradhan, U. Bhunia, A. Dutta, B.C. Mondal, Md Z.A. Naser, M. H. Rashid, G. Pal, C. Mallik And R.K. Bhandari , Variable Energy Cyclotron Centre, Kolkata, India","Beam Injection System Of The Kolkata Superconducting Cyclotron ",
349,"Y. Jongen, M.Abs, W.Beeckman, A.Blondin, W. Kleeven, D.Vandeplassche, S.Zaremba, IBA Louvain-la-Neuve, Belgium,G. Karamysheva, N. Morozov, S. Kostromin And E. Samsonov , JINR Dubna, Russia"," Simulation Of Extraction Magnetic Elements For C400 Superconducting Cyclotron ",
352,"J.J. Yang, T.J. Zhang, X.L. Jia, S.Z. An, H.J. Yao And Y.Z. Lin, 1China Institute of Atomic Energy, Beijing, 102413, China","Investigation Of Intense Beam Transport On Injection Line And Inflector Of Compact Cyclotron ",
355,"G. Gulbekyan, G. Ivanov, I. Kalagin, V. Kazacha, N. Kazarinov, M. Khabarov, V. Melnikov, Joint, Kairat K. Kadyrzhanov And Adil Zh. Tuleushev Institute of Nuclear Physics NNC, Almaty, Republic Kazakhstan","Beam Lines For Physical Experiments Of Dc-350 Cyclotron ",
358,"Sz.An, Lc.Wu, Tianjue Zhang, Gf.Song, Yl.Lu, Xl.Jia, Fp.Guan, Yj.Bi, B.Ji, Jj.Yang, Sm.Wei, Cj.Chu, Js.Xing, Zg.Li, Zh.Zhou, Gf.Pan, Zg.Yin, Sg.Hou, T.Ge, Lp.Weng And F.Yang, China Institute of Atomic Energy, Beijing, 102413, P.R. China ","Test Beam Line For Pulsed Beam Generation At Ciae’s Crm Cyclotron ",
361,"J.E. Theroux, M.P. Dehnel, P.T. Jackle, M. Roeder, T.M. Stewart, D-Pace Inc., PO Box 201, Nelson, B.C., Canada, V1L 5P9 M. Stokely, B. Wieland, Bruce Technologies, 114 Fieldstone Ct., Chapel Hill, NC, USA 27514 P. Holton, Peter Holton Consulting LLC, 14 Blueberry Lane, Lexington, MA, USA 02420 "," A ‘Short Port’ Beamline For Mounting Custom Targets To A Ge Pettrace™ Cyclotron ",
367,"L.M.Onischenko And E.V.Samsonov , JINR, Duban Russia","untitledCurrent Limit In The Compact Cyclotron With External Injection ",
370,"M.K. Craddock And Y.-N. Rao, University of British Columbia and TRIUMF","High-Energy Cyclotrons Without Spiral ",
373," Sytze Brandenburg, Mariet Anna Hofstee, Tjalling Nijboer, KVI, University of Groningen, Zernikelaan 25, 9747 AA Groningen, The Netherlands","Influence Of The Rf Magnetic Field On The Beam Phase In Cyclotrons ",
376,"P. Sing Babu, A. Goswami And V. S. Pandit, Variable Energy Cyclotron Centre, 1- AF, Bidhannagar, Kolkata, India","Simulation Study Of High Intensity Beam Bunching ",
379,"N. Kazarinov And I.Kalagin Joint Institute for Nuclear Research, 6, Joliot-Curie, 141980, Dubna, Russia","The Computation Of The Bunching System Of Intense Ion Beam By Moments  Method  ",
382,"Y.Jongen, W.Beeckman, W.Kleeven, D.Vandeplassche, S.Zaremba, IBA, Belgium, E.Samsonov And N.Morozov Joint Institute for Nuclear Research, 6, Joliot-Curie, 141980, Dubna, Russia ","Numerical Study Of The Resonances In Superconducting Cyclotron C400 ",
385,"Milan Čihák, Ondřej Lebeda And Jan Štursa, Nuclear Physics Institute, Rez, Czech Republic","Beam Dynamic Simulation In The Isochronous Cyclotron U-120m ",
388,"V. S. Pandit, A. Goswami, P. Sing Babu And P. R. Sarma , Variable Energy Cyclotron Centre, 1- AF, Bidhannagar, Kolkata-700 064, India","Design Studies On The Magnet And Central Region Of A 10 Mev High Current Compact Cyclotron ",
39,"P. Bertrand And M.H. Moscatello On Behalf Of The Spiral 2 Team. ","The Advancement Of Spiral 2 Project",
391,"D. Campo, D. Battaglia, L. Calabretta, M. Maggiore And L.A.C. Piazza , INFN - LNS"," Central Region And Static Orbit Study For The 300 A Mev Superconducting Cyclotron ",
394,"Y. Jongen, M. Abs, W. Kleeven, S. Zaremba, D. Vandeplassche, W. Beeckman, IBA, Belgium, G. Karamysheva And N. Morozov  JINR, Russia","Center Region Design Of The Cyclotron C400 For Hadron Therapy ",
397,"D. H. An , J. Kang, I. S. Jung, K. U. Kang, B. H. Hong, H. S. Jang, S. S. Hong, Y. Kim, M. Y. Lee, T. K. Yang And J. Chai , KIRAMS, Seoul, Korea","The Study Of The Central Region Of Kirams-30 Cyclotron ",
400,"P. Beličev, V. Jocić, N. Nešković, B. Radenović, M. Rajčević, Vinca Institute of Nuclear Sciences, Belgrade, Serbia, E. E. Perepelkin, A. S. Vorozhtsov And S. B. Vorozhtsov , JINR, Dubna, Russia","Spiral Inflectors And Electrodes In The Central Region Of The Vincy     Cyclotron  ",
403,"V.Aleksandrov, N. Kazarinov, V. Shevtsov, A. Tuzikov JINR, Dubna Russia And Y. Jongen  IBA Belgium","Axial Injection Beam-Line Of C400 Cyclotron For Hadron Therapy: Particles Dynamics And Magnetic Field Screening ",
406,"Hongjuan Yao, R. Baartman, Y.-N. Rao, Tianjue Zhang, Yuzheng Lin China Institute of Atomic Energy, Beijing, 102413, China, TRIUMF, Vancouver, V6T 2A3, Canada","Gap-Crossing Resonance In Cyciae-100 Cyclotron ",
409,"A. Dobrosavljević, M. Rajčević, N. Grujić And V. Vujović , Vinca institute of nuclear sciences, Belgrade, Serbia","Spiral Inflector Exchange System Of The Vincy Cyclotron ",
412,"P. Beličev, Lj. Vukosavljević, S. Ćirković, A. Dobrosavljević, V. Jocić, J. Ristić-Durović, V.Vujović Vinca Serbia, And I. Kalagin  JINR, Russia","Back Extraction System Of The Vincy Cyclotron ",
415,"A. Dobrosavljević, P. Beličev, S. Ćirković, D. Košutić, J. Ristić-Durović, V. Vujović Vinca, Serbia, and I. Kalagin JINR, Russia","Front Extraction System Of The Vincy Cyclotron ",
418,"Y.Jongen, W.Beeckman, W.Kleeven, D.Vandeplassche, S.Zaremba, IBA, Belgium,  S.Kostromin, N.Morozov And E.Samsonov  JINR, Russia"," Simulation Of Two Beams Extraction From Superconducting Cyclotron C400 ",
421,"S.B.Vorozhtsov, L.M, Onischenko And E.E.Perepelkin, JINR, Dubna, Russia","Customs Cyclotron And Beam Delivery System ",
424,"N. Cufaro Petroni, Bari University, INFN Sez. Bari, Italy,S. De Martino, S. De Siena, and F. Illuminati, Salerno University, INFN Sez. Napoli  ","Stationary Distributions Of Non Gaussian Ornstein-Uhlenbeck Processes For Beam Halos ",
429,"J. Ohnishi, H. Okuno, N. Fukunishi, K. Yamada, A.Goto, And Y. Yano RIKEN Nishina Center, Japan","The Magnetic Field Of The Superconducting Ring Cyclotron ",
432,"B.N.Gikal G.Gulbekian, I.A.Ivanenko, J. Franko, JINR, Dubna, Russia, V.P.Kukhtin, E.V.Lamzin And S.E.Sytchevsky ERIEA St. Petersburg, Russia","The Method And Results Of Formation Of The Dc-60 Cyclotron Magnetic Field   ",
435,"C. Mallik, G. Pal, Sarbajit Pal, M K. Dey, J. Debnath, C. Nandi, J. Pradhan, U. Bhunia, S. Pal, A. Dutta, Anindya Roy, M. H. Rashid, Z. A. Naser And R. K. Bhandari , Variable Energy Cyclotron Centre, 1/AF, Bidhan Nagar, Kolkata – 700064, India","Magnetic Field Mapping Of Kolkata Superconducting Cyclotron ",
