438,"M. K. Dey, A. Dutta Gupta, J. Debnath, J. Pradhan, A. Dutta, S. Saha, M. Ahammed, P. Bhattacharjee, U. Bhunia, Z. Naser, S. Paul, J. Chaudhuri, C. Mallik And R.K.Bhandari, Variable Energy Cyclotron Centre, 1/AF, Bidhan Nagar, Kolkata – 700064, India ","Coil Centering Of The Kolkata Superconducting Cyclotron Magnet ",
441,"J Pradhan, A Dutta, U Bhunia, J Debnath, S Paul, Z A Naser, M K Dey, C Mallik And R K Bhandari , Variable Energy Cyclotron Centre, 1/AF, Bidhan Nagar, Kolkata – 700064, India ","Magnetic Field Simulation Using Radia And Tosca For Kolkata Superconducting Cyclotron ",
444,"J. Kang, D.H. An, J.S. Chai KIRAMS, Seoul, Korea, and K.H. Park  PAL Korea ","Field Shaping Of Kirams-30 Cyclotron Magnet ",
449,"K. Fong TRIUMF, Canada","New Technologies In The Design Of Rf Controls For Accelerators",
45,"Jong-Seo Chai, Joon-Sun Kang, In-Su Jung, Dong-Hyun An, Hong-Suk Chang, Bong-Hwan Hong, Kun-Uk Kang, Sung-Suk Hong, Min-Yong Lee, Won-Taek Hwang, Tae-Keun Yang, Yu-Seok Kim, Moo-Hyun Yoon, Chang-Kyun Kim And Ki-Hyeon Park , KIRAMS, Korea","Commissioning Of Kirams-30 Cyclotron For Nuclear Science Research ",
455,"N. Sakamoto, O. Kamigaito, S. Kohara, H. Okuno, M. Kase, A. Goto, Y. Yano And Y. Touchi,  RIKEN, Japan "," Rf-System For The Ribf Superconducting Ring Cyclotron ",
458,"Yuanjie Bi1, Tianjue Zhang, Bin Ji, Hongjuan Yao, Shizhong An, Jiansheng Xing And Chuanxiang Tang, CIAE, China"," The Study On Rf Cavity Tolerance For Cyciae-100 ",
461,"S.M. Wei, T.J. Zhang, B. Ji, J.S. Xing, X.L. Jia, Y.J. Bi, Z.G. Li , S.Z. An, F.Yang And Y.Z.Liu , CIAE, China","Thermal Analysis Of Rf Cavity For Cyciae-100 ",
464,"J. Grillenberger, M. Humbel, J. Y. Raguin And P. A. Schmelzbach , PSI, Villigen, Switzerland","Commissioning And Tuning Of The New Buncher System In The 870 Kev Injection Beamline ",
467,"L. Stingelin, M. Bopp And H. Fitze PSI, Switzerland","Development Of The New 50mhz Resonators For The Psi Injector Ii Cyclotron ",
470,"M. Fukuda, H. Tamura, T. Saito, T. Yorita And K. Hatanaka , RCNP, Osaka, Japan"," Development Of The Flat-Top Acceleration System For The Rcnp Avf Cyclotron  ",
473,"S. Som, R.K. Bhandari, Saikat Pal, A.K. Mukherjee, P. Gangopadhyay, A. Mandal, S. Seth, J.S. Prasad, P.R. Raj And S. Saha , VECC, India","Development Of Rf System For K500 Superconducting Cyclotron At Vecc,    Kolkata  Talk ",
476,"A. Caruso, A. Spartà, Yin Zhinguo And A. Longhitano , INFN - LNS Italy"," Steps Forward In The Digital Rf Control System At Lns ",
479,"A.Caruso, L.Calabretta, F.Consoli, A.Spartà, E.Zappalà, J.Sura And A.Longhitano , INFN - LNS, Italy"," Experimental Study On The Sliding Short Contacts As A Result Of A Theoretical Investigation On The Chopper-500 Coaxial Resonator ",
482,"Y. Jongen, M. Abs, W. Beeckman, W. Kleeven, D. Vandeplassche, S. Zaremba, IBA Belgium,  A. Glazov, S. Gurskiy, G. Karamysheva And N. Morozov   JINR, Russia","Radio Frequency System Of The Cyclotron C400 For Hadron Therapy ",
487,"F. Marti, Y. Batygin, G. Bollen, C. M. Campbell, S. Chouhan, C. Guénaut, D. Lawton, D. J. Morrissey, J. Ottarson, G. Keith Pang, S. Schwarz, B. Sherrill And A. Zeller  NSCL, East Lansing, Michigan 48824, U.S.A.","Stopping Of Energetic Radioactive Ions Using Cyclotron Principles ",
493,"S. Brandenburg, J.P.M. Beijers, M.A. Hofstee, H.R. Kremers, V. Mironov, T.W. Nijboer and J. Vorenholt Kernfysisch Versneller Instituut, University of Groningen, the Netherlands","High Intensity Operation Of The Agor-Cyclotron For Rib-Production",
499,"P. G. Bricault , M. Dombsky, Jens Lassen And Friedhelm Ames, TRIUMF, Canada ","Progress In Development Of Isol Rib Ion Sources And Targets For High Power ",
505,"D. P. May, G. J. Kim, R. E. Tribble, H. L. Clark, F. P. Abegglen, G. J. Derrig, G. Tabacaru, G. Souliotis, G. Chubaryan Cyclotron Institute, Texas A&M Univ., College Station, TX 77843 USA J. Ärje, JYFL, Jyväskylä, Finland"," Progress On The Facility Upgrade For Accelerated Radioactive Beams At Texas A&M ",
51,"Rakesh Kumar Bhandari And Bikash Sinha For Vecc Staff ","Status Of The K500 Superconducting Cyclotron Project At Kolkata ",
511,"P. A. Schmelzbach , PSI, Villigen, Switzerland","Concluding Remarks ",
54,"L. Medeiros Romao, M. Abs, J-C. Amelia, W. Beeckman, J-L. Delvaux, Y. Jongen, W. Kleeven, Y. Paradis, D. Vandeplassche And S. Zaremba , IBA, Belgium","Iba C70 Cyclotron Development ",
57,"Tianjue Zhang, Yinlong Lu, Fengping Guan, Xianlu Jia, Junqing Zhong, Hongjuan Yao And Yuzheng Lin , CIAE, China","The Study And Design Of Spiral Inflector And Central Region For Cyciae-100 Cyclotron ",
60,"G.G. Gulbekyan, S.L. Bogomolov, V.V. Bekhterev, I.V. Kalagin, N.Yu. Kazarinov, M.V. Khabarov, V.N.Melnikov, M.N.Sazonov, Kairat K. Kadyrzhanov And Adil Zh. Tuleushev , Joint Institute for Nuclear Research, FLNR, Dubna, Moscow region, Russia","Axial Injection Channel Of The Dc-350 Cyclotron ",
63,"D. Vandeplassche, W. Beeckman, W. Kleeven, S. Zaremba, J.L. Delvaux, L. Medeiros-Romao, J.C. Amélia, Y. Jongen And J. Fermé , IBA, Belgium","Extraction Simulations For The Iba C70 Cyclotron ",
66,"W. Kleeven, M. Abs, W. Beeckman, J.-L. Delvaux, Y. Jongen, L. Medeiros-Romao D. Vandeplassche And S. Zaremba , IBA, Belgium","Injection And Central Region Design For The Iba C70 Cyclotron ",
69,"Sz.An , Fp.Guan, Tj.Zhang, Hd Xie, Jq.Zhong, Xl.Jia, Sm.Wei, Hj.Yao, Yj.Bi, B.Ji, Cj.Chu, Js.Xing, Lc.Wu,Yl.Lu, Zg.Li, Zh.Zhou, Gf.Pan, Zg.Yin, Sg..Hou, T.Ge, Gf.Song, Lp.Weng And F.Yang , CIAE China","Extraction Simulation For Cyciae-100 ",
72,"Xianlu Jia And Tianjue Zhang China Institute of Atomic Energy, Beijing, 102413, China","Study On Space Charge Effect In The Spiral Inflector ",
75,"S. Zaremba, W. Beeckman, J.-L. Delvaux, Y. Jongen, W. Kleeven, L. Medeiros-Romao, D. Vandeplassche And A.-S. Chauchat  , IBA, Belgium","Magnetic Field Design And Calculations For The Iba C70 Cyclotron",
78,"Y. Paradis, D. Vandeplassche, W. Beeckman, J.-L. Delvaux, W. Kleeven, L. Medeiros-Romao, S. Zaremba, J.C. Amélia And F. Salicis , IBA, Belgium","The Magnetic Field Mapping System For The Iba C70 Cyclotron ",
81.,"W. Beeckman, J.C. Amelia, J.L. Delvaux, W. Kleeven, L. Medeiros-Romao, D. Vandeplassche, S. Zaremba And F. Forest , IBA, Belgium","Machining And Assembly Of The Iba C70 Cyclotron Magnet ",
84,"D. Alloni, A. Borio Di Tigliole, M. Cagnazzo, M. Coniglio, G. Magrotti, S. Manera, A. Piazzoli, M. Prata, A. Salvini And G. Scian  , L.E.N.A. - Laboratorio Energia Nucleare Applicata, Università degli Studi di Pavia","The Cyclotron Facility At The Laboratory Of Applied Nuclear Energy (L.E.N.A.) Of The University Of Pavia ",
87,"Rakesh Kumar Bhandari For Vecc Staff   ","Medical Cyclotron Facility At Kolkata ",
9,"A.E. Geisler, J. Hottenbacher, H.U. Klein, D. Krischel, H. Röcken, M. Schillo, T. Stephani, J.H. Timmer Accel Instruments GmbH, Bergisch Gladbach, Germany, and C. Baumgarten, PSI, Villigen, Switzerland","Commissioning Of The Accel 250 Mev Proton Cyclotron ",
93,"P. W. Schmor , TRIUMF, Canada","New Achievements At Triumf And Future Plans ",
99,"F. Chautard, C. Berthe, A. Colombe, L. David, P. Dolégieviez, B. Jacquot, C. Jamet, M. Lechartier, P. Lehérissier And G. Sénécal  , GANIL, France","Status Report On Ganil-Spiral1 ",
