a-01,"D.P. May, R.C. Rogers, P. Smelser, D.H. Youngblood, Texas AM University, College Station, Texas, USA","First Beams from the Texas AM Superconducting Cyclotron",99 98,
a-02,"J.A. Nolen, T.A. Antaya, H.G. Blosser, T.S. Kuo, F. Marti, B.M. Sherrill, A.F. Zeller, NSCL, East Lansing, Michigan, USA","Commissioning Experience with the NSCL K1200 Superconducting Cyclotron",5 8,
a-03,"B.-W. Wei, Institute of Modern Physics, Lanzhou, China","Invited Paper: Commissioning of HIRFL",9 12,
a-04,"Y. Yano, RIKEN, Saitama, Japan","Status Report on RIKEN Ring Cyclotron",13 16,
a-05,"S. Holm, Svedberg Laboratory, Uppsala, Sweden","Operational Experience of the Reconstructed Uppsala Synchrocyclotron",17 20,
b-01,"H.W. Schreuder, KVI, Groningen, The Netherlands","Invited Paper: The AGOR Cyclotron Past the Half-Way Mark",21 25,
b-02,"E. Acerbi, F. Alessandria, G. Baccaglioni, G. Bellomo, C. Birattari, A. Bosotti, F. Broggi, C. De Martinis, M. Di Giacomo, E. Fabrici, A. Ferrari, D. Giove, A. Giussani, W. Giussani, P. Michelato, C. Pagani, G.C. Rivoltella, L. Rossi, A. Sussetto, G. Varisco, INFN/LASA  University of Milan, Segrate, Milan, Italy; G. Cuttone, INFN/LNS, Catania, Italy; S. Zhou, Institute of Modern Physics, Lanzhou, China; P. Gmaj, University of Warsaw, Warsaw, Poland","Progress Report on the Milan Superconducting Cyclotron",26 29,
b-03,"H. Ikegami, Osaka University, Osaka, Japan","Invited Paper: The RCNP Ring Cyclotron Facilities",30 39,
b-04,"E. Liukkonen, University of Jyväskylä, Jyväskylä, Finland","The Jyväskylä K130 Cyclotron Project",40 42,
b-05,"J.I.M. Botman, H.L. Hagedoorn, Eindhoven University of Technology, Eindhoven, The Netherlands","General Purpose Storage Ring as Post Accelerator for the ILEC Cyclotron",43 46,
b-06,"W. Assmann, U. Buhl, A. Cazan, T. Grundey, G. Hinderer, J. Junger, H.-J. Körner, R. Kratz, M. Leu, C. Rieß, L. Rohrer, P. Schütz, U. Trinks, Ch. Yan, TU  University of Munich, Garching, Germany","Tritron Progress Report",47 50,
b-07,"A. Goto, K. Hatanaka, K. Ikegami, T. Kageyama, M. Kase, S. Kohara, M. Nagase, N. Nakanishi, M. Saito, H. Takebe, Y. Yano, RIKEN, Saitama, Japan; Y. Kumata, T. Tachikawa, Sumitomo Heavy Industries, Ehime, Japan","Injector AVF Cyclotron at RIKEN",51 54,
c-01,"H. Ikegami, Osaka University, Osaka, Japan","Invited Paper: Cyclotron Maser Cooling of Electron and Ion Beams",55 61,
c-02,"D. Reistad, Svedberg Laboratory, Uppsala, Sweden","Status of the CELSIUS Cooler-Storage Ring Project",62 65,
c-03,"H. Beuscher, W. Bräutigam, R. Brings, H. Lawin, R. Maier, S. Martin, J. Reich, M. Rogge, P. Wucherer, FZJ, Jülich, Germany; H.L. Hagedoorn, Eindhoven University of Technology, Eindhoven, The Netherlands","The Characteristics of the Cyclotron JULIC as Injector for COSY",66 69,
c-04,"D.K. Olsen, W.H. Atkins, D.T. Dowling, J.W. Johnson, R.S. Lord, J.M. McConnell, W.T. Milner, S.W. Mosko, B.A. Tatum, ORNL, Oak Ridge, Tennessee, USA","HISTRAP Prototype Hardware Studies",70 75,
c-05,"T. Katayama, K. Chida, T. Honma, A. Mizobuchi, M. Nakai, A. Noda, K. Noda, M. Sekiguchi, F. Soga, T. Tanabe, N. Ueda, S. Watanabe, T. Watanabe, M. Yoshizawa, University of Tokyo, Tokyo, Japan; T. Hattori, Tokyo Institute of Technology, Tokyo, Japan","Status of Heavy Ion Cooler Synchrotron TARN II",76 79,
d-01,"A.H. Botha, S.J. Burger, P.J. Celliers, J.L. Conradie, J.C. Cornell, J.W. Carstens, P.M. Cronje, Z.B. du Toit, R.E. Fenemore, D.T. Fourie, H.N. Jungwirth, J.E. Kriel, J.J. Kritzinger, P.G. Molteno, W.A.G. Nel, D. Reitmann, L.M.M. Roels, P.F. Rohwer, M.J. van Niekerk, D.M. van Rooyen, H.F. Weehuizen, National Accelerator Centre, Faure, Republic of South Africa","Operation and Development of the NAC Accelerator Facilities",80 83,
d-02,"G.H. Mackenzie, TRIUMF, Vancouver, B.C., Canada","Injection into a High-Intensity Synchrotron from a Cyclotron",84 87,
d-03,"H. Schmeing, C.B. Bigham, N.C. Bray, W.G. Davies, B.F. Greiner, C.R. Hoffmann, J.A. Hulbert, P.I. Hurley, E.H. Lindqvist, J.E. McGregor, R.E. Milks, G.R. Mitchel, J.F. Mouris, J.H. Ormrod, L.W. Shankland, E.P. Stock, L.W. Thomson, R.R. Tremblay, X.H. Zhou, Atomic Energy of Canada, Chalk River, Ontario, Canada","Current Status of the Superconducting Cyclotron at Chalk River",88 92,
d-04,"U. Schryber, PSI, Villigen, Switzerland","Status Report on the PSI-Accelerator Facility",93 96,
d-05,"P. Arndt, W. Busse, B. Martin, R. Michaelsen, W. Pelzer, D. Renner, K. Ziegler, HMI, Berlin, Germany","Status Report on VICKSI",97 100,
d-06,"A. Joubert, GANIL, Caen, France","Status Report on the First Six Years of GANIL Operation",101 105,
d-07,"T. Yamada, Y. Hirao, T. Kanai, H. Ogawa, Y. Sato, K. Suzuki, NIRS, Chiba, Japan","Recent Developments of the NIRS-Chiba Isochronous Cyclotron",106 110,
d-08,"M.P. Bourgarel, P. Attal, E. Baron, GANIL, Caen, France","Modification of the GANIL Injectors",111 115,
d-09,"J.L. Belmont, M. Fruneau, P. Martin, . SARA Staff, Institut des Sciences Nucléaires, Grenoble, France","New Developments at SARA",116 120,
d-10,"J.A. van der Heide, P. Magendans, R.J.L.J. de Regt, Eindhoven University of Technology, Eindhoven, The Netherlands; W.J. Kleeven, TRIUMF, Vancouver, B.C., Canada","The Eindhoven Minicyclotron ILEC",121 124,
d-11,"B.N. Gikal, G.G. Gulbekyan, V.B. Kutner, JINR, Dubna, USSR","The Present Status of the U-400 Isochronous Cyclotron",125 128,
d-12,"G. Goin, J. Briaud, L. Le Polotec, CNRS, Orléans, France","Status Report on the CNRS Orleans' Cyclotron",129 132,
d-13,"S.B. Vorozhtsov, V.P. Dmitrievsky, A.A. Glazov, V.V. Kalinichenko, L.M. Onishchenko, N.L. Zaplatin, JINR, Dubna, USSR","High-Current Cyclotron Injector",133 136,
e-01,"H.G. Blosser, NSCL, East Lansing, Michigan, USA","Invited Paper: Applications of Superconducting Cyclotrons",137 144,
e-02,"B.F. Milton, G. Dutto, W.J. Kleeven, R.E. Laxdal, L.S. Milinkovic, J.B. Pearson, R.L. Poirier, P.W. Schmor, H.R. Schneider, TRIUMF, Vancouver, B.C., Canada; R. Dawson, K.L. Erdman, W. Gyles, Q. Walker, Ebco Industries Ltd., Richmond, B.C., Canada","A 30 MeV H Cyclotron for Isotope Production",145 148,
e-03,"J.L. Bol, A. Chevalier, E. Conard, Y. Jongen, M. Ladeuze, G. Lannoye, T. Ledocte, Ion Beam Applications SA, Louvain-la-Neuve, Belgium; M. Lacroix, A. Ninane, G. Ryckewaert, S. Zaremba, University of Louvain-la-Neuve, Louvain-la-Neuve, Belgium","High Intensity H Cyclotrons for Radioisotope Production",149 151,
e-04,"P. Mandrillon, Ch. Rocher, Centre Antoine Lacassagne, Nice, France; R. Ostojic, Boris Kidriccaron; Institute, Belgrade, Yugoslavia; A. Susini, CERN, Geneva, Switzerland; G. Ryckewaert, University of Louvain-la-Neuve, Louvain-la-Neuve, Belgium","Status of the Feasibility Studies of the European Light Ion Medical Accelerator",152 155,
e-05,"P. Mandrillon, N. Brassart, F. Farley, J. Herault, . MEDICYC Team, Centre Antoine Lacassagne, Nice, France; R. Ostojic, Boris Kidriccaron; Institute, Belgrade, Yugoslavia; A. Susini, CERN, Geneva, Switzerland","Commissioning and Implementation of the MEDICYC Cyclotron Programme",156 159,
e-06,"R. Risler, S. Brossard, J. Eenmaa, J. Jacky, I. Kalet, A. Rask, P. Wootton, University of Washington Medical Center, Seattle, Washington, USA","Routine Operation of the Seattle Clinical Cyclotron Facility",160 163,
e-07,"M. Abs, J.L. Bol, A.A. Chevalier, E. Conard, Y. Jongen, M. Ladeuze, G. Lannoye, T. Ledocte, J.-L. Morelle, Ion Beam Applications SA, Louvain-la-Neuve, Belgium; M. Lacroix, A. Ninane, G. Ryckewaert, S. Zaremba, University of Louvain-la-Neuve, Louvain-la-Neuve, Belgium","A New Design of Truly Selfshielding Baby-Cyclotrons for Positron Emitter Production",164 166,
e-08,"V.A. Glukhikh, Yu.P. Vakhrushin, M.F. Vorogushin, D.V. Efremov Scientific Research Institute of Electrophysical Apparatus, Leningrad, USSR","Applied Cyclotrons Developed and Constructed in NIIEFA",167 169,
f1-01,"D.J. Clark, C.M. Lyneis, LBL, Berkeley, California, USA","Heavy Ion Development at the LBL 88-Inch Cyclotron",170 173,
f1-02,"M. Tanaka, Kobe Tokiwa Jr. College, Nagata, Japan; K. Katori, T. Ohshima, M. Fujiwara, T. Itahashi, M. Kondo, H. Ogata, Osaka University, Osaka, Japan","Construction of the RCNP Polarized Heavy Ion Source, ''HISPANIOLA''",174 177,
f1-03,"L. Buchmann, C.D.P. Levy, M. McDonald, R. Ruegg, P.W. Schmor, TRIUMF, Vancouver, B.C., Canada","Status of the TRIUMF Optically Pumped Polarized H Ion Source",178 181,
f1-04,"M. Malard, S. Gustafsson, L. Hablot, J.P. Schapira, A. Serafini, IPN, Orsay, France","AGOR Axial Injection, Using a Positive Light Ion Multicusp Source",182 185,
f1-05,"K. Hatanaka, E. Ikezawa, RIKEN, Saitama, Japan; W. Yokota, JAERI, Gunma, Japan; H. Nonaka, Sumitomo Heavy Industries, Ehime, Japan","Status of the RIKEN ECRIS",186 189,
f1-06,"D.K. Bose, R.K. Bhandari, J. Chaudhuri, G.S. Taki, Bhabha Atomic Research Centre, Calcutta, India","ECR Heavy Ion Source and External Injection System for the Calcutta Variable Energy Cyclotron (VEC)",190 193,
f1-07,"H.P. Ehret, R. Ernst, L. Friedrich, E. Huttel, J. Kaltenbaek, F. Schulz, L. Wiss, P. Ziegler, FZK, Karlsruhe, Germany","The Ion Sources at the Karlsruhe Cyclotron",194 196,
f2-01,"S. Brandenburg, C. Bieth, J.P. Chauvin, G. Coeur-Joly, R. Eyraud, V. Hervier, J. Lebris, B. Monsanglant, IPN, Orsay and KVI, Groningen, The Netherlands","The RF System of the Superconducting Cyclotron AGOR",197 200,
f2-02,"T. Saito, I. Miura, M. Uraki, Osaka University, Osaka, Japan; Y. Kumata, Y. Touchi, K. Uno, Sumitomo Heavy Industries, Ehime, Japan","The RF System for the RCNP Ring Cyclotron",201 204,
f2-03,"R. Worsham, D. Dohan, G. Dutto, K. Fong, V. Pacak, TRIUMF, Vancouver, B.C., Canada","Reduction of the Multipactoring Effects in the TRIUMF Cyclotron",205 207,
f2-04,"J.J. Kritzinger, R.E. Fenemore, M.J. van Niekerk, National Accelerator Centre, Faure, Republic of South Africa","Performance of the NAC RF Systems",208 211,
f2-05,"P.K. Sigg, PSI, Villigen, Switzerland","A Variable, High Speed Beam-Power Absorber",212 215,
f2-06,"A. Bosotti, M. Di Giacomo, L. Ferrucci, S. Gallo, C. Pagani, G. Varisco, F. Zibra, INFN/LASA  University of Milan, Segrate, Milan, Italy","New Developments in the Control Electronics for the Milan Superconducting Cyclotron RF System",216 219,
f3-01,"K. Pieterman, J.A.M. Dam, Cryocon B.V., Amersfoort, The Netherlands; C. Commeaux, G. Levy, IPN, Orsay, France","AGOR Cryogenics: A Status Report",220 223,
f3-02,"A. Horbowa, S. Buhler, IPN, Orsay, France","The AGOR Cryopumps",224 227,
f3-03,"A. Shimizu, I. Miura, Osaka University, Osaka, Japan; S. Ichida, I. Taguchi, Sumitomo Heavy Industries, Ehime, Japan","Vacuum System of the RCNP Ring Cyclotron",228 231,
f3-04,"E. Acerbi, F. Alessandria, G. Baccaglioni, G. Cartegni, D. Giove, G.C. Rivoltella, L. Rossi, A. Sussetto, INFN/LASA  University of Milan, Segrate, Milan, Italy; M. Cafici, INFN/LNS, Catania, Italy; P. Gmaj, University of Warsaw, Warsaw, Poland","Operational Experience with the Superconducting Coils of the Milan K800 Cyclotron",232 235,
f4-01,"W. Busse, HMI, Berlin, Germany","Control Systems Underway to be Implemented as Expert Systems",236 239,
f4-02,"P. Taskinen, J. Lampinen, K. Loberg, University of Jyväskylä, Jyväskylä, Finland","The Control System of Jyväskylä K130 Cyclotron",240 243,
f4-03,"J.C. Collins, J.R. Graham, Wm. Manwaring, Indiana University, Bloomington, Indiana, USA","The IUCF Cooler Ring Control System",244 247,
f4-04,"J.E. Larsson, J.O. Bergström, R. Kjellström, Scanditronix AB, Uppsala, Sweden","Fully Automated Control System for an MC17F Medical Cyclotron",248 251,
f4-05,"T. Yamazaki, A. Ando, K. Hosono, T. Itahashi, I. Katayama, M. Kibayashi, S. Kinjo, M. Kondo, I. Miura, K. Nagayama, T. Noro, H. Ogata, T. Saito, A. Shimizu, M. Uraki, Osaka University, Osaka, Japan; K. Aoki, K. Kodaira, M. Maruyama, S. Yamada, Sumitomo Heavy Industries, Ehime, Japan","Design of Distributed Control System for the RCNP Ring Cyclotron",252 256,
f4-06,"F. Zibra, A. Borini, A. Bosotti, M. Di Giacomo, D. Giove, C. Pagani, G. Varisco, INFN/LASA  University of Milan, Segrate, Milan, Italy","The Computer Control for the RF System of the Milan K800 Cyclotron",257 259,
f4-07,"D. Giove, A. Amato, P. Michelato, INFN/LASA  University of Milan, Segrate, Milan, Italy","Computer Automation of the Milan Superconducting Cyclotron Vacuum System",260 263,
f4-08,"D.R. Haenni, T. Cowden, C. Hargis, J. Reimund, R.C. Rogers, Texas AM University, College Station, Texas, USA","Personal Computer Control System for the TAMU K-500 Cyclotron",264 267,
f5-01,"F. Marti, R.A. Blue, J. Johnson, J. Kuchar, J.A. Nolen, P. Rutt, B.M. Sherrill, J. Yurkon, NSCL, East Lansing, Michigan, USA","Invited Paper: Beam Diagnostic Developments at NSCL",268 277,
f5-02,"M. Ball, T.J.P. Ellison, C.M. Fox, Indiana University, Bloomington, Indiana, USA","New Nondestructive Beam Diagnostics for the IUCF Cyclotron Cooler",278 282,
f5-03,"E. Acerbi, G.C. Rivoltella, L. Rossi, INFN/LASA  University of Milan, Segrate, Milan, Italy; G. Raia, INFN/LNS, Catania, Italy","The Beam Diagnostics of the Milan K800 Cyclotron",283 286,
f5-04,"E. Acerbi, A. Bosotti, M. Di Giacomo, G. Varisco, INFN/LASA  University of Milan, Segrate, Milan, Italy","Conceptual Design and Test of the Phase Probes for the Milan K800 Cyclotron",287 290,
f5-05,"R. Bassini, C. Birattari, M. Bonardi, INFN/LASA  University of Milan, Segrate, Milan, Italy; M. Castiglioni, Joint Research Centre, Ispra, Italy; M. Silari, CNR-ITBA, Milan, Italy","An Absolute Method for the Energy Calibration of Cyclotron Beams",291 294,
f5-06,"Z. Shen, Y. Wang, Institute of Modern Physics, Lanzhou, China","Beam Diagnostic System of HIRFL",295 297,
f5-07,"R. Wang, Technical Institute Sanqiao, Xi'an, China; B. Shao, Institute of Modern Physics, Lanzhou, China","A Diagnostic System for Measuring Profile of the Beam Lines",298 300,
f5-08,"T. Itahashi, T. Saito, I. Miura, Osaka University, Osaka, Japan; S. Ichida, Sumitomo Heavy Industries, Ehime, Japan","Design of Beam Diagnostics for the RCNP Ring Cyclotron",301 304,
f5-09,"P.M. Cronje, H. Gargan, A. Müller, P.F. Rohwer, P.A. van Schalkwyk, National Accelerator Centre, Faure, Republic of South Africa","Beam Centering with a Harp and Probes in the NAC SSC",305 308,
f5-10,"Z. Kormány, T. Lakatos, A. Valek, ATOMKI, Debrecen, Hungary","A Microcomputer-Based Versatile Profile Monitoring System",309 312,
f5-11,"L. Rezzonico, U. Frei, M. Graf, R. Erne, PSI, Villigen, Switzerland","A Profile Monitor Using Residual Gas",313 316,
f5-12,"V.V. Kolga, L.M. Onishchenko, M.F. Shabashov, N.G. Shakun, A.L. Shishkin, JINR, Dubna, USSR","Beam Diagnostics at the JINR Phasotron",317 321,
f5-13,"S. Dasgupta, C. Mallik, A. Roy, Bhabha Atomic Research Centre, Calcutta, India","Semi-Automatization of Existing Beam Diagnostic Facilities for Beam-Quality Evaluation",322 324,
f6-01,"G. Bellomo, INFN/LASA  University of Milan, Segrate, Milan, Italy","Invited Paper: The Central Region for Compact Cyclotrons",325 334,
f6-02,"J.P. Schapira, R. Brizzi, A. Le Goff, IPN, Orsay, France","AGOR Central Region Design",335 338,
f6-03,"Y.X. Xu, D.P. May, Texas AM University, College Station, Texas, USA","A New Magnetic Channel M9 for the K500 Superconducting Cyclotron",339 341,
f6-04,"Y.X. Xu, D.P. May, R.C. Rogers, Texas AM University, College Station, Texas, USA","New Design for a Central Region of the K500 Superconducting Cyclotron",342 345,
f6-05,"A. Ando, T. Itahashi, I. Miura, T. Nakatsuka, Osaka University, Osaka, Japan","Injection and Extraction System of the RCNP Ring Cyclotron",346 349,
f6-06,"F. Broggi, A. Ferrari, C. De Martinis, INFN/LASA  University of Milan, Segrate, Milan, Italy","The Electrostatic Deflectors for the Milan Superconducting Cyclotron",350 353,
f6-07,"S. Gustafsson, IPN, Orsay, France","A Superconducting Electromagnetic Channel for AGOR",354 357,
f6-08,"K. Pieterman, J.A.M. Dam, Cryocon B.V., Amersfoort, The Netherlands; C. Commeaux, G. Levy, IPN, Orsay, France","A Design Study for a Superconducting Extraction Element for AGOR",358 360,
f6-09,"X.Y. Wu, M.M. Gordon, NSCL, East Lansing, Michigan, USA","Magnetic Channel Design for a 250 MeV Superconducting Synchrocyclotron",361 364,
f6-10,"C. Mallik, Bhabha Atomic Research Centre, Calcutta, India","Design of Focusing Channel Using Triplet Iron Bars for Calcutta Cyclotron",365 367,
f6-11,"M. Zach, G. Dutto, K. Fong, R.E. Laxdal, G.H. Mackenzie, J.B. Pearson, G. Stanford, TRIUMF, Vancouver, Canada","Status of the H Extraction Program at TRIUMF",368 371,
f6-12,"E. Baron, P. Attal, A.R. Beck, J. Bony, M.P. Bourgarel, B. Bru, A. Chabert, S. Chel, Ch. Ricaud, GANIL, Caen, France; R. Vienet, CEN/Saclay, Gif-sur-Yvette, France","Preliminary Design of a New High Intensity Injection System for GANIL",372 375,
f7-01,"J.L. Conradie, J.C. Cornell, D.T. Fourie, National Accelerator Centre, Faure, Republic of South Africa","Transfer Beamlines for ECR and Polarized-Ion Sources for a New Injector Cyclotron at NAC",376 379,
f7-02,"D.L. Friesel, M. Ball, T.J.P. Ellison, T. Sloan, Indiana University, Bloomington, Indiana, USA","Multiple Beam Operations at IUCF",380 383,
f7-03,"A.R. Beck, . SME Group, GANIL, Caen, France","Medium Energy Beam Facility at GANIL",384 387,
f7-04,"W. Yokota, K. Arakawa, M. Fukuda, T. Kamiya, Y. Nakamura, R. Tanaka, JAERI, Gunma, Japan; T. Mita, T. Satoh, T. Tachikawa, Sumitomo Heavy Industries, Ehime, Japan","Design of Beam Chopping System for JAERI AVF Cyclotron",388 391,
f7-05,"G.R. Mitchel, J.E. McGregor, E.P. Stock, Atomic Energy of Canada, Chalk River, Ontario, Canada","TASCC Bunch Injection and Phase Control System: Review, Operating Experience and Recent Improvements",392 396,
f7-06,"P.R. Sarma, R.K. Bhandari, V.S. Pandit, Bhabha Atomic Research Centre, Calcutta, India","A Method to Optimize the Amplitudes of Harmonics in Beam Bunchers",397 400,
f7-07,"X. Gao, A. Shi, Z. Yin, J. Zhong, Institute of Modern Physics, Lanzhou, China","A Novel Monostructure Buncher for HIRFL",401 403,
f7-08,"C. Birattari, A. Ferrari, INFN/LASA  University of Milan, Segrate, Milan, Italy; A. Fassò, CERN, Geneva, Switzerland","Radiological Protection for the Milan Superconducting Cyclotron",404 407,
f7-09,"R. Wang, N. Chen, Technical Institute Sanqiao, Xi'an, China","Environmental Radiation Surveillance and Area Monitoring System of Accelerators",408 411,
g-01,"C.J. Kost, TRIUMF, Vancouver, Canada","Invited Paper: Computational Tools for Cyclotron Design, Commissioning, and Operation",412 421,
g-02,"C.W. Trowbridge, Vector Fields Ltd., Kidlington, Oxon, UK","Invited Paper: State of the Art in Electromagnetic Field Computation",422 431,
g1-01,"A.R. Beck, B. Bru, S. Chel, Ch. Ricaud, GANIL, Caen, France","Six-Dimensional Beam Matching for Axial Injection into a Cyclotron",432 434,
g1-02,"J.B. Pearson, R.J. Balden, W.J. Kleeven, L.S. Milinkovic, B.F. Milton, TRIUMF, Vancouver, Canada","Aspects of Phase Space Dynamics in Spiral Inflectors",435 438,
g1-03,"A. Goto, K. Hatanaka, T. Kageyama, Y. Yano, RIKEN, Saitama, Japan","Study of Beam Optics for the Injector AVF Cyclotron at RIKEN",439 442,
g1-04,"J.I.M. Botman, H.L. Hagedoorn, Eindhoven University of Technology, Eindhoven, The Netherlands; J. Reich, FZJ, Juumllich, Germany","Axial Inflectors and the Correlation Between Phase Spaces",443 446,
g1-05,"J.I.M. Botman, H.L. Hagedoorn, Eindhoven University of Technology, Eindhoven, The Netherlands; D. Potaux, IPN, Orsay, France","Analytical Treatment of Resonances",447 450,
g1-06,"N.C. Bhattacharya, Bhabha Atomic Research Centre, Calcutta, India","Improving the Energy Resolution by ''Dispersion Matching'' and ''Reduction of Kinematic Broadening''",451 452,
g1-07,"K.M. Subotic, Boris Kidriccaron; Institute, Belgrade, Yugoslavia","Proton Window and Superconducting Cyclotrons",453 456,
g1-08,"L.A. Sarkisyan, Yu.A. Artyukh, E.I. Moiseev, V.A. Sadovnichiî, Moscow State University, Moscow, USSR","The Investigation of Proton Crossing of the Integer Resonance Qr=2 in the Cyclotron by Numerical Integration of the Nonhomogeneous Linear Equation of Free Radial Oscillators",457 460,
g1-09,"J. Fermé, GANIL, Caen, France","Parameters of the Eigenellipsoid for Separated Sector Cyclotrons",461 463,
g2-01,"P. Heikkinen, University of Jyväskylä, Jyväskylä, Finland","The Jyväskylä K130 Cyclotron Magnet",464 466,
g2-02,"P.M. Cronje, H.N. Jungwirth, W.A.G. Nel, National Accelerator Centre, Faure, Republic of South Africa","Isochronous Fields for the NAC Separated-Sector Cyclotron",467 470,
g2-03,"N.C. Bhattacharya, Bhabha Atomic Research Centre, Calcutta, India; J.A. Nolen, S. Tanaka, NSCL, East Lansing, Michigan, USA","Design, Fabrication and Testing of a Nested Pair of ''cos theta; Dipole'' X-Y Steering Magnets",471 473,
g2-04,"K. Hosono, M. Kibayashi, I. Miura, Osaka University, Osaka, Japan; J. Abe, Sumitomo Heavy Industries, Ehime, Japan","Magnetic System of the RCNP Ring-Cyclotron",474 477,
g2-05,"P. Mandrillon, Centre Antoine Lacassagne, Nice, France; R. Ostojic, Boris Kidriccaron; Institute, Belgrade, Yugoslavia","Magnet Sector Design for the EULIMA Superconducting Cyclotron",478 481,
g2-06,"O.C. Dermois, C.W.J. van Lummel, KVI, Groningen, The Netherlands","Fringefield Corrections of Short Quadrupoles with a Large Aperture",482 485,
g2-07,"E. Acerbi, G. Bellomo, L. Rossi, INFN/LASA  University of Milan, Segrate, Milan, Italy; S. Zhou, Institute of Modern Physics, Lanzhou, China; P. Gmaj, University of Warsaw, Warsaw, Poland","The Magnetic Field Measurements of the Milan Superconducting Cyclotron",486 489,
g2-08,"P. Michelato, D. Giove, INFN/LASA, Segrate, Milan, Italy","Operational Experience on the Milan Superconducting Cyclotron Cryostat Vacuum System",490 493,
g2-09,"B.-W. Wei, G. Chang, H. Chen, J. Dang, R. He, D. Miao, G. Wang, S. Wang, S. Yang, Y. Yang, F. Ye, G. Zhang, Z. Zhang, J. Zheng, S. Zhou, W. Zhou, Institute of Modern Physics, Lanzhou, China","Main Results of the Magnetic Field Mapping for HIRFL SSC",494 497,
g2-10,"H.N. Jungwirth, National Accelerator Centre, Faure, Republic of South Africa; D.P. Brombach, PSI, Villigen, Switzerland","A Novel Concept for Superconducting Ring-Cyclotron Magnets",498 501,
h-01,"G. Hör, R. Standke, University of Frankfurt, Frankfurt, Germany","Cyclotron Produced Isotopes for Medical Applications",502 506,
h-02,"Ch. Markovits, S. Jaccard, Ch. Perret, PSI, Villigen, Switzerland","The Proton Beam Facility OPTIS for the Therapy of Ocular Tumours",507 510,
h-03,"M.A. Chaudhri, Austin Hospital  University of Melbourne, Melbourne, Australia","Cyclotron Production of Therapy Neutrons",511 518,
h-04,"V. Bechtold, N. Kernert, H. Schweickert, FZK, Karlsruhe, Germany","Modern Gas-Target Technology for the Production of High Quality Radiopharmaceuticals",519 522,
h-05,"S.J. Mills, F.M. Nortier, G.F. Steyn, National Accelerator Centre, Faure, Republic of South Africa; W.L. Rautenbach, University of Stellenbosch, Stellenbosch, Republic of South Africa","A Versatile Cooling-Water System for Radioisotope Production Targets in Tandem",523 526,
h-06,"S.J. Mills, F.M. Nortier, H.A. Smit, G.F. Steyn, National Accelerator Centre, Faure, Republic of South Africa; W.L. Rautenbach, University of Stellenbosch, Stellenbosch, Republic of South Africa","A Multi-Purpose Target Station for Radioisotope Production at Medium Energies",527 530,
h-07,"N.A.M. van Bree, J.J.M. de Goeij, A.G.M. Janssen, J.F.C.M. van den Broek, W. van Genderen, Eindhoven University of Technology, Eindhoven, The Netherlands","Production of 18F Using Static and Circulating [18O]-Water Targets",531 534,
h-08,"N.I. Venikov, D.I. Fomichev, V.I. Novikov, A.A. Sebyakin, V.A. Shabrov, Kurchatov Institute of Atomic Energy, Moscow, USSR","Production of High-Purity 123I on IAE Cyclotron",535 537,
h-09,"M.A. Chaudhri, Austin Hospital  University of Melbourne, Melbourne, Australia","Thickness Consideration for Li and Be Targets for Fast Neutron Production by Cyclotrons of Different Sizes",538 541,
h-10,"N.A. Konjachin, P.P. Dmitriev, N.N. Krasnov, V.P. Lapin, V.N. Mironov, M.V. Panarin, Institute of Physics and Power Engineering, Obninsk, USSR","On 123I Production by Irradiation of 124Xe with the Protons of Mean Energy",542 544,
j-01,"A. Möslang, S. Cierjacks, R. Lindau, FZK, Karlsruhe, Germany","Invited Paper: Test of Fusion Reactor Materials with Cyclotrons and Presentation of the Karlsruhe Dual-Beam Facility",545 554,
j-02,"B.E. Fischer, R. Spohr, GSI, Darmstadt, Germany","Invited Paper: Production of Microstructures by Heavy Ions",555 565,
j-03,"R. Tanaka, T. Agematsu, N. Akiyama, K. Arakawa, M. Fukuda, M. Hagiwara, T. Kamiya, M. Maruyama, Y. Nakamura, T. Nara, S. Okada, S. Tanaka, H. Watanabe, W. Yokota, JAERI, Gunma, Japan","JAERI AVF Cyclotron for Research of Advanced Radiation Technology",566 569,
j-04,"H. Fuchs, HMI, Berlin, Germany","Invited Paper: Nuclear-Physics Research with Heavy Ions in the 10 to 30 MeV/Nucleon Range: Birth and Death of Hot Nuclei",570 576,
j-05,"P. Fehsenfeld, A. Kleinrahm, FZK, Karlsruhe, Germany","Invited Paper: The Application of Cyclotron in Mechanical Engineering",577 581,
j-06,"M.L. Mallory, Wm.C. McHarris, R.M. Ronningen, B.M. Sherrill, NSCL, East Lansing, Michigan, USA","Production of 7Be from a Heavy Ion Cyclotron: A New Tool for Wear Studies",582 586,
j-07,"H.-E. Mahnke, HMI, Berlin, Germany","Invited Paper: Application of Heavy Ion Beams to Condensed Matter Studies",587 593,
j-08,"J.C. Cornell, D.T. Fourie, G.C.W. Lloyd, National Accelerator Centre, Faure, Republic of South Africa","A Neutron Beam Facility at NAC",594 597,
j-09,"G. Amarendra, K.P. Gopinathan, B. Viswanathan, Indira Gandhi Centre for Atomic Research, Kalpakkam, India","Helium Bubbles in Cyclotron-Bombarded Metals and Alloys Studied by Positron Annihilation Spectroscopy",598 601,
j-10,"M. Castiglioni, L. Manes, B. Weckermann, Joint Research Centre, Ispra, Italy; M. Bonardi, INFN/LASA  University of Milan, Segrate, Milan, Italy","Status Report of the Ispra Cyclotron Laboratory (MACY)",602 604,
