A-01,"H.W. Schreuder, KVI, Groningen, The Netherlands","Invited Paper: AGOR: Initial Beam Tests, Transport and Commissioning",6 11,
a-02,"L. Calabretta, A. Amato, G. Attinà, M. Cafici, A. Caruso, G. Cuttone, G. De Luca, S. Gammino, P. Gmaj, E. Migneco, S. Pace, S. Passarello, S. Pulvirenti, G. Raia, D. Rifuggiato, A. Rovelli, G. Sarta, M. Sedita, A. Spartà, F. Speziale, J. Sura, INFN/LNS, Catania, Italy; E. Acerbi, F. Alessandria, G. Baccaglioni, G. Bellomo, C. Birattari, A. Bosotti, C. De Martinis, E. Fabrici, D. Giove, W. Giussani, P. Michelato, C. Pagani, L. Rossi, G. Varisco, INFN/LASA  University of Milan, Segrate, Milan, Italy","Invited Paper: Commissioning of the K800 INFN Cyclotron",12 19,
a-03,"U. Trinks, TU München, Garching, Germany","Invited Paper: The Superconducting Separated-Orbit Cyclotron TRITRON",20 27,
a-04,"Z.B. Du Toit, A.H. Botha, S.J. Burger, P.J. Celliers, J.L. Conradie, J.C. Cornell, J.L.G. Delsink, J.G. De Villiers, R.E.F. Fenemore, D.T. Fourie, H.N. Jungwirth, A. Müller, P.F. Rohwer, W.F. Van Heerden, D.M. Van Rooyen, National Accelerator Centre, Faure, Republic of South Africa","Commissioning of the Injector Cyclotron for Polarised and Heavy Ions at NAC",28 31,
b-01,"U. Schryber, S. Adam, T. Blumer, J. Cherix, H.R. Fitze, H. Frei, D. George, G. Heidenreich, M. Humbel, I. Jirousek, W. Joho, M. Märki, C. Markovits, A. Mezger, M. Olivo, L. Rezzonico, U. Rohrer, P.K. Sigg, T. Stammbach, PSI, Villigen, Switzerland","Invited Paper: High Power Operation of the PSI-Accelerators",32 38,
b-02,"E. Baron, . GANIL Staff, GANIL, Caen, France","Invited Paper: Upgrading the GANIL Facilities for High-Intensity Heavy Ion Beams (T.H.I. Project)",39 44,
b-03,"F. Marti, H.G. Blosser, T. Grimm, D.A. Johnson, D. Lawton, M.M. Gordon, P. Miller, J. Vincent, X.Y. Wu, R.C. York, A.F. Zeller, NSCL, East Lansing, Michigan, USA","High Intensity Operation of a Superconducting Cyclotron",45 48,
b-04,"K. Hosono, S. Ano, K. Hatanaka, T. Itahashi, M. Kibayashi, I. Miura, T. Saito, K. Sato, A. Shimizu, K. Takahisa, H. Tamura, K. Tamura, M. Uraki, T. Yamazaki, Osaka University, Osaka, Japan","Operating Status of the RCNP Separated Sector Cyclotron",49 52,
b-05,"B. Sinha, Bhabha Atomic Research Centre, Variable Energy Cyclotron Centre, Calcutta, India","The Superconducting Cyclotron Project K500 at Calcutta Cyclotron Centre",53 56,
b-06,"K. Arakawa, T. Agematsu, M. Fukuda, I. Ishibori, Y.F. Nakamura, T. Nara, S. Okumura, W. Yokota, JAERI, Gunma, Japan","Status Report on JAERI-AVF Cyclotron",57 60,
b-07,"G. Dutto, E.W. Blackmore, J. Carey, K. Fong, R. Helmer, T. Hodges, A. Hurst, R.E. Laxdal, C.D.P. Levy, M. Mouat, D. Pearce, R. Poirier, Y. Yin, A.N. Zelenski, TRIUMF, Vancouver, B.C., Canada","Recent Performance of the TRIUMF Cyclotron and Status of the Facility",61 65,
b-08,"P. Heikkinen, E. Liukkonen, University of Jyväskylä, Jyväskylä , Finland","K130 Cyclotron - The First Years of Full Operation",66 69,
b-09,"H. Homeyer, HMI, Berlin, Germany","ISL-Berlin, an Ion Beam Laboratory for Applications",70 73,
b-10,"F. Loyer, . GANIL Staff, GANIL, Caen, France","Status Report on the GANIL Renovation Program",74 77,
b-11,"B. Martin, W. Busse, H. Homeyer, W. Pelzer, HMI, Berlin, Germany; A. Schempp, O. Engels, F. Marhauser, University of Frankfurt, Frankfurt, Germany","A New Injector Concept: The RFQ-Cyclotron Combination at ISL-Berlin",78 81,
b-12,"N. Nescaron;kovicacute;, D.V. Altiparmakov, P. Beliccaron;ev, B. Bojovicacute;, P. Bojovicacute;, A. Dobrosavljevicacute;, N. Makisimovicacute;, V. Vujovicacute;, VINCcaron;A Institute of Nuclear Sciences, Belgrade, Yugoslavia","Status Report on the VINCY Cyclotron",82 85,
b-13,"V. Karasyuk, G. Kurkin, P. Kuznetsov, V. Marusov, V. Parkhomchuk, G. Silvestrov, T. Sokolova, V. Turkin, T. Vsevolozhskaya, Institute of Nuclear Physics, Novosibirsk, Russia","H Cyclotron for Charge-Exchange Injection into a Synchrotron",86 91,
b-14,"G.W. East, Indiana University, Bloomington, Indiana, USA","Facility Status Update of IUCF",92 94,
b-15,"G. Gulbekian, . JINR Cyclotrons Group, JINR, Dubna, Russia","Status of the Flerov Laboratory of Nuclear Reactions JINR Heavy Ion Cyclotrons",95 98,
bnqt-01,"D. Reitmann, National Accelerator Centre, Faure, Republic of South Africa","A Brief History of South Africa's Cyclotrons",3 5,
c-01,"B.F. Milton, TRIUMF, Vancouver, B.C., Canada","Invited Paper: Commercial Compact Cyclotrons in the '90s",99 106,
c-02,"M. Chen, G. Chen, D. Li, X. Lu, L. Shen, S. Xu, Y. Zhang, Institute of Nuclear Research, Academia Sinica, Shanghai, China; W. Zhou, X'ian Academia Sinica, X'ian, China","A New Type of Mini Cyclotron as Accelerator Mass Spectrometer",107 110,
c-03,"D.J. Clark, K. Halbach, W.B. Kunkel, K.N. Leung, C.Y. Li, A.T. Young, LBNL, Berkeley, California, USA","A Compact Permanent Magnet Cyclotron for Accelerator Mass Spectrometry",111 114,
c-04,"Y. Jongen, D. Vandeplassche, P. Cohilis, Ion Beam Applications SA, Louvain-la-Neuve, Belgium","High Intensity Cyclotrons for Radioisotope Production, or The Comeback of the Positive Ions",115 119,
c-05,"M. Abs, J.C. Amélia, J.-L. Bol, M. De Leenheer, M. Ghyoot, J.-L. Delvaux, Y. Jongen, M. Ladeuze, G. Lannoye, J.-L. Morelle, M. Pinchart, M. Schuwer, S. Zaremba, Ion Beam Applications SA, Louvain-la-Neuve, Belgium","The IBA PET-Dedicated Cyclotrons: Main Features and Improvements",120 123,
c-06,"E.M. Conard, Particle Accelerator Consultants, Dion-Valmont, Belgium; D.W. Arnott, S. Parcell, National Medical Cyclotron, Camperdown, Australia","1 mA 30 MeV Proton Beams for Radionuclide Production",124 127,
c-07,"S.M. Haji-Saeid, H. Afarideh, A. Amirabadi, Nuclear Research Center for Agriculture and Medicine, Karadj, Iran","The NRCAM Cyclotron Facilities",128 131,
c-08,"M.F. Vorogushin, V. Glukhikh, B. Tronov, Yu.P. Vakhrushin, D.V. Efremov Scientific Research Institute of Electrophysical Apparatus, St. Petersburg, Russia","Status of Cyclotron Design in the Efremov Institute",132 135,
d-01,"P.Yu. Apel, JINR, Dubna, Russia","Invited Paper: Polymeric Materials Research with Cyclotrons",136 143,
d-02,"M.F. Stroosnijder, Joint Research Centre, Ispra (Va), Italy","The Application of a Cyclotron in Materials Research at the IAM of the European Commission",144 147,
d-03,"A.V. Demyanov, Institute for Nuclear Research, Kiev, Ukraine","Application of 235U+ Ion Beams for Increasing the Safety of Operation in Nuclear Reactors for Atomic Power Station (APS)",148 149,
d-04,"A.A. Ogloblin, Kurchatov Institute, Moscow, Russia","Radioactive Beams for Material Engineering",150 153,
d-05,"G. Laguzzi, R. Bisconti, G. Macchi, M.F. Stroosnijder, Joint Research Centre, Ispra (Va), Italy","Deuteron Activation of Chromium for Thin Layer Activation Studies",154 156,
d-06,"S. Tazawa, Sumitomo Heavy Industries Examination  Inspection, Toyo-shi, Japan; H. Muraoka, T. Nozaki, Purex Inc., Yokohama, Japan","Industrial Use of a Sub-Compact Cyclotron",157 160,
e-01,"P.K. Sigg, J. Cherix, H.R. Fitze, H. Frei, M. Märki, U. Schryber, PSI, Villigen, Switzerland","Invited Paper: High Beam Power RF-Systems for Cyclotrons",161 168,
e-02,"T. Saito, I. Miura, M. Uraki, Osaka University, Osaka, Japan","The Flat-Topping System for the RCNP Ring Cyclotron",169 172,
e-03,"C.M. Lyneis, D.J. Clark, Z.Q. Xie, LBNL, Berkeley, California, USA","LBNL 88-Inch Cyclotron Improvements",173 176,
e-04,"T. Kuo, R. Baartman, G. Dutto, K. Jayamanna, R.E. Laxdal, M. McDonald, B.F. Milton, R. Poirier, L. Root, P.W. Schmor, H.R. Schneider, N.R. Stevenson, W. Uzat, D. Yuan, TRIUMF, Vancouver, B.C., Canada","On the Development of 2 mA RF H Beams for Compact Cyclotrons",177 180,
e-05,"A. Schempp, University of Frankfurt, Frankfurt, Germany","Invited Paper: RF-Quadrupole Injectors for Cyclotrons",181 185,
e-06,"J. Dietrich, FZJ, Jülich, Germany","Invited Paper: Recent Beam Diagnostic Techniques",186 193,
e-07,"B. Launé, IPN, Orsay, France; . SPIRAL Group, GANIL, Caen, France","The Diagnostics System for the SPIRAL R.I.B. Facility",194 197,
e-08,"O.C. Dermois, K. Gerbens, J.M. Schippers, J. Zijlstra, KVI, Groningen, The Netherlands","Non intercepting Beam-Current and Position Monitors for the AGOR Beamlines",198 201,
e-09,"A. Goto, Y. Batygin, T. Chiba, M. Hemmi, E. Ikezawa, N. Inabe, T. Kageyama, O. Kamigaito, M. Kase, S. Kohara, Y. Miyazawa, T. Nakagawa, Y. Yano, RIKEN, Saitama, Japan","Construction of a New Pre-Injector System for the RILAC",202 205,
e-10,"J.Y. Tang, X.Q. Zhao, Institute of Modern Physics, Lanzhou, China","New Design of the SFC Central Region",206 209,
e-11,"D.V. Altiparmakov, M.V. Markovic, S.S. Tomic, VINCcaron;A Institute of Nuclear Sciences, Belgrade, Yugoslavia; N.A. Morozov, JINR, Dubna, Russia","Computer Modeling of the Isochronous Field in the VINCY Cyclotron",210 213,
e-12,"D.V. Altiparmakov, VINCcaron;A Institute of Nuclear Sciences, Belgrade, Yugoslavia; S.B. Vorozhtsov, JINR, Dubna, Russia","Computer Models of the VINCY Cyclotron Magnet",214 217,
e-13,"W. Beeckman, J.C. Amélia, A. Laisné, G. Lannoye, Y. Jongen, D. Vandeplassche, S. Zaremba, Ion Beam Applications SA, Louvain-la-Neuve, Belgium; T. Satoh, T. Tachikawa, M. Sano, Sumitomo Heavy Industries, Niihama-City, Japan","The C235 IBA-SHI Protontherapy Cyclotron for the NPTC Project: Magnetic System Design and Construction",218 221,
e-14,"W. Beeckman, J.C. Amélia, G. Lannoye, M. Schuwer, D. Vandeplassche, S. Zaremba, Ion Beam Applications SA, Louvain-la-Neuve, Belgium; H. Miyazaki, Sumitomo Heavy Industries, Niihama-City, Japan","The C235 IBA-SHI Protontherapy Cyclotron for the NPTC Project: Progress Report of the Magnetic Field Mapping and Shimming",222 225,
e-15,"O.C. Dermois, A.M. Van Den Berg, H.K.T. Van Der Molen, KVI, Groningen, The Netherlands","Fringefield Effects in Short Quadrupoles",226 229,
e-16,"O.C. Dermois, K. Gerbens, C. Herrema, S. Lettinga, KVI, Groningen, The Netherlands","A Fast Scanmagnet for Irradiation Purposes with AGOR Beams",230 232,
e-17,"T. Honma, M. Fujioka, T. Shinozuka, Tohoku University, Sendai, Japan","Properties of a Permanent-Magnet Dipole with Variable Field Strength and Polarity",233 236,
e-18,"T. Mitsumoto, S. Fujishima, A. Goto, K. Ikegami, T. Kawaguchi, T. Kubo, H. Okuno, Y. Tanaka, T. Tominaka, Y. Yano, RIKEN, Saitama, Japan","Design Study of Sector Magnets of Superconducting Ring Cyclotron for the RIKEN RI Beam Factory",237 240,
e-19,"D. Rifuggiato, L. Calabretta, P. Gmaj, INFN/LNS, Catania, Italy; G. Bellomo, INFN/LASA  University of Milan, Segrate, Milan, Italy","Analysis of the Final Magnetic Measurements of the L.N.S. Superconducting Cyclotron",241 244,
e-21,"E. Acerbi, M. Sorbi, INFN/LASA  University of Milan, Segrate, Milan, Italy; M. Castiglioni, Joint Research Centre, Ispra (Va), Italy; N. Fiétier, P. Mandrillon, Centre Antoine Lacassagne, Nice, France","Design of the RF Cavity for a 200 MeV Proton Superconducting Cyclotron",245 248,
e-22,"J.L. Conradie, A.H. Botha, R.E.F. Fenemore, J.J. Kritzinger, M.J. Van Niekerk, National Accelerator Centre, Faure, Republic of South Africa","A Flat-Top Acceleration System for the NAC Light Ion Injector Cyclotron",249 252,
e-23,"A. Caruso, A. Spartà, J. Sura, E. Zappalà, INFN/LNS, Catania, Italy; V. Pagani, M. Bonezzi, A. Bosotti, D. Corti, M. Fusetti, G. Varisco, INFN/LASA  University of Milan, Segrate, Milan, Italy","The Upgraded Control of the LNS Superconducting Cyclotron Radio-Frequency System",253 256,
e-24,"N. Fiétier, S. Besançon, V. Rossin, Centre Antoine Lacassagne, Nice, France","The RF System of the Accelerator Complex of the Energy Amplifier",257 260,
e-25,"J.J. Kritzinger, A. Müller, H.A. Smit, National Accelerator Centre, Faure, Republic of South Africa","Experience with Electrical Contact Systems for Radio Frequencies at NAC",261 264,
e-26,"J.Y. Tang, W. Lei, Y.F. Wang, Institute of Modern Physics, Lanzhou, China","A New Buncher System for SFC",265 268,
e-27,"P. Miller, D. Lawton, F. Marti, NSCL, East Lansing, Michigan, USA","Beam Loss from Charge Changing Collisions in a Cyclotron",269 272,
e-28,"L. Onischenko, N. Shakun, P. Shishlyannikov, JINR, Dubna, Russia","Beam Lifetime in the JINR Phasotron",273 275,
e-29,"Y.F. Nakamura, T. Agematsu, K. Arakawa, M. Fukuda, I. Ishibori, K. Mizuhashi, T. Nara, S. Okumura, W. Yokota, JAERI, Gunma, Japan","Performance and Constitution of the Vacuum System in the JAERI AVF Cyclotron",276 279,
e-30,"W. Bräutigam, R. Brings, FZJ, Jülich, Germany","Beam Stabilization by Feedback Control of the Accelerating Parameters in a Cyclotron",280 283,
e-31,"T. Agematsu, K. Arakawa, S. Okumura, JAERI, Gunma, Japan","Development of Visual Beam Adjustment Method for Cyclotron",284 287,
e-32,"A.A. Green, J. Birchall, J.R. Campbell, C.A. Davis, A.A. Hamian, L. Lee, S.A. Page, W.D. Ramsay, S.D. Reitzner, A.M. Sekulovich, V. Sum, W.T.H. Van Oers, University of Manitoba, Winnipeg, Canada; C.D.P. Levy, D.C. Healey, R. Helmer, W. Kellner, P.W. Schmor, A.N. Zelenski, TRIUMF, Vancouver, B.C., Canada; P.W. Green, G. Roy, J. Soukup, G.M. Stinson, T. Stocki, University of Alberta, Edmonton, Canada; J.D. Bowman, R.E. Mischke, LANL, Los Alamos, New Mexico, USA; N.A. Titov, Institute for Nuclear Research, Moscow, Russia; A.R. Berdoz, Carnegie Mellon University, Pittsburgh, Pennsylvania, USA","Precision Measurements of the Effects of Energy and Intensity Modulation of an Optically-Pumped Polarized Ion Source",288 290,
e-33,"M. Kase, A. Goto, M. Hemmi, N. Inabe, Y. Yano, I. Yokoyama, RIKEN, Saitama, Japan","Applications of MCP Phase Monitor to Operation of RIKEN Heavy Ion Accelerators",291 294,
e-34,"B. Lundström, D. Wessman, Uppsala University, Uppsala, Sweden","Improvements of the Diagnostics of the Gustaf Werner Cyclotron",295 297,
e-35,"G.H. Mackenzie, M. Dombsky, W.R. Rawnsley, G. Stanford, Y. Yin, TRIUMF, Vancouver, B.C., Canada; A. Novikov, Institute for Nuclear Research, Moscow, Russia","Beam Instrumentation for an ISOL Test Stand",298 301,
e-36,"T. Itahashi, S. Ano, K. Hatanaka, K. Hosono, M. Kibayashi, I. Miura, T. Saito, K. Sato, A. Shimizu, K. Takahisa, H. Tamura, K. Tamura, M. Uraki, T. Yamazaki, Osaka University, Osaka, Japan","Radial and Vertical Betatron Oscillation Frequencies Observed by a Scintillation Plate and a Three Wire Tomography Monitor",302 305,
e-37,"A.A. Green, J. Birchall, J.R. Campbell, C.A. Davis, A.A. Hamian, L. Lee, S.A. Page, W.D. Ramsay, S.D. Reitzner, A.M. Sekulovich, V. Sum, W.T.H. Van Oers, University of Manitoba, Winnipeg, Canada; N.A. Titov, Institute for Nuclear Research, Moscow, Russia; D.C. Healey, R. Helmer, W. Kellner, C.D.P. Levy, P.W. Schmor, A.N. Zelenski, TRIUMF, Vancouver, B.C., Canada; P.W. Green, G. Roy, J. Soukup, G.M. Stinson, T. Stocki, University of Alberta, Edmonton, Canada; J.D. Bowman, R.E. Mischke, LANL, Los Alamos, New Mexico, USA; A.R. Berdoz, Carnegie Mellon University, Pittsburgh, Pennsylvania, USA","Pulsed Integrating Feedback Amplifier Position Control of Intermediate Energy Proton Beams",306 309,
e-38,"J.S. Chai, J.H. Ha, Y.S. Kim, KAERI, Seoul, South Korea; D.S. Ahn, S.B. Hong, K.H. Kwon, SungKyanKwan University, Kyunggi-Do, South Korea","Beam Transport System Using Fuzzy Controller in the KCCH Cyclotron",310 313,
e-39,"A.H. Mohammadzadeh, H. Afarideh, S.M. Haji-Saeid, Nuclear Research Center for Agriculture and Medicine, Karadj, Iran","Improving the Energy Resolution of the 30 MeV Cyclotron Proton Using the Designed Achromatic System",314 317,
e-40,"J. Pivarccaron;, JINR, Dubna, Russia","Vacuum for Cyclotron Beam Transport Lines",318 321,
e-41,"H.F. Weehuizen, A.H. Botha, J.L. Conradie, P.M. Cronje, R.K. Fisch, D.T. Fourie, H.N. Jungwirth, H. Kettner, L.M. Roels, P.J. Theron, National Accelerator Centre, Faure, Republic of South Africa","Beam Control for Proton Therapy",322 325,
e-42,"H.F. Weehuizen, R.K. Fisch, M.E. Hogan, I.H. Kohler, P.J. Theron, National Accelerator Centre, Faure, Republic of South Africa","The Present Status of the NAC Control System",326 329,
e-43,"B. Mukherjee, National Medical Cyclotron, Camperdown, Australia","A ''Cook-Book-Method'' of Shielding Design for Compact Medical Cyclotrons",330 333,
e-44,"B. Mukherjee, National Medical Cyclotron, Camperdown, Australia","The Smart Effluent Monitoring System at the Australian National Medical Cyclotron",334 337,
f-01,"R. Maier, U. Bechstedt, J. Dietrich, S. Martin, D Prasuhn, A. Schnase, H. Schneider, H. Stockhorst, R. Tölle, FZJ, Jülich, Germany","Invited Paper: Commissioning of the Cooler Synchrotron COSY",338 344,
f-02,"R.E. Pollock, Indiana University, Bloomington, Indiana, USA","Invited Paper: New Developments at the IUCF Cooler Ring",345 349,
f-03,"D. Reistad, T. Bergmark, L. Einarsson, K. Gajewski, L. Hermansson, P. Jahnke, T. Lofnes, G. Norman, L. Westerberg, V. Ziemann, Svedberg Laboratory, Uppsala, Sweden; K. Hedblom, A. Johansson, Uppsala University, Uppsala, Sweden; M. Berglund, Alfvén Laboratory, Stockholm, Sweden","Injection, Cooling and Accumulation of Ions from the Gustaf Werner Cyclotron into the CELSIUS Cooler-Storage Ring",350 353,
f-04,"B.W. Wei, J.W. Xia, Institute of Modern Physics, Lanzhou, China","HIRFL-CSR Proposal",354 357,
f-05,"Y.N. Rao, B.W. Wei, J.W. Xia, Y.J. Yuan, Institute of Modern Physics, Lanzhou, China","Lifetime of Ion Beam Stored in HIRFL-CSR",358 361,
g-01,"G.D. Alton, ORNL, Oak Ridge, Tennessee, USA","Invited Paper: Future Prospects for ECR Ion Sources with Improved Charge State Distributions",362 371,
g-02,"K.N. Leung, LBNL, Berkeley, California, USA","Invited Paper: High-Intensity Sources for Light Ions",372 376,
g-03,"S. Gammino, G. Ciavola, INFN/LNS, Catania, Italy","ECR Ion Sources and Scaling Laws",377 380,
g-04,"D.P. May, F.P. Abegglen, G.J. Derrig, G.J. Kim, Texas AM University, College Station, Texas, USA","Commissioning of the Texas AM ECR Ion Source High B Upgrade",381 384,
g-05,"H. Schmeing, W.T. Diamond, J. Diserens, T. Taylor, J.S.C. Wills, Atomic Energy of Canada, Chalk River, Ontario, Canada","A Microwave-Driven Source for the Production of Intense Negative Ion Beams for TASCC",385 388,
g-06,"K. Hatanaka, K. Hosono, T. Itahashi, I. Miura, T. Saito, M. Sato, K. Takahisa, H. Tamura, K. Tamura, Osaka University, Osaka, Japan","The RCNP Atomic Beam Source",389 392,
g-07,"W. Kretschmer, A. Glombik, H. Meyer, R. Weidmann, University of Erlangen, Erlangen, Germany; M. Altmeier, P.D. Eversheim, O. Felden, R. Gebel, M. Glende, Bonn University, Bonn, Germany; M. Eggert, S. Lemaitre, R. Reckenfelderbäumer, H. Paetz Gen. Schieck, University of Cologne, Cologne, Germany","The Polarized Ion-Source for COSY",393 396,
g-08,"A. Valek, S. Biri, I. Szücs, J. Vámosi, Institute of Nuclear Research of the Hungarian Academy of Sciences, Debrecen, Hungary","Test Measurements of the Debrecen ECRIS Subsystems",397 400,
g-09,"A.A. Evremov, V.B. Kutner, A.V. Lebedev, V.N. Loginov, J. Pivarccaron;, N.Yu. Yatzvitsyiy, JINR, Dubna, Russia; H.W. Zhao, Institute of Modern Physics, Lanzhou, China","Experimental Results of the Gas Mixing Effect on DECRIS-14-2",401 403,
g-10,"P.A. Schmelzbach, S. Drack, PSI, Villigen, Switzerland","Commissioning and First Operating Experience with the ECR Heavy Ion Source at the PSI Philips Cyclotron",404 407,
g-11,"B. Sinha, D.K. Bose, C. Mallik, P.Y. Nabhiraj, G. Pal, G.S. Taki, Bhabha Atomic Research Centre, Variable Energy Cyclotron Centre, Calcutta, India","The Electron Cyclotron Resonance Ion Source at Variable Energy Cyclotron Centre, Calcutta",408 411,
g-12,"K. Takahisa, K. Hatanaka, K. Hosono, T. Itahashi, I. Miura, T. Saito, M. Sato, H. Tamura, K. Tamura, Osaka University, Osaka, Japan; M. Tanaka, Kobe Tokiwa Jr. College, Kobe, Japan; E. Kaneko, Sumitomo Heavy Industries Accelerator Service, Ehime, Japan","Status of the NEOMAFIOS at RCNP",412 415,
g-13,"H.W. Zhao, Institute of Modern Physics, Lanzhou, China; A.A. Efremov, V.B. Kutner, JINR, Dubna, Russia","Simulation of Multiply-Charged Ion Production in DECRIS-14-2",416 419,
g-16,"T. Kuo, R. Baartman, G. Dutto, K. Jayamanna, M. McDonald, P.W. Schmor, D. Yuan, TRIUMF, Vancouver, B.C., Canada","Development of a 15 mA DC H Multicusp Source for Cyclotron Injection",420 423,
g-17,"R.A. Naumann, Dartmouth College, Hanover, New Hampshire, USA","On-Line Investigation of Cyclotron-Produced Fission Products: Target-Ion Source Options",424 426,
g-18,"A.S. Demyanova, A.A. Ogloblin, Kurchatov Institute, Moscow, Russia; L.K. Druzhinin, B.V. Safronov, NETPAMM, Moscow, Russia","Production of 14C Pellets for Sputter Ion Sources",427 428,
g-19,"P. Kuznetsov, V. Parkhomchuk, G. Silvestrov, BINP, Novosibirsk, Russia","Multi-Channel Water Steam H Source for Internal Injection to a Cyclotron",429 431,
h-01,"R.E. Laxdal, TRIUMF, Vancouver, B.C., Canada","Invited Paper: Manipulation of the Micro- and Macro-Structure of Beams Extracted from Cyclotrons",432 439,
h-02,"R. Baartman, TRIUMF, Vancouver, B.C., Canada","Invited Paper: Intensity Limitations in Compact H Cyclotrons",440 445,
h-03,"S. Adam, PSI, Villigen, Switzerland","Space Charge Effects in Cyclotrons - From Simulations to Insights",446 449,
h-04,"M. Sekiguchi, University of Tokyo, Tokyo, Japan","A Numerical Study of the Space Charge Effects in a Spiral Inflector",450 453,
h-05,"D. Vandeplassche, J.C. Amélia, W. Beeckman, Y. Jongen, G. Lannoye, S. Zaremba, Ion Beam Applications SA, Louvain-la-Neuve, Belgium","The C235 IBA-SHI Protontherapy Cyclotron for the NPTC Project: On Beam Dynamics Issues",454 457,
h-06,"J.L. Conradie, A.H. Botha, National Accelerator Centre, Faure, Republic of South Africa","Optimisation of the Beam Buncher Parameters in the Injection Beamline of the NAC",458 461,
h-07,"N. Fiétier, P. Mandrillon, Centre Antoine Lacassagne, Nice, France; . CERN/AT/ET Group, CERN, Geneva, Switzerland","Beam Dynamics and Space-Charge Aspects in the Design of the Accelerators for the Energy Amplifier",462 465,
h-08,"G.H. Mackenzie, R. Lee, W.R. Rawnsley, TRIUMF, Vancouver, B.C., Canada","A Demonstration of Beam Intensity Modulation Without Loss of Charge",466 469,
h-09,"A.I. Papash, Institute for Nuclear Research, Kiev, Ukraine","Phase Space Stretching and Distortion Arising from the RF Deflector in the TRIUMF Cyclotron",470 474,
h-10,"D. Rifuggiato, L. Calabretta, INFN/LNS, Catania, Italy","Experimental Evidence of Beam Dynamics Features of the LNS Superconducting Cyclotron",475 478,
h-11,"Y.J. Yuan, Y.N. Rao, B.W. Wei, J.W. Xia, Institute of Modern Physics, Lanzhou, China","Simulation of RF Stacking and Multiple Single-Turn Injection and Multiturn Injection",479 482,
j-01,"E. Pedroni, H. Blattmann, T. Boehringer, A. Coray, E. Egger, S. Lin, A. Lomax, G. Munkel, B. Schaffner, PSI, Villigen, Switzerland","Invited Paper: Commissioning and Use of the PSI Spot-Scanning Isocentric System for Proton Therapy",483 490,
j-02,"D.T.L. Jones, A.N. Schreuder, J.E. Symons, National Accelerator Centre, Faure, Republic of South Africa","Invited Paper: Particle Therapy at NAC: Physical Aspects",491 498,
j-03,"J. Flanz, S. Durlacher, M. Goitein, A. Smith, S. Woods, . IBA Staff, . Bechtel Staff, Massachusetts General Hospital, Boston, Massachusets, USA","Invited Paper: The Northeast Proton Therapy Center at Massachusetts General Hospital",499 503,
j-04,"R.L. Maughan, J.D. Forman, A.T. Porter, M. Yudelev, Harper Hospital  Wayne State University, Detroit, Michigan, USA; H.G. Blosser, NSCL, East Lansing, Michigan, USA; E.B. Blosser, G.F. Blosser, MedCyc Corporation, Haslett, Michigan, USA","Four Years of Operating Experience with the Harper Hospital Superconducting Cyclotron for Neutron Radiation Therapy",504 507,
j-05,"J.S. Chai, Y.S. Kim, D.H. Lee, J.D. Lee, S.Y. Yoo, KAERI, Seoul, South Korea","Operation Experience of KCCH Cyclotron for 10 years and Prospect of Cyclotron in Korea",508 511,
j-06,"M.A. Chaudhri, Austin Hospital  The University of Melbourne, Melbourne, Australia","Fast Neutron Beams for Therapy: The Current Status and Room for Improvement?",512 514,
j-07,"F.D. Brooks, M.S. Allie, C.C. Bowley, A. Buffler, University of Cape Town, Rondebosch, South Africa; D.T.L. Jones, J.E. Symons, National Accelerator Centre, Faure, Republic of South Africa","Energy Spectra in the NAC Proton Therapy Beam",515 518,
j-09,"R. Risler, R. Emery, J. Jacky, I. Kalet, M. Patrick, P. Wootton, F. Ziai, University of Washington, Seattle, Washington, USA","Clinical Cyclotron Seattle: Eleven Years of Operation",519 522,
j-10,"A.N. Schreuder, T. Fulcher, D.T.L. Jones, A. Kiefer, J.E. Symons, National Accelerator Centre, Faure, Republic of South Africa","The NAC Proton Therapy Beam Delivery System",523 526,
j-11,"Yu.P. Vakhrushin, Yu.N. Gavrish, Yu.A. Svistunov, M.F. Vorogushin, D.V. Efremov Scientific Research Institute of Electrophysical Apparatus, St. Petersburg, Russia","10 MeV Cyclotron and RF Linac as Installation for Neutron Therapy",527 529,
j-12,"J. Zhang, H. Chang, B. Guo, J. Wei, H. Xiao, Institute of Nuclear Research, Academia Sinica, Shanghai, China","The Cyclotron Based Fast Neutron Therapy Facility of SINR",530 532,
j-13,"S. Fukumoto, KEK, Ibaraki, Japan","Cyclotron versus Synchrotron for Proton Beam Therapy",533 536,
k-01,"J.C. Clark, University of Cambridge, Cambridge, UK","Invited Paper: To What Extent Will Cyclotrons in Future Replace Reactors in the Field of Isotope Production?",537 537,
k-02,"D.M. Lewis, Amersham Laboratories, Buckinghamshire, UK","Isotope Production and the Future Potential of Accelerators",538 540,
k-03,"S.M. Qaim, G. Blessing, W. Bräutigam, N. Lavi, B. Scholten, G. Stöcklin, F. Tárkányi, FZJ, Jülich, Germany","Production of Longer-Lived Positron Emitters 73Se, 82mRb and 124I",541 544,
k-04,"C. Birattari, D. Arginelli, M. Bonardi, F. Groppi, L. Ulrici, INFN/LASA  University of Milan, Segrate, Milan, Italy; M. Gallorini, G. Miraglia, S. Saponaro, INFN Pavia, Pavia, Italy","Cyclotron Production of Pt, Pd and Rh Radiotracers to Study the Environmental Impact of the Catalytic Converter Emissions",545 548,
