frm1mcio01,"V.V. Parkhomchuk, BINP SB RAS, Novosibirsk; A.V. Bubley, BINP, Novosibirsk; V.M. Panasyuk, V.B. Reva, BINP SB RAS, Novosibirsk","Electron Cooling for the Therapy Accelerator Complex",168 172,
frm1mcio02,"X.D. Yang, Y.J. Yuan, IMP, Lanzhou","Commissioning of Electron Cooling in CSRe",173 177,
frm1mcio03,"J. Dietrich, FZJ, Jülich; M.I. Bryzgunov, A.D. Goncharov, BINP SB RAS, Novosibirsk; V. Kamerdzhiev, FZJ, Jülich; V.V. Parkhomchuk, V.B. Reva, D.N. Skorobogatov, BINP SB RAS, Novosibirsk","Status of the 2 MeV Electron Cooler for COSY Jülich",178 180,
frm2mcco01,"Y.S. Derbenev, JLAB, Newport News, Virginia","Electron Cooling for Future Electron-Ion Collide at JLAB",181 184,
frm2mcio02,"Y.J. Yuan, J.W. Xia, H.S. Xu, X.D. Yang, H.W. Zhao, IMP, Lanzhou","Status of HIRFL-CSR Project",185 189,
moa1mcco02,"V.A. Lebedev, R.J. Pasquinelli, S.J. Werkema, Fermilab, Batavia","Operation and Upgrade of Stacktail Cooling System",27 31,
moa1mcio01,"M.H. Bussmann, FZD, Dresden; G. Birkl, TU Darmstadt, Darmstadt; C. Dimopoulou, GSI, Darmstadt; Ch. Geppert, Johannes Gutenberg University Mainz, Mainz; C. Kozhuharov, T. Kühl, W. Nörtershäuser, GSI, Darmstadt; C. Novotny, Johannes Gutenberg University Mainz, Institut für Physik, Mainz; U. Schramm, FZD, Dresden; M. Steck, T. Stöhlker, GSI, Darmstadt; T. Walther, TU Darmstadt, Darmstadt; D.F.A. Winters, GSI, Darmstadt","All-Optical Ion Beam Cooling and Online Diagnostics at Relativistic Energies",22 26,
moa1mcio03,"F. Nolden, R. Hettrich, U. Jandewerth, C. Peschke, P. Petri, M. Steck, GSI, Darmstadt","Prototype Pick-up Tank for CR Stochastic Cooling at FAIR",32 35,
moa2mcio01,"R.J. Pasquinelli, Fermilab, Batavia","Twenty-five Years of Stochastic Cooling Experience at Fermilab",36 40,
moa2mcio02,"T. Katayama, A. Dolinskyy, B. Franzke, S.A. Litvinov, GSI, Darmstadt; D. Möhl, CERN, Geneva; F. Nolden, M. Steck, GSI, Darmstadt; L. Thorndahl, CERN, Geneva","Numerical Design Study of Stochastic Stacking of 3 GeV Anti-Proton Beam in the RESR for the FAIR Project",41 45,
mom1mcio01,"L.R. Prost, C.M. Bhat, D.R. Broemmelsiek, A.V. Burov, K. Carlson, J.L. Crisp, P. Derwent, N. Eddy, C. Gattuso, M. Hu, S.M. Pruss, A.V. Shemyakin, M. Sutherland, A. Warner, M. Xiao, Fermilab, Batavia","Status of Antiproton Accumulation and Cooling at Fermilab's Recycler",99 98,
mom1mcio02,"L. Bojtar, CERN, Geneva","Antiproton Decelerator Status Report",99 98,
mom2mcio01,"A.V. Fedotov, I. Ben-Zvi, X. Chang, A. Kayran, V. Litvinenko, A. Pendzick, T. Satogata, BNL, Upton, Long Island, New York","Electron Cooling for the Low-Energy RHIC Program",11 15,
mom2mcio02,"A.V. Smirnov, E.V. Ahmanova, V. Bykovsky, JINR, Dubna, Moscow Region; J. Dietrich, FZJ, Jülich; T. Katayama, GSI, Darmstadt; A.G. Kobets, JINR, Dubna, Moscow Region; D.A. Krestnikov, JINR/DLNP, Dubna, Moscow region; I.N. Meshkov, R. Pivin, A.Yu. Rudakov, A.O. Sidorin, S. Yakovenko, JINR, Dubna, Moscow Region","Application of Cooling Methods to NICA Project",16 20,
mom2mcio03,"D. Prasuhn, J. Dietrich, R. Maier, R. Stassen, H. Stockhorst, FZJ, Jülich","Cooling Experiments at COSY in Preparation for the HESR",21 21,
thm1mcco02,"X. Zhang, Fermilab, Batavia; V. Kamerdzhiev, FZJ, Jülich; A.L. Romanov, BINP SB RAS, Novosibirsk; V.D. Shiltsev, A. Valishev, Fermilab, Batavia","Tevatron Electron Lens and its Applications",103 106,
thm1mcco03,"L.J. Mao, G.H. Li, J. Li, Y. Liu, X.M. Ma, J.W. Xia, T.L. Yan, J.C. Yang, X.D. Yang, Y.J. Yuan, IMP, Lanzhou","Electron Cooling Force Measurements with Variable Profile Electron Beam in HIRFL-CSRm",107 110,
thm1mcio01,"M. Steck, GSI, Darmstadt","Status of the FAIR Project",98 102,
thm2mcco03,"A. Shornikov, K. Blaum, M. Grieser, D. Orlov, A. Wolf, MPI-K, Heidelberg","Ultra Low Energy Electron Cooler for the Heidelberg CSR",119 122,
thm2mcio01,"H. Danared, A. Källberg, A. Simonsson, MSL, Stockholm","Transfer of CRYRING to FAIR",111 114,
thm2mcio02,"C. Dimopoulou, A. Dolinskyy, R.G. Heine, T. Katayama, U. Laier, F. Nolden, G. Schreiber, M. Steck, GSI, Darmstadt","The Versatile NESR Storage Ring with Powerful Electron Cooling",115 118,
thpmcp001,"F. Nolden, GSI, Darmstadt","Numerical Analysis of Low-Intensity Schottky Spectra Recorded as Time Series",123 126,
thpmcp002,"A.V. Smirnov, JINR, Dubna, Moscow Region; D.A. Krestnikov, JINR/DLNP, Dubna, Moscow region; A.O. Sidorin, JINR, Dubna, Moscow Region","Effective Luminosity Simulation for PANDA Experiment at FAIR",127 129,
thpmcp003,"C. Peschke, U. Jandewerth, F. Nolden, P. Petri, M. Steck, GSI, Darmstadt","Prototype Pick-up Module for CR Stochastic Cooling at FAIR",130 133,
thpmcp004,"M.I. Bryzgunov, V.M. Panasyuk, V.B. Reva, BINP SB RAS, Novosibirsk","Calculations of Electron Beam Motion in Electron Cooling System for COSY",134 137,
thpmcp005,"T. Kikuchi, Nagaoka University of Technology, Nagaoka, Niigata; J. Dietrich, FZJ, Jülich; T. Katayama, GSI, Darmstadt; R. Maier, D. Prasuhn, H. Stockhorst, FZJ, Jülich","Simulation Study of Simultaneous Use of Stochastic Cooling and Electron Cooling with Internal Target at COSY and HESR",138 141,
thpmcp006,"A.V. Smirnov, JINR, Dubna, Moscow Region; C.M. Bhat, Fermilab, Batavia; A.V. Fedotov, BNL, Upton, Long Island, New York; D.A. Krestnikov, JINR/DLNP, Dubna, Moscow region; L.R. Prost, Fermilab, Batavia; A.O. Sidorin, JINR, Dubna, Moscow Region","Implementation of Longitudinal Dynamics with Barrier RF in Betacool and Comparison to ESME",142 145,
thpmcp007,"A.G. Kobets, V. Bykovsky, V.I. Lokhmatov, I.N. Meshkov, V. Pavlov, R. Pivin, A.Yu. Rudakov, A.A. Sidorin, S. Yakovenko, JINR, Dubna, Moscow Region","Advance in the LEPTA Project",146 149,
thpmcp008,"A. Sato, Osaka University, Osaka; S. Ishimoto, KEK, Ibaraki","Muon Cooling in a Racetrack FFAG using Superfluid Helium Wedge Absorbers",150 153,
thpmcp010,"T. Shirai, T. Furukawa, S. Hojo, K. Mizushima, NIRS, Chiba-shi; T. Nakamura, JASRI/SPring-8, Hyogo-ken; K. Noda, NIRS, Chiba-shi; S. Shibuya, AEC, Chiba","Cooling Stacking Experiments at HIMAC",154 156,
thpmcp011,"G.H. Li, J. Li, X.M. Ma, L.J. Mao, T.L. Yan, X.D. Yang, IMP, Lanzhou","Application of BPM in HIRFL-CSR Electron Cooler",157 159,
thpmcp012,"X.H. Liao, Y. Li, M.F. Meng, X.X. Wang, Q.L. Zhao, Institute of Electronics, Chinese Academy of Sciences, Beijing","Study on the Oxide Cathode for HIRFL-CSR Electron Cooler",160 163,
thpmcp013,"J.X. Wu, J.W. Xia, Y.J. Yuan, IMP, Lanzhou","The Primary Plan of Stochastic Cooling at HIRFL-CSRe",164 167,
tua1mcio01,"D. Li, LBNL, Berkeley, California","Status of the International Muon Ionization Cooling Experiment (MICE)",71 75,
tua1mcio02,"D. Huang, IIT, Chicago, Illinois; K.Y. Ng, Fermilab, Batavia; T.J. Roberts, Muons, Inc, Batavia","Study of Collective Effect in Ionization Cooling",76 80,
tua1mcio03,"K. Yonehara, Fermilab, Batavia","Development of Helical Cooling Channels for Muon Colliders",81 85,
tua2mcco03,"C.T. Rogers, STFC/RAL/ASTeC, Chilton, Didcot, Oxon; P. Snopok, UCR, Riverside, California","Wedge Absorber Simulations For The Muon Ionization Cooling Experiment",94 97,
tua2mcio01,"J. Wei, TUB, Beijing; X.-P. Li, Skyworks Solutions, Inc., Newbury Park. California; H. Okamoto, HU/AdSM, Higashi-Hiroshima; A. Sessler, LBNL, Berkeley, California; P.-CH. Yu, TUB, Beijing; Y. Yuri, JAEA/TARRI, Gunma-ken","Status and Challenges in Beam Crystallization",86 90,
tua2mcio02,"E.G. Bessonov, LPI, Moscow","The Evolution of the Phase Space Density of Particle Beams in External Fields",91 93,
tum1mcco03,"Y. Bao, C. Blume, MPI für Physics, Muenchen; A. Caldwell, MPI-P, München; D. Greenwald, MPI für Physics, Muenchen","Frictional Cooling Demonstration at MPP",55 58,
tum1mcio01,"A.D. Bross, S. Geer, Fermilab, Batavia; H.G. Kirk, BNL, Upton, Long Island, New York; V.D. Shiltsev, Fermilab, Batavia; M.S. Zisman, LBNL, Berkeley, California","Muon Cooling R&D for the Muon Collider - A Five-year Plan for the US",46 50,
tum1mcio02,"E.G. Bessonov, LPI, Moscow; A.A. Mikhailichenko, CLASSE, Ithaca, New York","Enhanced Optical Cooling of Muon Beams",51 54,
tum1mcio04,"P. Snopok, G.G. Hanson, UCR, Riverside, California","Six-Dimensional Cooling Simulations for the Muon Collider",59 62,
tum2mcio01,"H. Stockhorst, FZJ, Jülich; T. Katayama, GSI, Darmstadt; R. Maier, D. Prasuhn, R. Stassen, FZJ, Jülich; L. Thorndahl, CERN, Geneva","Compensation of Mean Energy Loss due to an Internal Target by Application of a Barrier Bucket and Stochastic Momentum Cooling at COSY",63 66,
tum2mcio02,"A.V. Smirnov, JINR, Dubna, Moscow Region; C. Dimopoulou, GSI, Darmstadt; D.A. Krestnikov, JINR/DLNP, Dubna, Moscow region; I.N. Meshkov, R. Pivin, JINR, Dubna, Moscow Region; G. Schreiber, GSI, Darmstadt; A.O. Sidorin, JINR, Dubna, Moscow Region; M. Steck, GSI, Darmstadt","Particle Accumulation with a Barrier Bucket RF System",67 70,
