frm1cco05,"A. Denker, C.R. Rethfeldt, J.R. Roehrich (Röhrich) [HZB, Berlin, Germany] D. Cordini, J. Heufelder, R. Stark, A. Weber [Charite, Berlin, Germany] ","Advocacy for a Dedicated 70 MeV Proton Therapy Facility",416 418,
frm1cio01,"Y. Jongen [IBA, Louvain-la-Neuve, Belgium] ","Review on Cyclotrons for Cancer Therapy",398 403,
frm1cio03,"N.A. Morozov, V. Aleksandrov, S. Gurskiy, G.A. Karamysheva, N.Yu. Kazarinov, S.A. Kostromin, E. Samsonov, V. Shevtsov, G. Shirkov, E. Syresin, A. Tuzikov [JINR, Dubna, Moscow Region, Russia] M. Abs, A. Blondin, Y. Jongen, W.J.G.M. Kleeven, D. Vandeplassche, S. Zaremba [IBA, Louvain-la-Neuve, Belgium] O. Karamyshev [JINR/DLNP, Dubna, Moscow region, Russia] ","IBA-JINR 400 MeV/u Superconducting Cyclotron for Hadron Therapy",404 409,
frm1cio04,"J.M. Schippers [PSI, Villigen, Switzerland] ","Fast Scanning Techniques for Cancer Therapy with Hadrons - a Domain of Cyclotrons",410 415,
frm2cco04,"T. Mitsumoto, K. Fujita, T. Ogasawara, H. Tsutsui, S. Yajima [SHI, Tokyo, Japan] A. Maruhashi, Y. Sakurai, H. Tanaka [KURRI, Osaka, Japan] ","BNCT System Using 30 MeV H- Cyclotron",430 432,
frm2cio01,"P. Schmor [TRIUMF, Canada's National Laboratory for Particle and Nuclear Physics, Vancouver, Canada] ","Review of Cyclotrons Used in the Production of Radio-Isotopes for Biomedical Applications",419 424,
frm2cio02,"M. Fan [HUST, Wuhan, People's Republic of China] ","Medical Cyclotron and Development in China",425 429,
moa1cio01,"J.W. Stetson, G. Machicoane, F. Marti, D.R. Poe [NSCL, East Lansing, Michigan, USA] ","Intense Beam Operation of the NSCL/MSU Cyclotrons",27 32,
moa1cio02,"G.G. Gulbekyan [JINR, Dubna, Moscow Region, Russia] ","High Intensity Cyclotrons for Super Heavy Elements Research of FLNR JINR",33 36,
moa2cco02,"J.L. Conradie, L.S. Anthony, A.H. Botha, M.A. Crombie, J.G. De Villiers, J.L.G. Delsink, W. Duckitt, D.T. Fourie, M.E. Hogan, I.H. Kohler, C. Lussi, R.H. McAlister, H.W. Mostert, S.S. Ntshangase, J.V. Pilcher, P.F. Rohwer, M. Sakildien, N. Stodart, R.W. Thomae, M.J. Van Niekerk, D. de Villiers, P.A. van Schalkwyk [iThemba LABS, Somerset West, South Africa] C. Boehme (C. Böhme) [UniDo/IBS, Dortmund, Germany] J. Dietrich [FZJ, Jülich, Germany] Z. Kormány [ATOMKI, Debrecen, Hungary] ","Current Status of the Cyclotron Facilities and Future Projects at iThemba Labs",42 44,
moa2cco03,"K. Yoshiki Franzen, P.W. Casey, A. Hodgkinson, M. Kireeff Covo, D. Leitner, C.M. Lyneis, L. Phair, P. Pipersky [LBNL, Berkeley, California, USA] ","Status of the LBNL 88-Inch Cyclotron High-Voltage Injection Upgrade Project",45 47,
moa2cio01,"Y.J. Yuan, X.H. Cai, D.Q. Gao, Y. He, L.Z. Ma, X. Ma, R.S. Mao, Y.W. Su, X.L. Tu, J.W. Xia, H.S. Xu, Z. Xu, J.C. Yang, X.D. Yang, X.T. Yang, Y.P. Yang, W. Zhang, H.W. Zhao [IMP, Lanzhou, People's Republic of China] ","HIRFL-CSR Facility Status and Development",37 41,
mom1cio02,"M.K. Craddock [UBC amp; TRIUMF, Vancouver, British Columbia, Canada] ","Eighty Years of Cyclotrons",1 8,
mom2cco03,"S. Brandenburg, J.P.M. Beijers, M.A. Hevinga, M.A. Hofstee, H.R. Kremers, V. Mironov, J. Mulder, S. Saminathan, A. Sen [KVI, Groningen, The Netherlands] ","Progress towards High Intensity Heavy Ion Beams at the AGOR-Facility",21 23,
mom2cco04,"D.P. May, R.E. Tribble [Texas Aamp;M University Cyclotron Institute, College Station, Texas, USA] F.P. Abegglen, G. Chubaryan, G.J. Derrig, G.J. Kim, G. Tabacaru [Texas Aamp;M University, Cyclotron Institute, College Station, USA] ","Recent Progress on the Facility Upgrade for Accelerated Radioactive Beams at Texas A&M",24 26,
mom2cio01,"A. Goto [RIKEN Nishina Center, Wako, Japan] ","Review of High Power Cyclotrons for Heavy Ion Beams",9 15,
mom2cio02,"F. Chautard [GANIL, Caen, France] ","Intense Beam Operation at GANIL",16 20,
mopcp002,"L.Z. Ma, Q.G. Yao [IMP, Lanzhou, People's Republic of China] ","The Isochronous Magnetic Field Optimization of HITFiL Cyclotron",48 50,
mopcp003,"P. Saidi Bidokhti [PPRC, Tehran, Iran] M. Sadeghi [Agricultural, Medical amp; Industrial Research School, Gohadasht, Iran] A. Shirazi [Tehran University, Faculty of Medicine, Tehran, Iran] ","Application of Cyclotrons in Brachytherapy",51 53,
mopcp005,"Y.T. Petrusenko, D.Y. Barankov, D.O. Irzhevskyi, S.M. Shkyryda [NSC/KIPT, Kharkov, Ukraine] R. Hoelzle (R. Hölzle) [FZJ, Jülich, Germany] ","Kharkov Compact Cyclotron CV-28: Present and Future Status",54 56,
mopcp008,"U. Panda, T. Bhattacharjee, R. Dey, A. Mandal, S. Pal [DAE/VECC, Calcutta, India] ","Control System of Cryogenic Plant for Superconducting Cyclotron at VECC",57 59,
mopcp009,"S.K. Thakur, R.K. Bhandari, A. De, Y. Kumar, J.S.P. Prasad, S. Saha, S.S. Som, T.P. Tiwari [DAE/VECC, Calcutta, India] ","Development of Power Supplies for 3-, 240 kW RF System with Crowbar Protection for Superconducting Cyclotron at VECC",60 62,
mopcp010,"R. Gebel, R. Brings, O. Felden, R. Maier [FZJ, Jülich, Germany] ","Activities at the COSY/Jülich Injector Cyclotron JULIC",63 65,
mopcp011,"R. Risler, S.P. Banerian, J.G. Douglas, R.C. Emery, I.J. Kalet, G.E. Laramore, D.D. Reid [University of Washington Medical Center, Seattle, USA] ","25 Years of Continuous Operation of the Seattle Clinical Cyclotron Facility",66 68,
mopcp013,"Z. Chen, D.Z. Chen, K.F. Liu, B. Qin [HUST, Wuhan, People's Republic of China] ","Magnetic Field Calculation and Magnet Shimming Simulation for the CYCHU-10 Cyclotron",69 71,
mopcp014,"J.M. Schippers, D.C. Kiselev, R. Luescher (Lüscher), O. Morath, M. Wohlmuther [PSI, Villigen, Switzerland] B. Amrein, P. Frey, M. Kostezer, A. Schmidt, G. Steen [PSI-LRF, Villigen, PSI, Switzerland] ","Activation of a 250 MeV SC-cyclotron for Protontherapy",72 74,
mopcp015,"A. Denker, C.R. Rethfeldt, J.R. Roehrich (Röhrich) [HZB, Berlin, Germany] D. Cordini, J. Heufelder, R. Stark, A. Weber [Charite, Berlin, Germany] ","Status of the HZB# Cyclotron: Eye Tumour Therapy in Berlin",75 77,
mopcp016,"K. Hatanaka, M. Fukuda, M. Kibayashi, S. Morinobu, K. Nagayama, T. Saito, H. Tamura, T. Yorita [RCNP, Osaka, Japan] ","Present Status of the RCNP Cyclotron Facility",78 80,
mopcp017,"V. Sabaiduc, D. Du, W. Gyles, R.R. Johnson, K. Suthanthiran [BCSI, Vancouver, BC, Canada] E.P. Conard [PAC sprl, Dion Valmont, Belgium] W.Z. Gelbart [ASD, Garden Bay, Canada] ","New High Intensity Compact Negative Hydrogen Ion Cyclotrons",81 83,
mopcp018,"D. van Rooyen, K.J. Gajewski, B. Gålnander, B. LundstrÃ¶m, M. Pettersson, A.V. Prokofiev [TSL, Uppsala, Sweden] ","Experience of Cyclotron Operation with Beam Sharing at TSL, Uppsala",84 86,
mopcp019,"T. Yuyama, I. Ishibori, T. Ishizaka, H. Kashiwagi, S. Kurashima, N. Miyawaki, T. Nara, S. Okumura, W. Yokota, K. Yoshida, Y. Yuri [JAEA/TARRI, Gunma-ken, Japan] ","Present Status of JAEA AVF Cyclotron Facility",87 89,
mopcp020,"O.N. Borisov [JINR, Dubna, Moscow Region, Russia] ","Beam Extraction of the Heavy Ions from the U-400M Cyclotron",90 92,
mopcp021,"T. Stephani, U. Behrens, H. Röcken [VMS-PT, Bergisch Gladbach, Germany] C. Baumgarten [PSI, Villigen, Switzerland] ","Automated Operation and Optimization of the VARIAN 250 MeV Superconducting Compact Proton Cyclotron",93 95,
mopcp022,"M. Kanazawa, S. Hojo, T. Honma, A. Sugiura, K. Tashiro [NIRS, Chiba-shi, Japan] T. Kamiya, T. Okada, Y. Takahashi [AEC, Chiba, Japan] ","Present Operational Status of NIRS Cyclotrons (AVF930, HM18)",96 98,
mopcp024,"J.H. Oh, J.-S. Chai, H.W. Kim, B.N. Lee [SKKU, Suwon, Republic of Korea] ","Design of RF System for Compact AVF Cyclotron",99 101,
mopcp025,"K. Yamada, S. Arai, M. Fujimaki, T. Fujinawa, N. Fukunishi, A. Goto, Y. Higurashi, E. Ikezawa, O. Kamigaito, M. Kase, M. Komiyama, K. Kumagai, T. Maie, T. Nakagawa, J. Ohnishi, H. Okuno, N. Sakamoto, K. Suda, H. Watanabe, Y. Watanabe, Y. Yano, S. Yokouchi [RIKEN Nishina Center, Wako, Japan] H. Fujisawa [Kyoto ICR, Uji, Kyoto, Japan] Y. Sato [KEK, Ibaraki, Japan] ","Construction of New Injector LINAC at RIBF",102 104,
mopcp026,"S.M. Wei, S. An, W.P. Hu, M. Li, Y.L. Lu, L.P. Wen, H.D. Xie, J.S. Xing, Z.G. Yin, T.J. Zhang [CIAE, Beijing, People's Republic of China] ","Beam Extraction System for CYCIAE-14",105 107,
mopcp028,"A.S. Dobrosavljević (A.S. Dobrosavljević), P. Beličev (Beličev), V. Jocic (Jocić), N. Neskovic (Nešković), I.M. Trajić (Trajić), V. Vujović (Vujović), Lj. Vukosavljevic (Vukosavljević) [VINCA, Belgrade, Serbia] ","Facility for Modification and Analysis of Materials with Ion Beams (FAMA)",108 110,
mopcp030,"M. Li, X.L. Jia, Y.L. Lu, C. Wang, J.J. Yang, H.J. Yao, T.J. Zhang [CIAE, Beijing, People's Republic of China] ","The Injection Line and Central Region Design of CYCIAE-70",111 113,
mopcp031,"S. An, F.P. Guan, M. Li, G.F. Song, C. Wang, S.M. Wei, F. Yang, T.J. Zhang, J.Q. Zhong [CIAE, Beijing, People's Republic of China] ","Physics Design and Calculation of CYCIAE-70 Extraction System",114 116,
mopcp032,"B.N. Lee, J.-S. Chai, H.W. Kim, J.H. Oh [SKKU, Suwon, Republic of Korea] ","Design Study of Compact Cyclotron For Injection of K=100 SSC",117 119,
mopcp033,"Kh.M. Gad, J.-S. Chai, H.W. Kim, B.N. Lee, J.H. Oh, J.A. Park, H.S. Song [SKKU, Suwon, Republic of Korea] ","Magnet Design of 70 MeV Separate Sector Cyclotron (KoRIA)",120 122,
mopcp034,"W. Wan [LBNL, Berkeley, California, USA] J.-W. Kim [NCC, Korea, Kyonggi, Republic of Korea] Y.-H. Park [NCC, Goyang, Kyeonggi, Republic of Korea] ","Beam Optics Study of a Fragment Separator for the Planned Rare Isotope Beam Facility in Korea",123 125,
mopcp037,"X. He [TUB, Beijing, People's Republic of China] K. Zhang [CAEP/IFP, Mainyang, Sichuan, People's Republic of China] ","Central Region Design of a Baby Cyclotron",126 128,
mopcp038,"A. Goswami, V.S. Pandit, P. Sing Babu [DAE/VECC, Calcutta, India] ","Design Optimization of the Spiral Inflector for a High Current Compact Cyclotron",129 131,
mopcp041,"M.K. Dey, R.K. Bhandari, U. Bhunia, J. Debnath, A. Dutta, C. Mallik, Z.A. Naser, S. Paul, J. Pradhan, M.H. Rashid [DAE/VECC, Calcutta, India] ","Beam Tuning in Kolkata Superconducting Cyclotron",132 134,
mopcp042,"N.Yu. Kazarinov, O.N. Borisov, V.I. Kazacha [JINR, Dubna, Moscow Region, Russia] ","Determination of Isochronous Field Using Magnetic Field Map",135 137,
mopcp043,"S.B. Vorozhtsov [JINR, Dubna, Moscow Region, Russia] A. Goto [RIKEN Nishina Center, Wako, Japan] V.L. Smirnov [JINR/DLNP, Dubna, Moscow region, Russia] ","Modification of the Central Region in the RIKEN AVF Cyclotron for Acceleration at the H=1 RF Harmonic",138 140,
mopcp044,"M.H. Rashid, R.K. Bhandari, C. Mallik [DAE/VECC, Calcutta, India] ","New Magnetic Einzel Lens and Its Beam Optical Features",141 143,
mopcp045,"Y.J. Bi, J.J. Yang, T.J. Zhang [CIAE, Beijing, People's Republic of China] A. Adelmann, R. Dölling, J.M. Humbel, W. Joho, M. Seidel [PSI, Villigen, Switzerland] Y.J. Bi [Tsinghua University, Beijing, People's Republic of China] C.-X. Tang [TUB, Beijing, People's Republic of China] ","Towards Quantitative Predictions of High Power Cyclotrons",144 146,
mopcp047,"Y.H. Xie, C.D. Hu, C.C. Jiang, L.Z. Liang, S. Liu, Y.L. Xie [ASIPP, Hefei, People's Republic of China] ","Analysis of Beam Quality Optimization of Bucket Ion Source",147 149,
mopcp049,"H. A. Koivisto, V.P. Aho, J. Arje (Ärje), T. Kalvas, J.A. Kauppinen, J.P. Kommpula, T. Ropponen, O.A. Tarvainen, V.A. Toivanen [JYFL, Jyvaskyla, Finland] ","Ion Source Related Research Work at JYFL",150 152,
mopcp050,"V.A. Toivanen, V.P. Aho, J. Arje (Ärje), J.A. Kauppinen, H. A. Koivisto, O.A. Tarvainen [JYFL, Jyvaskyla, Finland] L. Celona, G. Ciavola, S. Gammino, D. Mascali [INFN/LNS, Catania, Italy] A. Galatà [INFN/LNL, Legnaro (PD), Italy] T. Ropponen [NSCL, East Lansing, Michigan, USA] ","Studies of ECRIS Ion Beam Formation and Quality at the Department of Physics, University of Jyväskylä",153 155,
mopcp053,"V. Mironov, J.P.M. Beijers, S. Brandenburg, H.R. Kremers, J. Mulder, S. Saminathan [KVI, Groningen, The Netherlands] ","ECR Ion Source Development at the AGOR Facility",156 158,
mopcp057,"A.C. Caruso, F. Consoli, A. Spartà [INFN/LNS, Catania, Italy] A. Longhitano [ALTEK, San Gregorio (CATANIA), Italy] ","A Compact Solution for DDS-Generator, Turn-on and Protections in RF Accelerator Systems",159 161,
mopcp058,"S.S. Som, R.K. Bhandari, P. Gangopadhyay, A. Mandal, S.P. Pal, P.R. Raj, S. Saha, S. Seth [DAE/VECC, Calcutta, India] ","Commissioning Experience of the RF System of K500 Superconducting Cyclotron at VECC",162 164,
mopcp059,"M. Ahammed, R.K. Bhandari, P. Bhattacharyya, J. Chaudhuri, M.K. Dey, A. Dutta Gupta, B. Hemram, B.C. Mandal, N. Mandal, B. Manna, S. Murali, Y.E. Rao, S. Saha, S. Sur [DAE/VECC, Calcutta, India] ","Theoritical Analysis and Fabrication of Coupling Capacitor for K500 Superconducting Cyclotron at Kolkata",165 167,
mopcp060,"Z.G. Yin, B. Ji, Z.G. Li, T.J. Zhang, Z.L. Zhao [CIAE, Beijing, People's Republic of China] S.D. Wei, H.C. Xiao, Y. Xie [CASIC, Beijing, People's Republic of China] ","Design, Construction and Commissioning of the 100kW RF Amplifier for CYCIAE-100",168 170,
mopcp061,"G.A. Karamysheva, A.A. Glazov, S. Gurskiy, N.A. Morozov [JINR, Dubna, Moscow Region, Russia] M. Abs, Y. Jongen, W.J.G.M. Kleeven, S. Zaremba [IBA, Louvain-la-Neuve, Belgium] O. Karamyshev [JINR/DLNP, Dubna, Moscow region, Russia] ","RF Cavity Simulations for Superconducting C400 Cyclotron",171 173,
mopcp062,"Q. Zheng, K. Fong, M.P. Laverty [TRIUMF, Canada's National Laboratory for Particle and Nuclear Physics, Vancouver, Canada] ","TRIUMF Cyclotron Booster Frequency Tuning System",174 176,
mopcp064,"Z.G. Yin, K. Fei, B. Ji, P.Z. Li, G.S. Liu, G.F. Song, T.J. Zhang [CIAE, Beijing, People's Republic of China] C.J. Yu [CASIC, Beijing, People's Republic of China] ","Amplifier Test Stand for the CRM Cyclotron",177 179,
mopcp065,"A. Mandal, R.K. Bhandari, S.P. Pal, U. Panda, S. Saha, S. Seth, S.S. Som [DAE/VECC, Calcutta, India] ","Closed Loop RF Tuning for Superconducitng Cyclotron at VECC",180 182,
mopcp067,"B. Ji, P.Z. Li, J. Lin, G.S. Liu, G.F. Pan, Z.H. Wang, J.S. Xing, Z.G. Yin, S.P. Zhang, T.J. Zhang, Z.L. Zhao [CIAE, Beijing, People's Republic of China] ","Design and Primary Test of Full Scale Cavity of CYCIAE-100",183 185,
mopcp068,"K. Suda, M. Fujimaki, N. Fukunishi, M. Hemmi, O. Kamigaito, M. Kase, R. Koyama, K. Kumagai, N. Sakamoto, T. Watanabe, K. Yamada [RIKEN Nishina Center, Wako, Japan] ","Stable Operation of RF Systems for RIBF",186 188,
mopcp070,"E. Forton, M. Abs, W.J.G.M. Kleeven, B. Nactergal, D. Neuveglise (Neuvéglise), S. Zaremba [IBA, Louvain-la-Neuve, Belgium] ","Design of IBA Cyclone 30XP Cyclotron Magnet",189 191,
mopcp072,"V. Nuttens, M. Abs, W.J.G.M. Kleeven, B. Nactergal, D. Neuveglise (Neuvéglise), T. Servais, S. Zaremba [IBA, Louvain-la-Neuve, Belgium] ","Design of IBA Cyclone 11 Cyclotron Magnet",192 194,
mopcp073,"X.T. Yang, J. Meng, J.H. Zhang [IMP, Lanzhou, People's Republic of China] ","The Vacuum System of HIRFL Cyclotrons",195 196,
mopcp074,"W.J.G.M. Kleeven, M. Abs, E. Forton, B. Nactergal, D. Neuveglise (Neuvéglise), T. Servais, S. Zaremba [IBA, Louvain-la-Neuve, Belgium] ","Upgrade of the IBA Cyclone 3D Cyclotron",197 199,
mopcp075,"V. Nuttens, M. Abs, J.L. Delvaux, Y. Jongen, W.J.G.M. Kleeven, L. Medeiros-Romao, M. Mehaudens, T. Servais, T. Vanderlinden, P. Verbruggen [IBA, Louvain-la-Neuve, Belgium] ","Cyclotron Vacuum Model and H- Gas Stripping Losses",200 202,
mopcp076,"U. Bhunia, M. Ahmed, R.K. Bhandari, T. Bhattacharyya, M.K. Dey, R. Dey, A. Dutta, A. Dutta Gupta, C. Mallik, C. Nandi, Z.A. Naser, G.P. Pal, U. Panda, S. Paul, J. Pradhan, S. Saha [DAE/VECC, Calcutta, India] ","Operational Experience of Superconducting Cyclotron Magnet at VECC, Kolkata",203 205,
mopcp077,"N.A. Morozov, G.A. Karamysheva [JINR, Dubna, Moscow Region, Russia] P. Shishlyannikov [JINR/DLNP, Dubna, Moscow region, Russia] ","Median Plane Effects and Measurement Method for Radial Component of Magnetic Field in AVF Cyclotrons",206 208,
mopcp078,"J. Pradhan, R.K. Bhandari, U. Bhunia, J. Debnath, M.K. Dey, C. Mallik, S. Paul [DAE/VECC, Calcutta, India] ","Study of Magnetic Field Imperfections of Kolkata Superconducting Cyclotron",209 211,
mopcp079,"P. Sing Babu, A. Goswami, V.S. Pandit, P.R. Sarma [DAE/VECC, Calcutta, India] ","Optimization of Sector Geometry of a Compact Cyclotron by Random Search Method",212 214,
mopcp081,"S. Hojo, T. Honma, M. Kanazawa, N. Miyahara, M. Muramatsu, K. Noda, Y. Sakamoto, A. Sugiura, K. Tashiro [NIRS, Chiba-shi, Japan] T. Kamiya, T. Okada, Y. Takahashi [AEC, Chiba, Japan] ","Design Study of Magnetic Channel at NIRS-AVF930",215 217,
mopcp082,"H.W. Kim, J.-S. Chai, B.N. Lee, J.H. Oh [SKKU, Suwon, Republic of Korea] ","Design Study of AVF Magnet for Compact Cyclotron",218 220,
mopcp083,"A. Sen, S. Brandenburg, M.A. Hofstee, M.J. van Goethem [KVI, Groningen, The Netherlands] ","Vacuum Simulation for Heavy Ion Beams in the AGOR-Cyclotron",221 223,
mopcp085,"K. Hatanaka, M. Fukuda, T. Yorita [RCNP, Osaka, Japan] T. Kawaguchi [KT Science Ltd., Akashi, Japan] K. Noda [NIRS, Chiba-shi, Japan] Y. Sakemi [CYRIC, Sendai, Japan] ","Application of HTS Wire to Magnets",224 226,
mopcp087,"M.A. Hevinga, S. Brandenburg, T.W. Nijboer, J. Vorenholt [KVI, Groningen, The Netherlands] ","Beamloss Monitoring and Control for High Intensity Beams at the AGOR-Facility",227 229,
mopcp088,"C.D. Hu, L.Z. Liang, J.L. Wei [ASIPP, Hefei, People's Republic of China] ","The Simulation on Beam Interaction with Background Particles",230 232,
mopcp090,"S. Kurashima, I. Ishibori, T. Nara, W. Yokota [JAEA/TARRI, Gunma-ken, Japan] M. Taguchi [JAEA/QuBS, Takasaki, Japan] ","Progress in Formation of Single-Pulse Beams by a Chopping System at the JAEA/TIARA facility",233 235,
mopcp091,"G.P. Pal, R.K. Bhandari, S. Bhattacharya, T. Bhattacharyya, T. Das, C. Mallik, S. Roy [DAE/VECC, Calcutta, India] ","Status of Beam Diagnostic Components for Superconducting Cyclotron at Kolkata",236 238,
mopcp092,"X. Hu, D. Li, Y.Q. Xiong, J. Yang, T. Yu [HUST, Wuhan, People's Republic of China] ","Study on PXI and PAC-Based HIL Simulation Control System of CYCHU-10 Cyclotron",239 241,
mopcp093,"J. Debnath, S. Bhattacharya, T. Bhattacharyya, U. Bhunia, P.S. Chakraborty, M.K. Dey, C. Mallik, Z.A. Naser, G.P. Pal, S. Paul, J. Pradhan [DAE/VECC, Calcutta, India] ","Beam Extraction System and External Beam Line of Kolkata Superconducting Cyclotron",242 244,
mopcp094,"R. Koyama, M. Fujimaki, N. Fukunishi, A. Goto, M. Hemmi, O. Kamigaito, M. Kase, N. Sakamoto, K. Suda, T. Watanabe, K. Yamada [RIKEN Nishina Center, Wako, Japan] ","Consistency in Measurement of Beam Phase and Beam Intensity Using Lock-in Amplifier and Oscilloscope Systems",245 247,
mopcp095,"P. Bhattacharyya, M. Ahammed, S. Bandyopadhyay, R.K. Bhandari, U. Bhunia, J. Chaudhuri, A. De, A. Dutta Gupta, C. Mallik, A. Mukherjee, C. Nandi, U. Panda, S. Saha, S. Saha [DAE/VECC, Calcutta, India] ","Experiment and Analysis: Partial Loss of Insulation Vacuum in K-500 Superconducting Cyclotron During Energization",248 250,
mopcp098,"E. Samsonov, G.A. Karamysheva, S.A. Kostromin [JINR, Dubna, Moscow Region, Russia] Y. Jongen [IBA, Louvain-la-Neuve, Belgium] ","Influence of RF Magnetic Field on Ion Dynamics in IBA C400 Cyclotron",251 253,
mopcp100,"J.Q. Zhang, Y. Cao, L.Z. Ma, A. Shi, M.T. Song, L.P. Sun, X.T. Yang, Q.G. Yao, Z.M. You, X.Q. Zhang, X.Z. Zhang, H.W. Zhao, J.H. Zheng [IMP, Lanzhou, People's Republic of China] ","Axial Injection Beam Line of a Compact Cyclotron",254 255,
mopcp101,"H.F. Hao, K.D. Man, M.T. Song, Y.L. Su, B. Wang, Q.G. Yao, H.W. Zhao [IMP, Lanzhou, People's Republic of China] ","Beam Extraction System of Compact Cyclotron",256 257,
mopcp102,"H.F. Hao, J.F. Gao, Q.X. Guo, G.H. Han, A.P. Li, X.M. Su, A.J. Wang, S.X. Wang, C.L. Xie, J.J. Yang, W.Q. Yang, Y.P. Yang, H.W. Zhao [IMP, Lanzhou, People's Republic of China] ","Transmission Efficiency Study of SSC",258 259,
mopcp105,"X.N. Li, Y. He, Y.J. Yuan [IMP, Lanzhou, People's Republic of China] ","Research on Acceptance of SSC",260 262,
mopcp106,"J.H. Zheng, W. Liu, W. Ma, R.S. Mao, Y. Wang, J.X. Wu, Y. Yin [IMP, Lanzhou, People's Republic of China] ","Beam-Phase Measurement System for HIRFL",263 265,
mopcp107,"H.H. Yan, Y.X. Chen, X.M. Feng, D.Q. Gao, Y.L. Gao, J.B. Shangguan, Y. Tang, J.Y. Xin, H.B. Yan, Z.D. Yuan, X.L. Zhang, Z.Z. Zhou [IMP, Lanzhou, People's Republic of China] ","A Design of Switch Magnet Power Supply",266 268,
mopcp108,"B. Qin, Y. Mori, T. Planche [KURRI, Osaka, Japan] K. Okabe [University of Fukui, Faculty of Engineering, Fukui, Japan] ","Design of High Energy Hadron FFAGs for ADSR and other Applications",269 271,
mopcp109,"P. Li, J.X. Wu, Y.Q. Yang, Y.J. Yuan [IMP, Lanzhou, People's Republic of China] ","The Design of Transverse Emittance Measurement at HIRFL-CSR",272 274,
tha1cco04,"M.K. Craddock [UBC amp; TRIUMF, Vancouver, British Columbia, Canada] Y.-N. Rao [TRIUMF, Canada's National Laboratory for Particle and Nuclear Physics, Vancouver, Canada] ","Cyclotron and FFAG Studies Using Cyclotron Codes",395 397,
tha1cio01,"Y. Mori [KURRI, Osaka, Japan] ","FFAG Developments in Japan",376 381,
tha1cio02,"S.L. Smith [STFC/DL/ASTeC, Daresbury, Warrington, Cheshire, United Kingdom] ","First Commissioning Results from the Non-Scaling FFAG Accelerator, EMMA",384 388,
tha1cio03,"C. Johnstone [Fermilab, Batavia, USA] M. Berz, K. Makino [MSU, East Lansing, Michigan, USA] S.R. Koscielniak [TRIUMF, Canada's National Laboratory for Particle and Nuclear Physics, Vancouver, Canada] P. Snopok [UCR, Riverside, California, USA] ","Innovations in Fixed-Field Accelerators: Design and Simulation",389 394,
thm1cio01,"P. Bertrand, A. Savalle [GANIL, Caen, France] ","Post-acceleration of High Intensity RIB through the CIME Cyclotron in the Frame of the SPIRAL2 Project at GANIL",354 358,
thm1cio02,"R.E. Laxdal [TRIUMF, Canada's National Laboratory for Particle and Nuclear Physics, Vancouver, Canada] ","Acceleration above the Coulomb Barrier - Completion of the ISAC-II Project at TRIUMF",359 364,
thm1cio04,"P.G. Bricault, F. Ames, M. Dombsky, V. Hanemaayer, P. Kunz, J. Lassen [TRIUMF, Canada's National Laboratory for Particle and Nuclear Physics, Vancouver, Canada] ","Progress towards New RI and Higher RIB Intensities at TRIUMF",365 370,
thm2cco03,"F. Marti, S. Hitchcock, P.S. Miller, J.W. Stetson, J. Yurkon [NSCL, East Lansing, Michigan, USA] ","Stripper Foil Developments at NSCL/MSU",373 375,
tua1cco04,"Kh.M. Gad, J.-S. Chai, H.W. Kim, B.N. Lee, J.H. Oh, J.A. Park, H.S. Song [SKKU, Suwon, Republic of Korea] ","Design study of 70 MeV Separate Sector Cyclotron for KoRIA project",304 307,
tua1cio01,"L. Calabretta, M.M. Maggiore, L.A.C. Piazza, D. Rifuggiato [INFN/LNS, Catania, Italy] ","A Multi MegaWatt Cyclotron Complex to Search for CP Violation in the Neutrino Sector",298 303,
tua2cco02,"K. Takayama, T. Adachi [KEK, Ibaraki, Japan] W. Jiang [Nagaoka University of Technology, Nagaoka, Niigata, Japan] Y. Oguri [TIT, Tokyo, Japan] H. Tsutsui [SHI, Tokyo, Japan] ","Induction Sector Cyclotron for Cluster Ions",314 316,
tua2cco03,"B. Wang, D.Q. Gao, H.F. Hao, L.Z. Ma, K.D. Man, M.T. Song, X.W. Wang, X.T. Yang, Q.G. Yao, Z.M. You, J.Q. Zhang, S.H. Zhang, X.Q. Zhang, H.W. Zhao [IMP, Lanzhou, People's Republic of China] ","Design and Construction Progress of a 7MeV/u Cyclotron",317 320,
tua2cio01,"T.J. Zhang, Z.G. Li, Y.L. Lu [CIAE, Beijing, People's Republic of China] ","Progress on Construction of CYCIAE-100",308 313,
tum1cco03,"R.A. Baartman, F.W. Bach, I.V. Bylinskii, J.F. Cessford, G. Dutto, D.T. Gray, A. Hurst, K. Jayamanna, M. Mouat, Y.-N. Rao, W.R. Rawnsley, L.W. Root, R. Ruegg, V.A. Verzilov [TRIUMF, Canada's National Laboratory for Particle and Nuclear Physics, Vancouver, Canada] ","Reliable Production of Multiple High Intensity Beams with the 500 MeV TRIUMF Cyclotron",280 282,
tum1cco04,"H. Röcken, M. Abdel-Bary, E.M. Akcoeltekin, P. Budz, T. Stephani, J.C. Wittschen [VMS-PT, Bergisch Gladbach, Germany] ","The VARIAN 250 MeV Superconducting Compact Proton Cyclotron: Medical Operation of the 2nd Machine, Production and Commissioning Status of Machines No. 3 to 7",283 285,
tum1cio01,"M. Seidel [PSI, Villigen, Switzerland] ","Towards the 2MW Cyclotron and Latest Developments at PSI",275 279,
tum2cco02,"C. Mallik, R.K. Bhandari [DAE/VECC, Calcutta, India] ","First Beam Acceleration in Kolkata Superconducting Cyclotron and Its Present Status",292 294,
tum2cco03,"P. M.T. Heikkinen [JYFL, Jyvaskyla, Finland] ","Commissioning of the JYFL MCC30/15 Cyclotron",295 297,
tum2cio01,"O. Kamigaito, S. Arai, T. Dantsuka, M. Fujimaki, T. Fujinawa, H. Fujisawa, N. Fukunishi, A. Goto, H. Hasebe, Y. Higurashi, K. Ikegami, E. Ikezawa, H. Imao, T. Kageyama, M. Kase, M. Kidera, M. Komiyama, H. Kuboki, K. Kumagai, T. Maie, M. Nagase, T. Nakagawa, M. Nakamura, J. Ohnishi, H. Okuno, N. Sakamoto, K. Suda, H. Watanabe, T. Watanabe, Y. Watanabe, K. Yamada, Y. Yano, S. Yokouchi [RIKEN Nishina Center, Wako, Japan] ","Status of RIBF Accelerators at RIKEN",286 291,
wem1cio02,"T. Nakagawa [RIKEN Nishina Center, Wako, Japan] ","28 GHz SC-ECRIS at RIBF",321 326,
wem1cio03,"S. Gammino, L. Celona, G. Ciavola, D. Mascali [INFN/LNS, Catania, Italy] ","New Tools for the Improvement of Beam Brightness in ECR Ion Sources",327 331,
wem2cco02,"N. Sakamoto, M. Fujimaki, A. Goto, O. Kamigaito, M. Kase, R. Koyama, K. Suda, K. Yamada, S. Yokouchi [RIKEN Nishina Center, Wako, Japan] ","Operating Experience with the RF System for Superconducting Ring Cyclotron of RIBF",338 340,
wem2cco03,"J.M. Humbel [PSI-LRF, Villigen, PSI, Switzerland] H. Zhang [PSI, Villigen, Switzerland] ","Disturbance Effects Caused by RF Power Leaking Out From Cavities in the PSI Ringcyclotron",341 343,
wem2cco05,"T. Watanabe, M. Fujimaki, N. Fukunishi, O. Kamigaito, M. Kase, M. Komiyama, R. Koyama, H. Watanabe [RIKEN Nishina Center, Wako, Japan] ","Beam Diagnostics for RIBF in RIKEN",351 353,
