tupml031,"H. Ye, F.X. Kaertner (F.X. Kärtner), S. T. Trippel [Deutsches Elektronen Synchrotron (DESY) and Center for Free Electron Science (CFEL), Hamburg, Germany] A. Fallahi, J. Küpper, O. Muecke [CFEL, Hamburg, Germany] F.X. Kaertner (F.X. Kärtner) [MIT, Cambridge, Massachusetts, USA] F.X. Kaertner (F.X. Kärtner), J. Küpper, S. T. Trippel, H. Ye [The Hamburg Center for Ultrafast Imaging, University of Hamburg, hamburg, Germany] J. Küpper, G.M. Rossi [DESY, Hamburg, Germany] H. Ye [University of Hamburg, Hamburg, Germany] ","Characterization of Polarization-Dependent Emittance From an Array of Au Nanorods using Velocity Map Imaging Spectrometer",1612 1614,
tupml035,"F. Jafarinia, R.W. Assmann (R.W. Aßmann), F. Burkart, U. Dorda, C. Lechner, B. Marchetti, R. Rossmanith, P.A. Walker [DESY, Hamburg, Germany] A. Bernhard, R. Rossmanith [KIT, Karlsruhe, Germany] ","FELs Driven by Laser Plasma Accelerators Operated with Transverse Gradient Undulators",1615 1618,
tupml036,"P. Muggli [MPI, Muenchen, Germany] B. Cros [CNRS LPGP Univ Paris Sud, Orsay, France] ","ALEGRO, the Advanced LinEar collider study GROup",1619 1621,
tupml038,"F. Mayet, R.W. Assmann (R.W. Aßmann), U. Dorda, W. Kuropka [DESY, Hamburg, Germany] W. Kuropka, F. Mayet [University of Hamburg, Institut fuer Experimentalphysik, Hamburg, Germany] ","Simulation of Phase-Dependent Transverse Focusing in Dielectric Laser Accelerator Based Lattices",1622 1625,
tupml039,"F. Mayet, R.W. Assmann (R.W. Aßmann), U. Dorda, W. Kuropka [DESY, Hamburg, Germany] W. Kuropka, F. Mayet [University of Hamburg, Institut fuer Experimentalphysik, Hamburg, Germany] ","First Order Sensitivity Analysis of Electron Acceleration in Dual Grating Type Dielectric Laser Accelerator Structures",1626 1629,
tupml040,"P. Niknejadi, R.T.P. D'Arcy, A. Knetsch, V. Libov, A. Martinez de la Ossa, J. Osterhoff, K. Poder, L. Schaper [DESY, Hamburg, Germany] M. Kaluza, M.B. Schwab, A. Sävert, C. Wirth [IOQ, Jena, Germany] M. Kaluza [HIJ, Jena, Germany] T.J. Mehrling [LBNL, Berkeley, USA] C.A.J. Palmer [Cockcroft Institute, Lancaster University, Lancaster, United Kingdom] ","Status of the Transverse Diagnostics at FLASHForward",1630 1633,
tupml041,"E.N. Svystun, R.W. Assmann (R.W. Aßmann), U. Dorda, A. Ferran Pousa, T. Heinemann, B. Marchetti, P.A. Walker, M.K. Weikum, J. Zhu [DESY, Hamburg, Germany] A. Ferran Pousa, T. Heinemann, A. Martinez de la Ossa [University of Hamburg, Hamburg, Germany] T. Heinemann [USTRAT/SUPA, Glasgow, United Kingdom] ","Two-Stage Laser-Driven Plasma Acceleration With External Injection for EuPRAXIA",1634 1637,
tupml042,"T.J. Mehrling, C. Benedetti, E. Esarey, W. Leemans, C.B. Schroeder [LBNL, Berkeley, USA] ","Accurate Modeling of the Hose Instability in Plasma Based Accelerators",1638 1641,
tupml045,"D. Zhang [DESY, Hamburg, Germany] A-L. Calendron, H. Cankaya, M. Fakhari, A. Fallahi, Y. Hua, N.H. Matlis, X. Wu, L.E. Zapata [CFEL, Hamburg, Germany] M. Hemmer, F.X. Kaertner (F.X. Kärtner) [Deutsches Elektronen Synchrotron (DESY) and Center for Free Electron Science (CFEL), Hamburg, Germany] F.X. Kaertner (F.X. Kärtner) [MIT, Cambridge, Massachusetts, USA] ","Segmented Terahertz Driven Device for Electron Acceleration",1642 1644,
tupml046,"M. Gross (M. Groß), P. Boonpornprasert, Y. Chen, J. Engel, J.D. Good, H. Huck, I.I. Isaev, M. Krasilnikov, X. Li, O. Lishilin, G. Loisch, R. Niemczyk, A. Oppelt, H.J. Qian, Y. Renier, F. Stephan, Q.T. Zhao [DESY Zeuthen, Zeuthen, Germany] R. Brinkmann, A. Martinez de la Ossa, J. Osterhoff [DESY, Hamburg, Germany] F.J. Gruener (F.J. Grüner) [CFEL, Hamburg, Germany] F.J. Gruener (F.J. Grüner), A. Martinez de la Ossa [University of Hamburg, Institut fuer Experimentalphysik, Hamburg, Germany] T.J. Mehrling, C.B. Schroeder [LBNL, Berkeley, USA] I. Will [MBI, Berlin, Germany] ","Characterization of Self-Modulated Electron Bunches in an Argon Plasma",1645 1647,
tupml047,"G. Loisch, P. Boonpornprasert, J.D. Good, M. Gross (M. Groß), H. Huck, M. Krasilnikov, O. Lishilin, A. Oppelt, Y. Renier, F. Stephan [DESY Zeuthen, Zeuthen, Germany] R. Brinkmann, A. Martinez de la Ossa, J. Osterhoff [DESY, Hamburg, Germany] F.J. Gruener (F.J. Grüner) [CFEL, Hamburg, Germany] F.J. Gruener (F.J. Grüner), A. Martinez de la Ossa [University of Hamburg, Institut fuer Experimentalphysik, Hamburg, Germany] ","Optimisation of High Transformer Ratio Plasma Wakefield Acceleration at PITZ",1648 1650,
tupml049,"S.J. Gessner [CERN, Geneva, Switzerland] ","Comparison of Fourier Signal and Error Analysis Techniques for Identifying the Self-Modulation Frequency of a Proton Bunch",1651 1652,
tupml051,"T. Manegold, C. Benzing, M. Iberler, J. Jacoby, P. Mahmoodi Tavana, A. Müller-Münster, B. Podßus [IAP, Frankfurt am Main, Germany] ","Studies of Collision and Compression of Pulsed Plasmas Generated by Coaxial Accelerators",1653 1655,
tupml052,"F. Kramer, P. Goslawski, A. Jankowiak, M. Ries, M. Ruprecht, A. Schaelicke (A. Schälicke) [HZB, Berlin, Germany] ","Characterisation of the Second Stable Orbit Generated by Transverse Resonance Island Buckets (TRIBs)",1656 1659,
tupml053,"A. Neumann, D. Böhlick, M. Bürger, P. Echevarria, A. Frahm, H.-W. Glock, F. Goebel (F. Göbel), S. Heling, K. Janke, A. Jankowiak, T. Kamps, S. Klauke, G. Klemz, J. Knobloch, G. Kourkafas, J. Kuehn (J. Kühn), O. Kugeler, N. Leuschner, N. Ohm, E. Panofski, H. Plötz, S. Rotterdam, M.A.H. Schmeisser (M.A.H. Schmeißer), M. Schuster, H. Stein, Y. Tamashevich, J. Ullrich, A. Ushakov, J. Voelker (J. Völker) [HZB, Berlin, Germany] ","The BERLinPro SRF Photoinjector System - From First RF Commissioning to First Beam",1660 1663,
tupml054,"K. Koyama [KEK, Ibaraki, Japan] Z. Chen [The University of Tokyo, Tokyo, Japan] T. Takahashi [The University of Tokyo, The School of Engineering, Tokyo, Japan] M. Uesaka [The University of Tokyo, Nuclear Professional School, Ibaraki-ken, Japan] ","Microbeam Irradiation System with a Dielectric Laser Accelerator for Radiobiology Research",1664 1666,
tupml055,"M. Tomizawa, R. Muto, T. Ogitsu [KEK, Ibaraki, Japan] A. Konaka [TRIUMF, Canada's National Laboratory for Particle and Nuclear Physics, Vancouver, Canada] ","Beam Optics Designs of a Strecher Ring and a Transfer Line for J-PARC Slow Extraction",1667 1669,
tupml059,"X. Li, P.A.P. Nghiem [IRFU, CEA, University Paris-Saclay, Gif-sur-Yvette, France] A. Mosnier [CEA/IRFU, Gif-sur-Yvette, France] ","Slice Energy Spread Optimization for a 5 GeV Laser-Plasma Accelerator",1670 1672,
tupml060,"H. Iinuma [Ibaraki University, Hitachi, Ibaraki, Japan] M.R. Abdul [Sokendai, Ibaraki, Japan] Y. Fukao, K. Furukawa, H. Hisamatsu, T. Mibe, H. Nakayama, S. Ohsawa, K. Oide, K. Sasaki [KEK, Tsukuba, Japan] ","Three-Dimentional Spiral Beam Injection for a Compact Storage Ring",1673 1676,
tupml061,"G. Chen [IIT, Chicago, Illinois, USA] G. Adhikari, W.A. Schroeder [UIC, Chicago, Illinois, USA] S.P. Antipov, C.-J. Jing, K. Kovi [Euclid TechLabs, LLC, Solon, Ohio, USA] S.V. Baryshev [ANL, Argonne, Illinois, USA] L.K. Spentzouris [Illinois Institute of Technology, Chicago, Illinois, USA] ","Study of Mean Transverse Energy of (N)UNCD with Tunable Laser Source",1677 1679,
tupml062,"T.A. Mohayai [IIT, Chicago, Illinois, USA] D.V. Neuffer [Fermilab, Batavia, Illinois, USA] P. Snopok [Illinois Institute of Technology, Chicago, Illlinois, USA] D.J. Summers [UMiss, University, Mississippi, USA] ","A Wedge Test in MICE",1680 1683,
tupml063,"T.A. Mohayai [IIT, Chicago, Illinois, USA] D.V. Neuffer [Fermilab, Batavia, Illinois, USA] P. Snopok [Illinois Institute of Technology, Chicago, Illlinois, USA] ","A Non-parameteric Density Estimation Approach to Measuring Beam Cooling in MICE",1684 1687,
tupml064,"N.R. Neveu [IIT, Chicago, Illinois, USA] W. Gai, C.-J. Jing, J.G. Power [ANL, Argonne, Illinois, USA] C.-J. Jing [Euclid TechLabs, LLC, Solon, Ohio, USA] L.K. Spentzouris [Illinois Institute of Technology, Chicago, Illinois, USA] ","Staged Two Beam Acceleration Beam Line Design for the AWA Facility",1688 1691,
tupml065,"D. Rajaram [Illinois Institute of Technology, Chicago, Illinois, USA] V. Blackmore [Imperial College of Science and Technology, Department of Physics, London, United Kingdom] ","Phase Space Density Evolution in MICE",1692 1695,
tupml066,"P. Snopok [Illinois Institute of Technology, Chicago, Illinois, USA] J.S. Ellison [IIT, Chicago, Illinois, USA] ","Progress on Beam-Plasma Effect Simulations in Muon Ionization Cooling Lattices",1696 1698,
tupml067,"V. Blackmore [Imperial College of Science and Technology, Department of Physics, London, United Kingdom] ","Recent Results from the Study of Emittance Evolution in MICE",1699 1701,
tupml068,"M. Dracos [IPHC, Strasbourg Cedex 2, France] ","The European Spallation Source Neutrino Super Beam Design Study",1702 1705,
tupml070,"G.C. Wang, Q. Jin, L.T. Sun, J. Zhang, X.Z. Zhang, H.W. Zhao, H. Zhao [IMP/CAS, Lanzhou, People's Republic of China] ","Laser Ablation Plasma with Solenoid Field Confinement",1706 1708,
tupml071,"G. Torrisi, L. Allegra, A.C. Caruso, G. Castro, L. Celona, G. Gallo, S. Gammino, O. Leonardi, A. Longhitano, D. Mascali, L. Neri, S. Passarello, G. Sorbello [INFN/LNS, Catania, Italy] ","Experimental Performance of the Chopper for the ESS Linac",1709 1711,
tupml073,"L. Celona, A. Amato, G. Calabrese, A.C. Caruso, G. Castro, F. Chines, S. Gammino, O. Leonardi, A. Longhitano, G. Manno, S. Marletta, D. Mascali, A. Maugeri, M. Mazzaglia, A. Miraglia, L. Neri, S. Passarello, A. Seminara, D. Siliato, A. Spartà, G. Torrisi [INFN/LNS, Catania, Italy] ","Ion Source and Low Energy Beam Transport Line Final Commissioning Step and Transfer from INFN to ESS",1712 1714,
tupml074,"A. Lyapin, S.T. Boogert, K. Lekomtsev [JAI, Egham, Surrey, United Kingdom] A. Aryshev [KEK, Ibaraki, Japan] A.A. Tishchenko [MEPhI, Moscow, Russia] ","Resonant Excitation of Accelerating Field in Dielectric Corrugated Waveguide",1715 1717,
tupml075,"J.J. Dang, Y.-S. Cho, H.S. Kim, H.-J. Kwon, P. Lee, S. Lee, Y.G. Song [Korea Atomic Energy Research Institute (KAERI), Gyeongbuk, Republic of Korea] ","Development of Target/ion Source for Li-8 Beam at KOMAC*",1718 1720,
tupml076,"S. Lee, Y.-S. Cho, H.S. Kim, H.-J. Kwon [Korea Atomic Energy Research Institute (KAERI), Gyeongbuk, Republic of Korea] ","Installation, Commissioning and Characterization of EBIS-SC as a Short Pulsed Proton Source at KOMAC",1721 1723,
tupml077,"P. Lee, Y.-S. Cho, J.J. Dang, H.S. Kim, H.-J. Kwon, S. Lee, Y.G. Song, S.P. Yun [Korea Atomic Energy Research Institute (KAERI), Gyeongbuk, Republic of Korea] ","Development of Physical Processes in Geant4 for Simulation of ISOL Target-Ion-Source System",1724 1726,
tupml078,"Z. Martí, G. Benedetti, U. Iriso [ALBA-CELLS Synchrotron, Cerdanyola del Vallès, Spain] ","Fast Quadrupole Beam Based Alignment Using AC Corrector Excitations",1727 1730,
tupml079,"K. Wang, C. Bruni, K. Cassou, V. Chaumat, N. Delerue, D. Douillet, S. Jenzer, V. Kubytskyi, P. Lepercq, H. Purwar [LAL, Orsay, France] E. Baynard, M. Pittman [CLUPS, Orsay, France] J. Demailly, O. Guilbaud, S. Kazamias, B. Lucas, G. Maynard, O. Neveu, D. Ros [CNRS LPGP Univ Paris Sud, Orsay, France] D. Garzella [CEA, Gif-sur-Yvette, France] R. Prazeres [CLIO/ELISE/LCP, Orsay, France] ","A Start to End Simulation of the Laser Plasma Wakefield Acceleration Experiment at ESCULAP",1731 1734,
tuxgbd1,"S.J. Brooks [BNL, Upton, Long Island, New York, USA] ","Potential and Issues for Future Accelerators and Ultimate Colliders",578 583,
tuxgbd2,"J.M. Jowett [CERN, Geneva, Switzerland] ","Colliding Heavy Ions in the LHC",584 589,
tuxgbd3,"F.C. Pilat [ORNL, Oak Ridge, Tennessee, USA] ","Ideas and Concepts for Future Electron Ion Colliders",590 594,
tuxgbe1,"M. Turner [CERN, Geneva, Switzerland] ","Status and Prospects for the AWAKE Experiment",595 598,
tuxgbe2,"J. Resta-López, A.S. Alexandrova, V. Rodin, Y. Wei, C.P. Welsch, G.X. Xia [Cockcroft Institute, Warrington, Cheshire, United Kingdom] Y. M. Li, Y. Zhao [UMAN, Manchester, United Kingdom] ","Study of Ultra-High Gradient Acceleration in Carbon Nanotube Arrays",599 602,
tuxgbe3,"E. Chiadroni, D. Alesini, M.P. Anania, M. Bellaveglia, A. Biagioni, F.G. Bisesto, E. Brentegani, F. Cardelli, G. Costa, M. Croia, D. Di Giovenale, G. Di Pirro, M. Ferrario, F. Filippi, A. Gallo, A. Giribono, A. Marocchino, L. Piersanti, R. Pompili, S. Romeo, J. Scifo, V. Shpakov, A. Stella, C. Vaccarezza, F. Villa [INFN/LNF, Frascati (Roma), Italy] A. Cianchi [INFN-Roma II, Roma, Italy] M. Marongiu, A. Mostacci [Sapienza University of Rome, Rome, Italy] J.B. Rosenzweig [UCLA, Los Angeles, California, USA] A.R. Rossi [Istituto Nazionale di Fisica Nucleare, Milano, Italy] A. Zigler [The Hebrew University of Jerusalem, The Racah Institute of Physics, Jerusalem, Israel] ","Status of Plasma-Based Experiments at the SPARC_LAB Test Facility",603 606,
tuxgbe4,"A. Ferran Pousa, R.W. Assmann (R.W. Aßmann) [DESY, Hamburg, Germany] A. Martinez de la Ossa [University of Hamburg, Institut fuer Experimentalphysik, Hamburg, Germany] ","Beam Quality Limitations of Plasma-Based Accelerators",607 611,
tuxgbf2,"A.H. Lumpkin, N. Eddy, D.R. Edstrom, P.S. Prieto, J. Ruan, R.M. Thurman-Keup [Fermilab, Batavia, Illinois, USA] K. Bishofberger, B.E. Carlsten [LANL, Los Alamos, New Mexico, USA] O. Napoly [CEA/DSM/IRFU, France] ","Higher-Order-Mode Effects in Tesla-Type Superconducting RF Cavities on Electron Beam Quality",612 615,
tuxgbf3,"Y. Shobuda, Y. Irie, T. Takayanagi, T. Togashi, K. Yamamoto, M. Yamamoto [JAEA/J-PARC, Tokai-Mura, Naka-Gun, Ibaraki-Ken, Japan] ","Reduction of the Kicker Impedance Maintaining the Performance of Present Kicker Magnet at RCS in J-PARC",616 619,
tuxgbf4,"P.K. Saha, H. Harada, N. Hayashi, H. Hotchi, Y. Shobuda, F. Tamura [JAEA/J-PARC, Tokai-Mura, Naka-Gun, Ibaraki-Ken, Japan] ","ORBIT Simulation, Measurement and Mitigation of Transverse Beam Instability in the Presence of Strong Space Charge in the 3-GeV RCS of J-PARC",620 623,
tuygbd2,"C. Milardi, D. Alesini, S. Bini, O.R. Blanco-García, M. Boscolo, B. Buonomo, S. Cantarella, S. Caschera, A. D'Uffizi, A. De Santis, G.O. Delle Monache, D.G.C. Di Giulio, G. Di Pirro, A. Drago, L.G. Foggetta, A. Gallo, R. Gargana, A. Ghigo, S. Guiducci, C. Ligi, M. Maestri, A. Michelotti, L. Pellegrino, R. Ricci, U. Rotundo, A. Stecchi, A. Stella, M. Zobov [INFN/LNF, Frascati (Roma), Italy] ","A Review of DANE Performances During the KLOE-2 Run",624 627,
tuygbd3,"V. Ptitsyn, G. Bassi, J. Beebe-Wang, J.S. Berg, M. Blaskiewicz, A. Blednykh, J.M. Brennan, S.J. Brooks, K.A. Brown, K.A. Drees, A.V. Fedotov, W. Fischer, D.M. Gassner, W. Guo, Y. Hao, A. Hershcovitch, H. Huang, W.A. Jackson, J. Kewisch, C. Liu, H. Lovelace III, Y. Luo, F. Meot (F. Méot), M.G. Minty, C. Montag, R.B. Palmer, B. Parker, S. Peggs, V.H. Ranjbar, G. Robert-Demolaize, S. Seletskiy, V.V. Smaluk, K.S. Smith, S. Tepikian, P. Thieberger, D. Trbojevic, N. Tsoupas, W.-T. Weng, F.J. Willeke, H. Witte, Q. Wu, W. Xu, A. Zaltsman, W. Zhang [BNL, Upton, Long Island, New York, USA] E. Gianfelice-Wendt [Fermilab, Batavia, Illinois, USA] ","eRHIC Design Status",628 631,
tuygbd4,"S. Bai, J. Gao, H. Geng, D. Wang, Y. Wang, C.H. Yu, Y. Zhang [IHEP, Beijing, People's Republic of China] ","Beam Loss Background and Collimator Design in CEPC Double Ring",632 634,
tuygbe2,"G.H. Hoffstaetter, N. Banerjee, J. Barley, A.C. Bartnik, I.V. Bazarov, D.C. Burke, J.A. Crittenden, L. Cultrera, J. Dobbins, S.J. Full, F. Furuta, R.E. Gallagher, M. Ge, C.M. Gulliford, B.K. Heltsley, R.P.K. Kaplan, V.O. Kostroun, Y. Li, M. Liepe, W. Lou, C.E. Mayes, J.R. Patterson, P. Quigley, D.M. Sabol, D. Sagan, J. Sears, C.H. Shore, E.N. Smith, K.W. Smolenski, V. Veshcherevich, D. Widger [Cornell University (CLASSE), Cornell Laboratory for Accelerator-Based Sciences and Education, Ithaca, New York, USA] J.S. Berg, S.J. Brooks, C. Liu, G.J. Mahler, F. Meot (F. Méot), R.J. Michnoff, M.G. Minty, S. Peggs, V. Ptitsyn, T. Roser, P. Thieberger, D. Trbojevic, N. Tsoupas, J.E. Tuozzolo, F.J. Willeke, H. Witte [BNL, Upton, Long Island, New York, USA] D. Douglas [JLab, Newport News, Virginia, USA] J.K. Jones [Cockcroft Institute, Warrington, Cheshire, United Kingdom] D. Jusic [Cornell University, Ithaca, New York, USA] D.J. Kelliher [STFC/RAL/ASTeC, Chilton, Didcot, Oxon, United Kingdom] B.C. Kuske, M. McAteer, J. Voelker (J. Völker) [HZB, Berlin, Germany] ","CBETA, the 4-Turn ERL with SRF and Single Return Loop",635 639,
tuygbe3,"J.H. Shao, M.E. Conde, D.S. Doran, W. Gai, W. Liu, N.R. Neveu, J.F. Power, C. Whiteford, E.E. Wisniewski, L.M. Zheng [ANL, Argonne, Illinois, USA] C.-J. Jing [Euclid TechLabs, LLC, Solon, Ohio, USA] ","Recent progress of short pulse dielectric two-beam acceleration",640 643,
tuygbe4,"A. Zelenski, G. Atoian, E.N. Beebe, A. Poblaguev, D. Raparia, J. Ritter [BNL, Upton, Long Island, New York, USA] J.D. Maxwell, R. Milner, M. Musgrave [MIT, Cambridge, Massachusetts, USA] ","Optically-pumped Polarized H- and 3 He++ Ion Sources Development at RHIC",644 646,
tuygbf3,"M. Schmidt, P. Laux, G.H. Zschornack [DREEBIT, Großröhrsdorf, Germany] ","An EBIS-Based Low-Energy Accelerator for Fine-Focussed Ion Beams",647 650,
tuygbf4,"W.J.G.M. Kleeven, M. Abs, J. Brison, E. Forton, J. M. Hubert, J. Walle [IBA, Louvain-la-Neuve, Belgium] ","Design and Simulation Tools for the High-Intensity Industrial Rhodotron Electron Accelerator",651 654,
tuzgbd2,"T. Nakamura [JASRI/SPring-8, Hyogo-ken, Japan] ","Transverse and Longitudinal Bunch-by-Bunch Feedback for Storage Rings",1198 1203,
tuzgbd3,"N. Sereno, N.D. Arnold, R.W. Blake, A.R. Brill, H. Bui, J. Carwardine, G. Decker, L. Emery, T. Fors, P.S. Kallakuri, R.T. Keane, R.M. Lill, D.R. Paskvan, A.F. Pietryla, H. Shang, X. Sun, S. Veseli, J. Wang, S. Xu, B.X. Yang [ANL, Argonne, Illinois, USA] ","Beam Diagnostics for the APS MBA Upgrade",1204 1207,
tuzgbd4,"W. Höfle, H. Bartosik, E.R. Bjørsvik, G. Kotzian, T.E. Levens, K.S.B. Li [CERN, Geneva, Switzerland] J.E. Dusatko, J.D. Fox, C.H. Rivetta [SLAC, Menlo Park, California, USA] O. Turgut [Stanford University, Stanford, California, USA] ","Impact of a Wideband Feedback Prototype System on TMCI in the SPS",1208 1211,
tuzgbd5,"T. Bromwich, D.R. Bett, N. Blaskovic Kraljevic, R.M. Bodenstein, P. Burrows, G.B. Christian, C. Perry, R.L. Ramjiawan [JAI, Oxford, United Kingdom] S. Araki, A. Aryshev, T. Tauchi, N. Terunuma [KEK, Ibaraki, Japan] P. Bambade, S. Wallon [LAL, Orsay, France] S.W. Jang [Korea University Sejong Campus, Sejong, Republic of Korea] ","Performance of Nanometre-Level Resolution Cavity Beam Position Monitors at ATF2",1212 1214,
tuzgbe2,"N. Ohuchi, K.A. Aoki, Y. Arimoto, M.K. Kawai, T. Kawamoto, H. Koiso, Y. Kondo, M. Masuzawa, A. Morita, S. Nakamura, Y. Ohnishi, Y. Ohsawa, T. Oki, H. Sugimoto, K. Tsuchiya, R. Ueki, X. Wang, H. Yamaoka, Z.G. Zong [KEK, Ibaraki, Japan] M. Anerella, J. Escallier, A.K. Jain, A. Marone, B. Parker, P. Wanderer [BNL, Upton, Long Island, New York, USA] J. DiMarco, T.G. Gardner, J.M. Nogiec, M.A. Tartaglia, G. Velev [Fermilab, Batavia, Illinois, USA] T.-H. Kim [Mitsubishi Electric Corp, Advanced Technology R  D Center, Hyogo, Japan] ","Final-focus Superconducting Magnets for SuperKEKB",1215 1219,
tuzgbe3,"M. Sitko, V. Baglin, S. Calatroni, P. Chiggiato, B. Di Girolamo, E. Garcia-Tabares Valdivieso, M. Taborelli [CERN, Geneva, Switzerland] A. Abdolvand, D. Bajek, S. Wackerow [University of Dundee, Nethergate, Dundee, Scotland, United Kingdom] M. Colling, T.J. Jones, P.A. McIntosh [STFC/DL/ASTeC, Daresbury, Warrington, Cheshire, United Kingdom] ","Towards Implementation of Laser Engineered Surface Structures for Electron Cloud Mitigation",1220 1223,
tuzgbe4,"E.A. Nanni, V.A. Dolgashev, A.A. Haase, J. Neilson, S.G. Tantawi [SLAC, Menlo Park, California, USA] S. Jawla, R.J. Temkin [MIT/PSFC, Cambridge, Massachusetts, USA] S. C. Schaub [MIT, Cambridge, Massachusetts, USA] B. Spataro [INFN/LNF, Frascati (Roma), Italy] ","Toward High-Power High-Gradient Testing of mm-Wave Standing-Wave Accelerating Structures",1224 1227,
tuzgbe5,"J.M. Köszegi, K. Alomari, J. Knobloch, O. Kugeler, B. Schmitz [HZB, Berlin, Germany] ","A Combined Temperature and Magnetic Field Mapping System for SRF Cavities",1228 1231,
tuzgbf1,"Y. Iwata, T. Furukawa, Y. Hara, S. Matsuba, T. Murakami, K. Noda, N. S. Saotome, S. Sato, T. Shirai [NIRS, Chiba-shi, Japan] N. Amemiya [Kyoto University, Kyoto, Japan] H. Arai, T. Fujimoto [AEC, Chiba, Japan] T.F. Fujita, K. Mizushima, Y. Saraya [National Institute of Radiological Sciences, Chiba, Japan] S. Matsuba [HSRC, Higashi-Hiroshima, Japan] T. Obana [NIFS, Gifu, Japan] T. Ogitsu [KEK, Ibaraki, Japan] T. Orikasa, S. Takayama [Toshiba, Yokohama, Japan] R. Tansho [QST-NIRS, Chiba, Japan] ","Superconducting Gantry for Carbon-Ion Radiotherapy",1232 1236,
tuzgbf3,"L. Falbo, E. Bressi, S. Foglio, C. Priano [CNAO Foundation, Milan, Italy] ","Betatron Core Slow Extraction at CNAO",1237 1239,
tuzgbf4,"J.L. Conradie, L.S. Anthony, F. Azaiez, S. Baard, R.A. Bark, A.H. Barnard, P. Beukes, J.I. Broodryk, J.C. Cornell, J.G. De Villiers, H. Du Plessis, W. Duckitt, D.T. Fourie, P.G. Gardiner, M.E. Hogan, I.H. Kohler, J.J. Lawrie, C. Lussi, N.R. Mantengu, R.H. McAlister, J. Mira, K.V. Mjali, H.W. Mostert, C. Naidoo, F. Nemulodi, M. Sakildien, V.F. Spannenberg, G.F. Steyn, N. Stodart, R.W. Thomae, M.J. Van Niekerk, P.A. van Schalkwyk [iThemba LABS, Somerset West, South Africa] ","The South African Isotope Facility",1240 1243,
tuzgbf5,"A.V. Smirnov, R.B. Agustsson, M.A. Harrison, A.Y. Murokh, A.Yu. Smirnov [RadiaBeam Systems, Santa Monica, California, USA] S. Boucher, T.J. Campese, K.J. Hoyt [RadiaBeam, Los Angeles, California, USA] E.A. Savin [MEPhI, Moscow, Russia] A.A. Zavadtsev [Nano, Moscow, Russia] ","KlyLac Prototyping for Borehole Logging",1244 1246,
wepaf001,"A. Jeff, A. Benot-Morell, M. Caldara, P. Nadig [A.D.A.M. SA, Meyrin, Switzerland] ","A Diagnostic Test Bench for the LIGHT Accelerator",1808 1811,
wepaf003,"J.D. Kunz, C.M. Conrad, L.M. Romero [Anderson University, Anderson, USA] ","Beamline Architect",1812 1814,
wepaf005,"J.C. Dooling, M. Borland, K.C. Harkay, R.T. Keane, B.J. Micklich, C. Yao [ANL, Argonne, Illinois, USA] ","A Fast Beam Interlock System for the Advanced Photon Source Particle Accumulator Ring",1815 1818,
wepaf006,"J.C. Dooling, J.R. Calvey, K.C. Harkay, B.X. Yang, C. Yao [ANL, Argonne, Illinois, USA] ","Fast Photodetector Bunch Duration Monitor for the Advanced Photon Source Particle Accumulator Ring",1819 1822,
wepaf007,"U. Wienands, T.G. Berenc, T. Fors, F. Lenkszus, N. Sereno, G.J. Waldschmidt [ANL, Argonne, Illinois, USA] ","A Scheme for Asynchronous Operation of the APS-U Booster Synchrotron",1823 1825,
wepaf009,"Y.E. Tan [AS - ANSTO, Clayton, Australia] ","Optimising Response Matrix Measurements for LOCO Analysis",1826 1828,
wepaf010,"W.X. Cheng, B. Bacha, K. Ha, Y. Li [BNL, Upton, Long Island, New York, USA] ","Fast Glitch Detection of Coupled Bunch Instabilities and Orbit Motions",1829 1832,
wepaf011,"W.X. Cheng, B. Bacha, Y. Li [BNL, Upton, Long Island, New York, USA] D. Teytelman [Dimtel, San Jose, USA] ","Developments of Bunch by Bunch Feedback System at NSLS-II Storage Ring",1833 1836,
wepaf012,"W.X. Cheng, B. Bacha, B.N. Kosciuk, D. Padrazo Jr [BNL, Upton, Long Island, New York, USA] ","Improvements of NSLS-II X-ray Diagnostic Beamlines",1837 1840,
wepaf013,"J. Choi, R.P. Fliller, K. Ha, Y. Tian [BNL, Upton, Long Island, New York, USA] ","Database for the Management of NSLS-II Active Interlock System",1841 1843,
wepaf014,"N.S. Froemming [CENPA, Seattle, Washington, USA] K.E. Badgley, H. Nguyen, D. Stratakis [Fermilab, Batavia, Illinois, USA] J.D. Crnkovic [BNL, Upton, Long Island, New York, USA] L.E. Kelton [UKY, Kentucky, USA] M.J. Syphers [Northern Illinois University, DeKalb, Illinois, USA] ","Commissioning the Superconducting Magnetic Inflector System for the Muon g-2 Experiment",1844 1847,
wepaf015,"J.D. Crnkovic, V. Tishchenko [BNL, Upton, Long Island, New York, USA] K.E. Badgley, H. Nguyen, E. Ramberg [Fermilab, Batavia, Illinois, USA] E. Barlas Yucel, M. Yucel [Istanbul Technical University, Maslak, Istanbul, Turkey] J.M. Grange [ANL, Argonne, Illinois, USA] A.T. Herrod [Cockcroft Institute, Warrington, Cheshire, United Kingdom] A.T. Herrod [The University of Liverpool, Liverpool, United Kingdom] J.L. Holzbauer, W. Wu [UMiss, University, Mississippi, USA] H.D. Sanders [APP, Freeville, New York, USA] H.D. Sanders [Sanders Pulsed Power LLC, Batavia, Illinois, USA] N.H. Tran [BUphy, Boston, Massachusetts, USA] ","Commissioning the Muon g-2 Experiment Electrostatic Quadrupole System",1848 1851,
wepaf016,"J. Bradley [Edinburgh University, Edinburgh, United Kingdom] J.D. Crnkovic [BNL, Upton, Long Island, New York, USA] B.E. Drendel, D. Stratakis [Fermilab, Batavia, Illinois, USA] N.S. Froemming [CENPA, Seattle, Washington, USA] ","Application of Quad-Scan Measurement Techniques to Muon Beams in the Muon g-2 Experiment",1852 1855,
wepaf017,"Y. Hidaka, Y. Li, T.V. Shaftan, T. Tanabe, Y. Tian, G.M. Wang [BNL, Upton, Long Island, New York, USA] ","Correction of ID-Induced Transverse Linear Coupling at NSLS-II",1856 1859,
wepaf018,"P. Thieberger, M.G. Minty, C. Montag [BNL, Upton, Long Island, New York, USA] ","Proposed BPM-Based Bunch Crabbing Angle Monitor",1860 1863,
wepaf019,"P. Thieberger, D.M. Gassner, R.L. Hulsart, R.J. Michnoff, T.A. Miller, M.G. Minty, Z. Sorrell [BNL, Upton, Long Island, New York, USA] A.C. Bartnik [Cornell University (CLASSE), Cornell Laboratory for Accelerator-Based Sciences and Education, Ithaca, New York, USA] ","Fast Readout Algorithm for Cylindrical Beam Position Monitors Providing Good Accuracy for Particle Bunches with Large Offsets",1864 1866,
