frxgbd1,"A. Apollonio, L. Ponce, O. Rey Orozko, R. Schmidt, A.P. Siemko, B. Todd, J.A. Uythoven, A.P. Verweij, D. Wollmann, M. Zerlauth [CERN, Geneva, Switzerland] ","Reliability and Availability of Particle Accelerators: Concepts, Lessons, Strategy",5014 5018,
frxgbd2,"V.V. Gambaryan, A.A. Starostenko [BINP SB RAS, Novosibirsk, Russia] A.A. Starostenko [NSU, Novosibirsk, Russia] ","Fast Kicker for High Current Beam Manipulation: Experimental Facility",5019 5021,
frxgbd3,"A. Miura, K. Moriya [JAEA/J-PARC, Tokai-mura, Japan] T. Miyao [KEK, Ibaraki, Japan] ","Application of Carbon Nanotube Wire for Beam Profile Measurement of Negative Hydrogen Ion Beam",5022 5025,
frxgbd4,"Leshenok D. Leshenok, E.A. Bekhtenev [NSU, Novosibirsk, Russia] E.A. Bekhtenev, G.V. Karpov, S.A. Nikitin, O.A. Plotnikova [BINP SB RAS, Novosibirsk, Russia] ","Observation of Saw-Tooth Effect Orbit in the VEPP-4 M Collider",5026 5028,
frxgbe2,"D. L. Rubin, A.T. Chapelain [Cornell University (CLASSE), Cornell Laboratory for Accelerator-Based Sciences and Education, Ithaca, New York, USA] S. Charity, J. Price [The University of Liverpool, Liverpool, United Kingdom] J.D. Crnkovic, W. Morse, V. Tishchenko [BNL, Upton, Long Island, New York, USA] F.E. Gray [Regis University, Denver, USA] J. E. Mott [BUphy, Boston, Massachusetts, USA] W. Wu [UMiss, University, Mississippi, USA] ","Muon Beam Dynamics and Spin Dynamics in the g-2 Storage Ring",5029 5034,
frxgbe3,"T.A. Mohayai [IIT, Chicago, Illinois, USA] ","First Demonstration of Ionization Cooling in MICE",5035 5040,
frxgbf1,"Y. Kondo, K. Hasegawa, T. Morishita [JAEA/J-PARC, Tokai-Mura, Naka-Gun, Ibaraki-Ken, Japan] S. Bae, H. Choi, S. Choi, B. Kim, H.S. Ko [SNU, Seoul, Republic of Korea] Y. Fukao, K. Futatsukawa, N. Kawamura, T. Mibe, Y. Miyake, M. Otani, K. Shimomura, T. Yamazaki, M. Yoshida [KEK, Tsukuba, Japan] N. Hayashizaki [RLNR, Tokyo, Japan] T. Iijima, Y. Sue [Nagoya University, Graduate School of Science, Chikusa-ku, Nagoya, Japan] H. Iinuma, Y. Nakazawa [Ibaraki University, Ibaraki, Japan] K. Ishida [RIKEN Nishina Center, Wako, Japan] Y. Iwashita [Kyoto ICR, Uji, Kyoto, Japan] Y. Iwata [NIRS, Chiba-shi, Japan] R. Kitamura [University of Tokyo, Tokyo, Japan] S. Li [The University of Tokyo, Graduate School of Science, Tokyo, Japan] G.P. Razuvaev [Budker INP  NSU, Novosibirsk, Russia] N. Saito [J-PARC, KEK  JAEA, Ibaraki-ken, Japan] ","Re-Acceleration of Ultra Cold Muon in J-PARC Muon Facility",5041 5046,
frxgbf3,"L.T. Sun [IMP/CAS, Lanzhou, People's Republic of China] ","Perspectives in High Intensity Heavy Ion Sources for Future Heavy Ion Accelerators",5047 5052,
mopmf001,"S. Ogur, K. Oide, Y. Papaphilippou, F. Zimmermann [CERN, Geneva, Switzerland] D.N. Shatilov [BINP SB RAS, Novosibirsk, Russia] ","Bunch Schedules for the FCC-ee Pre-injector",79 82,
mopmf002,"O. Etisken [Ankara University, Faculty of Sciences, Ankara, Turkey] F. Antoniou, Y. Papaphilippou [CERN, Geneva, Switzerland] A.K. Ciftci (A.K. Çiftçi) [Izmir University of Economics, Balçova/Izmir, Turkey] ","Pre-Booster Ring Considerations for the FCC e+e- Injector",83 86,
mopmf004,"J.L. Martinez Marin, B. Mustapha [ANL, Argonne, USA] ","Spin Dynamics in the JLEIC Alternative Pre-Booster Ring",87 90,
mopmf005,"B. Mustapha, J.L. Martinez Marin [ANL, Argonne, USA] Y.S. Derbenev, F. Lin, V.S. Morozov, Y. Zhang [JLab, Newport News, Virginia, USA] ","Beam Formation in the Alternative JLEIC Ion Complex",91 94,
mopmf006,"W. Fischer, M.R. Costanzo, A.V. Fedotov, X. Gu, A. Marusic, M.G. Minty, C. Montag, Y. Tan, P. Thieberger [BNL, Upton, Long Island, New York, USA] ","Test of Stepwise Electron Bunch Replacement in eRHIC Using an Electron Lens in RHIC",95 98,
mopmf010,"Y. Luo, W. Fischer, A. Marusic, M.G. Minty [BNL, Upton, Long Island, New York, USA] ","Measurement and Simulation of Betatron Coupling Beam Transfer Function in RHIC",99 101,
mopmf011,"Y. Luo, M. Blaskiewicz, A. He, C. Montag, V. Ptitsyn [BNL, Upton, Long Island, New York, USA] ","Beam-Beam Issues With Two Interaction Points in eRHIC",102 104,
mopmf012,"Y. Luo, G. Bassi, M. Blaskiewicz, W. Fischer, Y. Hao, C. Montag, V. Ptitsyn, V.V. Smaluk, F.J. Willeke [BNL, Upton, Long Island, New York, USA] J. Qiang [LBNL, Berkeley, California, USA] ","Study of Crabbed Collision in eRHIC With a Combination of Strong-Strong and Weak-Strong Simulations",105 107,
mopmf013,"F. Meot (F. Méot), E.C. Aschenauer, H. Huang, C. Montag, V. Ptitsyn, V.H. Ranjbar, E. Wang, Z. Zhao [BNL, Upton, Long Island, New York, USA] I.V. Bazarov, D. L. Rubin [Cornell University, Ithaca, New York, USA] L. Cultrera, G.H. Hoffstaetter, K.W. Smolenski, R.M. Talman [Cornell University (CLASSE), Cornell Laboratory for Accelerator-Based Sciences and Education, Ithaca, New York, USA] D. Gaskell, O. Glamazdin, J.M. Grames [JLab, Newport News, Virginia, USA] ","eRHIC EIC: Plans for Rapid Acceleration of Polarized Electron Bunch at Cornell Synchrotron",108 111,
mopmf014,"F. Meot (F. Méot) [BNL, Upton, Long Island, New York, USA] ","Polarization at eRHIC Electron Storage Ring, an Ergodic Approach",112 114,
mopmf016,"V.H. Ranjbar, M. Blaskiewicz, J.M. Brennan, S.J. Brooks, D.M. Gassner, H.-C. Hseuh, I. Marneris, F. Meot (F. Méot), M.G. Minty, C. Montag, V. Ptitsyn, K.S. Smith, S. Tepikian, F.J. Willeke, H. Witte, B. P. Xiao, A. Zaltsman [BNL, Upton, Long Island, New York, USA] I.V. Pogorelov [Tech-X, Boulder, Colorado, USA] ","Progress on RCS eRHIC Injector Design",115 117,
mopmf018,"P. Adams, H. Huang, J. Kewisch, F. Meot (F. Méot), P. Oddo, V. Ptitsyn, V.H. Ranjbar, G. Robert-Demolaize, T. Roser [BNL, Upton, Long Island, New York, USA] ","Numerical Simulation of Spin Dynamics with Spin Flipper in RHIC",118 120,
mopmf020,"Q. Wu, I. Ben-Zvi, S. Verdu-Andres (S. Verdú-Andrés), B. P. Xiao [BNL, Upton, Long Island, New York, USA] I. Ben-Zvi [Stony Brook University, Stony Brook, USA] ","Higher Order Mode Coupling Options for the eRHIC Crab Cavity",121 124,
mopmf021,"F. Yan, Z. Duan, D. Ji, Y. Jiao, Z.Z. Wang, Y. Wei, G. Xu [IHEP, Beijing, People's Republic of China] ","Ground Motion Measurement and Analysis for HEPS",125 128,
mopmf022,"E. Yamakawa, R. Apsimon, A.C. Dexter [Cockcroft Institute, Lancaster University, Lancaster, United Kingdom] P. Baudrenghien, R. Calaga, F.J. Galindo Guarch [CERN, Geneva, Switzerland] ","Luminosity Reduction Caused by the Full-Detuning LLRF Scheme on the HL-LHC Crab Cavities",129 132,
mopmf023,"D. Boutin, A. Chance (A. Chancé), B. Dalena [CEA/IRFU, Gif-sur-Yvette, France] B.J. Holzer, D. Schulte [CERN, Geneva, Switzerland] ","Updates on the Optic Corrections of FCC-hh",133 136,
mopmf024,"B. Dalena [CEA/IRFU, Gif-sur-Yvette, France] D. Boutin, A. Chance (A. Chancé) [CEA/DRF/IRFU, Gif-sur-Yvette, France] B.J. Holzer, S. Izquierdo Bermudez, D. Schoerling, D. Schulte [CERN, Geneva, Switzerland] ","Dipole Field Quality and Dynamic Aperture for FCC-hh",137 140,
mopmf025,"A. Chance (A. Chancé), B. Dalena [CEA/IRFU, Gif-sur-Yvette, France] D. Boutin [CEA/DRF/IRFU, Gif-sur-Yvette, France] B.J. Holzer, D. Schulte [CERN, Geneva, Switzerland] ","Overview of Arc Optics of FCC-hh",141 144,
mopmf028,"D. Sagan [Cornell University (CLASSE), Cornell Laboratory for Accelerator-Based Sciences and Education, Ithaca, New York, USA] ","A Superconvergent Algorithm for Invariant Spin Field Stroboscopic Calculations",145 148,
mopmf029,"S. Arsenyev, D. Schulte [CERN, Geneva, Switzerland] O. Boine-Frankenheim [GSI, Darmstadt, Germany] ","FCC-hh transverse impedance budget",149 152,
mopmf030,"S. Arsenyev, D. Schulte [CERN, Geneva, Switzerland] ","Broadband Impedance of Pumping Holes and Interconnects in the FCC-hh Beamscreen",153 156,
mopmf031,"S. Arsenyev, D. Schulte [CERN, Geneva, Switzerland] ","Modelling Wake Impedance of a Rough Surface in Application to the FCC-hh Beamscreen",157 160,
mopmf032,"F.S. Carlier, E.H. Maclean, T. Persson, R. Tomas (R. Tomás) [CERN, Geneva, Switzerland] ","Nonlinear Correction Strategies for the LHC Using Resonance Driving Terms",161 164,
mopmf033,"F.S. Carlier, M. Giovannozzi, E.H. Maclean, T. Persson, R. Tomas (R. Tomás) [CERN, Geneva, Switzerland] ","Probing the Forced Dynamic Aperture in the LHC at Top Energy Using AC Dipoles",165 168,
mopmf034,"S. Ogur, T.K. Charles, K. Oide, Y. Papaphilippou, L. Rinolfi, F. Zimmermann [CERN, Geneva, Switzerland] A.M. Barnyakov, A.E. Levichev, P.V. Martyshkin, D.A. Nikiforov [BINP SB RAS, Novosibirsk, Russia] I. Chaikovska, R. Chehab [LAL, Orsay, France] K. Furukawa, N. Iida, T. Kamitani, F. Miyahara [KEK, Ibaraki, Japan] E.V. Ozcan [Bogazici University, Bebek / Istanbul, Turkey] S.M. Polozov [MEPhI, Moscow, Russia] ","Layout and Performance of the FCC-ee Pre-Injector Chain",169 172,
mopmf036,"Sh. Gorgi Zadeh, U. van Rienen [Rostock University, Faculty of Computer Science and Electrical Engineering, Rostock, Germany] R. Calaga, F. Gerigk [CERN, Geneva, Switzerland] ","FCC-ee Hybrid RF Scheme",173 175,
mopmf038,"N. Fuster-Martinez (N. Fuster-Martínez), R. Bruce, P.D. Hermes, J.M. Jowett, D. Mirarchi, S. Redaelli [CERN, Geneva, Switzerland] ","Cleaning Performance of the Collimation System with Xe Beams at the Large Hadron Collider",176 179,
mopmf039,"M. Schaumann, R. Alemany-Fernandez (R. Alemany-Fernández), P. Baudrenghien, T. Bohl, C. Bracco, R. Bruce, N. Fuster-Martinez (N. Fuster-Martínez), M.A. Jebramcik, J.M. Jowett, T. Mertens, D. Mirarchi, S. Redaelli, B. Salvachua, M. Solfaroli, H. Timko, J. Wenninger [CERN, Geneva, Switzerland] ","First Xenon-Xenon Collisions in the LHC",180 183,
mopmf040,"N. Karastathis, K. Fuchsberger, M. Hostettler, Y. Papaphilippou, D. Pellegrini [CERN, Geneva, Switzerland] ","Crossing Angle Anti-Leveling at the LHC in 2017",184 187,
mopmf041,"N. Karastathis, R. De Maria, S.D. Fartoukh, Y. Papaphilippou, D. Pellegrini [CERN, Geneva, Switzerland] ","Refining the HL-LHC Operational Settings with Inputs From Dynamic Aperture Simulations: A Progress Report",188 191,
mopmf042,"B. Lindstrom, H. Burkhardt, V.K.B. Olsen, A. Santamaría García, K.N. Sjobak, M. Valette, D. Wollmann [CERN, Geneva, Switzerland] ","Crab Cavity Failures Combined with a Loss of the Beam-Beam Kick in the High Luminosity LHC",192 195,
mopmf043,"E. Marin (E. Marín), A. Latina, J. Pfingstner, D. Schulte, R. Tomas (R. Tomás) [CERN, Geneva, Switzerland] J. Pfingstner [University of Oslo, Oslo, Norway] ","Tuning of CLIC-Final Focus System 3 TeV Baseline Design Under Static and Dynamic Imperfections",196 199,
mopmf044,"S. Chemli, M. Bernardini, T.W. Birtwistle, A. Bolognesi, B. Brito Da Palma, S.E. Bustamante, J. Coupard, K. Foraz, E. Kleszcz, N. Kotsolakos, T. Krastev, P. A. Kulig, Y. Muttoni, B. Nicquevert, L. Pater, A. Patrascoiu, S. Petit, C. Rauser, A. Wardzinska [CERN, Geneva, Switzerland] ","New Coordination Tools to Prepare Programmed Stops in the LHC and its Injectors",200 203,
mopmf046,"Y.C. Nie, A. Bertarelli, F. Carra, C. Fichera, L.K. Mettler, R. Schmidt, D. Wollmann [CERN, Geneva, Switzerland] ","Simulation of Hydrodynamic Tunneling Caused by High Energy Proton Beam in Copper through Coupling of FLUKA and Autodyn",204 207,
mopmf047,"T. Persson, G. Baud, X. Buffat, J.M. Coello de Portugal, E. Fol, K. Fuchsberger, M. Gabriel, M. Gasior (M. Gąsior), M. Giovannozzi, G.H. Hemelsoet, M. Hostettler, M. Hruska, D. Jacquet, E.H. Maclean, L. Malina, J. Olexa, P.K. Skowronski (P.K. Skowroński), M. Solfaroli Camillocci, M.E. Söderén, R. Tomas (R. Tomás), D. Valuch, A. Wegscheider, J. Wenninger [CERN, Geneva, Switzerland] ","Transverse Coupling Measurements With High Intensity Beams Using Driven Oscillations",208 211,
mopmf048,"N. Fuster-Martinez (N. Fuster-Martínez), R. Bruce, J. Dilly, E.H. Maclean, T. Persson, S. Redaelli, R. Tomas (R. Tomás) [CERN, Geneva, Switzerland] L.J. Nevay [Royal Holloway, University of London, Surrey, United Kingdom] ","Aperture Measurements with AC Dipole at the Large Hadron Collider",212 215,
mopmf050,"M. Pojer, M. Albert, R. Alemany-Fernandez (R. Alemany-Fernández), T. Argyropoulos, E. Bravin, A. Calia, G.E. Crockford, S.D. Fartoukh, K. Fuchsberger, R. Giachino, M. Giovannozzi, G.H. Hemelsoet, M. Hostettler, W. Höfle, Y. Le Borgne, D. Nisbet, L. Ponce, S. Redaelli, B. Salvachua, M. Solfaroli, R. Suykerbuyk, D.J. Walsh, J. Wenninger, M. Zerlauth [CERN, Geneva, Switzerland] ","LHC Operational Experience of the 6.5 TeV Proton Run with ATS Optics",216 219,
mopmf051,"B. Salvachua, M. Albert, R. Alemany-Fernandez (R. Alemany-Fernández), T. Argyropoulos, E. Bravin, H. Burkhardt, G.E. Crockford, JCD. Dumont, S.D. Fartoukh, K. Fuchsberger, R. Giachino, M. Giovannozzi, G.H. Hemelsoet, W. Höfle, J.M. Jowett, Y. Le Borgne, D. Nisbet, M. Pojer, L. Ponce, S. Redaelli, M. Solfaroli, R. Suykerbuyk, D.J. Walsh, J. Wenninger, M. Zerlauth [CERN, Geneva, Switzerland] ","LHC Operational Scenarios During 2017 Run",220 223,
mopmf052,"N. Karastathis, F. Antoniou, I. Efthymiopoulos, M. Hostettler, G. Iadarola, S. Papadopoulou, Y. Papaphilippou, D. Pellegrini, B. Salvachua [CERN, Geneva, Switzerland] ","Monitoring and Modeling of the LHC Luminosity Evolution in 2017",224 227,
mopmf053,"J.M. Jimenez, D. Amorim, S. A. Antipov, G. Arduini, A. Bertarelli, N. Biancacci, B. Bradu, E. Bravin, G. Bregliozzi, K. Brodzinski, R. Bruce, X. Buffat, L.R. Carver, P. Chiggiato, S.D. Claudet, P. Collier, R. Garcia Alia, M. Giovannozzi, L. K. Grob, E.B. Holzer, W. Höfle, G. Iadarola, G. Kotzian, A. Lechner, T.E. Levens, B. Lindstrom, T. Medvedeva, A. Milanese, D. Mirarchi, E. Métral, D. Perini, S. Redaelli, G. Rumolo, B. Salvant, R. Schmidt, M. Valette, D. Valuch, J. Wenninger, D. Wollmann, C. Yin Vallgren, C. Zamantzas, M. Zerlauth [CERN, Geneva, Switzerland] D. Amorim [Université Grenoble Alpes, Grenoble, France] A.A. Gorzawski [University of Manchester, Manchester, United Kingdom] L. Mether [EPFL, Lausanne, Switzerland] ","Observations, Analysis and Mitigation of Recurrent LHC Beam Dumps Caused by Fast Losses in Arc Half-Cell 16L2",228 231,
mopmf054,"G.P. Di Giovanni, S.C.P. Albright, V. Forte, M.A. Fraser, G. Guidoboni, B. Mikulec, F. Roncarolo, A. Santamaría García [CERN, Geneva, Switzerland] ","Comparison of Different Transverse Emittance Measurement Techniques in the Proton Synchrotron Booster",232 235,
mopmf055,"Y. Han, L. Ma [SDU, Shandong, People's Republic of China] C. Bayar [Ankara University, Faculty of Sciences, Ankara, Turkey] S. Doebert (S. Döbert), A. Latina, D. Schulte [CERN, Geneva, Switzerland] ","Update of the CLIC Positron Source",236 239,
mopmf056,"J.Ph. G. L. Tock, M. Bednarek, L. Bottura, E. Karentzos, S.L.N. Le Naour, F. Meuter, M. Pojer, C.E. Scheuerlein, E. Todesco, D. Tommasini, L. X. Van Den Boogaard, G.P. Willering [CERN, Geneva, Switzerland] ","The Second LHC Long Shutdown (LS2) for the Superconducting Magnets",240 243,
mopmf057,"T. Tydecks, S. Aumon, T.K. Charles, B. Haerer (B. Härer), B.J. Holzer, K. Oide, Y. Papaphilippou, J. Wenninger [CERN, Geneva, Switzerland] ","FCC-ee Dynamic Aperture Studies and Frequency Map Analysis",244 246,
mopmf058,"T. Tydecks, D. Alves, T.E. Levens, M. Wendt, J. Wenninger [CERN, Geneva, Switzerland] ","Status of the LHC Schottky Monitors",247 249,
mopmf059,"B. Haerer (B. Härer), B.J. Holzer, Y. Papaphilippou, T. Tydecks [CERN, Geneva, Switzerland] ","Status of the FCC-ee Top-Up Booster Synchrotron",250 252,
mopmf060,"M. Valette, B. Lindstrom, A. Mereghetti, R. Schmidt, M. Solfaroli, J.A. Uythoven, D. Valuch, J. Wenninger, D. Wollmann, M. Zerlauth [CERN, Geneva, Switzerland] ","Safe Disposal of the LHC Beam without Beam Dump - Method and Experimental Verification",253 256,
mopmf061,"F. Antoniou, H. Bartosik, T. Bohl, R. Calaga, L.R. Carver, J. Repond, G. Vandoni [CERN, Geneva, Switzerland] A. Alekou [UMAN, Manchester, United Kingdom] ","Emittance Growth in Coast in the SPS at CERN",257 260,
mopmf062,"C. Wiesner, W. Bartmann, C. Bracco, M. Calviani, E. Carlier, L. Ducimetière, M.I. Frankl, M.A. Fraser, S.S. Gilardoni, B. Goddard, T. Kramer, A. Lechner, N. Magnin, A. Perillo-Marcone, T. Polzin, E. Renner, V. Senaj [CERN, Geneva, Switzerland] ","Upgrade of the Dilution System for HL-LHC",261 264,
mopmf063,"C. Wiesner, W. Bartmann, C. Bracco, E. Carlier, L. Ducimetière, M.I. Frankl, M.A. Fraser, B. Goddard, C. Hessler (C. Heßler), T. Kramer, A. Lechner, N. Magnin, V. Senaj, D. Wollmann [CERN, Geneva, Switzerland] ","Asynchronous Beam Dump Tests at LHC",265 268,
mopmf064,"F. Zimmermann, D. Amorim, S. A. Antipov, S. Arsenyev, M. Benedikt, R. Bruce, M.P. Crouch, S.D. Fartoukh, M. Giovannozzi, B. Goddard, M. Hofer, R. Kersevan, V. Mertens, Y. Muttoni, J.A. Osborne, V. Parma, V. Raginel, S. Redaelli, T. Risselada, I. Ruehl, B. Salvant, D. Schoerling, E.N. Shaposhnikova, L.J. Tavian, E. Todesco, R. Tomas (R. Tomás), D. Tommasini, F. Valchkova-Georgieva, V. Venturi, D. Wollmann [CERN, Geneva, Switzerland] J.L. Abelleira, E. Cruz Alaniz, P. Martinez Mirave, A. Seryi, L. van Riesen-Haupt [JAI, Oxford, United Kingdom] A. Apyan [ANSL, Yerevan, Armenia] J. Barranco (J. Barranco García), L. Mether, T. Pieloni, L. Rivkin, C. Tambasco [EPFL, Lausanne, Switzerland] F. Burkart [DESY, Hamburg, Germany] Y. Cai, Y.M. Nosochkov [SLAC, Menlo Park, California, USA] G. Guillermo Cantón [CINVESTAV, Mérida, Mexico] K. Ohmi, K. Oide, D. Zhou [KEK, Ibaraki, Japan] ","High-Energy LHC Design",269 272,
mopmf065,"F. Zimmermann [CERN, Geneva, Switzerland] ","LHC- and FCC-Based Muon Colliders",273 276,
mopmf067,"Y.M. Nosochkov, Y. Cai [SLAC, Menlo Park, California, USA] M.P. Crouch, M. Giovannozzi, M. Hofer, J. Keintzel, T. Risselada, E. Todesco, R. Tomas (R. Tomás), F. Zimmermann [CERN, Geneva, Switzerland] D. Zhou [KEK, Ibaraki, Japan] L. van Riesen-Haupt [JAI, Oxford, United Kingdom] ","Optimized Arc Optics for the HE-LHC",277 280,
mopmf068,"M.A. Valdivia García, D. El Khechen, K. Oide, F. Zimmermann [CERN, Geneva, Switzerland] ","Quantum Excitation due to Classical Beamstrahlung in Circular Colliders",281 284,
mopmf069,"T. Pieloni, J. Barranco (J. Barranco García), L. Rivkin, C. Tambasco [EPFL, Lausanne, Switzerland] D. Amorim, S. A. Antipov, X. Buffat, B. Salvant, F. Zimmermann [CERN, Geneva, Switzerland] ","The High Energy LHC Beam-Beam Effects studies",285 288,
mopmf070,"M.L. Alvarez, C.C. Jensen, D.K. Morris, V.P. Nagaslaev, H. Pham, D.G. Tinsley [Fermilab, Batavia, Illinois, USA] ","High Voltage Design for the Electrostatic Septum for the Mu2e Beam Resonant Extraction",289 291,
mopmf071,"E. Gianfelice-Wendt [Fermilab, Batavia, Illinois, USA] S. Tepikian [BNL, Upton, Long Island, New York, USA] ","Polarization Studies for the eRHIC electron Storage Ring",292 295,
mopmf072,"V.D. Shiltsev, D.V. Neuffer [Fermilab, Batavia, Illinois, USA] ","On the Feasibility of a Pulsed 14 TeV C.M.E. Muon Collider in the LHC Tunnel",296 299,
mopmf073,"K. Furukawa, M. Akemoto, D.A. Arakawa, Y. Arakida, H. Ego, A. Enomoto, Y. Enomoto, T. Higo, H. Honma, N. Iida, M. Ikeda, H. Kaji, K. Kakihara, T. Kamitani, H. Katagiri, M. Kawamura, M. Kurashina, S. Matsumoto, T. Matsumoto, H. Matsushita, S. Michizono, K. Mikawa, T. Miura, F. Miyahara, H. Nakajima, K. Nakao, T. Natsui, M. Nishida, Y. Ogawa, Y. Ohnishi, S. Ohsawa, F. Qiu, I. Satake, M. Satoh, Y. Seimiya, A. Shirakawa, H. Sugimura, T. Suwada, T. Takenaka, M. Tanaka, N. Toge, Y. Yano, K. Yokoyama, M. Yoshida, R. Zhang, X. Zhou [KEK, Ibaraki, Japan] ","Rejuvenation of 7-Gev SuperKEKB Injector Linac",300 303,
mopmf074,"Y. Seimiya, N. Iida, T. Kamitani, M. Satoh [KEK, Ibaraki, Japan] ","Beam Phase Space Jitter and Effective Emittance for SuperKEKB Injector Linac",304 306,
mopmf076,"M. Kuriki [HU/AdSM, Higashi-Hiroshima, Japan] ","Energy Spread Compensation in Arbitrary Format Multi-Bunch Acceleration With Standing Wave and Traveling Wave Accelerators",307 310,
mopmf077,"H. Nagoshi, M. Kuriki [HU/AdSM, Higashi-Hiroshima, Japan] S. Kashiwagi [Tohoku University, Research Center for Electron Photon Science, Sendai, Japan] K. Negishi [Iwate University, Morioka, Iwate, Japan] T. Omori, M. Satoh, Y. Seimiya, J. Urakawa [KEK, Ibaraki, Japan] Y. Sumitomo [LEBRA, Funabashi, Japan] T. Takahashi [Hiroshima University, Graduate School of Science, Higashi-Hiroshima, Japan] ","A Design Study of the Electron-driven ILC Positron Source Including Beam Loading Effect",311 314,
mopmf079,"D. Wang, S. Bai, F.S. Chen, W. Chou, J. Gao, Y.M. Peng, Y. Wang, M. Yang, C.H. Yu, Y. Zhang [IHEP, Beijing, People's Republic of China] ","The CEPC lattice design with combined dipole magnet",315 318,
mopmf084,"C. Meng, X.P. Li, G. Pei, J.R. Zhang [IHEP, Beijing, People's Republic of China] ","The Progress of CEPC Positron Source Design",319 321,
mopmf085,"M. Boscolo, O.R. Blanco-García [INFN/LNF, Frascati (Roma), Italy] H. Burkhardt, R. Kersevan, M. Lueckhof [CERN, Geneva, Switzerland] F. Collamati [INFN-Roma1, Rome, Italy] ","Beam-gas Background Characterization in the FCC-ee IR",322 325,
mopmf086,"M. Boscolo, M. Antonelli, O.R. Blanco-García, S. Guiducci, A. Stella [INFN/LNF, Frascati (Roma), Italy] F. Collamati [INFN-Roma1, Rome, Italy] R. Li Voti [Sapienza University of Rome, Rome, Italy] S.M. Liuzzo, P. Raimondi [ESRF, Grenoble, France] ","Proposal of an Experimental Test at DANE for the Low Emittance Muon Beam Production From Positrons on Target",326 329,
mopmf087,"M. Boscolo, M. Antonelli, O.R. Blanco-García, S. Guiducci [INFN/LNF, Frascati (Roma), Italy] F. Collamati [INFN-Roma1, Rome, Italy] L. Keller [SLAC, Menlo Park, California, USA] S.M. Liuzzo, P. Raimondi [ESRF, Grenoble, France] D. Schulte [CERN, Geneva, Switzerland] ","Muon Accumulator Ring Requirements for a Low Emittance Muon Collider from Positrons on Target",330 333,
mopmf088,"C. Milardi, D. Alesini, S. Bini, O.R. Blanco-García, M. Boscolo, B. Buonomo, S. Cantarella, S. Caschera, A. D'Uffizi, A. De Santis, G.O. Delle Monache, D.G.C. Di Giulio, G. Di Pirro, A. Drago, L.G. Foggetta, A. Gallo, R. Gargana, A. Ghigo, S. Guiducci, S. Incremona, F. Iungo, C. Ligi, M. Maestri, A. Michelotti, L. Pellegrino, R. Ricci, U. Rotundo, L. Sabbatini, C. Sanelli, G. Sensolini, A. Stecchi, A. Stella, A. Vannozzi, M. Zobov [INFN/LNF, Frascati (Roma), Italy] G. Castorina [INFN-Roma1, Rome, Italy] J. Chavanne, G. Le Bec, P. Raimondi [ESRF, Grenoble, France] ","Preparation Activity for the Siddharta-2 Run at DANE",334 337,
mopmf089,"A. De Santis, C. Bisegni, O.R. Blanco-García, O. Coiro, A. Michelotti, C. Milardi, A. Stecchi [INFN/LNF, Frascati (Roma), Italy] ","DANE Luminosity Monitor",338 340,
mopmf090,"A. Abramov, S.T. Boogert, L.J. Nevay, S.D. Walker [JAI, Egham, Surrey, United Kingdom] ","First Studies of Ion Collimation for the LHC Using BDSIM",341 344,
mopmk001,"L. van Riesen-Haupt, J.L. Abelleira [University of Oxford, Oxford, United Kingdom] J.L. Abelleira, E. Cruz Alaniz, P. Martinez Mirave, A. Seryi [JAI, Oxford, United Kingdom] M. Hofer, F. Zimmermann [CERN, Geneva, Switzerland] D. Zhou [KEK, Ibaraki, Japan] ","Optics for RF Acceleration Section for the High Energy Large Hadron Collider",345 347,
mopmk002,"M. Hofer [TU Vienna, Wien, Austria] M.P. Crouch, J. Keintzel, T. Risselada, R. Tomas (R. Tomás), F. Zimmermann [CERN, Geneva, Switzerland] Y.M. Nosochkov [SLAC, Menlo Park, California, USA] D. Zhou [KEK, Ibaraki, Japan] L. van Riesen-Haupt [JAI, Oxford, United Kingdom] ","Integrated Full HE-LHC Optics and Its Performance",348 351,
mopmk003,"J.L. Abelleira, E. Cruz Alaniz, A. Seryi, L. van Riesen-Haupt [JAI, Oxford, United Kingdom] J.L. Abelleira, E. Cruz Alaniz, L. van Riesen-Haupt [University of Oxford, Oxford, United Kingdom] ","Energy Deposition Studies and Luminosity Evolution for the Alternative FCC-hh Triplet",352 355,
mopmk005,"J.L. Abelleira, E. Cruz Alaniz, A. Seryi, L. van Riesen-Haupt [JAI, Oxford, United Kingdom] J.L. Abelleira, E. Cruz Alaniz, L. van Riesen-Haupt [University of Oxford, Oxford, United Kingdom] ","HE-LHC Final Focus: Flat Beam Parameters and Energy Deposition Studies",356 359,
mopmk006,"L. van Riesen-Haupt, J.L. Abelleira [University of Oxford, Oxford, United Kingdom] J.L. Abelleira, E. Cruz Alaniz, A. Seryi [JAI, Oxford, United Kingdom] M.P. Crouch, F. Zimmermann [CERN, Geneva, Switzerland] D. Zhou [KEK, Ibaraki, Japan] ","Experimental Interaction Region Optics for the High Energy LHC",360 363,
mopmk007,"L. van Riesen-Haupt, J.L. Abelleira [University of Oxford, Oxford, United Kingdom] J.L. Abelleira, E. Cruz Alaniz, A. Seryi [JAI, Oxford, United Kingdom] ","An Optimised Triplet for the Final Focus of the FCC-HH with a 40m Final Drift",364 367,
mopmk010,"Y. Hao [FRIB, East Lansing, USA] Y. Luo, V. Ptitsyn [BNL, Upton, Long Island, New York, USA] J. Qiang [LBNL, Berkeley, California, USA] ","Study Progress of the Coupling Resonance of the Crab Crossing Scheme in Electron-Ion Collider",368 370,
