thpal035,"M. Xu, C. Compton, C. Contreras-Martinez, W. Hartung, S.H. Kim, S.J. Miller, P.N. Ostroumov, A.S. Plastun, J.T. Popielarski, L. Popielarski, M.A. Reaume, K. Saito, A. Taylor, J. Wei, T. Xu, Q. Zhao [FRIB, East Lansing, USA] I.V. Gonin, T.N. Khabiboulline, V.P. Yakovlev [Fermilab, Batavia, Illinois, USA] ","Design of =0.65, 5 Cells, 644 MHz Elliptical Cavity for FRIB Upgrade",3712 3715,
thpal036,"S.A. Kahn, M.A. Cummings [Muons, Inc, Illinois, USA] E.Z. Barzi, D. Turrioni [Fermilab, Batavia, Illinois, USA] S. Falletta [Politecnico di Torino, Torino, Italy] A. Kikuchi [NIMS, Tsukuba, Ibaraki, Japan] ","Nb3Sn Thin Films for the Production of Higher Gradient SRF Cavities at Reduced Cost",3716 3719,
thpal037,"S.A. Kahn, M.A. Cummings [Muons, Inc, Illinois, USA] E.Z. Barzi [Fermilab, Batavia, Illinois, USA] ","Nano-engineering of Nb3Sn Thin Films to Improve Wire Performance and Reduce Cost",3720 3722,
thpal038,"G.M. Kazakevich, R.P. Johnson [Muons, Inc, Illinois, USA] V.A. Lebedev, V.P. Yakovlev [Fermilab, Batavia, Illinois, USA] ","Phase Grouping of Larmor Electrons by a Synchronous Wave in Controlled Magnetrons",3723 3725,
thpal039,"G.M. Kazakevich, R.P. Johnson [Muons, Inc, Illinois, USA] V.A. Lebedev, V.P. Yakovlev [Fermilab, Batavia, Illinois, USA] ","Improved Magnetron Stability and Reduced Noise in Efficient Transmitters for Superconducting Accelerators",3726 3728,
thpal040,"M.L. Neubauer, A. Dudas [Muons, Inc, Illinois, USA] F. Marhauser [JLab, Newport News, Virginia, USA] ","Lossy Beam Pipe HOM Load Ceramics with DC Conductivity",3729 3731,
thpal041,"H. Guler, D. Auguste, J. Bonis, O. Bouras, M. El Khaldi, W. Kaabi, P. Lepercq [LAL, Orsay, France] ","Power Coupler Design for the LUCRECE Project",3732 3735,
thpal042,"M.L. Neubauer, A. Dudas, S.A. Kahn [Muons, Inc, Illinois, USA] R.A. Rimmer, H. Wang [JLab, Newport News, Virginia, USA] ","Injection Locked 1497 MHz Magnetron",3736 3738,
thpal043,"I.S. Guk, O.M. Bovda, V.O. Bovda, A.N. Dovbnya, S.G. Kononenko, V.N. Ljashchenko, A. Mytsykov, L.V. Onishchenko, A.Y. Zelinsky [NSC/KIPT, Kharkov, Ukraine] ","Dipole Magnets for the Technological Electron Accelerators",3739 3741,
thpal044,"I.S. Guk, O.M. Bovda, V.O. Bovda, A.N. Dovbnya, A.I. Kalinichenko, S.S. Kandybey, V.N. Ljashchenko, A. Mytsykov, L.V. Onishchenko, O.A. Repikhov, A.Y. Zelinsky [NSC/KIPT, Kharkov, Ukraine] ","The Permanent Magnets Magnetic Characteristics Change Under Effect of 10 MeV Beam",3742 3744,
thpal045,"Z.K. Liu, F.Y. Chang, L.-H. Chang, M.H. Chang, S.W. Chang, L.J. Chen, F.-T. Chung, M.-C. Lin, C.H. Lo, Ch. Wang, M.-S. Yeh, T.-C. Yu [NSRRC, Hsinchu, Taiwan] ","Determination of the Electron Bunch Length With Third Harmonic Cavity for the Taiwan Photon Source",3745 3747,
thpal046,"F.-T. Chung, F.Y. Chang, L.-H. Chang, M.H. Chang, S.W. Chang, L.J. Chen, Y.T. Li, M.-C. Lin, Z.K. Liu, C.H. Lo, Ch. Wang, M.-S. Yeh, T.-C. Yu [NSRRC, Hsinchu, Taiwan] ","Energy-Savings for the TPS Booster RF System at the NSRRC in Taiwan",3748 3750,
thpal049,"Y.T. Li, F.Y. Chang [NSRRC, Hsinchu, Taiwan] ","Power Supply Decoupling Design",3751 3753,
thpal050,"C.S. Chen, W.S. Chan, Y.Y. Cheng, Y.-C. Chung, C.Y. Liu, Y.-H. Liu, Z.-D. Tsai [NSRRC, Hsinchu, Taiwan] ","Beam Dynamics of the First Beams for the IFMIF-EVEDA RFQ Commissioning",3754 3756,
thpal051,"Y.-H. Liu, C.-S. Chen, Y.-C. Chung, Z.-D. Tsai [NSRRC, Hsinchu, Taiwan] ","The Data Acquisition on Vibration Evaluation for Ice Water Pumps Systems in TPS",3757 3759,
thpal052,"J.-C. Chang, Y.-H. Liu [NSRRC, Hsinchu, Taiwan] ","Finite Element Analysis on Beam-Induced Heat Load in in-Vacuum Undulators with a Small Magnet Gap",3760 3762,
thpal053,"H.H. Chen, C.H. Kuo, K.-K. Lin, Y.-H. Liu [NSRRC, Hsinchu, Taiwan] ","Perveance Measurement of the TLS-Linac Klystron and the Evaluation of Its Operation Performance",3763 3765,
thpal054,"Y.S. Wong, Huang, J.C. Huang, C.Y. Liu, K.-B. Liu, B.S. Wang [NSRRC, Hsinchu, Taiwan] ","Modification of a Power Supply for Low-Alpha Operation in the Taiwan Photon Source",3766 3768,
thpal055,"Y.S. Wong, K.-B. Liu [NSRRC, Hsinchu, Taiwan] J.F. Chen [NCKU, Tainan city, Taiwan] ","A Novel High Step-down DC-DC Converter with Isolated Transformer and Switched Capacitor Techniques for Corrector Magnet Bulk Power in Taiwan Photon Source",3769 3771,
thpal056,"Y.C. Yang, C.K. Chan, C.-C. Chang, C.S. Chen, J. -Y. Chuang, Y.M. Hsiao, C.C. Liang, Y.Z. Lin [NSRRC, Hsinchu, Taiwan] ","Vibration Measurements in the TPS Vacuum System",3772 3774,
thpal057,"G.-Y. Hsiung, J.-R. Chen, C.M. Cheng, S-N. Hsu, H.P. Hsueh, Y.C. Yang [NSRRC, Hsinchu, Taiwan] J.-R. Chen [National Tsing Hua University, Hsinchu, Taiwan] ","Development of the Aluminum Beam Duct for the Ultra-Low Emittance Light Source",3775 3777,
thpal058,"C.M. Cheng, C.K. Chan, C.-C. Chang, Y.T. Cheng, J. -Y. Chuang, G.-Y. Hsiung, L.H. Wu, Y.C. Yang [NSRRC, Hsinchu, Taiwan] ","Effect of Ozonated Water Cleaning on Photon Stimulated Desorption in a Stainless Steel Chamber",3778 3780,
thpal059,"Y.T. Huang, C.-C. Chang, C.M. Cheng, P.J. Chou, Y.C. Yang [NSRRC, Hsinchu, Taiwan] ","TEMPERATURE ISSUES OF THE TPS BPMS",3781 3784,
thpal060,"I.A. Chernyavskiy, D.K. Abe, B. Levush, A.N. Vlasov [NRL, Washington, DC, USA] T.M. Antonsen [UMD, College Park, Maryland, USA] T.M. Antonsen [Leidos Corp, Billerica, MA, USA] J. Rodgers [Naval Research Laboratory (NRL), Washington, USA] ","Advanced Modeling of Klystrons by the Tesla-Family of Large-Signal Codes",3785 3787,
thpal061,"T. Tanaka","Simulation of Pulsed Temperature Rise in Cryogenic Copper RF Cavity Achieving a Very High Accelerating Field",3788 3791,
thpal062,"S. Carrozza, L. Bondesan, A. Morato, M.P. Pretelli, G.T. Taddia [OCEM, Valsamoggia, Italy] M.C. Bastos, J.-P. Burnet, G. Hudson, Q. King, G. Le Godec, O. Michels [CERN, Geneva, Switzerland] Y. Bylinskii, A.C.M. Leung, W. L. Louie, F. Mammarella, R.B. Nussbaumer, C. Valencia [TRIUMF, Canada's National Laboratory for Particle and Nuclear Physics, Vancouver, Canada] ","The New 20 kA 80 V Power Supply for the 520 MeV H- Cyclotron at TRIUMF",3792 3795,
thpal063,"S.W. Lee, Y.W. Kang [ORNL, Oak Ridge, Tennessee, USA] ","RF and Thermo-Mechanical Considerations in Designing the Waveguide Iris Coupler for the Drift Tube Linac in the ORNL Spallation Neutron Source",3796 3798,
thpal064,"A. Rakhman, Y. Liu [ORNL, Oak Ridge, Tennessee, USA] ","Burst-Mode UV Enhancement Cavity for Laser-Assisted Hydrogen Ion Beam Stripping at SNS",3799 3801,
thpal065,"K.E. Tippey, R. Afanador, M. Doleans, S.-H. Kim, J.D. Mammosser, C.J. McMahan [ORNL, Oak Ridge, Tennessee, USA] M. Martinello [Fermilab, Batavia, Illinois, USA] ","Improving the Work Function of Nitrogen-Doped Niobium Surfaces for SRF Cavities by Plasma Processing",3802 3804,
thpal067,"S.U. De Silva, J.R. Delayen, H. Park [ODU, Norfolk, Virginia, USA] P. Berrutti [Fermilab, Batavia, Illinois, USA] N.A. Huque, H. Park [JLab, Newport News, Virginia, USA] ","Room Temperature Measurements of Higher Order Modes for the SPS Prototype RF-Dipole Crabbing Cavity",3805 3807,
thpal068,"P. Craievich, M. Bopp, H.-H. Braun, R. Ganter, T. Kleeb, M. Pedrozzi, E. Prat, S. Reiche, R. Zennaro [PSI, Villigen PSI, Switzerland] R.W. Assmann (R.W. Aßmann), F. Christie, R.T.P. D'Arcy, U. Dorda, M. Foese, P. González Caminal, M. Hoffmann, M. Huening (M. Hüning), R. Jonas, O. Krebs, S. Lederer, V. Libov, B. Marchetti, D. Marx, J. Osterhoff, F. Poblotzki, M. Reukauff, H. Schlarb, S. Schreiber, G. Tews, M. Vogt, A. Wagner [DESY, Hamburg, Germany] N. Catalan-Lasheras (N. Catalán Lasheras), A. Grudiev, G. McMonagle, W. Wuensch [CERN, Geneva, Switzerland] ","Status of the Polarix-TDS Project",3808 3811,
thpal069,"P.P. Gan, S. Huang, Y.R. Lu, S.Z. Wang, K. Zhu [PKU, Beijing, People's Republic of China] ","Simulation of a 10 mm Diameter Cascaded Plasma Window",3812 3814,
thpal070,"Q.Y. Tan, M.J. Easton, Q. Fu, P.P. Gan, H.P. Li, Y.R. Lu, Z. Wang [PKU, Beijing, People's Republic of China] ","Multi-Physics Analysis of Two Bunchers for CIFNEF",3815 3817,
thpal071,"Wu,M.J. Wu, Y.X. Geng, Q. Liao, C. Lin, H.Y. Lu, Y.R. Lu, W.J. Ma, Y.R. Shou, X. Xu, X.Q. Yan, Y.Y. Zhao, J.G. Zhu, K. Zhu [PKU, Beijing, People's Republic of China] ","Preliminary Emittance Measurement of Laser Driven Proton Beam Employing a Quadruple Triplet Magnet",3818 3820,
thpal073,"A.V. Smirnov, R.B. Agustsson, S. Boucher, A.Y. Murokh, A.Yu. Smirnov [RadiaBeam Systems, Santa Monica, California, USA] M.A. Ahmadi, P. Blanchard, M.D. Mccann, C. Nguen, P.B. Peter, J. Zabek [Microsemi Corporation, Aliso Viejo, USA] G.R. Branner, K.S. Yuk [UC Davis, Davis, USA] J.J. Hartzell, K.J. Hoyt, T.J. Villabona [RadiaBeam, Santa Monica, California, USA] V. Khodos [Sierra Nevada Corporation, Irvine, USA] ","Progress on 1.5 GHz Multi-kW CW Amplifier",3821 3823,
thpal074,"T.G. Hallilingaiah, U. van Rienen [Rostock University, Faculty of Computer Science and Electrical Engineering, Rostock, Germany] A. Arnold, U. Lehnert, P. Michel [HZDR, Dresden, Germany] ","Numerical Studies of Normal Conducting Deflecting Cavity Designs for the ELBE Accelerator",3824 3827,
thpal076,"T. Porcelli, E. Maccallini, P. Manini, M. Mura, M.F. Urbano [SAES Getters S.p.A., Lainate, Italy] ","Experimental Methods for the Assessment of NEG Pumps Working in Dust-Sensitive Environments",3828 3830,
thpal078,"M.A.G. Johansson, J. Langton, J.A. Safranek [SLAC, Menlo Park, California, USA] S.C. Gottschalk [STI Magnetics LLC, Woodinville, USA] ","In-Vacuum Lambertson Septum for SPEAR3 Low Emittance Injection",3831 3834,
thpal080,"P.B. Welander, Z. Li, M.H. Nasr, S.G. Tantawi [SLAC, Menlo Park, California, USA] ","Parallel-Feed SRF Accelerator Structures",3835 3837,
thpal081,"D.B. Bazyl, H. De Gersem, W.F.O. Müller [TEMF, TU Darmstadt, Darmstadt, Germany] J. Enders, S. Weih [TU Darmstadt, Darmstadt, Germany] ","A 3 GHz SRF Reduced-beta Cavity for the S-DALINAC",3838 3840,
thpal082,"T. Takayanagi, K. Horino, T. Ueno [JAEA/J-PARC, Tokai-mura, Japan] ","Development of a New Modular Switch Using a Next-Generation Semiconductor",3841 3844,
thpal083,"R.E. Abel, D.C. Faircloth, S.R. Lawrie, J.H. Macgregor, M. Perkins [STFC/RAL/ISIS, Chilton, Didcot, Oxon, United Kingdom] ","A Test Facility for Developments in Ion Source Plasma Power Supplies",3845 3847,
thpal084,"L.S. Cowie, A.D. Brynes, J.K. Jones, A.E. Wheelhouse, P.H. Williams [STFC/DL/ASTeC, Daresbury, Warrington, Cheshire, United Kingdom] R. Apsimon, G. Burt, W.L. Millar [Cockcroft Institute, Lancaster University, Lancaster, United Kingdom] O. Mete (Ö. Mete) [UMAN, Manchester, United Kingdom] A.J. Moss [STFC/DL, Daresbury, Warrington, Cheshire, United Kingdom] ","An X-Band Lineariser for the CLARA FEL",3848 3851,
thpal085,"L.S. Cowie, D.J. Scott [STFC/DL/ASTeC, Daresbury, Warrington, Cheshire, United Kingdom] G. Burt, W.L. Millar [Cockcroft Institute, Lancaster University, Lancaster, United Kingdom] ","High Power RF Conditioning on CLARA",3852 3855,
thpal086,"P. Goudket, L. Bizel-Bizellot, L. Gurran, O.B. Malyshev, S.M. Pattalwar, R. Valizadeh [STFC/DL/ASTeC, Daresbury, Warrington, Cheshire, United Kingdom] G. Burt, L. Gurran [Cockcroft Institute, Lancaster University, Lancaster, United Kingdom] P. Goudket, T. Junginger, O.B. Malyshev, S.M. Pattalwar, R. Valizadeh [Cockcroft Institute, Warrington, Cheshire, United Kingdom] L. Gurran, T. Junginger [Lancaster University, Lancaster, United Kingdom] ","Superconducting Thin Film RF Measurements",3856 3858,
thpal089,"O.B. Malyshev, L. Bizel-Bizellot, K.D. Dumbell, P. Goudket, N. Pattalwar, S.M. Pattalwar, P. Pizzol, P.A. Smith, R. Valizadeh, S. Wilde [STFC/DL/ASTeC, Daresbury, Warrington, Cheshire, United Kingdom] P. Pizzol [The University of Liverpool, Liverpool, United Kingdom] ","Design, Assembly and Commissioning of a New Cryogenic Facility for Complex Superconducting Thin Film Testing",3859 3861,
thpal092,"O. Seify, A.N. Hannah, O.B. Malyshev, Sirvinskaite, R. Sirvinskaite, R. Valizadeh [STFC/DL/ASTeC, Daresbury, Warrington, Cheshire, United Kingdom] Sirvinskaite, R. Sirvinskaite [Loughborough University, Loughborough, Leicestershire, United Kingdom] ","Test Particle Monte Carlo Simulation of NEG Coated Narrow Tubular Samples",3862 3864,
thpal095,"A.N. Hannah, J.A. Conlon, L.B. Jones, B.L. Militsyn, T.C.Q. Noakes, R. Valizadeh [STFC/DL/ASTeC, Daresbury, Warrington, Cheshire, United Kingdom] V. R. Dhanak [The University of Liverpool, Liverpool, United Kingdom] L.B. Jones, B.L. Militsyn [Cockcroft Institute, Warrington, Cheshire, United Kingdom] S. Lederer [DESY Zeuthen, Zeuthen, Germany] S. Lederer [DESY, Hamburg, Germany] ","Metal Photocathodes Preparation for Compact Linear Accelerator at Daresbury Laboratory",3865 3868,
thpal098,"Sirvinskaite, R. Sirvinskaite, M.D. Cropper, M.D. Cropper [Loughborough University, Loughborough, Leicestershire, United Kingdom] A.N. Hannah, O.B. Malyshev, R. Valizadeh [STFC/DL/ASTeC, Daresbury, Warrington, Cheshire, United Kingdom] O.B. Malyshev, R. Valizadeh [Cockcroft Institute, Warrington, Cheshire, United Kingdom] ","Pumping Properties of Single Metal Zirconium Non-Evaporable Getter Coating",3869 3871,
thpal101,"J.J. Guo, Q. Gu, H.T. Hou, J.H. Tan, M. Zhang [SINAP, Shanghai, People's Republic of China] ","Longitudinal Effects of Trapped Homs in Shanghai Coherent Light Facility",3872 3874,
thpal102,"Y.F. Liu, Z.H. Chen, M. Gu, Y. Wu, Q. Yuan, X.X. Zhou [SINAP, Shanghai, People's Republic of China] ","Design a High Power Pulse Transformer for C-band Klystron Modulator",3875 3877,
thpal104,"H.F. Wang [SSRF, Shanghai, People's Republic of China] M.F. Qian, W. Zhang, Q.G. Zhou [SINAP, Shanghai, People's Republic of China] ","The Magnetic Field Measurement Systems for a Cryogenic Undulator and a Superconducting Undulator at SSRF",3878 3881,
thpal105,"H. Ito [Sokendai, Ibaraki, Japan] C.Z. Antoine [CEA/IRFU, Gif-sur-Yvette, France] A. Four [CEA/DRF/IRFU, Gif-sur-Yvette, France] H. Hayano, T. Kubo, T. Saeki [KEK, Ibaraki, Japan] R. Ito, T. Nagata [ULVAC, Inc, Chiba, Japan] Y. Iwashita, R. Katayama, H. Tongu [Kyoto ICR, Uji, Kyoto, Japan] H. Oikawa [Utsunomiya University, Utsunomiya, Japan] ","Lower Critical Field Measurement System of Thin Film Superconductor",3882 3884,
thpal106,"W.T. Kitka, P. Bulira, P. Czernecki, M.K. Fa¿owski, K. Kubal, P. Kurdziel, A.M. Marendziak, M.P. Nowak, M. Ostoja-Gajewski, M. Rozwadowski, K. Wawrzyniak, Z. Zbylut [Solaris National Synchrotron Radiation Centre, Jagiellonian University, Krakow, Poland] ","Heating Unit Controller at NSRC SOLARIS",3885 3887,
thpal107,"A.M. Marendziak, M. Rozwadowski, T. Sobol, M.J. Stankiewicz, A.I. Wawrzyniak [Solaris National Synchrotron Radiation Centre, Jagiellonian University, Krakow, Poland] ","Three Years of Operational Experience With the Solaris Vacuum System",3888 3890,
thpal108,"P.B. Borowiec, A.I. Wawrzyniak [Solaris National Synchrotron Radiation Centre, Jagiellonian University, Krakow, Poland] J. Björklund Svensson [Lund University, Division of Atomic Physics, Lund, Sweden] ","In-Situ Characterization of Normal Conducting RF Cavities in Solaris Light Source Storage Ring",3891 3894,
thpal109,"N. Juntong, K. Kittimanapun, P. Sunwong [SLRI, Nakhon Ratchasima, Thailand] A. Sutchada [Walailak University, Nakhon Si Thammarat, Thailand] ","The New 118 MHz Cavity for RF Development Activities of the RF for Accelerator Laboratory at SLRI",3895 3898,
thpal110,"Y. Lei, X. Guan, R. Tang, X.W. Wang, Q.Z. Xing, H.Y. Zhang, S.X. Zheng [TUB, Beijing, People's Republic of China] J. Jiang, H. Li, C. Yu [Beijing Aerospace Guagntong Technology Co., Beijing, People's Republic of China] ","High-Power RF Test of Coaxial Couplers for the Injection Linac of XiPAF",3899 3901,
thpal112,"T. Au, B. Barquest, J.J. Keir, V. Zvyagintsev [TRIUMF, Canada's National Laboratory for Particle and Nuclear Physics, Vancouver, Canada] ","RF Matching Circuit for CANREB RFQ",3902 3904,
thpal113,"N.V. Avreline [TRIUMF, Canada's National Laboratory for Particle and Nuclear Physics, Vancouver, Canada] ","The Design of 1 MeV Proton LINAC Operating in CW",3905 3907,
thpal114,"N.V. Avreline [TRIUMF, Canada's National Laboratory for Particle and Nuclear Physics, Vancouver, Canada] ","The Analytical Model of the Helical Accelerating Structure of Linac with Helix Outside of the Vacuum Chamber",3908 3910,
thpal115,"N.V. Avreline, Y. Bylinskii, B. Jakovljevic, Y. Ma, V. Zvyagintsev [TRIUMF, Canada's National Laboratory for Particle and Nuclear Physics, Vancouver, Canada] ","The Design of 1.1 MW RF Dummy Load for the RF System of 520 MeV Cyclotron",3911 3913,
thpal116,"B. Barquest, F. Ames, T. Au, L. Graham, M.R. Pearson, V. Zvyagintsev [TRIUMF, Canada's National Laboratory for Particle and Nuclear Physics, Vancouver, Canada] J. Bale, J. Dilling, R. Kruecken, Y. Lan [UBC  TRIUMF, Vancouver, British Columbia, Canada] G. Gwinner [University of Manitoba, Manitoba, Canada] N. Janzen, R.A. Simpson [UW/Physics, Waterloo, Ontario, Canada] R. Kanungo [Saint Mary's University, Halifax, Canada] ","Development and Installation of the CANREB RFQ Buncher at TRIUMF",3914 3916,
thpal117,"L. Egoriti, P.G. Bricault, T. Day Goodacre, A. Gottberg [TRIUMF, Canada's National Laboratory for Particle and Nuclear Physics, Vancouver, Canada] M. Delonca, R.M. Dos Santos Augusto, J.P. Ramos, S. Rothe, T. Stora [CERN, Geneva, Switzerland] M. Dierckx, D. Houngbo, L. Popescu [SCK-CEN, Mol, Belgium] R.M. Dos Santos Augusto [LMU, München, Germany] ","Development of a Proton-to-Neutron Converter for Radioisotope Production at ISAC-TRIUMF",3917 3920,
thpal118,"T. Junginger [TRIUMF, Canada's National Laboratory for Particle and Nuclear Physics, Vancouver, Canada] T. Prokscha, Z. Salman, A. Suter [PSI, Villigen PSI, Switzerland] A-M. Valente-Feliciano [JLab, Newport News, Virginia, USA] ","Critical Fields of SRF Materials",3921 3924,
thpal120,"A.N. Koveshnikov, Y. Bylinskii, G.W. Hodgson, D. Kishi, R.E. Laxdal, R.R. Nagimov, D. Yosifov [TRIUMF, Canada's National Laboratory for Particle and Nuclear Physics, Vancouver, Canada] ","Cryogenics Infrastructure at TRIUMF's Particle Accelerator Facilities",3925 3927,
thpal121,"R.R. Nagimov, Y. Bylinskii, D. Kishi, S.R. Koscielniak, A.N. Koveshnikov, R.E. Laxdal, D. Yosifov [TRIUMF, Canada's National Laboratory for Particle and Nuclear Physics, Vancouver, Canada] ","The Operational Experience of E-Linac Cryogenic System at TRIUMF",3928 3930,
thpal122,"S.D. Rädel, S. Kiy, R.E. Laxdal, O. Shelbaya [TRIUMF, Canada's National Laboratory for Particle and Nuclear Physics, Vancouver, Canada] ","Beam Performance Study of an RF Structure to Accelerate or Bunch Low Energy Ion Beams",3931 3933,
thpal123,"Z.Y. Yao, J.J. Keir, D. Kishi, D. Lang, R.E. Laxdal, H.L. Liu, Y. Ma, B. Matheson, B.S. Waraich, Q. Zheng, V. Zvyagintsev [TRIUMF, Canada's National Laboratory for Particle and Nuclear Physics, Vancouver, Canada] ","Fabrication and Test of =0.3 325MHz Balloon Single Spoke Resonator",3934 3936,
thpal126,"R. Grewe, L. Alff, M. Arnold, J. Conrad, S. Flege, M. Major, N. Pietralla [TU Darmstadt, Darmstadt, Germany] F. Hug [IKP, Mainz, Germany] ","Nitrogen Bake-out Procedures at the Vertical High-Temperature UHV-Furnace of the S-DALINAC",3937 3939,
thpal127,"M. Major, L. Alff, M. Arnold, J. Conrad, S. Flege, R. Grewe, M. Mahr, N. Pietralla [TU Darmstadt, Darmstadt, Germany] F. Hug [KPH, Mainz, Germany] ","Structural Investigations of Nitrogen-Doped Niobium for Superconducting RF Cavities",3940 3942,
thpal128,"N. Schweizer [Technische Universität Darmstadt (TU Darmstadt, RMR), Darmstadt, Germany] I. Pongrac [GSI, Darmstadt, Germany] ","Autonomous Topography Detection and Traversal for an Inspection Robot Within the Beamline of Particle Accelerators",3943 3945,
thpal129,"MNS. Sayeed, H. Elsayed-Ali [ODU, Norfolk, Virginia, USA] G.V. Eremeev, M.J. Kelley, C.E. Reece [JLab, Newport News, Virginia, USA] M.J. Kelley, U. Pudasaini [The College of William and Mary, Williamsburg, Virginia, USA] M.J. Kelley [Virginia Polytechnic Institute and State University, Blacksburg, USA] ","Magnetron Sputtering of Nb3Sn for SRF Cavities",3946 3949,
thpal130,"U. Pudasaini, M.J. Kelley [The College of William and Mary, Williamsburg, Virginia, USA] G.V. Eremeev, M.J. Kelley, C.E. Reece [JLab, Newport News, Virginia, USA] M.J. Kelley, J. Tuggle [Virginia Polytechnic Institute and State University, Blacksburg, USA] ","Effect of Deposition Temperature and Duration on Nb3Sn Diffusion Coating",3950 3953,
thpal131,"U. Pudasaini, M.J. Kelley [The College of William and Mary, Williamsburg, Virginia, USA] G.V. Eremeev, M.J. Kelley, C.E. Reece [JLab, Newport News, Virginia, USA] M.J. Kelley, J. Tuggle [Virginia Polytechnic Institute and State University, Blacksburg, USA] ","Studies of Electropolishing and Oxypolishing Treated Diffusion Coated Nb3Sn Surfaces",3954 3957,
thpal133,"B.S. Sian [UMAN, Manchester, United Kingdom] O.B. Malyshev, R. Valizadeh [STFC/DL/ASTeC, Daresbury, Warrington, Cheshire, United Kingdom] ","LASE Surfaces for Mitigation of Electron Cloud in Accelerators",3958 3960,
thpal134,"M.A. Drury, G. Cheng, G. Ciovati, E. Daly, G.K. Davis, J. Guo, R.A. Legg, F. Marhauser, T. Powers, A.V. Reilly, R.A. Rimmer [JLab, Newport News, Virginia, USA] ","Commissioning of the Prototype C75 Cavities in a CEBAF Cryomodule",3961 3964,
thpal137,"M.A. Drury, E. Daly, N.A. Huque, L.K. King, M.D. McCaughan, A.D. Solopova [JLab, Newport News, Virginia, USA] J. Nelson [SLAC, Menlo Park, California, USA] ","Acceptance Testing of the First Group of LCLS II Cryomodules at Jefferson Lab",3965 3967,
thpal140,"A.D. Palczewski, K. Macha, H. Park, C.E. Reece, K.M. Wilson [JLab, Newport News, Virginia, USA] A. Burrill, D. Gonnella [SLAC, Menlo Park, California, USA] ","Rework Recipe Development, Analysis and Results of Select 9-Cell Cavities for LCLS-II",3968 3971,
thpal141,"K.M. Wilson, G. Cheng, E. Daly, J.A. Fitzpatrick, N.A. Huque, M.L. Laney, F. Marhauser, A.D. Palczewski, H. Park, T. Peshehonoff, G. Tenbusch, M. Torres [JLab, Newport News, Virginia, USA] ","Optimizing Procurement Strategies for LCLS-II",3972 3974,
thpal142,"D.R. Beverstock, M.J. Kelley, C.E. Reece, J.K. Spradlin, A-M. Valente-Feliciano [JLab, Newport News, Virginia, USA] ","Surface Characterization of NbTiN Films for Accelerator Applications",3975 3977,
thpal143,"H. Tian, M. Lester, J. Musson, H.L. Phillips, C.E. Reece, C. Seaton [JLab, Newport News, Virginia, USA] ","Commissioning of JLab Vertical Cavity Processing System for SRF Nb Single Cell and Multicell Cavity With HF-Free Pulse-Reverse Electopolishing",3978 3981,
thpal144,"R.A. Rimmer, W.A. Clemens, F. Fors, J. Guo, F.E. Hannon, J. Henry, F. Marhauser, L. Turlington, H. Wang, S. Wang [JLab, Newport News, Virginia, USA] ","952.6 MHz SRF Cavity Development for JLEIC",3982 3985,
thpal145,"R.A. Rimmer, T. E. Plawski, H. Wang [JLab, Newport News, Virginia, USA] A. Dudas, S.A. Kahn, M.L. Neubauer [Muons, Inc, Illinois, USA] ","Magnetron R&D toward the Amplitude Modulation Control for SRF Accelerator",3986 3989,
thpal146,"F. Marhauser, S. Castagnola, W.A. Clemens, J.G. Dail, P. Dhakal, F. Fors, J. Henry, R.A. Rimmer, L. Turlington, R.S. Williams [JLab, Newport News, Virginia, USA] R. Calaga, K.M. Dr. Schirm, E. Jensen [CERN, Geneva, Switzerland] ","802 MHz ERL Cavity Design and Development",3990 3992,
thpal148,"Y. Okubo, S. Fujii, K. Suzuki, T.E. Tanaka [Toshiba Electron Tubes  Devices Co., Ltd (TETD), Tochigi, Japan] ","Status of High Efficiency Klystron Development in TETD",3993 3995,
thpal149,"P. Wang, D.Z. Cao, H.B. Chen, J. Shi, Z.H. Wang, H. Zha [TUB, Beijing, People's Republic of China] ","RF System Based on Two Klystrons and Phase Modulation for Photo-Cathode Injector",3996 3998,
thpal150,"M.M. Peng, D.Z. Cao, W. Gai, Y.L. Jiang, J. Liu, J. Shi, P. Wang [TUB, Beijing, People's Republic of China] ","Development of Tsinghua X-Band High Power Test Facility",3999 4001,
thpal151,"X.W. Wu, D.Z. Cao, H.B. Chen, J. Shi, H. Zha [TUB, Beijing, People's Republic of China] T. Abe, T. Higo, S. Matsumoto [KEK, Ibaraki, Japan] ","Progress in Understanding Breakdown Characteristics of X-Band Choke-Mode Structures",4002 4004,
thpal152,"Y.L. Jiang, D.Z. Cao, H.B. Chen, J. Shi, P. Wang, H. Zha [TUB, Beijing, People's Republic of China] ","Study of X-Band Phase Shifter Using Ferrite Material",4005 4007,
thpal153,"P. Wang, D.Z. Cao, H.B. Chen, C. Cheng, J. Shi, Z.H. Wang, H. Zha [TUB, Beijing, People's Republic of China] ","High Power Test of the S-Band Spherical Pulse Compressor at Tsinghua University",4008 4010,
thpal154,"X.W. Wu, D.Z. Cao, H.B. Chen, J. Shi, H. Zha [TUB, Beijing, People's Republic of China] T. Abe, T. Higo, S. Matsumoto [KEK, Ibaraki, Japan] ","High-Gradient Performance of X-Band Choke-Mode Structures",4011 4013,
thpal155,"P. Wang, D.Z. Cao, H.B. Chen, J. Shi, Z.H. Wang, H. Zha [TUB, Beijing, People's Republic of China] ","Fabrication and Cold Test of the Correction Cavity Chain for Klystron-Based CLIC",4014 4016,
thpal156,"J. Liu, H.B. Chen, J.Q. Qiu, J. Shi, Z.H. Wang, X.W. Wu, H. Zha [TUB, Beijing, People's Republic of China] ","High-Power Test of a Compact X-Band RF Rotary Joint",4017 4019,
thpal157,"X.C. Meng, H.B. Chen, J. Shi, Z.H. Wang, H. Zha, S.X. Zheng [TUB, Beijing, People's Republic of China] G.H. Li, J.S. Liu, Y.H. Liu [NUCTECH, Beijing, People's Republic of China] ","Investigation of Transverse Wakefield and Beam Break Up Effect in Irradiation Linacs",4020 4022,
thpal158,"M.M. Peng, W. Gai, J. Shi, Z.H. Wang, H. Zha [TUB, Beijing, People's Republic of China] ","Development of an Half-Cell Accelerating Structure in Tsinghua",4023 4025,
thpmf001,"S. Yamin, R.W. Assmann (R.W. Aßmann), B. Marchetti, J. Zhu [DESY, Hamburg, Germany] ","Beam Dynamics Studies for Beam Focusing and Solenoid Alignment at SINBAD",4026 4029,
