fr1a01,"F. Marti [FRIB, East Lansing, Michigan, USA] ","Heavy Ion Strippers",1050 1054,
fr1a02,"R. Gobin [CEA/IRFU, Gif-sur-Yvette, France] N. Chauvin, O. Delferriere (O. Delferrière), O. Tuske, D. Uriot [CEA/DSM/IRFU, France] ","Light Ion ECR Sources State of the Art for Linacs",1055 1058,
fr1a04,"M. Marchetto, F. Ames, B. Davids, R.E. Laxdal, A.C. Morton [TRIUMF, Vancouver, Canada] ","In Flight Ion Separation using a Linac Chain",1059 1063,
fr1a05,"P.N. Ostroumov, Z.A. Conway, M.P. Kelly, A. Kolomiets, S.V. Kutsaev, B. Mustapha [ANL, Argonne, USA] J. Rodnizki [Soreq NRC, Yavne, Israel] ","SARAF Phase II P/D 40 MeV Linac Design Studies",1064 1068,
fr2a01,"K. Hasegawa [J-PARC, KEK  JAEA, Ibaraki-ken, Japan] ","Recovery of the J-PARC Linac from the Earthquake",1069 1073,
mo1a01,"D. Berkovits, A. Arenshtam, Y. Ben Aliz, Y. Buzaglo, O. Dudovich, Y. Eisen, I. Eliyahu, G. Feinberg, I. Fishman, I. Gavish, I.G. Gertz, A. Grin, S. Halfon, D. Har-Even, Y.F. Haruvy, T. Hirsch, D. Hirschmann, Z. Horvitz, B. Kaizer, D. Kijel, A. Kreisel, G. Lempert, J. Luner, I. Mardor, A. Perry, E. Reinfeld, J. Rodnizki, G. Shimel, A. Shor, I. Silverman, L. Weissman, E. Zemach [Soreq NRC, Yavne, Israel] ","Operational Experience and Future Goals of the SARAF Linac at SOREQ",100 104,
mo1a02,"W. Decking [DESY, Hamburg, Germany] ","Status of the European XFEL – Constructing the 17.5 GeV Superconducting Linear Accelerator",105 109,
mo1a03,"V.P. Yakovlev, C.M. Ginsburg [Fermilab, Batavia, USA] ","SRF Linac Technology Development at Fermilab",110 114,
mo2a02,"J. Galambos, A.V. Aleksandrov, M.A. Plum, A.P. Shishlo [ORNL, Oak Ridge, Tennessee, USA] E. Laface [ESS, Lund, Sweden] V.A. Lebedev [Fermilab, Batavia, USA] ","Increased Understanding of Beam Losses from the SNS Linac Proton Experiment",115 119,
mo3a01,"G. Clemente, W.A. Barth, L. Groening, S. Mickat, B. Schlitt, W. Vinzenz [GSI, Darmstadt, Germany] R. M. Brodhage, M. Busch, F.D. Dziuba, H. Podlech, U. Ratzinger [IAP, Frankfurt am Main, Germany] ","Development of H-mode Linacs for the FAIR Project",120 124,
mo3a02,"N. Sakamoto, M. Fujimaki, H. Hasebe, Y. Higurashi, O. Kamigaito, H. Okuno, K. Suda, T. Watanabe, K. Yamada [RIKEN Nishina Center, Wako, Japan] R. Koyama [SHI Accelerator Service Ltd., Tokyo, Japan] ","Commissioning of a New Injector for the RIKEN RI-Beam Factory",125 129,
mo3a03,"O. Meusel, L.P. Chau, M. Heilmann, H. Podlech, U. Ratzinger, K. Volk, C. Wiesner [IAP, Frankfurt am Main, Germany] ","FRANZ – Accelerator Test Bench and Neutron Source",130 132,
mo3a04,"M. Kitaguchi [Kyoto University, Research Reactor Institute, Osaka, Japan] Y. Arimoto, H.M. Shimizu [KEK, Ibaraki, Japan] P.W. Geltenbort [ILL, Grenoble, France] S. Imajo [Kyoto University, Kyoto, Japan] Y. Iwashita [Kyoto ICR, Uji, Kyoto, Japan] Y. Seki [RIKEN Nishina Center, Wako, Japan] T. Yoshioka [Kyushu University, Fukuoka, Japan] ","Accelerator/Decelerator of Slow Neutrons",133 137,
mopb001,"F.-J. Decker, W.S. Colocho, N. Lipkowitz, Y. Nosochkov, J. Sheppard, H. Smith, Y. Sun, M.-H. Wang, G.R. White, U. Wienands, M. Woodley, G. Yocky [SLAC, Menlo Park, California, USA] ","Emittance Control for Different FACET Beam Setups in the SLAC Linac",174 176,
mopb002,"T. Kamitani, M. Akemoto, D.A. Arakawa, Y. Arakida, A. Enomoto, S. Fukuda, K. Furukawa, Y. Higashi, T. Higo, H. Honma, N. Iida, M. Ikeda, E. Kadokura, K. Kakihara, H. Katagiri, M. Kurashina, S. Matsumoto, T. Matsumoto, H. Matsushita, S. Michizono, K. Mikawa, T. Miura, F. Miyahara, T. Mori, K. Nakao, T. Natsui, Y. Ogawa, S. Ohsawa, T. Shidara, A. Shirakawa, H. Sugimoto, T. Suwada, T. Takatomi, T. Takenaka, Y. Yano, K. Yokoyama, M. Yoshida, L. Zang, X. Zhou [KEK, Ibaraki, Japan] D. Satoh [TIT, Tokyo, Japan] ","Positron Injector Linac Upgrade for SuperKEKB",177 179,
mopb003,"B. Constance, R. Corsini, D. Gamba, P.K. Skowronski (P. Skowroński) [CERN, Geneva, Switzerland] ","Recent Improvements to the Control of the CTF3 High-Current Drive Beam",180 182,
mopb004,"G. Burt, T.N. Abram, P.K. Ambattu, C. Lingwood [Cockcroft Institute, Lancaster University, Lancaster, United Kingdom] I. Burrows, T. Hartnett, J.P. Hindley, C.J. White [STFC/DL, Daresbury, Warrington, Cheshire, United Kingdom] P.A. Corlett, A.R. Goulden, P.A. McIntosh, K.J. Middleman, Y.M. Saveliev, R.J. Smith [STFC/DL/ASTeC, Daresbury, Warrington, Cheshire, United Kingdom] ","Design and Operation of a Compact 1 MeV X-band Linac",183 185,
mopb005,"T. Inagaki, C. Kondo, Y. Otake, T. Sakurai [RIKEN SPring-8 Center, Sayo-cho, Sayo-gun, Hyogo, Japan] ","High Gradient Operation of 8 GeV C-Band Accelerator in SACLA",186 188,
mopb007,"D. Huang, Q. Gu, M. Zhang [SINAP, Shanghai, People's Republic of China] ","Study of Microbunching Instabilitity in the Linac of the Shanghai Soft X-Ray Free Electron Laser Facility",189 191,
mopb011,"B.L. Militsyn, D. Angal-Kalinin, C. Hill, S.P. Jamison, J.K. Jones, J.W. McKenzie, K.J. Middleman, B.J.A. Shepherd, R.J. Smith, R. Valizadeh, A.E. Wheelhouse [STFC/DL/ASTeC, Daresbury, Warrington, Cheshire, United Kingdom] N. Bliss, M.D. Roper [STFC/DL, Daresbury, Warrington, Cheshire, United Kingdom] ","Photoinjector of the EBTF/CLARA Facility at Daresbury",192 194,
mopb012,"A.A. Sulimov, P.B. Borowiec, V. Gubarev, J. Iversen, D. Kostin, G. Kreps, K. Krzysik, A. Matheisen, W.-D. Moeller (W.-D. Möller), D. Reschke, W. Singer [DESY, Hamburg, Germany] ","First RF Measurement Results for the European XFEL SC Cavity Production",195 197,
mopb013,"R. Roux, F. Blot, J. Brossard, C. Bruni, S. Cavalier, J-N. Cayla, V. Chaumat, M. El Khaldi, A. Gonnin, P. Lepercq, E.N. Mandag, B. Mercier, H. Monard, C. Prevost, V. Soskov, A. Variola [LAL, Orsay, France] ","Experimental Results on the PHIL Photo-injector Test Stand at LAL",198 200,
mopb014,"S.A. Bogacz, G.A. Krafft, V.S. Morozov, Y. Roblin [JLAB, Newport News, Virginia, USA] K.B. Beard [Muons. Inc., USA] ","Electron Model of a Dogbone RLA with Multi-Pass Arcs",201 203,
mopb016,"C. Christou [Diamond, Oxfordshire, United Kingdom] ","In-situ Measurement of Beam-induced Fields in the S-band Accelerating Structures of the Diamond Light Source linac",204 206,
mopb017,"E. Vogel, S. Barbanotti, J. Branlard, H. Brueck, S. Choroba, L. Hagge, K. Jensch, V.V. Katalev, D. Kostin, D. Käfer, L. Lilje, A. Matheisen, W.-D. Moeller (W.-D. Möller), D. Noelle (D. Nölle), B. Petersen, J. Prenting, D. Reschke, H. Schlarb, M. Schmoekel (M. Schmökel), J.K. Sekutowicz, W. Singer, H. Weise [DESY, Hamburg, Germany] J. Swierblewski (J. Świerbleski), P.B. Borowiec [IFJ-PAN, Kraków, Poland] S. Berry, O. Napoly, B. Visentin [CEA/DSM/IRFU, France] A. Bosotti, P. Michelato [INFN/LASA, Segrate (MI), Italy] W. Kaabi [LAL, Orsay, France] C. Madec [CEA/IRFU, Gif-sur-Yvette, France] E.P. Plawski [NCBJ, Świerk/Otwock, Poland] F. Toral [CIEMAT, Madrid, Spain] ","Integration of the European XFEL Accelerating Modules",207 209,
mopb018,"C. Xu [The College of William and Mary, Williamsburg, USA] M.J. Kelley, C.E. Reece [JLAB, Newport News, Virginia, USA] ","Analyzing Surface Roughness Dependence of Linear RF Losses",210 212,
mopb020,"G. Huang, D. Jia, K. Jin, H. Lin, Weishi,Zhou. Zhou [USTC/NSRL, Hefei, Anhui, People's Republic of China] Y. Liu [USTC, Hefei, Anhui, People's Republic of China] ","LLRF System Improvement for HLS Linac Upgrade",213 215,
mopb021,"G. Huang, D. Jia, K. Jin, H. Lin, Weishi,Zhou. Zhou [USTC/NSRL, Hefei, Anhui, People's Republic of China] Y. Liu [USTC, Hefei, Anhui, People's Republic of China] ","Bunch-by-bunch Phase Modulation for Linac Beam-loading Compensation",216 218,
mopb022,"S. Pei, M. Hou, X. Li, J.R. Zhang [IHEP, Beijing, People's Republic of China] B.L. Wang [SINAP, Shanghai, People's Republic of China] ","RF Characteristic Studies on the Whole Accelerating Structure for the BEPCII Linear Accelerator",219 221,
mopb023,"S. Pei, J. Cao, Y.L. Chi, B. Deng, C.D. Deng, H.S. Guo, D.Y. He, X. He, M. Hou, X.C. Kong, Q. Le, X. Li, J. Liu, R.L. Liu, W.B. Liu, K. Lv, C. Ma, H.Z. Ma, G. Pei, H. Song, L. Wang, S.H. Wang, X. Wang, Q. Yang, J. Yue, J.R. Zhang, F. Zhao, J.B. Zhao, J.X. Zhao, Z.S. Zhou [IHEP, Beijing, People's Republic of China] M.I. Ayzatskiy, I.M. Karnaukhov, V.A. Kushnir, V.V. Mytrochenko, A.Y. Zelinsky [NSC/KIPT, Kharkov, Ukraine] Y. Gohar [ANL, Argonne, USA] ","Progress on the Design and Construction of the 100 MeV / 100 kW Electron Linac for the NSC KIPT Neutron Source",222 224,
mopb024,"A. Chakrabarti, S. Dechoudhury, V. Naik [VECC, Kolkata, India] F. Ames, R.A. Baartman, Y.-C. Chao, R.E. Laxdal, M. Marchetto, L. Merminga, F. Yan [TRIUMF, Vancouver, Canada] G. Goh [SFU, Burnaby, BC, Canada] ","Beam Dynamics Simulation and Optimization for 10 MeV Superconducting e-Linac Injector for VECC-RIB Facility",225 227,
mopb025,"M. Kuriki, S. Hosoda, H. Iijima [HU/AdSM, Higashi-Hiroshima, Japan] H. Hayano, J. Urakawa, K. Watanabe [KEK, Ibaraki, Japan] G. Isoyama, R. Kato, K. Kawase [ISIR, Osaka, Japan] S. Kashiwagi [Tohoku University, Research Center for Electron Photon Science, Sendai, Japan] A. Kuramoto [Sokendai, Ibaraki, Japan] K. Sakaue [RISE, Tokyo, Japan] ","1ms Multi-bunch Electron Beam Acceleration by a Normal Conducting RF Gun and Superconducting Accelerator",228 230,
mopb026,"R.E. Laxdal, F. Ames, Y.-C. Chao, K. Fong, C. Gong, A. Laxdal, M. Marchetto, W.R. Rawnsley, S. Saminathan, V.A. Verzilov, Q. Zheng, V. Zvyagintsev [TRIUMF, Vancouver, Canada] J.M. Abernathy, D. Karlen, D.W. Storey [Victoria University, Victoria, B.C., Canada] A. Chakrabarti, V. Naik [VECC, Kolkata, India] ","TRIUMF/VECC e-Linac Injector Beam Test",231 233,
mopb029,"C. Limborg-Deprey, C. Adolphsen, M.P. Dunning, S. Gilevich, C. Hast, R.K. Jobe, D.J. McCormick, A. Miahnahri, T.O. Raubenheimer, A.E. Vlieks, D.R. Walz, S.P. Weathersby [SLAC, Menlo Park, California, USA] ","Commissioning of the X-Band Test Area at SLAC",234 236,
mopb030,"M.A. Drury, A. Burrill, G.K. Davis, J. Hogan, L.K. King, F. Marhauser, H. Park, J.P. Preble, C.E. Reece, A.V. Reilly, R.A. Rimmer, H. Wang, M. Wiseman [JLAB, Newport News, Virginia, USA] ","Performance of First C100 Cryomodules for the CEBAF 12 GeV Upgrade Project",237 239,
mopb031,"G.K. Davis, J. Matalevich, T. Powers, M. Wiseman [JLAB, Newport News, Virginia, USA] ","Vibration Response Testing of the CEBAF 12 GeV Upgrade Cryomodules",240 242,
mopb032,"A. Dubrovskiy [JINR, Dubna, Moscow Region, Russia] B.N. Bathe, S. Srivastava [BARC, Mumbai, India] F. Tecker [CERN, Geneva, Switzerland] ","Stabilization of the Beam Intensity in the Linac at the CTF3 CLIC Test Facility",243 245,
mopb033,"A.K. Mitra, Z.T. Ang, S. Calic, P.R. Harmer, S.R. Koscielniak, R.E. Laxdal, W.R. Rawnsley, R.W. Shanks [TRIUMF, Vancouver, Canada] ","High Power Coupler Test for TRIUMF E-linac SC Cavities",246 248,
mopb034,"V. Litvinenko [BNL, Upton, Long Island, New York, USA] ","Novel Technique of Suppressing TBBU in High-energy ERLs",249 251,
mopb035,"K. Jin, Y. Hong, G. Huang, D. Jia, S.C. Zhang [USTC/NSRL, Hefei, Anhui, People's Republic of China] ","The Linear Accelerating Structure Development for HLS Upgrade",252 254,
mopb036,"T. Atkinson, A.V. Bondarenko, A.N. Matveenko, Y. Petenev [HZB, Berlin, Germany] ","Feasibility Study of Short Pulse Mode Operation for Multi-turn ERL Light Source",255 257,
mopb037,"Y. Petenev, T. Atkinson, A.V. Bondarenko, A.N. Matveenko [HZB, Berlin, Germany] ","Linac Optics Design for Multi-turn ERL Light Source",258 260,
mopb038,"Y. Shoji, K. Takeda [LASTI, Hyogo, Japan] ","Single Shot Bunch-by-Bunch Beam Emittance Measurement of the SPring-8 Linac",261 263,
mopb041,"A. Kanareykin, S.P. Antipov, J.E. Butler, C.-J. Jing [Euclid TechLabs, LLC, Solon, Ohio, USA] W. Gai [ANL, Argonne, USA] V. Yakimenko [BNL, Upton, Long Island, New York, USA] ","Advances in Beam Tests of Dielectric Based Accelerating Structures",264 266,
mopb042,"J. Pfingstner, D. Schulte [CERN, Geneva, Switzerland] ","On-line Dispersion Free Steering for the Main Linac of CLIC",267 269,
mopb043,"V.F. Khan, A. Grudiev [CERN, Geneva, Switzerland] ","Detailed Analysis of the Long-Range Wakefield in the Baseline Design of the CLIC Main Linac",270 272,
mopb045,"A. Gerbershagen, A. Andersson, D. Schulte [CERN, Geneva, Switzerland] P. Burrows [JAI, Oxford, United Kingdom] F.O. Ilday (F.Ö. Ilday) [Bilkent University, Bilkent, Ankara, Turkey] ","Specifications of the Distributed Timing System for the CLIC Main Linac",273 275,
mopb046,"G. Pei, Y.L. Chi, M.H. Dai, D.Y. He, X. He, X. Li, J. Liu, C. Ma, X. Wang, X.W. Yang, C.H. Yu, F. Zhao, J. Zhao, Z.S. Zhou [IHEP, Beijing, People's Republic of China] Y. Feng, H. Huang, S. Shi, E. Tang, X. Yang, Q. Yuan, Z. Zhu [Institute of High Energy Physics (IHEP), People's Republic of China] Z. Li, X. Zhang [Wuxi EL PONT Radiation Technology Ltd, Wuxi, People's Republic of China] ","A 10 MeV L-band Linac for Irradiation Applications in China",276 278,
mopb047,"C.-J. Jing, S.P. Antipov, A. Kanareykin, P. Schoessow [Euclid TechLabs, LLC, Solon, Ohio, USA] M.E. Conde, W. Gai, J.G. Power [ANL, Argonne, USA] ","Applications of Compact Dielectric Based Accelerators",279 281,
mopb048,"A.E. Levichev, A.M. Barnyakov, V.M. Pavlov [BINP SB RAS, Novosibirsk, Russia] Y.D. Chernousov [ICKC, Novosibirsk, Russia] V. Ivannikov, I.V. Shebolaev [ICKC SB RAS, Novosibirsk, Russia] ","Linear Accelerator Based on Parallel Coupled Accelerating Structure",282 284,
mopb049,"H. Yang, M.-H. Cho, W. Namkung [POSTECH, Pohang, Kyungbuk, Republic of Korea] S.H. Kim [ANL, Argonne, USA] J.-S. Oh [NFRI, Daejon, Republic of Korea] ","Design of Compact C-Band Standing-Wave Accelerator for Medical Radiotherapy",285 287,
mopb051,"Y. Socol [Falcon Analytics, Netanya, Israel] ","Changing Attitude to Radiation Hazards and Consequent Opportunities for LINAC Applications",288 290,
mopb052,"C.M. Ginsburg [Fermilab, Batavia, USA] ","Fermilab 1.3 GHz Superconducting RF Cavity and Cryomodule Program for Future Linacs",291 293,
mopb053,"Y. Iwashita, Y. Fuwa, M. Hashida, K. Otani, S. Sakabe, S. Tokita, H. Tongu [Kyoto ICR, Uji, Kyoto, Japan] H. Hayano, K. Watanabe, Y. Yamamoto [KEK, Ibaraki, Japan] ","Non-destructive Inspections for SC Cavities",294 296,
mopb054,"E.R. Harms, K. Carlson, B. Chase, D.J. Crawford, E. Cullerton, D.R. Edstrom, Jr, A. Hocker, M.J. Kucera, J.R. Leibfritz, O.A. Nezhevenko, D.J. Nicklaus, Y.M. Pischalnikov, P.S. Prieto, J. Reid, W. Schappert, P. Varghese [Fermilab, Batavia, USA] ","Test Results of Tesla-style Cryomodules at Fermilab",297 299,
mopb055,"J.P. Holzbauer, A. Nassiri, G.J. Waldschmidt, G. Wu [ANL, Argonne, USA] ","Development of Superconducting Radio-Frequency (SRF) Deflecting Mode Cavities and Associated Waveguide Dampers for the APS Upgrade Short Pulse X-Ray Project",300 302,
mopb056,"C.S. Hopper, J.R. Delayen [ODU, Norfolk, Virginia, USA] ","Multipacting Analysis of High-Velocity Superconducting Spoke Resonators",303 305,
mopb057,"S. He, Y. He, S.C. Huang, F.F. Wang, R.X. Wang, M.X. Xu, Y.Z. Yang, W.M. Yue, C. Zhang, S.H. Zhang, S.X. Zhang, H.W. Zhao [IMP, Lanzhou, People's Republic of China] ","Mechanical Study of the First Superconducting Half-wave Resonator for Injector II of CADS Project",306 308,
mopb059,"M.X. Xu, S. He, Y. He, S.C. Huang, Y.L. Huang, T.C. Jiang, R.X. Wang, Z.J. Wang, J.W. Xia, Y.Z. Yang, W.M. Yue, C. Zhang, S.H. Zhang, S.X. Zhang, H.W. Zhao [IMP, Lanzhou, People's Republic of China] ","The Superconducting CH Cavity Development in IMP*",309 311,
mopb060,"B. P. Xiao, G.V. Eremeev, H.L. Phillips, C.E. Reece [JLAB, Newport News, Virginia, USA] M.J. Kelley, B. P. Xiao [The College of William and Mary, Williamsburg, USA] ","RF Surface Impedance Characterization of Potential New Materials for SRF-based Accelerators",312 314,
mopb061,"C.E. Reece, A.V. Reilly [JLAB, Newport News, Virginia, USA] ","The New 2nd Generation SRF R&D Facility at Jefferson Lab: TEDF",315 317,
mopb062,"C.E. Reece, A.D. Palczewski, H. Tian [JLAB, Newport News, Virginia, USA] ","A New Internal Optical Profilometry System for Characterization of RF Cavity Surfaces – CYCLOPS",318 320,
mopb063,"S.A. Belomestnykh, I. Ben-Zvi, J.C. Brutus, H. Hahn, D. Kayran, V. Litvinenko, G.J. Mahler, G.T. McIntyre, V. Ptitsyn, R. Than, J.E. Tuozzolo, W. Xu, A. Zaltsman [BNL, Upton, Long Island, New York, USA] S.A. Belomestnykh [Stony Brook University, Stony Brook, USA] ","Superconducting RF Linac for eRHIC",321 323,
mopb064,"S.A. Belomestnykh, Z. Altinbas, I. Ben-Zvi, J.C. Brutus, D.M. Gassner, H. Hahn, L.R. Hammons, J.P. Jamilkowski, D. Kayran, J. Kewisch, V. Litvinenko, G.J. Mahler, G.T. McIntyre, D. Pate, D. Phillips, T. Rao, S.K. Seberg, T. Seda, B. Sheehy, J. Skaritka, K.S. Smith, R. Than, J.E. Tuozzolo, E. Wang, Q. Wu, W. Xu, A. Zaltsman [BNL, Upton, Long Island, New York, USA] S.A. Belomestnykh, J. Dai, M. Ruiz-Oses (M. Ruiz-Osés), T. Xin [Stony Brook University, Stony Brook, USA] C.H. Boulware, T.L. Grimm [Niowave, Inc., Lansing, Michigan, USA] A. Burrill [JLAB, Newport News, Virginia, USA] R. Calaga [CERN, Geneva, Switzerland] M.D. Cole, A.J. Favale, D. Holmes, J. Rathke, T. Schultheiss, A.M.M. Todd [AES, Medford, NY, USA] X. Liang [SBU, Stony Brook, New York, USA] ","Developing of Superconducting RF Guns at BNL",324 326,
mopb065,"J.M. Vogt, J. Knobloch, O. Kugeler [HZB, Berlin, Germany] ","Impact of Trapped Magnetic Flux and Systematic Flux Expulsion in Superconducting Niobium",327 329,
mopb066,"B. Riemann, T. Weis [DELTA, Dortmund, Germany] A. Neumann [HZB, Berlin, Germany] ","Alternative Approaches for HOM-Damped Cavities",330 332,
mopb067,"A. Neumann, W. Anders, J. Knobloch [HZB, Berlin, Germany] K. Brackebusch, T. Flisgen, T. Galek, K. Papke, U. van Rienen [Rostock University, Faculty of Computer Science and Electrical Engineering, Rostock, Germany] B. Riemann, T. Weis [DELTA, Dortmund, Germany] ","Results and Performance Simulations of the Main Linac Design for BERLinPro",333 335,
mopb069,"P.V. Tyagi [Sokendai, Ibaraki, Japan] H. Hayano, S. Kato, T. Saeki, M. Sawabe [KEK, Ibaraki, Japan] ","Study of HPR Created Oxide Layer at Nb Surfaces",336 338,
mopb070,"R. Oweiss, K. Elliott, A. Facco, M. Hodek, I.M. Malloch, J. Popielarski, L. Popielarski, K. Saito [FRIB, East Lansing, Michigan, USA] ","Quality Control of Cleanroom Processing Procedures of SRF Cavities for Mass Production",339 341,
mopb071,"L. Popielarski, C. Compton, L.J. Dubbs, K. Elliott, A. Facco, L.L. Harle, I.M. Malloch, R. Oweiss, J.P. Ozelis, J. Popielarski, K. Saito [FRIB, East Lansing, USA] ","Process Developments for Superconducting RF Low Beta Resonators for the ReA3 LINAC and Facility for Rare Isotope Beams",342 344,
mopb072,"R.G. Olave, J.R. Delayen, C.S. Hopper [ODU, Norfolk, Virginia, USA] ","Multipole Expansion of the Fields in Superconducting High-Velocity Spoke Cavities",345 347,
mopb073,"M.P. Kelly, Z.A. Conway, S.M. Gerbick, M. Kedzie, R.C. Murphy, P.N. Ostroumov, T. Reid [ANL, Argonne, USA] ","Cold Testing of Superconducting 72 MHz Quarter-wave Cavities for ATLAS",348 350,
mopb074,"N. Bazin, P. Bosland, S. Chel, G. Devanz, N. Grouas, P. Hardy, J. Migne, F. Orsini, F. Peauger [CEA/DSM/IRFU, France] ","Thermo-Mechanical Simulations of the Frequency Tuning Plunger for the IFMIF Half-Wave Resonator",351 353,
mopb077,"N. Solyak, G.I. Cancelo, B. Chase, D.J. Crawford, D.R. Edstrom, Jr, E.R. Harms, Y.M. Pischalnikov, W. Schappert [Fermilab, Batavia, USA] ","Lorentz Force Detuning Compensation Studies for Long Pulses in ILC type SRF Cavities",354 356,
mopb079,"G. Burt, P.K. Ambattu, A.C. Dexter, C. Lingwood, B.J. Woolley [Cockcroft Institute, Lancaster University, Lancaster, United Kingdom] S.R. Buckley, P. Goudket, C. Hill, P.A. McIntosh, J.W. McKenzie, A.E. Wheelhouse [STFC/DL/ASTeC, Daresbury, Warrington, Cheshire, United Kingdom] V.A. Dolgashev [SLAC, Menlo Park, California, USA] A. Grudiev [CERN, Geneva, Switzerland] R.M. Jones [UMAN, Manchester, United Kingdom] ","Normal Conducting Deflecting Cavity Development at the Cockcroft Institute",357 359,
mopb080,"R. Boni, D. Alesini, M. Bellaveglia, G. Di Pirro, M. Ferrario, A. Gallo, B. Spataro [INFN/LNF, Frascati (Roma), Italy] A. Mostacci, L. Palumbo [URLS, Rome, Italy] ","Status of the C-Band RF System for the SPARC-LAB High Brightness Photoinjector",360 362,
mopb081,"V.V. Paramonov [RAS/INR, Moscow, Russia] ","Travelling Wave Accelerating Structures with a Large Phase Advance",363 365,
mopb082,"V.V. Paramonov, L.V. Kravchuk [RAS/INR, Moscow, Russia] K. Floettmann (K. Flöttmann) [DESY, Hamburg, Germany] ","RF Parameters of the TE - Type Deflecting Structure for S-Band Frequency Range",366 368,
mopb083,"A. Fabris, P. Delgiusto, F. Gelmetti, M.M. Milloch, A. Milocco, F. Pribaz, C. Serpico, N. Sodomaco, R. Umer, L. Veljak [ELETTRA, Basovizza, Italy] ","Operational experience with the FERMI@Elettra S-band RF System",369 371,
mopb084,"T. Sakurai, T. Inagaki, Y. Otake [RIKEN SPring-8 Center, Sayo-cho, Sayo-gun, Hyogo, Japan] H. Ego [JASRI/SPring-8, Hyogo-ken, Japan] ","Design of a C-band Disk-loaded Type Accelerating Structure for a Higher Pulse Repetition Rate in the SACLA Accelerator.",372 374,
mopb086,"W. Fang, Q. Gu, Z.T. Zhao [SINAP, Shanghai, People's Republic of China] D.C. Tong [TUB, Beijing, People's Republic of China] ","The Nonresonant Perturbation Theory Based Field Measurement and Tuning of a Linac Accelerating Structure",375 377,
mopb087,"A. Krasnykh, F.-J. Decker [SLAC, Menlo Park, California, USA] R.W. LeClair [INTA, Santa Clara, USA] ","S-Band Loads for SLAC Linac",378 380,
mopb088,"B. Zhang [IMP, Lanzhou, People's Republic of China] ","Fabrication Tests for IMP 162.5 MHz RFQ",381 382,
mopb089,"Y.-C. Du, J.F. Hua, W.-H. Huang, C.-X. Tang, L.X. Yan, H. Zha, Z. Zhang [TUB, Beijing, People's Republic of China] ","X-Ray Local Energy Spectrum Measurement at Tsinghua Thomson Scattering X-Ray Source (TTX)",383 385,
mopb090,"J. Popielarski, E.C. Bernard, S. Bricker, S. Chouhan, C. Compton, A. Facco, A. Fila, L.L. Harle, M. Hodek, L. Hodges, S. Jones, M. Leitner, D. R. Miller, S.J. Miller, D. Morris, R. Oweiss, J.P. Ozelis, L. Popielarski, K. Saito, N.R. Usher, J. Weisend, Y. Zhang, S. Zhao, Z. Zheng [FRIB, East Lansing, USA] M. Klaus [Technische Universität Dresden, Dresden, Germany] ","FRIB Technology Demonstration Cryomodule Test",386 388,
mopb091,"R.E. Laxdal, A. Koveshnikov, N. Muller, W.R. Rawnsley, G. Stanford, V. Zvyagintsev [TRIUMF, Vancouver, Canada] M. Ahammed, M. Mondrel [VECC, Kolkata, India] ","The Injector Cryomodule for the ARIEL e-Linac at TRIUMF",389 391,
mopb093,"M.E. Conde, D.S. Doran, W. Gai, R. Konecny, W. Liu, J.G. Power, Z.M. Yusof [ANL, Argonne, USA] S.P. Antipov, C.-J. Jing [Euclid TechLabs, LLC, Solon, Ohio, USA] E.E. Wisniewski [Illinois Institute of Technology, Chicago, Illinois, USA] ","The Upgraded Argonne Wakefield Accelerator Facility (AWA): a Test-Bed for the Development of High Gradient Accelerating Structures and Wakefield Measurements",392 394,
mopb094,"T. Maruta [JAEA/J-PARC, Tokai-mura, Japan] M. Ikegami [J-PARC, KEK  JAEA, Ibaraki-ken, Japan] ","Simulation Study on the Longitudinal Bunch Shape Measurement by RF Chopper at J-PARC Linac",395 397,
mopb095,"A.V. Shemyakin, C.M. Baffes, A.Z. Chen, Y.I. Eidelman, B.M. Hanna, V.A. Lebedev, S. Nagaitsev, J.-F. Ostiguy, R.J. Pasquinelli, D.W. Peterson, L.R. Prost, G.W. Saewert, V.E. Scarpine, B.G. Shteynas, N. Solyak, D. Sun, M. Wendt, V.P. Yakovlev [Fermilab, Batavia, USA] T. Tang [SLAC, Menlo Park, California, USA] ","Design of MEBT for the Project X Injector Experiment at Fermilab",398 400,
mopb096,"M. Ikegami, Z. Fang, K. Futatsukawa, T. Miyao [KEK, Ibaraki, Japan] Y. Liu [KEK/JAEA, Ibaraki-Ken, Japan] T. Maruta, A. Miura, J. Tamura, G.H. Wei [JAEA/J-PARC, Tokai-mura, Japan] H. Sako [JAEA, Ibaraki-ken, Japan] ","Beam Loss Mitigation in J-PARC Linac after the Tohoku Earthquake",401 403,
mopb098,"C. Xiao, O.K. Kester [IAP, Frankfurt am Main, Germany] L. Groening [GSI, Darmstadt, Germany] ","Planning for Experimental Demonstration of Transverse Emittance Transfer at the GSI UNILAC through Eigen-Emittance Shaping",404 406,
moplb01,"F.-J. Decker, W.S. Colocho, N. Lipkowitz, Y. Nosochkov, J. Sheppard, H. Smith, Y. Sun, M.-H. Wang, G.R. White, U. Wienands, M. Woodley, G. Yocky [SLAC, Menlo Park, California, USA] ","Emittance Control for Different FACET Beam Setups in the SLAC Linac",138 140,
moplb02,"T. Kamitani, M. Akemoto, D.A. Arakawa, Y. Arakida, A. Enomoto, S. Fukuda, K. Furukawa, Y. Higashi, T. Higo, H. Honma, N. Iida, M. Ikeda, E. Kadokura, K. Kakihara, H. Katagiri, M. Kurashina, S. Matsumoto, T. Matsumoto, H. Matsushita, S. Michizono, K. Mikawa, T. Miura, F. Miyahara, T. Mori, H. Nakajima, K. Nakao, T. Natsui, Y. Ogawa, S. Ohsawa, M. Satoh, T. Shidara, A. Shirakawa, H. Sugimoto, T. Suwada, T. Takatomi, T. Takenaka, Y. Yano, K. Yokoyama, M. Yoshida, L. Zang, X. Zhou [KEK, Ibaraki, Japan] D. Satoh [TIT, Tokyo, Japan] ","Positron Injector Linac Upgrade for SuperKEKB",141 143,
moplb03,"A. Kanareykin, S.P. Antipov, J.E. Butler, C.-J. Jing [Euclid TechLabs, LLC, Solon, Ohio, USA] W. Gai [ANL, Argonne, USA] V. Yakimenko [BNL, Upton, Long Island, New York, USA] ","Advances in Beam Tests of Dielectric Based Accelerating Structures",144 146,
moplb04,"G. Pei, Y.L. Chi, M.H. Dai, D.Y. He, X. He, X. Li, J. Liu, C. Ma, X. Wang, C.H. Yu, F. Zhao, J. Zhao, Z.S. Zhou [IHEP, Beijing, People's Republic of China] Y. Feng, H. Huang, S. Shi, E. Tang, X. Yang, Q. Yuan, Z. Zhu [Institute of High Energy Physics (IHEP), People's Republic of China] Z. Li, X. Zhang [Wuxi EL PONT Radiation Technology Ltd, Wuxi, People's Republic of China] ","A 10 MeV L-band Linac for Irradiation Applications in China",147 149,
moplb05,"C.-J. Jing, S.P. Antipov, A. Kanareykin, P. Schoessow [Euclid TechLabs, LLC, Solon, Ohio, USA] M.E. Conde, W. Gai, J.G. Power [ANL, Argonne, USA] ","Applications of Compact Dielectric-Based Accelerators",150 152,
moplb06,"C.M. Ginsburg [Fermilab, Batavia, USA] ","Fermilab 1.3 GHz Superconducting RF Cavity and Cryomodule Program for Future Linacs",153 155,
