we1a01,"Y. Kobayashi [KEK, Ibaraki, Japan] ","ERL-Based Light Source Challenges",714 718,
we1a02,"R. Corsini [CERN, Geneva, Switzerland] ","Status and Future of the CLIC Study",719 723,
we1a03,"G. D'Auria [ELETTRA, Basovizza, Italy] ","Application of X-band Linacs",724 728,
we1a04,"S.R. Koscielniak, F. Ames, R.A. Baartman, I.V. Bylinskii, Y.-C. Chao, D. Dale, R.J. Dawson, E.R. Guetre, N. Khan, A. Koveshnikov, A. Laxdal, R.E. Laxdal, F. Mammarella, M. Marchetto, L. Merminga, A.K. Mitra, T. Planche, Y.-N. Rao, A. Sitnikov, V.A. Verzilov, D. Yosifov, V. Zvyagintsev [TRIUMF, Vancouver, Canada] D. Karlen, R.R. Langstaff [Victoria University, Victoria, B.C., Canada] ","The ARIEL Superconducting Electron Linac",729 733,
we1a05,"R. Hajima [JAEA, Ibaraki-ken, Japan] ","Linac-Based Laser Compton Scattering X-Ray and Gamma-Ray Sources",734 737,
we2a01,"I. Syratchev [CERN, Geneva, Switzerland] ","RF Power Production at the Two Beam Test Stand at CERN",738 742,
we2a02,"M.A. Kemp [SLAC, Menlo Park, California, USA] ","Solid State Marx Modulators for Emerging Applications",743 747,
