thpb086,"Ch. Schmidt, J. Branlard, S. Pfeiffer, H. Schlarb [DESY, Hamburg, Germany] W. Jalmuzna (W. Jałmużna) [TUL-DMCS, Lodz, Poland] ","Precision Regulation of RF Fields with MIMO Controllers and Cavity-based Notch Filters",1026 1028,
thpb089,"I. Moya, J. Calero, J.M. Cela-Ruiz, L. García-Tabarés, A. Guirao, J.L. Gutierrez (J.L. Gutiérrez), L.M. Martinez, T. Martínez de Alvaro, E. Molina Marinas, L. Sanchez, S. Sanz, F. Toral, C. Vazquez (C. Vázquez), J.G.S. de la Gama [CIEMAT, Madrid, Spain] J. Campmany, J. Marcos, V. Massana [CELLS-ALBA Synchrotron, Cerdanyola del Vallès, Spain] ","Magnetic Characterization of the Phase Shifter Prototypes Built by CIEMAT for E-XFEL",1029 1031,
thpb091,"M. Jonker, H. Schmickler, R. Schmidt, D. Schulte [CERN, Geneva, Switzerland] M.C. Ross [SLAC, Menlo Park, California, USA] ","Machine Protection Issues and Solutions for Linear Accelerator Complexes",1032 1034,
thpb092,"S. Suzuki, T. Asaka, H. Dewa, H. Hanaki, T. Kobayashi, T. Magome, A. Mizuno, T. Taniuchi, H. Tomizawa, K. Yanagida [JASRI/SPring-8, Hyogo-ken, Japan] ","Recent Improvements in SPring-8 Linac for Early Recovery from Beam Interruption",1035 1037,
thpb094,"A. Shor, D. Berkovits, I. Fishman, A. Grin, B. Kaizer, L. Weissman [Soreq NRC, Yavne, Israel] ","Performance of Beam Chopper at SARAF via RF Deflector Before the RFQ",1038 1040,
thpb095,"K. Koyama [UTNL, Ibaraki, Japan] A. Aimidura, M. Uesaka [The University of Tokyo, Nuclear Professional School, Ibaraki-ken, Japan] Y. Matsumura [University of Tokyo, Tokyo, Japan] T. Natsui, M. Yoshida [KEK, Ibaraki, Japan] ","Designing of a Phase-mask-type Laser Driven Dielectric Accelerator for Radiobiology",1041 1043,
thpb096,"S.V. Kuzikov, A.V. Savilov [IAP/RAS, Nizhny Novgorod, Russia] S.V. Kuzikov [Omega-P, Inc., New Haven, USA] ","High-power Sources of RF Radiation Driven by Periodic Laser Pulses",1044 1046,
thpb097,"E. Pozdeyev, N.K. Bultman, G. Machicoane, G. Morgan, X. Rao, Q. Zhao [FRIB, East Lansing, Michigan, USA] V.L. Smirnov, S.B. Vorozhtsov [JINR, Dubna, Moscow Region, Russia] J. Stovall [CERN, Geneva, Switzerland] L.T. Sun [IMP, Lanzhou, People's Republic of China] L.M. Young [LANL, Los Alamos, New Mexico, USA] ","FRIB Front End Design Status",1047 1049,
thplb01,"S. Fu, J. Li, H.C. Liu, H.F. Ouyang, X. Yin [IHEP, Beijing, People's Republic of China] ","Linac Construction for China Spallation Neutron Source",807 809,
thplb02,"P. Varghese, B.W. Barnes, B. Chase, E. Cullerton, C.C. Tan [Fermilab, Batavia, USA] ","Performance of Ferrite Vector Modulators in the LLRF system of the Fermilab HINS 6-Cavity Test",810 812,
thplb03,"C. Zhang, H. Klein, D. Mäder, H. Podlech, U. Ratzinger, A. Schempp, R. Tiede, M. Vossberg [IAP, Frankfurt am Main, Germany] ","Front-End Linac Design and Beam Dynamics Simulations for MYRRHA",813 815,
thplb04,"J. Zhu, S. Chen, J. Deng, Y. Shen, J. Shi, W.D. Wang, L.S. Xia, H. Zhang, L.W. Zhang [CAEP/IFP, Mainyang, Sichuan, People's Republic of China] ","Preliminary Study of Proton Beam Transport in a 10 MeV Dielectric Wall Accelerator",816 818,
thplb05,"S.C. Joshi, J. Dwivedi, P.D. Gupta, P.R. Hannurkar, P. Khare, P.K. Kush, G. Mundra, A. Puntambekar, S.B. Roy, P. Shrivastava [RRCAT, Indore (M.P.), India] ","R&D Activities on High Intensity Superconducting Proton Linac at RRCAT",819 821,
thplb06,"A.D. Kovalenko [JINR, Dubna, Moscow Region, Russia] A. Kolomiets [ITEP, Moscow, Russia] ","The New Option for a Front End of Ion Linac",822 824,
thplb07,"P. Gerhard, W.A. Barth, L.A. Dahl, W. Hartmann, G. Schreiber, W. Vinzenz, H. Vormann [GSI, Darmstadt, Germany] ","Experience with a 4-Rod CW Radio Frequency Quadrupole",825 827,
thplb08,"E. Fagotti, L. Antoniazzi, F. Grespan, A. Palmieri [INFN/LNL, Legnaro (PD), Italy] M. Desmons [CEA/DSM/IRFU, France] ","High-Power RF Conditioning of the TRASCO RFQ",828 830,
thplb09,"C. Madec [CEA, Gif-sur-Yvette, France] S. Berry, J.-P. Charrier, A. Dael (A. Daël), M. Fontaine, Y. Gasser, O. Napoly, Y. Sauce, C.S. Simon, T.V. Vacher, B. Visentin [CEA/DSM/IRFU, France] A. Brasseur, P. Charon, C. Cloue (C. Cloué), S. Langlois, G. Monnereau, J.L. Perrin, D. Roudier, N. Sacepe (N. Sacépé) [CEA/IRFU, Gif-sur-Yvette, France] ","Status of E-XFEL String and Cryomodule Assembly at CEA-Saclay",831 833,
thplb11,"I. Haber, B.L. Beaudoin, S. Bernal, R.A. Kishek, T.W. Koeth, Y. Mo [UMD, College Park, Maryland, USA] ","Experimental and Simulation Study of the Long-path-length Dynamics of a Space-charge-dominated Bunch",834 836,
thplb12,"A. Neumann, W. Anders, T. Kamps, J. Knobloch [HZB, Berlin, Germany] E.N. Zaplatin [FZJ, Jülich, Germany] ","Photoinjector SRF Cavity Development for BERLinPro",837 839,
tu1a01,"A. Mosnier [Fusion for Energy, Garching, Germany] ","Status of the IFMIF-EVEDA 9 MeV 125 mA Deuteron Linac",407 411,
tu1a03,"Y.L. Chi, S. Fu, W.M. Pan, P. Sha [IHEP, Beijing, People's Republic of China] Q.Z. Xing [TUB, Beijing, People's Republic of China] ","Chinese ADS Project and Proton Accelerator Development",412 416,
tu1a04,"J. Wei, E.C. Bernard, N.K. Bultman, F. Casagrande, S. Chouhan, C. Compton, K.D. Davidson, A. Facco, P.E. Gibson, T . Glasmacher, K. Holland, M.J. Johnson, S. Jones, D. Leitner, M. Leitner, G. Machicoane, F. Marti, D. Morris, J.P. Ozelis, S. Peng, J. Popielarski, L. Popielarski, E. Pozdeyev, T. Russo, K. Saito, R.C. Webber, M. Williams, Y. Yamazaki, A. Zeller, Y. Zhang, Q. Zhao [FRIB, East Lansing, USA] D. Arenius, V. Ganni [JLAB, Newport News, Virginia, USA] J.A. Nolen [ANL, Argonne, USA] ","FRIB Accelerator Status and Challenges",417 421,
tu1a05,"H.-J. Kwon, Y.-S. Cho, J.-H. Jang, D.I. Kim, H.S. Kim, B.-S. Park, J.Y. Ryu, K.T. Seol, Y.-G. Song, S.P. Yun [KAERI, Daejon, Republic of Korea] ","Status and Commissioning Plan of the PEFP 100-MeV Linear Accelerator",422 426,
tu2a02,"Y. Otake [RIKEN SPring-8 Center, Sayo-cho, Sayo-gun, Hyogo, Japan] ","Overview of SACLA Machine Status",427 431,
tu2a03,"T.O. Raubenheimer [SLAC, Menlo Park, California, USA] ","LCLS Operation Experience and LCLS-II Design",432 436,
tu2a04,"I. Ben-Zvi [BNL, Upton, Long Island, New York, USA] ","High Current ERL at BNL",437 441,
tupb001,"V.V. Paramonov [RAS/INR, Moscow, Russia] ","The Fine Structure of the Zone of Particle Interaction with a Finite Length Periodic Structure",473 475,
tupb002,"V.V. Paramonov [RAS/INR, Moscow, Russia] ","Deflecting Structures with Minimized Level of Aberrations",476 478,
tupb004,"V. Vogel, L. Butkowski, A. Cherepenko, S. Choroba, I. Harders, J. Hartung [DESY, Hamburg, Germany] ","Results of Testing of Multi-beam Klystrons for the European XFEL",479 481,
tupb005,"A. Gover [University of Tel-Aviv, Faculty of Engineering, Tel-Aviv, Israel] A. Nause [University of Tel Aviv, Tel Aviv, Israel] ","Computational Model Analysis for Experimental Observation of Optical Current Noise Suppression Below the Shot-noise Limit",482 485,
tupb006,"T. Asaka, T. Hasegawa, T. Inagaki, H. Maesaka, T. Ohshima, Y. Otake, S. Takahashi, K. Togawa [RIKEN SPring-8 Center, Sayo-cho, Sayo-gun, Hyogo, Japan] ","Stability Performance of the Injector for SACLA/XFEL at SPring-8",486 488,
tupb008,"A. Zholents [ANL, Argonne, USA] ","Major Trends in Linac Design for X-ray FELs",489 491,
tupb009,"R. Zennaro, J. Alex, H. Blumer, M. Bopp, A. Citterio, T. Kleeb, L. Paly, J.-Y. Raguin [PSI, Villigen, Switzerland] ","C-Band Accelerating Structure Development and Tests for the SwissFEL",492 494,
tupb010,"J.-Y. Raguin, M. Bopp, A. Citterio, A. Scherer [PSI, Villigen, Switzerland] ","The Swiss FEL RF Gun: RF Design and Thermal Analysis",495 497,
tupb011,"J.-Y. Raguin [PSI, Villigen, Switzerland] ","The Swiss FEL S-Band Accelerating Structure: RF Design",498 500,
tupb012,"J.-Y. Raguin, M. Bopp [PSI, Villigen, Switzerland] ","The Swiss FEL C-Band Accelerating Structure: RF Design and Thermal Analysis",501 503,
tupb013,"T. Schietinger [PSI, Villigen, Switzerland] ","Update on the Commissioning Effort at the SwissFEL Injector Test Facility",504 506,
tupb014,"Yu. Lurie, Y. Pinhasi [Ariel University Center of Samaria, Faculty of Engineering, Ariel, Israel] ","Comparative Design of Single Pass, Photo-cathode RF-LINAC FEL for the THz Frequency Range: Self Amplification vs. Enhanced Super-radiance",507 509,
tupb015,"M. Huening (M. Hüning) [DESY, Hamburg, Germany] ","Warm Beamlines and Infrastructure in the European XFEL",510 512,
tupb018,"D. Gu, Q. Gu, D. Huang, M. Zhang, M.H. Zhao [SINAP, Shanghai, People's Republic of China] ","Study of Beam-Based Alignment for Shanghai Soft X-Ray FEL Facility",513 515,
tupb019,"J.K. Sekutowicz, V. Ayvazyan, J. Branlard, M. Ebert, J. Eschke, A. Goessel (A. Gössel), D. Kostin, W. Merz, F. Mittag, R. Onken [DESY, Hamburg, Germany] W. Cichalewski, W. Jalmuzna (W. Jałmużna), A. Piotrowski, K.P. Przygoda [TUL-DMCS, Lodz, Poland] K. Czuba, L. Zembala (Ł. Zembala) [Warsaw University of Technology, Institute of Electronic Systems, Warsaw, Poland] I.M. Kudla, J. Szewinski (J. Szewiński) [NCBJ, Swierk/Otwock, Poland] ","Second CW and LP Operation Test of XFEL Prototype Cryomodule",516 518,
tupb020,"E. Vogel [DESY, Hamburg, Germany] A. Bosotti, P. Michelato, L. Monaco, C. Pagani, R. Paparella, P. Pierini, D. Sertore [INFN/LASA, Segrate (MI), Italy] E.R. Harms [Fermilab, Batavia, USA] ","Status of the European XFEL 3.9 GHz system",519 521,
tupb021,"D. Huang, Q. Gu [SINAP, Shanghai, People's Republic of China] K.Y. Ng [Fermilab, Batavia, USA] ","Study of Plasma Effect in Longitudinal Space Charge Induced Microbunching Instability",522 524,
tupb022,"Q. Gu, M. Zhang, M.H. Zhao [SINAP, Shanghai, People's Republic of China] ","A Passive Linearizer for Bunch Compression",525 527,
tupb023,"A.Yu. Smirnov, O.A. Adonev, P.V. Binyukov, N.P. Sobenin [MEPhI, Moscow, Russia] ","The Optimization of RF Deflector Input Power Coupler",528 530,
tupb026,"F. Hug, C. Burandt, M. Konrad, N. Pietralla [TU Darmstadt, Darmstadt, Germany] R. Eichhorn [Cornell University, Ithaca, New York, USA] ","Measurements of a Reduced Energy Spread of a Recirculating Linac by Non-isochronous Beam Dynamics",531 533,
tupb028,"J.-W. Kim [IBS, Daejeon, Republic of Korea] ","Status of the Rare Isotope Science Project in Korea",534 536,
tupb029,"C. Jamet, T.A. Andre (T. André), C. Doutresssoulles, B. Ducoudret, W. Le Coz, G. Ledu, S.L. Leloir, S. Loret [GANIL, Caen, France] ","Beam Intensity and Energy Control for the SPIRAL2 Facility",537 539,
tupb030,"D. Jeon, C. Choi, J.D. Joo, H.C. Jung, H.J. Kim, H.J. Kim, S.K. Kim, Y.H. Kim, J.H. Lee, G.-T. Park, J. Song [IBS, Daejeon, Republic of Korea] Y.Y. Lee [KAERI, Daejon, Republic of Korea] ","Overview of the Superconducting Linacs of the Rare Isotope Science Project",540 542,
tupb031,"V.S. Dyubkov, A.S. Plastun [MEPhI, Moscow, Russia] ","Beam Envelope Analysis and Simulation",543 545,
tupb032,"M. Comunian, C. Roncolato [INFN/LNL, Legnaro (PD), Italy] B.B. Chalykh [ITEP, Moscow, Russia] ","Beam Dynamics of the Linac ALPI-PIAVE in View of Possible Upgrades Scenario for the SPES Project.",546 548,
tupb033,"B.K. Sahu, R. Ahuja, G.K. Chowdhury, R.N. Dutt, S. Ghosh, D. Kanjilal, J. Karmakar, M. Kumar, R. Kumar, D.S. Mathuria, A. Pandey, P. Patra, A. Rai, A. Roy, S.K. Suman [IUAC, New Delhi, India] ","Piezoelectric Actuator Based Phase Locking System for IUAC Linac",549 551,
tupb034,"S.X. Peng, J. Chen, J.E. Chen, S.L. Gao, Z.Y. Guo, P.N. Lu, H.T. Ren, Z. Wang, Y. Xu, J. Zhao [PKU/IHIP, Beijing, People's Republic of China] ","A Helium Injector for Coupled RFQ and SFRFQ Cavity Project at Peking University",552 554,
tupb035,"S.G. Yaramyshev, W.A. Barth, G. Clemente, L.A. Dahl, V. Gettmann, F. Herfurth, M. Kaiser, M.T. Maier, D. Neidherr, A. Orzhekhovskaya, H. Vormann, G. Vorobjev [GSI, Darmstadt, Germany] R. Repnow [MPI-K, Heidelberg, Germany] ","A New Design of the RFQ Channel for GSI HITRAP Facility",555 557,
tupb036,"L.P. Sun, X. Du, Y. He, A. Shi, C. Zhang, Z.L. Zhang [IMP, Lanzhou, People's Republic of China] ","Design of Re-Buncher Cavity for Heavy-ion LINAC in IMP",558 560,
tupb039,"Z.J. Wang, Y. He, H. Jia, C. Li, S.H. Liu, W. Wu, X.B. Xu, B. Zhang, H.W. Zhao [IMP, Lanzhou, People's Republic of China] ","Conceptual Design of Superconducting Heavy Ion Linear Injector for HIAF",561 563,
tupb040,"M. Leitner, E.C. Bernard, J. Binkowski, B. Bird, S. Bricker, S. Chouhan, C. Compton, K. Elliott, B. Enkhbat, A.D. Fox, L.L. Harle, M. Hodek, M.J. Johnson, I.M. Malloch, D. R. Miller, S.J. Miller, T. Nellis, D. Norton, R. Oweiss, J.P. Ozelis, J. Popielarski, L. Popielarski, K. Saito, M. Shuptar, G.J. Velianoff, J. Wei, M. Williams, K. Witgen, Y. Xu, Y. Yamazaki, Y. Zhang [FRIB, East Lansing, USA] A. Facco [INFN/LNL, Legnaro (PD), Italy] ","Status of the Linac SRF Acquisition for FRIB",564 566,
tupb041,"F. Roncarolo, E. Chevallay, M. Duraffourg, G.J. Focker, C. Hessler (C. Heßler), U. Raich, VC. Vuitton, F. Zocca [CERN, Geneva, Switzerland] B. Cheymol [ESS, Lund, Sweden] ","Scattering of H- Stripped Electrons from SEM Grids and Wire Scanners at the CERN LINAC4",567 569,
tupb042,"T. Morishita [JAEA/LINAC, Ibaraki-ken, Japan] K. Hasegawa, Y. Kondo [JAEA, Ibaraki-ken, Japan] H. Kawamata, F. Naito, T. Sugimura [KEK, Ibaraki, Japan] ","Progress on RFQIII Fabrication in J-PARC Linac",570 572,
tupb043,"X.H. Zhang, J.W. Xia, Y.J. Yuan [IMP, Lanzhou, People's Republic of China] ","One Design of Heavy Ion Linac Injector for CSRm",573 575,
tupb044,"X.H. Guo, Y.N. Han, T. Jin, X.F. Niu, H.L. Su, J.H. Zhang [IMP, Lanzhou, People's Republic of China] L.Q. Liu, N. Peng, L.-Y. Xiong [TIPC, BeiJing, People's Republic of China] ","Cryogenic System for the ADS Injector II in IMP, CAS",576 578,
tupb046,"P.N. Ostroumov, A. Barcikowski, Z.A. Conway, S.M. Gerbick, M. Kedzie, M.P. Kelly, S.V. Kutsaev, J.W. Morgan, R.C. Murphy, B. Mustapha, D.R. Paskvan, T. Reid, D.L. Schrage, S.I. Sharamentov, K.W. Shepard, G.P. Zinkann [ANL, Argonne, USA] ","R&D Towards CW Ion Linacs at ANL",579 581,
tupb047,"W. Venturini Delsolaro, L. Alberty Vieira, S. Calatroni, O. Capatina, A. D'Elia, B. Delaup, M.A. Fraser, N.M. Jecklin, Y. Kadi, P. Maesen, I. Mondino, E. Montesinos, M. Therasse, D. Valuch [CERN, Geneva, Switzerland] ","Status of the Superconducting RF Activities for the HIE ISOLDE Project",582 584,
tupb048,"S. Molloy [ESS, Lund, Sweden] R. Ainsworth [Royal Holloway, University of London, Surrey, United Kingdom] ","Discussion of the Optimisation of a Linac Lattice to Minimise Disruption by a Class of Parasitic Modes",585 587,
tupb049,"P.N. Prakash, K.K. Mistri, A. Roy, J. Sacharias, S.S. Sonti [IUAC, New Delhi, India] ","Superconducting Low Beta Niobium Resonator for Heavy Ions",588 590,
tupb052,"R. Ainsworth [Royal Holloway, University of London, Surrey, United Kingdom] S. Molloy [ESS, Lund, Sweden] ","Studies of Parasitic Cavity Modes for Proposed ESS Linac Lattices",591 593,
tupb053,"S. Kazakov, S. Cheban, T.N. Khabiboulline, M. Kramp, Y. Orlov, V. Poloubotko, O. Pronitchev, V.P. Yakovlev [Fermilab, Batavia, USA] M.S. Champion [ORNL, Oak Ridge, Tennessee, USA] ","Main Coupler Design for Project X",594 596,
tupb054,"A.I. Sukhanov, I.V. Gonin, T.N. Khabiboulline, A. Lunin, A. Saini, N. Solyak, A. Vostrikov, V.P. Yakovlev [Fermilab, Batavia, USA] ","Coherent Effects of High Current Beam in Project-X Linac",597 599,
tupb055,"W.M. Yue, X.L. Guo, S. He, Y. He, R.X. Wang, P.R. Xiong, M.X. Xu, B. Zhang, C. Zhang, S.H. Zhang, S.X. Zhang, H.W. Zhao [IMP, Lanzhou, People's Republic of China] ","R&D of IMP Superconducting HWR for China ADS",600 602,
tupb056,"C. Zhang, S. He, Y. He, S.C. Huang, Y.L. Huang, T.C. Jiang, R.X. Wang, M.X. Xu, Y.Z. Yang, W.M. Yue, S.H. Zhang, S.X. Zhang, H.W. Zhao [IMP, Lanzhou, People's Republic of China] ","The Multipacting Simulation for the New-shaped QWR using TRACK3P",603 605,
tupb057,"C. Zhang, S. He, Y. He, S.C. Huang, Y.L. Huang, T.C. Jiang, R.X. Wang, M.X. Xu, Y.Z. Yang, W.M. Yue, S.H. Zhang, S.X. Zhang, H.W. Zhao [IMP, Lanzhou, People's Republic of China] ","Structural Analysis of the New-Shaped QWR for HIAF in IMP",606 608,
tupb058,"Z.Q. He, Z. Zheng [TUB, Beijing, People's Republic of China] Z.Q. He, Z. Liu, J. Wei, Y. Zhang [FRIB, East Lansing, Michigan, USA] ","An Analytical Cavity Model for Fast Linac-Beam Tuning",609 611,
tupb060,"Z. Zheng, A. Facco, Z. Liu, J. Popielarski, K. Saito, J. Wei, Y. Xu, Y. Zhang [FRIB, East Lansing, Michigan, USA] Z. Zheng [TUB, Beijing, People's Republic of China] ","Multipacting Suppression Modeling for Half Wave Resonator and RF Coupler*",612 614,
tupb061,"Z. Zheng, Z. Liu, J. Wei, Y. Zhang, S. Zhao [FRIB, East Lansing, Michigan, USA] Z. Zheng [TUB, Beijing, People's Republic of China] ","ADRC Control for Beam Loading and Microphonics",615 617,
tupb062,"G.I. Cancelo, B. Chase, Y.I. Eidelman, S. Nagaitsev, N. Solyak [Fermilab, Batavia, USA] ","Longitudinal Dynamic Analysis for the Project X 3-8 GeV Pulsed Linac",618 620,
tupb066,"Z.A. Conway, S.M. Gerbick, M. Kedzie, M.P. Kelly, J.W. Morgan, R.C. Murphy, P.N. Ostroumov, T. Reid [ANL, Argonne, USA] ","Reduced-beta Cavities for High-intensity Compact Accelerators",621 623,
tupb067,"Z.A. Conway, R.L. Fischer, S.M. Gerbick, M. Kedzie, M.P. Kelly, S.V. Kutsaev, B. Mustapha, P.N. Ostroumov, K.W. Shepard [ANL, Argonne, USA] I.V. Gonin, A. Lunin, V.P. Yakovlev [Fermilab, Batavia, USA] ","Development of a Superconducting Half-Wave Resonator for PXIE",624 626,
tupb068,"Z.A. Conway, G.L. Cherry, R.L. Fischer, S.M. Gerbick, M. Kedzie, M.P. Kelly, S.H. Kim, J.W. Morgan, P.N. Ostroumov, K.W. Shepard [ANL, Argonne, USA] ","Cryomodule Designs for Superconducting Half-Wave Resonators",627 629,
tupb069,"A.V. Samoshin [MEPhI, Moscow, Russia] ","BEAMDULAC-SCL Code for Complex Approach of Beam Dynamic Investigation in SC LINAC",630 632,
tupb070,"A.V. Samoshin, S.M. Polozov [MEPhI, Moscow, Russia] ","Development of Proton Therapy at the SC Linac with BEAMDULAC-SCL Code",633 635,
tupb071,"M. Busch, F.D. Dziuba, H. Podlech, U. Ratzinger [IAP, Frankfurt am Main, Germany] M. Amberg [HIM, Mainz, Germany] W.A. Barth, S. Mickat [GSI, Darmstadt, Germany] M. Pekeler [RI Research Instruments GmbH, Bergisch Gladbach, Germany] ","First Measurements on the 325 MHz Superconducting CH Cavity",636 638,
tupb072,"F.D. Dziuba, M. Amberg, M. Busch, H. Podlech, U. Ratzinger [IAP, Frankfurt am Main, Germany] K. Aulenbacher [IKP, Mainz, Germany] W.A. Barth, S. Mickat [GSI, Darmstadt, Germany] ","Status of the Superconducting CW Demonstrator for GSI",639 641,
tupb073,"L. Lu [RIKEN, Saitama, Japan] O. Kamigaito, N. Sakamoto, K. Suda, K. Yamada [RIKEN Nishina Center, Wako, Japan] ","Design and Simulation of a Test Model for a Tri-Spoke Cavity at RIKEN",642 644,
tupb074,"W.A. Barth, V. Gettmann, S. Mickat [GSI, Darmstadt, Germany] W.A. Barth, P. Gerhard [HIM, Mainz, Germany] ","Superconducting CW Heavy Ion Linac at GSI",645 647,
tupb075,"Z. Li, P. Cheng, H. Geng, Z. Guo, C. Meng, B. Sun, J.Y. Tang, F. Yan [IHEP, Beijing, People's Republic of China] ","Beam Dynamics Design of China ADS Proton Linac",648 650,
tupb077,"S. Peggs [BNL, Upton, Long Island, New York, USA] R. Cywinski, R. Seviour [University of Huddersfield, Huddersfield, United Kingdom] S. Peggs [ESS, Lund, Sweden] ","Thorium Energy",651 653,
tupb079,"K. Yanagida, H. Hanaki, S. Suzuki [JASRI/SPring-8, Hyogo-ken, Japan] ","Design and Beam Test of Six-Electrode BPMs for Second-Order Moment Measurement",654 656,
tupb080,"H. Tomizawa, K. Ogawa, T. Sato, M. Yabashi [RIKEN SPring-8 Center, Sayo-cho, Sayo-gun, Hyogo, Japan] M. Aoyama [JAEA/Kansai, Kyoto, Japan] A. Iwasaki, S. Owada [The University of Tokyo, Tokyo, Japan] S. Matsubara, Y. Okayasu, T. Togashi [JASRI/SPring-8, Hyogo, Japan] T. Matsukawa, H. Minamide [RIKEN ASI, Sendai, Miyagi, Japan] E. Takahashi [RIKEN, Saitama, Japan] ","Non-destructive Real-time Monitor to Measure 3D Bunch Charge Distribution with Arrival Timing to Maximize 3D Overlapping for HHG-Seeded EUV-FEL",657 659,
tupb081,"V.A. Verzilov, P.S. Birney, D.P. Cameron, J.V. Holek, S.Y. Kajioka, S. Kellogg, M. Lenckowski, M. Minato, W.R. Rawnsley [TRIUMF, Vancouver, Canada] J.M. Abernathy, D. Karlen, D.W. Storey [Victoria University, Victoria, B.C., Canada] ","Beam Diagnostics Development for Triumf E-Linac",660 662,
tupb082,"H. Sako, T. Maruta, A. Miura [JAEA/J-PARC, Tokai-Mura, Naka-Gun, Ibaraki-Ken, Japan] ","Beam Loss Track Measurements by a Fast Trigger Scheme in J-PARC Linac",663 665,
tupb084,"C. Deibele [ORNL, Oak Ridge, Tennessee, USA] D. Curry, R. Dickson [ORNL RAD, Oak Ridge, Tennessee, USA] ","High Dynamic-Range High Speed Linac Current Measurements",666 668,
tupb090,"Y. Fuwa, Y. Iwashita, H. Tongu [Kyoto ICR, Uji, Kyoto, Japan] S. Fukuda, S. Michizono [KEK, Ibaraki, Japan] ","Development of Permanent Magnet Focusing System for Klystrons",669 671,
tupb091,"A.Yu. Smirnov, E.V. Ivanov, A.A. Krasnov, K.I. Nikolskiy, N.V. Tikhomirova [Siemens Research Center, Moscow,, Russia] O. Heid, T.J.S. Hughes [Siemens AG, Erlangen, Germany] ","176 MHz Solid State Microwave Generator Design",672 674,
tupb092,"B. Kaizer, I. Fishman, I.G. Gertz [Soreq NRC, Yavne, Israel] ","High Power Amplifier Systems for SARAF Phase II",675 677,
tupb093,"M.P. Kelly, Z.A. Conway, M. Kedzie, S.V. Kutsaev [ANL, Argonne, USA] J.L. Crisp, L.L. Harle [FRIB, East Lansing, Michigan, USA] ","Compact 4 kW Variable RF Power Coupler for FRIB Quarter-wave Cavities",678 680,
tupb094,"E. Fagotti, L. Antoniazzi, F. Grespan, A. Palmieri, F. Scarpa [INFN/LNL, Legnaro (PD), Italy] O. Brunasso Cattarello, R. Panero [INFN-Torino, Torino, Italy] M. Desmons [CEA/DSM/IRFU, France] ","High Power Tests of TRASCO RFQ Couplers",681 683,
tupb095,"K. Suda, S. Arai, Y. Chiba, O. Kamigaito, M. Kase, H. Okuno, N. Sakamoto, Y. Watanabe, K. Yamada [RIKEN Nishina Center, Wako, Japan] ","Design of Coupler for Direct Coupled Amplifier to Drift Tube Linac Cavities of the Injector RILAC2 for RIKEN RI Beam Factory",684 686,
tupb097,"C.P. Wang, Q. Gu, Z.T. Zhao [SINAP, Shanghai, People's Republic of China] ","The C-band RF Pulse Compression for Soft XFEL at SINAP",687 689,
tupb099,"F. Naito, K. Nanmo, H. Tanaka [KEK, Ibaraki, Japan] K. Hirano, T. Ito [JAEA/J-PARC, Tokai-mura, Japan] ","Input Coupler of the J-PARC DTL",690 692,
tupb100,"T. Ito, K. Hirano [JAEA/LINAC, Ibaraki-ken, Japan] F. Naito, K. Nanmo [KEK, Ibaraki, Japan] ","Recovery and Status Report of DTL/SDTL for the J-PARC After Earthquake",693 695,
tupb101,"A. Miura, K. Hirano, T. Ito, T. Maruta [JAEA/J-PARC, Tokai-mura, Japan] M. Ikegami [J-PARC, KEK  JAEA, Ibaraki-ken, Japan] T. Miyao, F. Naito, K. Nanmo [KEK, Ibaraki, Japan] ","Beam Loss Occurred at DTL Cavity in J-PARC Linac",696 698,
tupb102,"A. Miura [JAEA/J-PARC, Tokai-mura, Japan] Z. Igarashi, T. Miyao [KEK, Ibaraki, Japan] ","Design and Performances of Phase Monitor in J-PARC Linac",699 701,
tupb103,"H.C. Liu, Q. Chen, S. Fu, K.Y. Gong, A.H. Li, J. Peng, Y.C. Xiao, X. Yin [IHEP, Beijing, People's Republic of China] ","CSNS DTL Prototyping and RF Tuning",702 704,
tupb104,"H.J. Kim, J.G. Hwang, D. Jeon [IBS, Daejeon, Republic of Korea] ","Study of the Beam Dynamics in the RISP Driver Linac",705 707,
tupb107,"V.A. Goryashko, R.J.M.Y. Ruber, R.A. Yogi, V.G. Ziemann [Uppsala University, Uppsala, Sweden] ","Amplitude and Phase Control of the Accelerating Field in the ESS Spoke Cavity",708 710,
tupb108,"R.A. Yogi, T.J.C. Ekelöf, V.A. Goryashko, L. Hermansson, M. Noor, R. Santiago Kern, V.G. Ziemann [Uppsala University, Uppsala, Sweden] D.S. Dancila, A. Rydberg [Uppsala University, Department of Engineering Sciences, Uppsala, Sweden] K.J. Gajewski, T. Lofnes, R. Wedberg [TSL, Uppsala, Sweden] R.J.M.Y. Ruber [CERN, Geneva, Switzerland] ","Uppsala High Power Test Stand for ESS Spoke Cavities",711 713,
tuplb01,"J.-Y. Raguin, M. Bopp, A. Citterio, A. Scherer [PSI, Villigen, Switzerland] ","The Swiss FEL RF Gun: RF Design and Thermal Analysis",442 444,
tuplb02,"V.V. Paramonov [RAS/INR, Moscow, Russia] ","Deflecting Structures with Minimized Level of Aberrations",445 447,
tuplb04,"V. Vogel, L. Butkowski, A. Cherepenko, S. Choroba, I. Harders, J. Hartung [DESY, Hamburg, Germany] ","Results of Testing of Multi-beam Klystrons for the European XFEL",448 450,
tuplb05,"A. Gover [University of Tel-Aviv, Faculty of Engineering, Tel-Aviv, Israel] A. Nause [University of Tel Aviv, Tel Aviv, Israel] ","Computational Model Analysis for Experimental Observation of Optical Current Noise Suppression below the Shot-Noise Limit",451 454,
tuplb06,"J.-W. Kim [IBS, Daejeon, Republic of Korea] ","Status of the Rare Isotope Science Project in Korea",455 457,
tuplb07,"Z.A. Conway, S.M. Gerbick, M. Kedzie, M.P. Kelly, J.W. Morgan, R.C. Murphy, P.N. Ostroumov, T. Reid [ANL, Argonne, USA] ","Reduced-beta Cavities for High-intensity Compact Accelerators",458 460,
tuplb08,"P.N. Ostroumov, A. Barcikowski, Z.A. Conway, S.M. Gerbick, M. Kedzie, M.P. Kelly, S.V. Kutsaev, J.W. Morgan, R.C. Murphy, B. Mustapha, D.R. Paskvan, T. Reid, D.L. Schrage, S.I. Sharamentov, K.W. Shepard, G.P. Zinkann [ANL, Argonne, USA] ","R&D Towards CW Ion Linacs at ANL",461 463,
tuplb09,"K. Yanagida, H. Hanaki, S. Suzuki [JASRI/SPring-8, Hyogo-ken, Japan] ","Design and Beam Test of Six-electrode BPMs for Second-order Moment Measurement",464 466,
tuplb10,"H. Tomizawa, K. Ogawa, T. Sato, M. Yabashi [RIKEN SPring-8 Center, Sayo-cho, Sayo-gun, Hyogo, Japan] M. Aoyama [JAEA/Kansai, Kyoto, Japan] A. Iwasaki, S. Owada [The University of Tokyo, Tokyo, Japan] S. Matsubara, Y. Okayasu, T. Togashi [JASRI/SPring-8, Hyogo, Japan] T. Matsukawa, H. Minamide [RIKEN ASI, Sendai, Miyagi, Japan] E. Takahashi [RIKEN, Saitama, Japan] ","Non-destructive Real-time Monitor to Measure 3D-bunch Charge Distribution with Arrival Timing to Maximize 3D Overlapping for HHG-seeded EUV-FEL",467 469,
tuplb12,"Y. Fuwa, Y. Iwashita, H. Tongu [Kyoto ICR, Uji, Kyoto, Japan] S. Fukuda, S. Michizono [KEK, Ibaraki, Japan] ","Development of Permanent Magnet Focusing System for Klystrons",470 472,
