moplb07,"Y. Iwashita, Y. Fuwa, M. Hashida, K. Otani, S. Sakabe, S. Tokita, H. Tongu [Kyoto ICR, Uji, Kyoto, Japan] H. Hayano, K. Watanabe, Y. Yamamoto [KEK, Ibaraki, Japan] ","Non-destructive Inspections for SC Cavities",156 158,
moplb08,"G. Burt, P.K. Ambattu, A.C. Dexter, C. Lingwood, B.J. Woolley [Cockcroft Institute, Lancaster University, Lancaster, United Kingdom] S.R. Buckley, P. Goudket, C. Hill, P.A. McIntosh, J.W. McKenzie, A.E. Wheelhouse [STFC/DL/ASTeC, Daresbury, Warrington, Cheshire, United Kingdom] V.A. Dolgashev [SLAC, Menlo Park, California, USA] A. Grudiev [CERN, Geneva, Switzerland] R.M. Jones [UMAN, Manchester, United Kingdom] ","Normal Conducting Deflecting Cavity Development at the Cockcroft Institute",159 161,
moplb09,"R. Boni, D. Alesini, M. Bellaveglia, G. Di Pirro, M. Ferrario, A. Gallo, B. Spataro [INFN/LNF, Frascati (Roma), Italy] A. Mostacci, L. Palumbo [URLS, Rome, Italy] ","Status of the C-Band RF System for the SPARC-LAB High Brightness Photoinjector",162 164,
moplb10,"J. Popielarski, E.C. Bernard, S. Bricker, S. Chouhan, C. Compton, A. Facco, A. Fila, L.L. Harle, M. Hodek, L. Hodges, S. Jones, M. Leitner, D. R. Miller, S.J. Miller, D. Morris, R. Oweiss, J.P. Ozelis, L. Popielarski, K. Saito, N.R. Usher, J. Weisend, Y. Zhang, S. Zhao, Z. Zheng [FRIB, East Lansing, USA] M. Klaus [Technische Universität Dresden, Dresden, Germany] ","FRIB Technology Demonstration Cryomodule Test",165 167,
moplb11,"M.E. Conde, D.S. Doran, W. Gai, R. Konecny, W. Liu, J.G. Power, Z.M. Yusof [ANL, Argonne, USA] S.P. Antipov, C.-J. Jing [Euclid TechLabs, LLC, Solon, Ohio, USA] E.E. Wisniewski [Illinois Institute of Technology, Chicago, Illinois, USA] ","The Upgraded Argonne Wakefield Accelerator Facility (AWA): a Test-Bed for the Development of High Gradient Accelerating Structures and Wakefield Measurements",168 170,
moplb12,"Y.-C. Du, J.F. Hua, W.-H. Huang, C.-X. Tang, L.X. Yan, H. Zha, Z. Zhang [TUB, Beijing, People's Republic of China] ","X-Ray Local Energy Spectrum Measurement on Tsinghua Thomson Scattering X-Ray Source (TTX)",171 173,
supb001,"C. Xu, M.J. Kelley [The College of William and Mary, Williamsburg, USA] C.E. Reece [JLAB, Newport News, Virginia, USA] ","Analyzing Surface Roughness Dependence of Linear RF Losses",99 98,
supb003,"T. Atkinson, A.V. Bondarenko, A.N. Matveenko, Y. Petenev [HZB, Berlin, Germany] ","Feasibility Study of Short Pulse Mode Operation for Multi-turn ERL Light Source",4 6,
supb004,"Y. Petenev, T. Atkinson, A.V. Bondarenko, A.N. Matveenko [HZB, Berlin, Germany] ","Linac Optics Design for Multi-turn ERL Light Source",7 9,
supb006,"D. Gu, Q. Gu, D. Huang, M. Zhang, M.H. Zhao [SINAP, Shanghai, People's Republic of China] ","Study of Beam-Based Alignment for Shanghai Soft X-Ray FEL Facility",10 12,
supb007,"J. Pfingstner, D. Schulte [CERN, Geneva, Switzerland] ","On-Line Dispersion Free Steering for the Main Linac of CLIC",13 15,
supb008,"A. Gerbershagen, A. Andersson, D. Schulte [CERN, Geneva, Switzerland] P. Burrows [JAI, Oxford, United Kingdom] F.O. Ilday (F.Ö. Ilday) [Bilkent University, Bilkent, Ankara, Turkey] ","Specifications of the Distributed Timing System for the CLIC Main Linac",16 18,
supb009,"A.E. Levichev, A.M. Barnyakov, V.M. Pavlov [BINP SB RAS, Novosibirsk, Russia] Y.D. Chernousov [ICKC, Novosibirsk, Russia] V. Ivannikov, I.V. Shebolaev [ICKC SB RAS, Novosibirsk, Russia] ","Linear Accelerator based on Parallel Coupled Accelerating Structure",19 21,
supb010,"F. Hug, C. Burandt, M. Konrad, N. Pietralla [TU Darmstadt, Darmstadt, Germany] R. Eichhorn [Cornell University, Ithaca, New York, USA] ","Measurements of a Reduced Energy Spread of a Recirculating Linac by Non-Isochronous Beam Dynamics",22 24,
supb011,"A. Nause, A. Gover [University of Tel-Aviv, Faculty of Engineering, Tel-Aviv, Israel] ","Computational Model Analysis for Experimental Observation of Optical Current Noise Suppression Below the Shot-noise Limit",25 28,
supb012,"D. Mäder, H. Klein, H. Podlech, U. Ratzinger, C. Zhang [IAP, Frankfurt am Main, Germany] ","Status of CH Cavity and Solenoid Design of the 17 MeV Injector for MYRRHA",29 31,
supb013,"Z.J. Wang, Y. He, H. Jia, C. Li, S.H. Liu, W. Wu, X.B. Xu, B. Zhang, H.W. Zhao [IMP, Lanzhou, People's Republic of China] ","The Beam Commissioning Plan of Injector II in C-ADS",32 34,
supb014,"B. Koubek, A. Schempp, J.S. Schmidt [IAP, Frankfurt am Main, Germany] J. Haeuser [Kress GmbH, Biebergemuend, Germany] ","RF Setup of the MedAustron RFQ",35 37,
supb015,"F. Scantamburlo, R. Dima, A. Pepato [INFN- Sez. di Padova, Padova, Italy] C. Roncolato [INFN/LNL, Legnaro (PD), Italy] ","Production and Quality Control of the First Modules of the IFMIF-EVEDA RFQ",38 40,
supb016,"A. Kolomiets [ITEP, Moscow, Russia] A.S. Plastun [MEPhI, Moscow, Russia] ","RFQ With Improved Energy Gain",41 43,
supb017,"J.S. Schmidt, B. Klump, B. Koubek, A. Schempp [IAP, Frankfurt am Main, Germany] ","Tuning Studies on 4-rod-RFQs",44 46,
supb018,"R. Ainsworth [Royal Holloway, University of London, Surrey, United Kingdom] S. Molloy [ESS, Lund, Sweden] ","Studies of Parasitic Cavity Modes for Proposed ESS Linac Lattices",47 49,
supb019,"C. Zhang, S. He, Y. He, S.C. Huang, Y.L. Huang, T.C. Jiang, R.X. Wang, M.X. Xu, Y.Z. Yang, W.M. Yue, S.H. Zhang, S.X. Zhang, H.W. Zhao [IMP, Lanzhou, People's Republic of China] ","The Multipacting Simulation for the New-Shaped QWR using TRACK3P",50 52,
supb020,"C. Zhang, S. He, Y. He, S.C. Huang, Y.L. Huang, T.C. Jiang, R.X. Wang, Y.Z. Yang, W.M. Yue, S.H. Zhang, S.X. Zhang, H.W. Zhao [IMP, Lanzhou, People's Republic of China] M.H. Xu [IHEP, Beijing, People's Republic of China] ","Structural Analysis of the New-Shaped QWR for HIAF in IMP",53 55,
supb022,"M. Busch, F.D. Dziuba, H. Podlech, U. Ratzinger [IAP, Frankfurt am Main, Germany] M. Amberg [HIM, Mainz, Germany] W.A. Barth, S. Mickat [GSI, Darmstadt, Germany] M. Pekeler [RI Research Instruments GmbH, Bergisch Gladbach, Germany] ","First Measurements on the 325 MHz Superconducting CH Cavity",56 58,
supb023,"F.D. Dziuba, M. Amberg, M. Busch, H. Podlech, U. Ratzinger [IAP, Frankfurt am Main, Germany] K. Aulenbacher [IKP, Mainz, Germany] W.A. Barth, S. Mickat [GSI, Darmstadt, Germany] ","Status of the Superconducting CW Demonstrator for GSI",59 61,
supb024,"Y. Fuwa, Y. Iwashita, H. Tongu [Kyoto ICR, Uji, Kyoto, Japan] S. Fukuda, S. Michizono [KEK, Ibaraki, Japan] ","Development of Permanent Magnet Focusing System for Klystrons",62 64,
supb025,"J.P. Holzbauer, A. Nassiri, G.J. Waldschmidt, G. Wu [ANL, Argonne, USA] ","Development of Superconducting Radio-Frequency (SRF) Deflecting Mode Cavities and Associated Waveguide Dampers for the APS Upgrade Short Pulse X-Ray Project",65 67,
supb026,"C.S. Hopper, J.R. Delayen [ODU, Norfolk, Virginia, USA] ","Multipacting Analysis of High-velocity Superconducting Spoke Resonators",68 70,
supb027,"S. He, Y. He, S.C. Huang, F.F. Wang, R.X. Wang, M.X. Xu, Y.Z. Yang, W.M. Yue, C. Zhang, S.H. Zhang, S.X. Zhang, H.W. Zhao [IMP, Lanzhou, People's Republic of China] ","Mechanical Study of the First Superconducting Half-wave Resonator for Injector II of CADS Project",71 73,
supb028,"M.X. Xu, S. He, Y. He, S.C. Huang, Y.L. Huang, T.C. Jiang, R.X. Wang, Z.J. Wang, J.W. Xia, Y.Z. Yang, W.M. Yue, C. Zhang, S.H. Zhang, S.X. Zhang, H.W. Zhao [IMP, Lanzhou, People's Republic of China] ","The Superconducting CH Cavity Development in IMP*",74 76,
supb029,"J.M. Vogt, J. Knobloch, O. Kugeler [HZB, Berlin, Germany] ","Impact of Trapped Flux and Systematic Flux Expulsion in Superconducting Niobium",77 79,
supb031,"W. Fang, Q. Gu, Z.T. Zhao [SINAP, Shanghai, People's Republic of China] D.C. Tong [TUB, Beijing, People's Republic of China] ","The Nonresonant Perturbation Theory Based Field Measurement and Tuning of a Linac Accelerating Structure",80 82,
supb032,"C.P. Wang, Q. Gu, Z.T. Zhao [SINAP, Shanghai, People's Republic of China] ","The C-band RF Pulse Compression for Soft XFEL at SINAP",83 85,
supb035,"S.M. Polozov, T.V. Bondarenko [MEPhI, Moscow, Russia] Y.A. Bashmakov [LPI, Moscow, Russia] ","RF Photoinjector and Radiating Structure for High-power THz Radiation Source",86 88,
supb037,"J.N. Bai, S. Xiao, T.G. Xu, L. Zeng [IHEP, Beijing, People's Republic of China] ","The Development of Timing Control System for RFQ",89 91,
supb038,"S.U. De Silva, J.R. Delayen [ODU, Norfolk, Virginia, USA] S.U. De Silva [JLAB, Newport News, Virginia, USA] ","Multipole Field Effects for the Superconducting Parallel-Bar Deflecting/Crabbing Cavities",92 94,
supb039,"S.U. De Silva [ODU, Norfolk, Virginia, USA] S.U. De Silva [JLAB, Newport News, Virginia, USA] ","Compact Superconducting Crabbing and Deflecting Cavities",95 99,
th1a01,"H. Hayano, M. Akemoto, S. Fukuda, K. Hara, N. Higashi, E. Kako, H. Katagiri, Y. Kojima, Y. Kondo, T. Matsumoto, S. Michizono, T. Miura, H. Nakai, H. Nakajima, K. Nakanishi, S. Noguchi, N. Ohuchi, T. Saeki, T. Shidara, T. Shishido, T. Takenaka, A. Terashima, N. Toge, K. Tsuchiya, K. Watanabe, S. Yamaguchi, A. Yamamoto, Y. Yamamoto, K. Yokoya [KEK, Ibaraki, Japan] C. Adolphsen, C.D. Nantista [SLAC, Menlo Park, California, USA] T.T. Arkan, S. Barbanotti, M.A. Battistoni, H. Carter, M.S. Champion, A. Hocker, R.D. Kephart, J.S. Kerby, D.V. Mitchell, T.J. Peterson, Y.M. Pischalnikov, M.C. Ross, W. Schappert, B.E. Smith [Fermilab, Batavia, USA] A. Bosotti, R. Paparella, P. Pierini [INFN/LASA, Segrate (MI), Italy] K. Jensch, D. Kostin, L. Lilje, A. Matheisen, W.-D. Moeller (W.-D. Möller), P. Schilling, M. Schmoekel (M. Schmökel), N.J. Walker, H. Weise [DESY, Hamburg, Germany] C. Pagani [Università degli Studi di Milano  INFN, Segrate, Italy] ","Results Achieved by the S1-Global Collaboration for ILC",748 752,
th1a02,"S.U. De Silva [ODU, Norfolk, Virginia, USA] S.U. De Silva [JLAB, Newport News, Virginia, USA] ","Compact Superconducting Crabbing and Deflecting Cavities",753 757,
th1a03,"J.R. Delayen [ODU, Norfolk, Virginia, USA] ","Superconducting Spoke Cavities for Electron and High-Velocity Proton Linacs",758 762,
th1a04,"A. Roy [IUAC, New Delhi, India] ","Superconducting Linac and Associated Developments at IUAC Delhi",763 767,
th2a004,"A. Gover [University of Tel-Aviv, Faculty of Engineering, Tel-Aviv, Israel] A. Nause [University of Tel Aviv, Tel Aviv, Israel] ","Computational Model Analysis for Experimental Observation of Optical Current Noise Suppression Below the Shot-noise Limit",783 786,
th2a01,"M. Lindroos, H. Danared, C. Darve, D.P. McGinnis, S. Molloy [ESS, Lund, Sweden] ","The ESS Linac Design",768 772,
th2a02,"P. Bertrand, R. Ferdinand [GANIL, Caen, France] ","SPIRAL2 Accelerator Construction Progress",773 777,
th2a03,"F. Gerigk, Y. Cuvet, A. Dallocchio, G. Favre, J.-M. Geisser, L. Gentini, J.-M. Giguet, S.J. Mathot, M. Polini, S. Ramberger, B. Riffaud, C. Rossi, P. Ugena Tirado, M. Vretenar, R. Wegner [CERN, Geneva, Switzerland] E. Kendjebulatov, Ya.G. Kruchkov, A.G. Tribendis [BINP SB RAS, Novosibirsk, Russia] M.Y. Naumenko [RFNC-VNIITF, Snezhinsk, Chelyabinsk region, Russia] ","Design and Construction of the Linac4 Accelerating Structures",778 782,
th3a01,"A. Yamamoto [KEK, Ibaraki, Japan] M.C. Ross [SLAC, Menlo Park, California, USA] N.J. Walker [DESY, Hamburg, Germany] ","Status of ILC",787 791,
th3a02,"F.C. Pilat [JLAB, Newport News, Virginia, USA] ","The 12 GeV Energy Upgrade at Jefferson Laboratory",792 796,
th3a03,"F. Zimmermann [CERN, Geneva, Switzerland] ","ERL-Based Lepton-Hadron Colliders: eRHIC and LHeC",797 801,
th3a04,"C.I. Clarke, E. Adli, S. Corde, F.-J. Decker, R.J. England, R.A. Erickson, A.S. Fisher, S.J. Gessner, C. Hast, M.J. Hogan, S.Z. Li, N. Lipkowitz, M.D. Litos, Y. Nosochkov, J.T. Seeman, J. Sheppard, I. Tudosa, G.R. White, U. Wienands, M. Woodley, Z. Wu, G. Yocky [SLAC, Menlo Park, California, USA] C.E. Clayton, C. Joshi, W. Lu, K.A. Marsh, N. Vafaei [UCLA, Los Angeles, California, USA] ","Plasmas, Dielectrics and the Ultrafast: First Science and Operational Experience at FACET",802 806,
thpb002,"J. Zhu, S. Chen, J. Deng, Y. Shen, J. Shi, W.D. Wang, L.S. Xia, H. Zhang, L.W. Zhang [CAEP/IFP, Mainyang, Sichuan, People's Republic of China] Y. Liu [Institute of Fluid Physics, China Academy of Engineering Physics, Mianyang,Sichuan, People's Republic of China] ","Preliminary Study of Proton Beam Transport in a 10 MeV Dielectric Wall Accelerator",840 842,
thpb003,"S.C. Joshi, J. Dwivedi, P.D. Gupta, P.R. Hannurkar, P. Khare, P.K. Kush, G. Mundra, A. Puntambekar, S.B. Roy, P. Shrivastava [RRCAT, Indore (M.P.), India] ","R&D Activities on High Intensity Superconducting Proton Linac at RRCAT",843 845,
thpb004,"D.C. Plostinar, C. Gabor [STFC/RAL/ASTeC, Chilton, Didcot, Oxon, United Kingdom] S.M.H. Alsari, M. Aslaninejad, A. Kurup, J.K. Pozimski, P. Savage [Imperial College of Science and Technology, Department of Physics, London, United Kingdom] J.J. Back [University of Warwick, Coventry, United Kingdom] G.E. Boorman, A. Bosco [Royal Holloway, University of London, Surrey, United Kingdom] M.A. Clarke-Gayther, D.C. Faircloth, S.R. Lawrie, A.P. Letchford [STFC/RAL/ISIS, Chilton, Didcot, Oxon, United Kingdom] S. Jolly [UCL, London, United Kingdom] ","Current Status of the RAL Front End Test Stand (FETS) Project",846 848,
thpb005,"C. Zhang, H. Klein, D. Mäder, H. Podlech, U. Ratzinger, A. Schempp, R. Tiede, M. Vossberg [IAP, Frankfurt am Main, Germany] ","Front-End Linac Design and Beam Dynamics Simulations for MYRRHA",849 851,
thpb006,"A. Almomani, M. Droba, I. Hofmann, U. Ratzinger [IAP, Frankfurt am Main, Germany] ","Post Acceleration of Laser-generated Proton Bunches by a CH-DTL",852 854,
thpb007,"U. Ratzinger, H. Podlech, A. Schempp, K. Volk [IAP, Frankfurt am Main, Germany] U. Hagen, O. Heid, T.J.S. Hughes [Siemens AG, Erlangen, Germany] H. Hoeltermann [BEVATECH OHG, Offenbach/Main, Germany] ","A Pulsed Linac Front-end for ADS Applications",855 857,
thpb008,"M. Heilmann, O. Meusel, D. Mäder, U. Ratzinger, A. Schempp, M. Schwarz [IAP, Frankfurt am Main, Germany] ","A Coupled RFQ-IH Cavity for the Neutron Source FRANZ",858 860,
thpb009,"D. Mäder, H. Klein, H. Podlech, U. Ratzinger, C. Zhang [IAP, Frankfurt am Main, Germany] ","Status of CH Cavity and Solenoid Design of the 17 MeV Injector for MYRRHA",861 863,
thpb010,"M. Vretenar, L. Arnaudon, P. Baudrenghien, G. Bellodi, C. Bertone, Y. Body, J.C. Broere, O. Brunner, M.C.L. Buzio, C. Carli, J.-P. Corso, J. Coupard, A. Dallocchio, N. Dos Santos, J.-F. Fuchs, A. Funken, R. Garoby, F. Gerigk, L. Hammouti, K. Hanke, J. Hansen, I. Kozsar, J.-B. Lallement, J. Lettry, A.M. Lombardi, L.A. Lopez Hernandez, C. Maglioni, S.J. Mathot, B. Mikulec, D. Nisbet, M.M. Paoluzzi, B. Puccio, U. Raich, S. Ramberger, F. Roncarolo, C. Rossi, N. Schwerg, R. Scrivens, G. Vandoni, J. Vollaire, R. Wegner, S. Weisz, Th. Zickler [CERN, Geneva, Switzerland] ","Progress in the Construction of Linac4 at CERN",864 866,
thpb011,"G. Bellodi, V.A. Dimov, L.M. Hein, J.-B. Lallement, A.M. Lombardi, O. Midttun, R. Scrivens [CERN, Geneva, Switzerland] P.A. Posocco [Imperial College of Science and Technology, Department of Physics, London, United Kingdom] ","Linac4 45 keV Proton Beam Measurements",867 869,
thpb012,"A.P. Zhukov, A.V. Aleksandrov [ORNL, Oak Ridge, Tennessee, USA] ","High Resolution Emittance Measurements at SNS Front End",870 872,
thpb013,"A.V. Aleksandrov, W. Blokland, Y. Liu, C.D. Long, A.P. Zhukov [ORNL, Oak Ridge, Tennessee, USA] ","Diagnostics Tools for Beam Halo Investigation in SNS Linac",873 875,
thpb014,"N. Solyak, J.-P. Carneiro, V.A. Lebedev, J.-F. Ostiguy, A. Saini [Fermilab, Batavia, USA] ","Lattice Design and Beam Dynamics Studies for Project X",876 878,
thpb015,"P. Varghese, B.W. Barnes, B. Chase, E. Cullerton, C.C. Tan [Fermilab, Batavia, USA] ","Performance of Ferrite Vector Modulators in the LLRF system of the Fermilab HINS 6-Cavity Test",879 881,
thpb016,"M. Popovic [Fermilab, Batavia, USA] ","Concept: Low Energy, Low Intensity NF from ProjectX",882 884,
thpb017,"M. Popovic, J.-F. Ostiguy [Fermilab, Batavia, USA] ","A Concept: 8GeV CW Linac, Staged Approach",885 887,
thpb020,"H. Ao, H. Asano, N. Ouchi, J. Tamura [JAEA/J-PARC, Tokai-mura, Japan] F. Naito, K. Takata [KEK, Ibaraki, Japan] ","Annular-ring Coupled Structure for the Energy Upgrade of the J-PARC Linac",888 890,
thpb021,"J. Tamura, H. Ao, H. Asano, T. Morishita, N. Ouchi [JAEA/J-PARC, Tokai-mura, Japan] Y. Sawabe [MELCO SC, Tsukuba, Japan] ","Recovery Efforts from the Tohoku Earthquake and Energy Upgrade Preparation of the Beam Transport from the J-PARC Linac to the 3-GeV Synchrotron",891 893,
thpb022,"H.S. Kim, Y.-S. Cho, J.-H. Jang, H.-J. Kwon, J.Y. Ryu, K.T. Seol, Y.-G. Song [KAERI, Daejon, Republic of Korea] ","Beam Phase Measurement for PEFP Linear Accelerator",894 896,
thpb023,"S. Fu, J. Li, H.C. Liu, H.F. Ouyang, X. Yin [IHEP, Beijing, People's Republic of China] ","Linac Construction for China Spallation Neutron Source",897 899,
thpb024,"F. Yan, Z. Li, C. Meng, J.Y. Tang [IHEP, Beijing, People's Republic of China] ","Main Linac Physics Design Study of the C-ADS Project",900 902,
thpb025,"S. Pei, X. Li, H.F. Ouyang, J.R. Zhang [IHEP, Beijing, People's Republic of China] ","325 MHz CW Room Temperature High Power Bunching Cavity for the China ADS MEBT1",903 905,
thpb026,"Z.J. Wang, Y. He, H. Jia, C. Li, S.H. Liu, W. Wu, X.B. Xu, B. Zhang, H.W. Zhao [IMP, Lanzhou, People's Republic of China] ","The Beam Commissioning Plan of Injector II in C-ADS",906 908,
thpb027,"Y. He, J. Meng, A. Shi, Z.J. Wang, J.X. Wu, W. Wu, H.S. Xu, Z. Xu, B. Zhang, J.H. Zhang, S.H. Zhang, Z.M. Zhang, H.W. Zhao, Z.Z. Zhou [IMP, Lanzhou, People's Republic of China] D. Li [LBNL, Berkeley, California, USA] ","Progress of one of 10 MeV superconducting proton linear Injectors for C-ADS",909 911,
thpb028,"L. Neri, L. Calabretta, A.C. Caruso, L. Celona, S. Gammino, A. Longhitano, D. Mascali [INFN/LNS, Catania, Italy] B. Cheymol, A. Ponton [ESS, Lund, Sweden] ","The ESS Low Energy Beam Transport Line Design",912 914,
thpb029,"A. Ponton [ESS, Lund, Sweden] ","The ESS RFQ Beam Dynamics Design",915 917,
thpb030,"M. Comunian, F. Grespan, A. Pisent [INFN/LNL, Legnaro (PD), Italy] R. De Prisco [Lund University, Lund, Sweden] M. Eshraqi [ESS, Lund, Sweden] P. Mereu [INFN-Torino, Torino, Italy] ","DTL Design for ESS",918 920,
thpb031,"B. Pottin, M. Desmons, A. France, R. Gobin, O. Piquet [CEA/DSM/IRFU, France] ","Status Report on the French High-intensity Proton Injector Project at SACLAY (IPHI)",921 923,
thpb032,"D.C. Plostinar, C.R. Prior, G.H. Rees [STFC/RAL/ASTeC, Chilton, Didcot, Oxon, United Kingdom] ","Beam Dynamics Design Aspects for a Proposed 800 MeV H- ISIS Linac",924 926,
thpb034,"L. Groening, W.A. Barth, R. Berezov, G. Clemente, P. Forck, R. Hollinger, A. Kraemer (A. Krämer), C. Muehle (C. Mühle), J. Pfister, G. Schreiber, J. Trueller (J. Trüller), W. Vinzenz, C. Will [GSI, Darmstadt, Germany] N. Chauvin, O. Delferriere (O. Delferrière), O. Tuske [CEA/IRFU, Gif-sur-Yvette, France] B. Koubek, H. Podlech, U. Ratzinger, A. Schempp, R. Tiede [IAP, Frankfurt am Main, Germany] B. Laune (B. Launé), J. Lesrel [IPN, Orsay, France] C.S. Simon [CEA/DSM/IRFU, France] ","Status of the FAIR 70 MeV Proton Linac",927 929,
thpb035,"P. Gerhard, W.A. Barth, L.A. Dahl, W. Hartmann, G. Schreiber, W. Vinzenz, H. Vormann [GSI, Darmstadt, Germany] ","Experience with a 4-Rod CW Radio Frequency Quadrupole",930 932,
thpb036,"A.D. Kovalenko [JINR, Dubna, Moscow Region, Russia] A. Kolomiets [ITEP, Moscow, Russia] ","The New Option for a Front End of Ion Linac",933 935,
thpb037,"M. Okamura [BNL, Upton, Long Island, New York, USA] P.J. Jandovitz [Cornell University, Ithaca, New York, USA] T. Kanesue [IAP, Frankfurt am Main, Germany] M. Sekine [RLNR, Tokyo, Japan] T. Yamamoto [RISE, Tokyo, Japan] ","Iron Beam Acceleration with DPIS",936 938,
thpb038,"C. Rossi, A. Dallocchio, J. Hansen, J.-B. Lallement, A.M. Lombardi, S.J. Mathot, D. Pugnat, M.A. Timmins, G. Vandoni, M. Vretenar [CERN, Geneva, Switzerland] M. Desmons, A. France, Y. Le Noa, J. Novo, O. Piquet [CEA/DSM/IRFU, France] ","Assembly and RF Tuning of the Linac4 RFQ at CERN",939 941,
thpb039,"Z.L. Zhang, X. Du, Y. He, X. Jin, C. Li, Y. Liu, A. Shi, L.P. Sun, B. Zhang, H.W. Zhao [IMP, Lanzhou, People's Republic of China] M.D. Hoff, A.R. Lambert, D. Li, J.W. Staples, S.P. Virostek [LBNL, Berkeley, California, USA] J. Wang [Lanzhou University of Technology, People's Republic of China] C. Zhang [IAP, Frankfurt am Main, Germany] ","Design of a Four-Vane RFQ for China ADS Project",942 944,
thpb040,"E. Fagotti, L. Antoniazzi, F. Grespan, A. Palmieri [INFN/LNL, Legnaro (PD), Italy] M. Desmons [CEA/DSM/IRFU, France] ","High-Power RF Conditioning of the TRASCO RFQ",945 947,
thpb042,"F. Scantamburlo, R. Dima, A. Pepato [INFN- Sez. di Padova, Padova, Italy] C. Roncolato [INFN/LNL, Legnaro (PD), Italy] ","Production and Quality Control of the First Modules of the IFMIF-EVEDA RFQ",948 950,
thpb043,"M. Comunian, F. Grespan, A. Palmieri, A. Pisent [INFN/LNL, Legnaro (PD), Italy] ","The RFQ injector for the Radioactive Ion Beam of SPES Project",951 953,
thpb044,"M.S. Champion, A.V. Aleksandrov, M.T. Crofford, D. Heidenreich, Y.W. Kang, J. Moss, R.T. Roseberry, J.P. Schubert [ORNL, Oak Ridge, Tennessee, USA] ","Plans for an Integrated Front-End Test Stand at the Spallation Neutron Source",954 956,
thpb046,"B. Koubek, A. Schempp, J.S. Schmidt [IAP, Frankfurt am Main, Germany] J. Haeuser [Kress GmbH, Biebergemuend, Germany] ","RF Setup of the MedAustron RFQ",957 959,
thpb047,"M. Vossberg, H. Klein, H. Podlech, A. Schempp, C. Zhang [IAP, Frankfurt am Main, Germany] A. Bechtold [NTG Neue Technologien GmbH  Co KG, Gelnhausen, Germany] ","Test RFQ for the MAX Project",960 962,
thpb049,"J.S. Schmidt, B. Klump, B. Koubek, A. Schempp [IAP, Frankfurt am Main, Germany] ","Tuning Studies on 4-Rod-RFQs",963 965,
thpb050,"A. Kolomiets [ITEP, Moscow, Russia] A.S. Plastun [MEPhI, Moscow, Russia] ","RFQ With Improved Energy Gain",966 968,
thpb051,"D. Raparia, J.G. Alessi, B. Briscoe, J.M. Fite, O. Gould, V. LoDestro, M. Okamura, J. Ritter, A. Zelenski [BNL, Upton, Long Island, New York, USA] ","Improvements at the BNL 200 MeV Linac",969 971,
thpb052,"Y. Kondo, K. Hasegawa, T. Morishita [JAEA/J-PARC, Tokai-Mura, Naka-Gun, Ibaraki-Ken, Japan] H. Kawamata, F. Naito, T. Sugimura [KEK, Ibaraki, Japan] ","Recent Progress with the J-PARC RFQs",972 974,
thpb055,"J.-F. Ostiguy, A. Saini, N. Solyak [Fermilab, Batavia, USA] ","Numerical Simulations of ProjectX/PXIE RFQ",975 977,
thpb061,"I. Haber, B.L. Beaudoin, S. Bernal, R.A. Kishek, T.W. Koeth, Y. Mo [UMD, College Park, Maryland, USA] ","Experimental and Simulation Study of the Long-path-length Dynamics of a Space-charge-dominated Bunch",978 980,
thpb062,"S.U. De Silva, J.R. Delayen [ODU, Norfolk, Virginia, USA] S.U. De Silva [JLAB, Newport News, Virginia, USA] ","Multipole Field Effects for the Superconducting Parallel-Bar/RF-Dipole Deflecting/Crabbing Cavities",981 983,
thpb063,"C. Dickerson, S.A. Kondrashev, B. Mustapha, P.N. Ostroumov [ANL, Argonne, USA] ","Simulated Performance of the CARIBU EBIS Charge Breeder Transport Line",984 986,
thpb064,"A.S. Setty [THALES, Colombes, France] ","Beam Dynamics Tools for Linacs Design",987 989,
thpb065,"E. Tanke, J.A. Rodriguez, W. Wittmer, X. Wu [FRIB, East Lansing, Michigan, USA] S. Valero [CEA, Gif-sur-Yvette, France] D. Wang [NSCL, East Lansing, Michigan, USA] ","Status of the Beam Dynamics Code DYNAC",990 992,
thpb066,"A. Neumann, W. Anders, T. Kamps, J. Knobloch [HZB, Berlin, Germany] E.N. Zaplatin [FZJ, Jülich, Germany] ","Photoinjector SRF Cavity Development for BERLinPro",993 995,
thpb068,"H. Tomizawa, H. Dewa, A. Mizuno, T. Taniuchi [JASRI/SPring-8, Hyogo, Japan] ","First Observation of Photoemission Enhancement from Copper Cathode Illuminated by Z-Polarized Laser Pulse",996 998,
thpb069,"T. Kamps, A. Neumann, J. Voelker (J. Völker) [HZB, Berlin, Germany] ","Beam Dynamics Studies for SRF Photoinjectors",999 1001,
thpb073,"C. Christou, S.A. Pande [Diamond, Oxfordshire, United Kingdom] ","Initial RF Tests of the Diamond S-Band Photocathode Gun",1002 1004,
thpb074,"S.M. Polozov, T.V. Bondarenko [MEPhI, Moscow, Russia] Y.A. Bashmakov [LPI, Moscow, Russia] ","RF Photoinjector and Radiating Structure for High-power THz Radiation Source",1005 1007,
thpb076,"L. Celona, L. Allegra, C. Caliri, G. Castro, G. Ciavola, R. Di Giugno, S. Gammino, D. Mascali, L. Neri [INFN/LNS, Catania, Italy] ","Design Issues of the Proton Source for the ESS Facility",1008 1010,
thpb079,"W. Wu, S.F. Han, Y. He, L.Z. Ma, D.S. Ni, Z.J. Wang, B.M. Wu, W.J. Yang, X.L. Yang, S.J. Zheng, L. Zhu [IMP, Lanzhou, People's Republic of China] ","Development of a Superconducting Focusing Solenoid for CADS",1011 1013,
thpb081,"J.N. Bai, S. Xiao, T.G. Xu, L. Zeng [IHEP, Beijing, People's Republic of China] ","The Development of Timing Control System for RFQ",1014 1016,
thpb083,"C. Madec [CEA, Gif-sur-Yvette, France] S. Berry, J.-P. Charrier, A. Dael (A. Daël), M. Fontaine, Y. Gasser, O. Napoly, Y. Sauce, C.S. Simon, T.V. Vacher, B. Visentin [CEA/DSM/IRFU, France] A. Brasseur, P. Charon, C. Cloue (C. Cloué), S. Langlois, G. Monnereau, J.L. Perrin, D. Roudier, N. Sacepe (N. Sacépé) [CEA/IRFU, Gif-sur-Yvette, France] ","Status of E-XFEL String and Cryomodule Assembly at CEA-Saclay",1017 1019,
thpb084,"J.-W. Kim, D.G. Kim [IBS, Daejeon, Republic of Korea] C.K. Hwang [KAERI, Daejon, Republic of Korea] ","A Low-Level RF Control System for a Quarter-Wave Resonator",1020 1022,
thpb085,"J. Branlard, V. Ayvazyan, O. Hensler, H. Schlarb, Ch. Schmidt, N.J. Walker, M. Walla [DESY, Hamburg, Germany] G.I. Cancelo, B. Chase [Fermilab, Batavia, USA] J. Carwardine [ANL, Argonne, USA] W. Cichalewski, W. Jalmuzna (W. Jałmużna) [TUL-DMCS, Lodz, Poland] S. Michizono [KEK, Ibaraki, Japan] ","LLRF Automation for the 9mA ILC Tests at FLASH",1023 1025,
