mod1a01,"G. Rehm, M. G. Abbott, J. Rowland, I. Uzun, Diamond, Oxfordshire","Digital EBPMs at Diamond: Operational Experience and Integration into a Fast Global Orbit Feedback",24 26,
mod1a03,"U. Iriso, A. Olmos, ALBA, Bellaterra","Electron Beam Diagnostics for the ALBA Light Source",27 29,
moo1a02,"E. Bravin, CERN, Geneva","High Resolution Transverse Profile Measurement",99 98,
moo1a03,"G. Kube, DESY, Hamburg","Review of Synchrotron Radiation based Diagnostics for Transverse Profile Measurements",6 10,
moo2a01,"V. Malka, LOA, Palaiseau","Physics And Diagnostics Of Laser-Plasma Accelerators",11 16,
moo2a02,"C. Gerth, DESY, Hamburg","Electron Beam Diagnostics for the European X-Ray Free-Electron Laser",17 19,
moo2a03,"M. Ferianis, ELETTRA, Basovizza, Trieste","FERMI@elettra Diagnostics",20 23,
moo3a01,"A. Toyoda, A. Agari, E. Hirose, M. Ieiri, Y. Katoh, M. Minakawa, H. Noumi, Y. Sato, Y. Suzuki, H. Takahashi, M. Takasaki, K. H. Tanaka, H. Watanabe, Y. Yamanoi, KEK, Tsukuba","Optical Transition Radiation Monitor for High Intensity Proton Beam at the J-PARC",30 32,
moo3a02,"F. Becker, C. A. Andre, P. Forck, GSI, Darmstadt; D. Hoffmann, TU Darmstadt, Darmstadt","Beam Induced Fluorescence (BIF) Monitor for Transverse Profile Determination of 5 to 750 MeV/u Heavy Ion Beams",33 35,
moo3a03,"G. Decker, ANL, Argonne, Illinois; S. G. Arutunian, M. R. Mailian, YerPhI, Yerevan; G. Rosenbaum, UGA, Athens, Georgia","First Vibrating Wire Monitor Measurements of a Hard X-ray Undulator Beam at the Advanced Photon Source",36 38,
tuo1a01,"J. M. Brennan, M. Blaskiewicz, F. Severino, BNL, Upton, Long Island, New York","Bunched Beam Stochastic Cooling for RHIC",39 42,
tuo1a02,"R. J. Steinhagen, CERN, Geneva","Feedbacks on Tune and Chromaticity",43 47,
tuo1a03,"J. M. Koch, F. Epaud, G. A. Naylor, E. Plouviez, ESRF, Grenoble","Beam Diagnostic Features of the ESRF Multibunch Feedback",48 50,
tupb01,"G. R. Tassotto, H. Nguyen, D. P. Schoo, G. W. Sellberg, Fermilab, Batavia, Illinois","A Fiber Profile Monitor for low Beam Intensities.",51 53,
tupb02,"J. D. Fox, T. Mastorides, SLAC, Menlo Park, California","Stripline Transversal Filter Techniques For Sub-Picosecond Bunch Timing Measurements",54 56,
tupb03,"I. Podadera Aliseda, L. Soby, CERN, Geneva","Precision Beam Position Monitor for EUROTeV",57 59,
tupb04,"M. Lonza, L. Battistello, D. Bulfone, R. De Monte, S. Fontanini, V. Forchi', G. Gaio, F. Giacuzzo, R. Marizza, R. Passuello, L. Pivetta, C. Scafuri, ELETTRA, Basovizza, Trieste","BPM detectors upgrade for the ELETTRA Fast Orbit Feedback",60 62,
tupb05,"B. Buonomo, INFN/LNF, Frascati (Roma); L. G. Foggetta, S. Hasan, Univ. Insubria and INFN Milano, Como; G. Mazzitelli, INFN/LNF, Frascati (Roma); A. Mozzanica, Univ. Insubria and INFN Milano, Como; F. Murtas, INFN/LNF, Frascati (Roma); M. Prest, Univ. Insubria and INFN Milano, Como; L. Quintieri, INFN/LNF, Frascati (Roma); P. Valente, INFN-Roma, Roma; E. Vallazza, INFN-Trieste, Trieste","A Tagged Photon Source at the Frascati Beam-Test Facility (BTF)",63 65,
tupb06,"A. A. Galatis, P. Forck, K. Lang, A. Peters, GSI, Darmstadt","First Tests with the Sis18 Digital BPM System*",66 68,
tupb07,"K. B. Scheidt, ESRF, Grenoble","Electric -In-Air-X-Ray- Detectors for high Resolution Vertical Beam Position Measurement at the ESRF",69 71,
tupb08,"K. B. Scheidt, ESRF, Grenoble","Measurement of Vertical Emittance with a system of Six -In-Air-X-Ray- Projection Monitors at the ESRF",72 74,
tupb09,"G. Kasprowicz, J. M. Belleman, U. Raich, CERN, Geneva","Digital Beam Trajectory and Orbit System, for the CERN Proton Synchrotron",75 77,
tupb10,"J. D. Gilpatrick, B. Blind, S. S. Kurennoy, R. C. McCrady, J. F. O'Hara, C. Pillai, J. F. Power, L. Rybarcyk, LANL, Los Alamos, New Mexico","Proposed Beam Position and Phase Measurements for the LANSCE Linac",78 80,
tupb11,"D. A. Lee, Imperial College of Science and Technology, Department of Physics, London; C. Gabor, STFC/RAL/ASTeC, Chilton, Didcot, Oxon; J. K. Pozimski, STFC/RAL, Chilton, Didcot, Oxon; P. Savage, Imperial College of Science and Technology, Department of Physics, London","A laserwire beam profile measuring device for the RAL Front End Test Stand",81 83,
tupb12,"D. Noelle, N. Baboi, K. Knaack, D. Lipka, J. Lund-Nielsen, N. Mildner, R. Neumann, F. Schmidt-Foehre, M. Siemens, T. Traber, S. Vilcins, DESY, Hamburg","BPMs for the XFEL Cryo module",84 86,
tupb13,"J. Roensch, Uni HH, Hamburg; J. W. Baehr, S. Khodyachykh, S. A. Korepanov, M. Krasilnikov, S. Rimjaem, DESY Zeuthen, Zeuthen; J. Rossbach, Uni HH, Hamburg; L. Staykov, F. Stephan, DESY Zeuthen, Zeuthen","Design Considerations of a Spectrometer Dipole Magnet for the Photo Injector Test facility at DESY in Zeuthen (PITZ)",87 89,
tupb14,"D. A. Liakin, S. V. Barabin, ITEP, Moscow; P. Forck, T. Giacomini, GSI, Darmstadt; A. Y. Orlov, ITEP, Moscow","Test of a Silicon Photomultiplier for Ionization Profile Monitor Applications",90 92,
tupb15,"C. Simon, CEA, Gif-sur-Yvette; N. Baboi, DESY, Hamburg; S. Chel, P. Contrepois, P. Girardot, M. Luong, CEA, Gif-sur-Yvette; N. Rouvière, IPN, Orsay","Beam Position Monitors Using a Re-entrant Cavity",93 95,
tupb16,"P. Kowina, W. Kaufmann, J. Schoelles, GSI, Darmstadt","Optimization of the Linear-cut Beam Position Monitors Based on Finite Element Methods",96 98,
tupb17,"W. Farabolini, D. Bogard, A. Brabant, A. Curtoni, P. Girardot, F. Gobin, R. Granelli, F. Harrault, C. L.H. Lahonde-Hamdoun, T. Lerch, M. Luong, A. Mosnier, F. Orsini, F. Peauger, C. Simon, CEA, Gif-sur-Yvette","Diagnostics for the CTF3 Probe Beam Linac CALIFES",99 101,
tupb18,"G. A. Naylor, B. Joly, ESRF, Grenoble","Measurement of Electron Beam Charge in the ESRF Accelerator Complex for Absolute and Injection Efficency Measurements Using an FPGA Based Digital BPM Electronics",102 104,
tupb19,"G. Kube, M. Werner, DESY, Hamburg","Signal Level Calculation for the PETRA-III Beam Position Monitor System",105 107,
tupb20,"K. E. Hacker, F. Loehl, H. Schlarb, DESY, Hamburg","Large Horizontal Aperture BPM and Precision Bunch Arrival Pickup",108 110,
tupb21,"P. Hartmann, J. Fuersch, D. Schirmer, T. Weis, K. Wille, DELTA, Dortmund","Experience with Libera Beam Position Monitors at DELTA",111 113,
tupb22,"S. Sasaki, T. Fujita, M. Shoji, T. Takashima, JASRI/SPring-8, Hyogo-ken","Renewal of BPM Electronics of SPring-8 Storage Ring",114 116,
tupb23,"G. Asova, K. Floettmann, DESY, Hamburg; D. J. Holder, STFC/DL/ASTeC, Daresbury, Warrington, Cheshire; S. Khodyachykh, M. Krasilnikov, DESY Zeuthen, Zeuthen; B. D. Muratori, STFC/DL/ASTeC, Daresbury, Warrington, Cheshire; F. Stephan, DESY Zeuthen, Zeuthen","Design Considerations for Phase Space Tomography Diagnostics at the PITZ Facility",117 119,
tupb24,"G. Tranquille, C. B. Bal, V. Prieto, R. S. Sautier, CERN, Geneva","First Results from the LEIR Ionisation Profile Monitors",120 122,
tupb25,"W. Goettmann, HMI, Berlin; M. Koerfer, DESY, Hamburg; F. Wulf, HMI, Berlin","Beam Profile Measurement with Optical Fiber Sensors at FLASH",123 125,
tupb26,"E. D. van Garderen, M. Böge, J. T.M. Chrin, J. Krempasky, V. Schlott, T. Schmidt, A. Streun, PSI, Villigen","Characterisation of the Systematic Effects of the Insertion Devices with Photon Beam Position Monitors",126 128,
tupb27,"Å. Andersson, MAX-lab, Lund; O. V. Chubar, SOLEIL, Gif-sur-Yvette; A. Luedeke, M. Rohrer, V. Schlott, A. Streun, PSI, Villigen","Recent Results from the Electron Beam Profile Monitor at the Swiss Light Source",129 131,
tupb28,"T. Lefevre, C. B. Bal, E. Bravin, S. Burger, B. Goddard, S. C. Hutchins, T. Renaglia, CERN, Geneva","A Large Scintillating Screen for the LHC Dump Line",132 134,
tupb29,"M. Krasilnikov, DESY, Hamburg; J. W. Baehr, M. Hänel, F. Stephan, DESY Zeuthen, Zeuthen; I. Will, MBI, Berlin","Experimental Optimization of the Cathode Laser Temporal Profile",135 137,
tupb30,"C. H. Kuo, J. Chen, P. C. Chiu, K. T. Hsu, S. Y. Hsu, D. Lee, C. Y. Wu, NSRRC, Hsinchu","Applications of IEEE-1394 and GigE Vision Digital Camera in the TLS",138 140,
tupb31,"T. Bogey, O. R. Jones, CERN, Geneva","The Beam Position System of the CERN Neutrino to Gran Sasso Proton Beam Line",141 143,
tupb32,"S. A. Korepanov, DESY Zeuthen, Zeuthen; D. Alesini, INFN/LNF, Frascati (Roma); L. Ficcadenti, Rome University La Sapienza, Roma; M. Krasilnikov, F. Stephan, DESY Zeuthen, Zeuthen","An RF Deflector for the Longitudinal and Transverse Beam Phase Space Analysis at PITZ",144 146,
tupc02,"Ye. Ivanisenko, G. Asova, J. W. Baehr, DESY Zeuthen, Zeuthen; O. Kalekin, Erlangen University, Erlangen; S. A. Korepanov, M. Krasilnikov, B. Petrosyan, F. Stephan, DESY Zeuthen, Zeuthen","Photo Injector Cathode Laser Beam Intensity and Pointing Position Diagnostics at PITZ",147 149,
tupc03,"C. Gerth, DESY, Hamburg","Synchrotron Radiation Monitor for Energy Spectrum Measurements in the Bunch Compressor at FLASH",150 152,
tupc05,"R. Spesyvtsev, J. W. Baehr, S. Khodyachykh, L. Staykov, DESY Zeuthen, Zeuthen","Screen studies at PITZ",153 155,
tupc06,"M. Veronese, S. Di Mitri, M. Ferianis, ELETTRA, Basovizza, Trieste","Coherent Radiation Studies For The FERMI@Elettra Relative Bunch Length Diagnostics",156 158,
tupc07,"S. Khodyachykh, J. W. Baehr, DESY Zeuthen, Zeuthen; T. Garvey, LAL, Orsay; M. Krasilnikov, A. Oppelt, DESY Zeuthen, Zeuthen; J. Roensch, Uni HH, Hamburg; L. Staykov, F. Stephan, DESY Zeuthen, Zeuthen","Design and Construction of the Multipurpose Dispersive Section at PITZ",159 161,
tupc08,"P. Cameron, BNL, Upton, Long Island, New York; M. Gasior, CERN, Geneva; A. Jansson, C.-Y. Tan, Fermilab, Batavia, Illinois","Quadrupole Transfer Function for Emittance Measurement",162 164,
tupc09,"P. Craievich, C. Bontoiu, M. Ferianis, ELETTRA, Basovizza, Trieste; M. Poggi, INFN/LNL, Legnaro, Padova; V. V. Smaluk, BINP SB RAS, Novosibirsk; G. Trovato, ELETTRA, Basovizza, Trieste","Design of the cavity BPM system for FERMI@elettra",165 167,
tupc10,"P. Craievich, ELETTRA, Basovizza, Trieste; D. Alesini, INFN/LNF, Frascati (Roma); S. Di Mitri, M. Ferianis, ELETTRA, Basovizza, Trieste; M. Petronio, DEEI, Trieste; M. Veronese, ELETTRA, Basovizza, Trieste","A transverse RF deflecting cavity for the FERMI@elettra project",168 170,
tupc11,"L. Badano, M. Ferianis, M. Trovo, M. Veronese, ELETTRA, Basovizza, Trieste","The Beam Diagnostics System for the FERMI@elettra Photoinjector",171 173,
tupc12,"I. Krouptchenkov, K. Wittenburg, DESY, Hamburg","FPGA based Frame Grabber for Video Beam Diagnostics",174 176,
tupc13,"R. De Monte, ELETTRA, Basovizza, Trieste","The new Diode BPM system for ELETTRA",177 179,
tupc16,"M.-A. Tordeux, L. Cassinari, O. V. Chubar, J.-C. Denard, D. Pedeau, B. Pottin, SOLEIL, Gif-sur-Yvette","Ultimate Resolution of Soleil X-Ray Pinhole Camera",180 182,
tupc18,"A. M. Tron, LPI, Moscow; T. V. Gorlov, MEPhI, Moscow","New Type Photocathode for X-Ray Streak Camera of the 10-Fs Resolution",183 185,
tupc19,"A. Olmos, F. Pérez, ALBA, Bellaterra; G. Rehm, Diamond, Oxfordshire","Matlab Code for BPM Button Geometry Computation",186 188,
tupc20,"N. Hubert, L. Cassinari, J.-C. Denard, N. L. Leclercq, A. Nadji, L. S. Nadolski, D. Pedeau, SOLEIL, Gif-sur-Yvette","The SOLEIL BPM and Orbit Feedback Systems",189 191,
tupc23,"A. Lunin, G. Romanov, N. Solyak, M. Wendt, Fermilab, Batavia, Illinois","Design of a Submicron Resolution Cavity BPM for the ILC Main Linac",192 194,
tupc24,"H. R. Kremers, J. P.M. Beijers, S. Brandenburg, KVI, Groningen","A Versatile Emittance Meter and Profile Monitor",195 197,
tupc25,"V. Schlott, Å. Andersson, M. Dach, S. C. Leemann, M. Rohrer, A. Streun, PSI, Villigen","Design and Calibration of an Emittance Monitor for the PSI XFEL Project",198 200,
tupc26,"J. Lund-Nielsen, N. Baboi, DESY, Hamburg; W. Riesch, DESY Zeuthen, Zeuthen","Button Beam Position Monitors for FLASH",201 203,
weo1a01,"A. Winter, DESY, Hamburg","Sub-ps Timing and Synchronization Systems for Longitudinal Electron Bunch Profile Measurements",204 208,
weo1a02,"J. M. Byrd, LBNL, Berkeley, California","Progress in Ultrafast X-ray Streak Cameras",209 214,
weo1a03,"T. Lefevre, CERN, Geneva; D. Alesini, C. Biscari, INFN/LNF, Frascati (Roma); H.-H. Braun, E. Bravin, CERN, Geneva; B. Buonomo, INFN/LNF, Frascati (Roma); S. Burger, CERN, Geneva; O. Coiro, INFN/LNF, Frascati (Roma); R. Corsini, CERN, Geneva; P. Craievich, ELETTRA, Basovizza, Trieste; A. E. Dabrowski, NU, Evanston; S. Doebert, CERN, Geneva; M. Ferianis, ELETTRA, Basovizza, Trieste; A. Ferrari, UU/ISV, Uppsala; A. Ghigo, F. Marcellini, B. Preger, INFN/LNF, Frascati (Roma); L. Soby, F. Tecker, P. Urschütz, CERN, Geneva; M. Velasco, NU, Evanston; M. Veronese, ELETTRA, Basovizza, Trieste; C. P. Welsch, CERN, Geneva","Instrumentation for Longitudinal Beam Gymnastics in FEL's and in the CLIC test facility 3",215 217,
weo2a01,"S. Jolly, Imperial College of Science and Technology, Department of Physics, London; D. C. Faircloth, STFC/RAL, Chilton, Didcot, Oxon; C. Gabor, STFC/RAL/ASTeC, Chilton, Didcot, Oxon; D. A. Lee, Imperial College of Science and Technology, Department of Physics, London; J. K. Pozimski, STFC/RAL, Chilton, Didcot, Oxon; P. Savage, Imperial College of Science and Technology, Department of Physics, London","Beam Diagnostics for the Front End Test Stand at RAL",218 220,
weo2a02,"P. J. Phillips, UAD, Dundee; G. Berden, FOM Rijnhuizen, Nieuwegein; W. A. Gillespie, University of Dundee, Nethergate, Dundee, Scotland; S. P. Jamison, STFC/DL/ASTeC, Daresbury, Warrington, Cheshire; E.-A. Knabbe, DESY, Hamburg; A. MacLeod, UAD, Dundee; B. Schmidt, P. Schmüser, B. Steffen, DESY, Hamburg; A. F.G. van der Meer, FOM Rijnhuizen, Nieuwegein","Single Shot Longitudinal Bunch Profile Measurements by Temporally Resolved Electro-Optical Detection",221 223,
weo2a03,"A. Cianchi, INFN-Roma II, Roma; D. Alesini, INFN/LNF, Frascati (Roma); A. Bacci, INFN-Milano, Milano; M. Bellaveglia, R. Boni, M. Boscolo, M. Castellano, INFN/LNF, Frascati (Roma); L. Catani, INFN-Roma II, Roma; E. Chiadroni, INFN/LNF, Frascati (Roma); S. Cialdi, INFN-Milano, Milano; A. Clozza, INFN/LNF, Frascati (Roma); A. M. Cook, UCLA, Los Angeles, California; L. Cultrera, G. Di Pirro, A. Drago, INFN/LNF, Frascati (Roma); M. P. Dunning, UCLA, Los Angeles, California; A. Esposito, M. Ferrario, D. Filippetto, INFN/LNF, Frascati (Roma); P. Frigola, UCLA, Los Angeles, California; V. Fusco, A. Gallo, G. Gatti, A. Ghigo, INFN/LNF, Frascati (Roma); L. Giannessi, ENEA C. R. Frascati, Frascati (Roma); M. Incurvati, C. Ligi, INFN/LNF, Frascati (Roma); M. Migliorati, A. Mostacci, Rome University La Sapienza, Roma; P. Musumeci, UCLA, Los Angeles, California; E. Pace, INFN/LNF, Frascati (Roma); L. Palumbo, Rome University La Sapienza, Roma; L. Pellegrino, INFN/LNF, Frascati (Roma); M. Petrarca, INFN-Roma, Roma; M. Quattromini, ENEA C. R. Frascati, Frascati (Roma); R. Ricci, C. Ronsivalle, INFN/LNF, Frascati (Roma); J. B. Rosenzweig, UCLA, Los Angeles, California; A. R. Rossi, INFN-Milano, Milano; C. Sanelli, INFN/LNF, Frascati (Roma); L. Serafini, INFN-Milano, Milano; M. Serio, F. Sgamma, B. Spataro, F. Tazzioli, S. Tomassini, C. Vaccarezza, M. Vescovi, C. Vicario, INFN/LNF, Frascati (Roma)","Advanced Measurements at the SPARC Photoinjector",224 228,
weo3a01,"D. M. Treyer, PSI, Villigen","Low-Latency High-Resolution Single-Shot Beam Position Monitors",376 380,
weo3a02,"M. Schwickert, A. Peters, GSI, Darmstadt","Diagnostic Instrumentation for Medical Accelerator Facilities",381 385,
wepb01,"M. Justus, FZD, Dresden; P. Evtushenko, Jefferson Lab, Newport News, Virginia; U. Lehnert, P. Michel, FZD, Dresden","Design of an Electron Beam Energy Control Loop Using Transverse Dispersion",229 231,
wepb02,"B. Keil, G. J. Behrmann, M. Dehler, R. Kramert, PSI, Villigen; J. Lund-Nielsen, DESY, Hamburg; G. Marinkovic, PSI, Villigen; D. Noelle, DESY, Hamburg; P. Pollet, M. Roggli, M. Rohrer, T. Schilcher, V. Schlott, PSI, Villigen; M. Siemens, DESY, Hamburg; D. M. Treyer, PSI, Villigen; S. Vilcins, DESY, Hamburg","Design of an Intra-Bunch-Train Feedback System for the European X-Ray FEL",232 234,
wepb03,"A. Winter, DESY, Hamburg; F. O. Ilday, Bilkent University, Bilkent, Ankara; B. Steffen, DESY, Hamburg","Femtosecond Yb-Doped Fiber Laser System at 1 um of Wavelength with 100-nm Bandwidth and Variable Pulse Structure for Accelerator Diagnostics",235 237,
wepb04,"A. N. Zhuravlev, S. I. Gluhov, V. F. Gurko, A. D. Khilchenko, V. A. Kiselev, A. N. Kvashnin, E. B. Levichev, O. I. Meshkov, P. A. Piminov, V. V. Smaluk, P. V. Zubarev, BINP SB RAS, Novosibirsk","The VEPP-4M Dynamic Aperture Determination Through the Precise Measurement of the Beam Lifetime",238 240,
wepb05,"M. Labat, L. Cassinari, M.-E. Couprie, R. Nagaoka, D. Pedeau, SOLEIL, Gif-sur-Yvette","Streak Camera Measurements of the SOLEIL Bunch Length",241 243,
wepb06,"O. I. Meshkov, V. A. Kiselev, N. Yu. Muchnoi, S. V. Sinyatkin, V. V. Smaluk, V. N. Zhilich, A. N. Zhuravlev, BINP SB RAS, Novosibirsk","Direct Comparison of the Methods of Beam Energy Spread Determination in the VEPP-4M Collider",244 246,
wepb07,"V. A. Verzilov, R. E. Laxdal, M. Marchetto, W. R. Rawnsley, TRIUMF, Vancouver","Time Domain Diagnostics for the ISAC-II Superconducting Heavy Ion Linac",247 249,
wepb08,"B. Lorbeer, TUHH, Hamburg; F. Loehl, DESY, Hamburg; B. Lorbeer, TUHH, Hamburg; F. Ludwig, J. M. Mueller, H. Schlarb, A. Winter, DESY, Hamburg","Noise and drift characterization of critical components for the laser based synchronization system at FLASH",250 252,
wepb09,"D. B. Belohrad, S. Longo, OP. Odier, S. Thoulet, CERN, Geneva","Mechanical Design of the Intensity Measurement Devices for the LHC",253 255,
wepb12,"T. Obina, T. Mitsuhashi, KEK, Ibaraki","Measurement of Bunch Lengthening Effects Using a Streak Camera with Reflective Optics",256 258,
wepb13,"L. G. Sukhikh, TPU, Tomsk; A. S. Aryshev, KEK, Ibaraki; S. T. Boogert, V. Karataev, JAI, Egham, Surrey; G. A. Naumenko, A. Potylitsyn, TPU, Tomsk; J. Urakawa, KEK, Ibaraki","Focusing of Optical Transition and Diffraction Radiation by a Spherical Target",259 261,
wepb15,"F. Loehl, K. E. Hacker, H. Schlarb, DESY, Hamburg","A Sub-50 Femtosecond bunch arrival time monitor system for FLASH",262 264,
wepb16,"F. Loehl, DESY, Hamburg; J. Chen, F. X. Kaertner, J. Kim, MIT, Cambridge, Massachusetts; H. Schlarb, DESY, Hamburg","First prototype of an optical cross-correlation based fiber-link stabilization for the FLASH synchronization system",265 267,
wepb18,"A. Warner, K. Carlson, G. M. Kazakevich, L. R. Prost, M. Sutherland, Fermilab, Batavia, Illinois","Electron Beam Temperature Measurements at the Fermilab Medium Energy Electron Cooler",268 270,
wepb19,"P.-A. Duperrex, G. G. Gamma, B. Keil, M. U. Müller, PSI, Villigen","Digital Analysis of Beam Diagnostic Noise",271 273,
wepb20,"J. W. Baehr, H. L. Luedecke, DESY Zeuthen, Zeuthen; J. Roensch, Uni HH, Hamburg","Optical System for Measuring Electron Bunch Length and Longitudinal Phase Space at Pitz: Extension and Methodical Investigations",274 276,
wepb21,"P. Hartmann, J. Fuersch, DELTA, Dortmund; R. Wagner, Bergische Universität Wuppertal, Wuppertal; T. Weis, K. Wille, DELTA, Dortmund","Kicker Based Tune Measurement for DELTA",277 279,
wepb22,"A. Mochihashi, UVSOR, Okazaki; Y. Hori, KEK, Ibaraki; M. Hosaka, Nagoya University, Nagoya; M. Katoh, M. Shimada, UVSOR, Okazaki; Y. Takashima, Nagoya University, Nagoya","Touschek Lifetime Measurement with a Spurious Bunch in UVSOR-II Electron Storage Ring",280 282,
wepb23,"T. Sieber, H. Fadil, M. Grieser, A. Wolf, R. von Hahn, MPI-K, Heidelberg","Beam Diagnostics Development for the Cryogenic Storage Ring CSR",283 285,
wepb24,"Y.-M. Abiven, F. Dohou, R. P. Patrick, SOLEIL, Gif-sur-Yvette","Machine Protection and Interlock Systems at Synchrotron SOLEIL",286 288,
wepb25,"C. A. Thomas, G. Rehm, Diamond, Oxfordshire","Time Domain Measurements at Diamond",289 291,
wepb26,"S. G. Arutunian, YerPhI, Yerevan; G. Decker, ANL, Argonne, Illinois; M. R. Mailian, YerPhI, Yerevan; G. Rosenbaum, UGA, Athens, Georgia","Transition Thermal Processes In Vibrating Wire Monitors",292 294,
wepb28,"A. F.D. Morgan, G. Rehm, I. Uzun, Diamond, Oxfordshire","First Tests of the Transverse Multibunch Feedback at Diamond",295 297,
wepb29,"A. Bocci, M. C.G. Cestelli Guidi, A. Clozza, A. Drago, INFN/LNF, Frascati (Roma); E. P. Emanuele, Università degli Studi di Firenze, Firenze; A. G. Grilli, A. Marcelli, INFN/LNF, Frascati (Roma); M. P. Piccinini, Università Roma Tre, Roma; J. P. Piotrowski, Vigo System Sa, Warsaw; A. R. Raco, R. S. Sorchetti, INFN/LNF, Frascati (Roma)","Bunch-by-Bunch Longitudinal Diagnostics at DAFNE by IR Light",298 300,
wepb30,"K. Knaack, DESY, Hamburg; R. Neubert, S. Nietzsche, FSU Jena, Jena; A. Peters, HIT, Heidelberg; F. Schiller, W. Vodel, FSU Jena, Jena; K. Wittenburg, DESY, Hamburg","Current Status of the SQUID Based Cryogenic Current Comparator for Absolute Measurements of the Dark Current of Superconducting RF Accelerator Cavities",301 303,
wepb31,"C. Jamet, T. A. Andre, GANIL, Caen; P. Ausset, IPN, Orsay; C. Doutresssoulles, B. Ducoudret, W. LC. Le Coz, GANIL, Caen; C. O. Olivetto, IPHC, Strasbourg Cedex 2; J. L. Vignet, GANIL, Caen","Injector Diagnostics Overview of SPIRAL2 Accelerator",304 306,
wepc01,"H. Schlarb, C. Gerth, W. Koprek, F. Loehl, E. Vogel, DESY, Hamburg","Beam Based Measurements of RF Phase and Amplitude Stability at FLASH",307 309,
wepc02,"L. Pavlovic, Uni LJ, Ljubljana; M. Ferianis, ELETTRA, Basovizza, Trieste; K. E. Hacker, DESY, Hamburg; T. Korosec, Uni LJ, Ljubljana; F. Loehl, DESY, Hamburg; F. Rossi, ELETTRA, Basovizza, Trieste; H. Schlarb, DESY, Hamburg; M. Vidmar, Uni LJ, Ljubljana","Developments at Elettra of the Electronics for the Bunch-Arrival Monitor",310 312,
wepc03,"D. K. Kramer, B. Dehning, G. Ferioli, E. B. Holzer, CERN, Geneva","Secondary Electron Emission Beam Loss Monitor for LHC",313 315,
wepc04,"R. Nagaoka, L. Cassinari, J.-C. Denard, J.-M. Filhol, N. Hubert, SOLEIL, Gif-sur-Yvette; K. Kobayashi, JASRI/SPring-8, Hyogo-ken; M.-P. Level, P. Marchand, C. Mariette, SOLEIL, Gif-sur-Yvette; T. Nakamura, JASRI/SPring-8, Hyogo-ken; F. Ribeiro, R. Sreedharan, SOLEIL, Gif-sur-Yvette","Transverse Feedback Development at SOLEIL",316 318,
wepc06,"E. Effinger, B. Dehning, J. E. Emery, G. Ferioli, C. Zamantzas, CERN, Geneva","Single gain radiation tolerant LHC beam loss acquisition card",319 321,
wepc07,"D. Teytelman, F.-J. Decker, SLAC, Menlo Park, California","Injection Diagnostics Using Triggered Bunch-by-Bunch Data Acquisition",322 324,
wepc08,"S. De Santis, J. M. Byrd, LBNL, Berkeley, California; Y. Yin, Y. Y. Labs, Inc., Fremont, California","Fiberoptics-Based Instrumentation for Storage Ring Beam Diagnostics",325 327,
wepc09,"M. Stockner, B. Dehning, C. Fabjan, E. B. Holzer, CERN, Geneva; D. K. Kramer, TUL, Liberec","Classification of the LHC BLM Ionization Chamber",328 330,
wepc10,"P. Cameron, J. Cupolo, W. C. Dawson, C. Degen, A. J. Della Penna, L. T. Hoff, Y. Luo, A. Marusic, R. Schroeder, C. Schultheiss, S. Tepikian, BNL, Upton, Long Island, New York","Tune, Coupling, and Chromaticity Measurement and Feedback During RHIC Run 7",331 333,
wepc11,"M. Ferianis, ELETTRA, Basovizza, Trieste","FERMI@elettra Timing System: Design and Recent Synchronization Achievements",334 336,
wepc13,"A. Azima, S. Düsterer, J. Feldhaus, DESY, Hamburg; M. Meyer, LIXAM, Orsay; P. Radcliffe, H. Redlin, H. Schlarb, DESY, Hamburg","Jitter Reduced Pump-Probe Experiments",337 339,
wepc14,"T. Lefevre, H.-H. Braun, E. Bravin, C. Dutriat, C. P. Welsch, CERN, Geneva","Segmented Beam Dump for Time Resolved Spectrometry on a High Current Electron Beam",340 342,
wepc16,"C. Mariette, J.-C. Denard, R. Nagaoka, SOLEIL, Gif-sur-Yvette","Excitation Striplines for SOLEIL Fast Transverse Feedback",343 345,
wepc17,"C. H. Kuo, NSRRC, Hsinchu; A. Bardorfer, Instrumentation Technologies, Solkan; J. Chen, P. C. Chiu, K. T. Hsu, K. H. Hu, K.-B. Liu, NSRRC, Hsinchu","Fast Orbit Feeback System Upgrade with New Digital Bpm and Power Supply in the Tls",346 348,
wepc19,"A. Hamdi, F. Ballester, CEA, Gif-sur-Yvette; L. Froehlich, M. Görler, DESY, Hamburg; M. Luong, CEA, Gif-sur-Yvette; S. Magnus, DESY, Hamburg; J. Novo, CEA, Gif-sur-Yvette; M. Staack, M. Werner, DESY, Hamburg","Toroid Protection System for FLASH",349 351,
wepc20,"L. Badano, ELETTRA, Basovizza, Trieste; K. Abbas, JRC, Ispra; L. Badano, ELETTRA, Basovizza, Trieste; M. Caccia, C. Cappellini, V. Chmill, Univ. Insubria and INFN Milano, Como; O. Ferrando, Ente Ospedaliero Ospedali Galliera, Genova; P. N. Gibson, U. Holzwarth, JRC, Ispra; M. Jastrzab, Univ. Insubria and INFN Milano, Como; G. Molinari, CERN, Geneva","A Real-Time Beam Monitor for Hadrontherapy Applications Based on Thin Foil Secondary Electron Emission and a Back-Thinned Monolithic Pixel Sensor",352 354,
wepc21,"A. G. Shkvarunets, R. B. Fiorito, UMD, College Park, Maryland; F. Mueller, V. Schlott, PSI, Villigen","Diagnostics of the Waveform of Picosecond Electron Bunches Using the Angular Distribution of Coherent Sub-mmTransition and Diffraction Radiation",355 357,
wepc22,"L. Banchi, ELETTRA, Basovizza, Trieste; A. Bogoni, CNIT, Pisa; M. Ferianis, ELETTRA, Basovizza, Trieste; P. Ghelfi, L. Poti', CNIT, Pisa; F. Rossi, ELETTRA, Basovizza, Trieste","Synchronization of a 3GHz Repetition Rate Harmonically Mode-Locked Fiber Laser for Optical Timing Applications",358 360,
wepc23,"R. Dölling, PSI, Villigen","Progress of the Diagnostics at the Proscan Beam Lines",361 363,
wepc24,"S. J. Payne, P. G. Barnes, G. M. Cross, A. Pertica, S. A. Whitehead, STFC/RAL/ISIS, Chilton, Didcot, Oxon","A Self Calibrating Real Time Multi-Channel Profile Monitor for the Isis Proton Synchrotron",364 366,
wepc26,"V. P. Cherepanov, E. N. Dementyev, E. B. Levichev, A. S. Medvedko, V. V. Smaluk, D. P. Sukhanov, BINP SB RAS, Novosibirsk","Transverse Bunch-by-Bunch Feedback for the VEPP-4M Electron-Positron Collider",367 369,
