froa3,"Y.Z. Chen, Z.C. Chen, L.F. Han, Y.B. Leng, Y.C. Xu, K.R. Ye, L.Y. Yu, W.M. Zhou, SINAP, Shanghai","Beam Diagnostic at SDUV-FEL",711 713,
froa4,"Yu. Shvyd'ko, K.-J. Kim, R.R. Lindberg, D. Shu, ANL, Argonne; H. Sinn, European XFEL GmbH, Hamburg; S. Stoupin, ANL, Argonne","Feasibility of X-Ray Cavities for Hard X-Ray FEL Oscillators",714 714,
froai1,"J.J. Welch, SLAC, Menlo Park, California","X-Ray Diagnostics Commissioning at the LCLS",705 705,
froai2,"M. Zangrando, D. Cocco, ELETTRA, Basovizza","Non-Invasive Diagnostics on FEL Photon Beams: General Remarks and the Case of FERMI@Elettra",706 710,
frob3,"Y. Cerenius, MAX-lab, Lund","The MAX IV Project",717 717,
frobi1,"A. Barty, CFEL, Hamburg","Ultrafast Single-Shot Diffraction Imaging of Nanoscale Dynamics",715 715,
frobi2,"C. Callegari, ELETTRA, Basovizza; T. Möller, Technische Universität Berlin, Berlin; K.C. Prince, ELETTRA, Basovizza; F. Stienkemeier, Physikalisches Institut Albert-Ludwig, Freiburg; S. Stranges, Università di Roma "La Sapienza", Roma","The LDM Beamline at FERMI@Elettra",716 716,
mooai1,"D. Dowell, SLAC, Menlo Park, California","FEL Prize Lecture: The Limits of Beam Brightness from Photocathode RF Guns",99 98,
mooai2,"P. Emma, SLAC, Menlo Park, California","FEL Prize Lecture: Emittance Growth Mechanisms in Linac-Based Free-Electron Lasers",2 2,
mooai3,"S. Schreiber, DESY, Hamburg","First Lasing at FLASH with 4.45 nm",3 3,
mooai4,"L. Giannessi, ENEA C.R. Frascati, Frascati (Roma)","SPARC Operation in Seeded and Chirped Mode",4 11,
mooai5,"S. Werin, MAX-lab, Lund","MAX-Lab Test FEL",12 12,
mooai7,"T. Togashi, JASRI/SPring-8, Hyogo-ken; M. Aoyama, JAEA/Kansai, Kyoto; M.-E. Couprie, SOLEIL, Gif-sur-Yvette; K. Fukami, JASRI/SPring-8, Hyogo-ken; T. Hara, T. Hatsui, T. Ishikawa, RIKEN/SPring-8, Hyogo; A. Iwasaki, The University of Tokyo, Tokyo; T.K. Kameshima, RIKEN/SPring-8, Hyogo; F. Kannari, Keio University, Kanagawa-ken; H. Kitamura, N. Kumagai, RIKEN/SPring-8, Hyogo; S. Matsubara, JASRI/SPring-8, Hyogo-ken; K. Midorikawa, RIKEN, Saitama; M. Nagasono, RIKEN/SPring-8, Hyogo; H. Nakano, NTT Corp., Kanagawa-ken; H. Ohashi, JASRI/SPring-8, Hyogo-ken; T. Okino, The University of Tokyo, Tokyo; Y. Otake, RIKEN/SPring-8, Hyogo; S. Owada, T. Sato, The University of Tokyo, Tokyo; T. Shintake, RIKEN/SPring-8, Hyogo; E. Takahashi, RIKEN, Saitama; H. Tanaka, T. Tanaka, K. Togawa, RIKEN/SPring-8, Hyogo; H. Tomizawa, T. Watanabe, JASRI/SPring-8, Hyogo-ken; M. Yabashi, RIKEN/SPring-8, Hyogo; A. Yagishita, KEK, Tsukuba; K. Yamakawa, JAEA/Kansai, Kyoto; K. Yamanouchi, The University of Tokyo, Tokyo","First Observation of the 61.5 nm Seeded FEL at the SCSS Test Accelerator",13 13,
mooai8,"S.V. Benson, JLAB, Newport News, Virginia","First Lasing of the Jefferson Lab UV Demo Laser",14 14,
moob3,"T. Garvey, PSI, Villigen","Status of the PSI X-ray Free Electron Laser "SwissFEL"",21 24,
moob4,"J. Feldhaus, DESY, Hamburg","The EuroFEL Consortium of Free Electron Lasers in Europe",25 25,
moobi1,"Z.T. Zhao, SINAP, Shanghai","Progress in SDUV-FEL and Development of X-Ray FELs in Shanghai",15 19,
moobi2,"T. Shintake, RIKEN/SPring-8, Hyogo","XFEL/SPring-8 Construction and SCSS Operation Status",20 20,
mooc3,"A. Gover, E. Dyunin, University of Tel-Aviv, Faculty of Engineering, Tel-Aviv","Sub-radiance and the coherence limits of FEL",174 177,
mooc4,"Q.K. Jia, USTC/NSRL, Hefei, Anhui","The Effect of Undulator Harmonics Field on Free-Electron Laser Harmonic Generation",178 181,
mooci1,"S. Reiche, PSI, Villigen","FEL Simulations: History, Status and Outlook",165 172,
mooci2,"E. Schneidmiller, M.V. Yurkov, DESY, Hamburg","Coherence Properties of the Radiation From X-Ray FELs",173 173,
mopa02,"S. Di Mitri, E. Allaria, R. Appio, L. Badano, ELETTRA, Basovizza; R. Bartolini, Diamond, Oxfordshire; D. Castronovo, M. Cornacchia, P. Craievich, ELETTRA, Basovizza; G. De Ninno, University of Nova Gorica, Nova Gorica; P. Evtushenko, JLAB, Newport News, Virginia; W.M. Fawley, LBNL, Berkeley, California; S. Ferry, L. Froehlich, ELETTRA, Basovizza; L. Giannessi, ENEA C.R. Frascati, Frascati (Roma); A.A. Lutman, DEEI, Trieste; S.V. Milton, G. Penco, C. Scafuri, ELETTRA, Basovizza; M. Sjöström, MAX-lab, Lund; S. Spampinati, University of Nova Gorica, Nova Gorica; C. Spezzani, M. Trovò, M. Veronese, ELETTRA, Basovizza","Recent Commissioning Experience on the FERMI@Elettra First Bunch Compressor Area: Investigations of Beam Dynamics, Modeling and Control Software",26 29,
mopa04,"K.L. Ferguson, C.W. Bennett, W.B. Colson, J.R. Harris, J.W. Lewellen, S.P. Niles, B. Rusnak, NPS, Monterey, California; T.I. Smith, Stanford University, Stanford, California; R. Swent, NPS, Monterey, California","NPS BPL and FEL Facility Update",30 32,
mopa05,"W.B. Colson, Y.H. Bae, J. Blau, K.J. Cohn, NPS, Monterey, California","Free Electron Lasers in 2010",33 37,
mopa06,"J.N. Corlett, K.M. Baptiste, J.M. Byrd, A.E. Charman, P. Denes, R.W. Falcone, J. Feng, D. Filippetto, C.M.R. Greaves, J. Kirz, LBNL, Berkeley, California; E. Kur, UCB, Berkeley, California; D. Li, H.A. Padmore, C. F. Papadopoulos, G.C. Pappas, G. Penn, J. Qiang, M.W. Reinsch, R.D. Ryne, F. Sannibale, R.W. Schoenlein, J.W. Staples, C. Steier, T. Vecchione, M. Venturini, W. Wan, R.P. Wells, R.B. Wilcox, J.S. Wurtele, LBNL, Berkeley, California; A. Zholents, ANL, Argonne","Design Studies for a Next Generation Light Source Facility at LBNL",38 40,
mopa08,"J.A. Clarke, D.J. Dunning, S. Leonard, A.D. Smith, STFC/DL/ASTeC, Daresbury, Warrington, Cheshire; M. Surman, STFC/DL/SRD, Daresbury, Warrington, Cheshire; N. Thompson, STFC/DL/ASTeC, Daresbury, Warrington, Cheshire","Status of the ALICE IR-FEL",41 44,
mopa09,"H. Bluem, V. Christina, AES, Medford, NY; L.R. Dalesio, EPIC Consulting, Medford, New York; D. Douglas, Douglas Consulting, York, Virginia; D. Dowell, AES, Princeton, New Jersey; S. Gewinner, FHI, Berlin; S.C. Gottschalk, STI, Washington; K. Jordan, Kevin Jordan PE, Newport News, Virginia; H. Junkes, FHI, Berlin; R.N. Kelly, STI, Washington; U. Lehnert, HZDR, Dresden; G. Meijer, FHI, Berlin; P. Michel, HZDR, Dresden; J.H. Park, J. Rathke, AES, Medford, NY; W. Schöllkopf, FHI, Berlin; W. Seidel, FZD, Dresden; A.M.M. Todd, AES, Princeton, New Jersey; R. Wünsch, FZD, Dresden; L.M. Young, AES, Medford, NY; W.Q. Zhang, G. von Helden, FHI, Berlin","The Fritz Haber Institute THz FEL Status",45 47,
mopb01,"W.M. Fawley, J.-L. Vay, LBNL, Berkeley, California","Fully Electromagnetic FEL Simulation via Lorentz-Boosted Frame Transformation",48 51,
mopb02,"S.D. Webb, V. Litvinenko, G. Wang, BNL, Upton, Long Island, New York","A 3-Dimensional Theory of Free Electron Lasers",52 55,
mopb03,"S.D. Webb, V. Litvinenko, BNL, Upton, Long Island, New York","Dispersion Relations for 1D High-Gain FELs",56 59,
mopb04,"G. Wang, V. Litvinenko, BNL, Upton, Long Island, New York; S.D. Webb, Stony Brook University, Stony Brook","The Physics of FEL in an Infinite Electron Beam",60 63,
mopb06,"F. Jafari Bahman, B. Maraghechi, AUT, Tehran","Three-Dimensional Simulation of Free-Electron Laser With Helical Wiggler and Ion-Channel Guiding",64 67,
mopb12,"A. Raghavi, pnum, Mashhad; N. Mahdizadeh, PPRC, Tehran","FEL-IFEL, a Crossed Field Wiggler Scheme for Energy Transfer Between Two Electromagnetic Waves",68 70,
mopb13,"V.A. Goryashko, NASU/IRE, Kharkov","Analysis and Optimization of FELs With Irregular Waveguides",71 74,
mopb20,"V. Petrillo, Universita' degli Studi di Milano, Milano; M. Ferrario, INFN/LNF, Frascati (Roma); A.R. Rossi, Istituto Nazionale di Fisica Nucleare, Milano","Momentum Modulations Produced by Laser-Beam Interaction at a Photocathode",75 78,
mopb21,"V. Petrillo, Universita' degli Studi di Milano, Milano; M. Ferrario, INFN/LNF, Frascati (Roma); L. Giannessi, ENEA C.R. Frascati, Frascati (Roma); C. Maroli, Universita' degli Studi di Milano, Milano","One-Dimensional FEL Equations Without the Slowly Varying Envelope Approximation",79 82,
mopb23,"J.T. Donohue, CENBG, Gradignan; J. Gardelle, CESTA, Le Barp","Three-Dimensional Modes of a Lamellar Grating for Smith-Purcell Experiments",83 86,
mopb27,"J. Wu, SLAC, Menlo Park, California; R.A. Bosch, UW-Madison/SRC, Madison, Wisconsin; B. Jia, FEL/Duke University, Durham, North Carolina; A.A. Lutman, DEEI, Trieste; J.J. Welch, SLAC, Menlo Park, California","The Imperfectness of Electron Bunch Initial Longitudinal Phase Space on a Seeded Free Electron Laser Performance",87 90,
mopb28,"Z. Huang, Y.T. Ding, J. Wu, SLAC, Menlo Park, California","Three-Dimensional Analysis of Frequency-Chirped FELs",91 94,
mopb30,"L.T. Campbell, B.W.J. McNeil, USTRAT/SUPA, Glasgow","An Unaveraged Computational Model of a Variably Polarised Undulator FEL",95 98,
mopb32,"J. Henderson, USTRAT/SUPA, Glasgow; D.J. Dunning, STFC/DL/ASTeC, Daresbury, Warrington, Cheshire; B.W.J. McNeil, USTRAT/SUPA, Glasgow","Beam Quality and Transport Stability Simulations in Echo Enabled Harmonic Generation",99 102,
mopb33,"O.A. Shevchenko, N. Vinokurov, BINP SB RAS, Novosibirsk","The SASE FEL Two-Time Correlation Function",103 106,
mopb38,"N. Mahdizadeh, Islamic Azad University, Sabzevar Branch, Sabzevar; F.M. Aghamir, University of Tehran, Tehran; A. Raghavi, pnum, Mashhad; S. Saviz, PPRC, Tehran","Beam Temperature Effects on the Growth Rate of a Two-Stream Free Electron Laser",107 110,
mopc02,"T. Hara, H. Tanaka, K. Togawa, RIKEN/SPring-8, Hyogo","Beam Optics and Parameter Design of the XFEL/SPring-8 Accelerator",111 114,
mopc04,"E. Schneidmiller, M.V. Yurkov, DESY, Hamburg","Options of FLASH Extension for Generation of Circularly Polarized Radiation in the Wavelength Range Down to 1.2 nm",115 118,
mopc05,"E. Schneidmiller, M.V. Yurkov, DESY, Hamburg","Expected Properties of the Radiation From the European XFEL Operating at the Energy of 14 GeV",119 122,
mopc06,"E. Schneidmiller, M.V. Yurkov, DESY, Hamburg","An Option of Frequency Doubler at the European XFEL for Generation of Circularly Polarized Radiation in the Wavelength Range Down to 1 - 2.5 nm",123 126,
mopc07,"R. Brinkmann, E. Schneidmiller, M.V. Yurkov, DESY, Hamburg","Betatron Switcher for a Multi-Color Operation of an X-Ray FEL",127 130,
mopc08,"C. Behrens, C. Gerth, DESY, Hamburg","Measurement of Sliced-Bunch Parameters at FLASH",131 134,
mopc10,"L.-G. Wißmann, J. Breunlin, Uni HH, Hamburg; B. Schmidt, B. Steffen, DESY, Hamburg","Ytterbium Fibre Laser Based Electro-Optic Measurements of the Longitudinal Charge Distribution of Electron Bunches at FLASH",135 138,
mopc11,"J. Breunlin, Uni HH, Hamburg; B. Schmidt, B. Steffen, DESY, Hamburg; L.-G. Wißmann, Uni HH, Hamburg","Commissioning of an Electro-Optic Electron Bunch Length Monitor at FLASH",139 142,
mopc13,"A.H. Lumpkin, M.D. Church, H.T. Edwards, S. Nagaitsev, M. Wendt, Fermilab, Batavia","Considerations on Fermilab's Superconducting Test Linac for an EUV/Soft X-ray SASE FEL",143 146,
mopc14,"J. Wu, Y.T. Ding, P. Emma, Z. Huang, H. Loos, M. Messerschmidt, SLAC, Menlo Park, California; E. Schneidmiller, M.V. Yurkov, DESY, Hamburg","LCLS X-Ray Pulse Duration Measurement Using the Statistical Fluctuation Method",147 150,
mopc16,"Y.T. Ding, Z. Huang, SLAC, Menlo Park, California; S.A. Ocko, MIT, Cambridge, Massachusetts","Transverse-Coherence Properties of the FEL at the LCLS",151 154,
mopc19,"H.-S. Kang, S.H. Nam, PAL, Pohang, Kyungbuk","X-Ray Free Electron Laser Project of Pohang Accelerator Laboratory",155 158,
mopc20,"S. Reiche, B. Pedrini, PSI, Villigen","Coherence Properties of SwissFEL",159 162,
mopc22,"J.P.M. Beijers, KVI, Groningen; F. Bijkerk, FOM, Utrecht; S. Brandenburg, K. Eikema, R. Hoekstra, S. Hoekstra, K. Jungmann, KVI, Groningen; O.J. Luiten, TUE, Eindhoven; B. Noheda, T.T. Palstra, P. Rudolf, RUG, Groningen; T. Schlathoelter, R.G. Timmermans, L. Willmann, KVI, Groningen; P.H.M. van Loosdrecht, RUG, Groningen","ZFEL: A Compact, Soft X-ray FEL in the Netherlands",163 164,
motui1,"B.W.J. McNeil, USTRAT/SUPA, Glasgow","How an FEL Works",182 182,
thoa3,"M. Felber, M.K. Bock, DESY, Hamburg; J. Breunlin, Uni HH, Hamburg; P. Gessler, K.E. Hacker, T. Lamb, F. Ludwig, H. Schlarb, B. Schmidt, DESY, Hamburg; S. Schulz, L.-G. Wißmann, Uni HH, Hamburg","RF-based Synchronization of the Seed and Pump-Probe Lasers to the Optical Synchronization System at FLASH",544 547,
thoa4,"N. Cutic, F. Lindau, MAX-lab, Lund; E. Mansten, Lund University, Division of Atomic Physics, Lund; S. Werin, MAX-lab, Lund","On-Line Arrival Time and Jitter Measurements Using Electro-Optical Spectral Decoding",548 551,
thoai1,"J.M. Byrd, LBNL, Berkeley, California; J. Arthur, SLAC, Menlo Park, California; L.R. Doolittle, LBNL, Berkeley, California; J.C. Frisch, SLAC, Menlo Park, California; G. Huang, J.W. Staples, LBNL, Berkeley, California; W.E. White, SLAC, Menlo Park, California; R.B. Wilcox, LBNL, Berkeley, California","Femtosecond Synchronization of Laser Systems for the LCLS",534 536,
thoai2,"W. Koprek, C. Behrens, M.K. Bock, M. Felber, P. Gessler, H. Schlarb, Ch. Schmidt, S. Schulz, B. Steffen, DESY, Hamburg; J. Szewinski, The Andrzej Soltan Institute for Nuclear Studies, Centre Swierk, Swierk/Otwock; S. Wesch, DESY, Hamburg","Intra-train Longitudinal Feedback for Beam Stabilization at FLASH",537 543,
thob2,"V. Yakimenko, BNL, Upton, Long Island, New York","Practical Solution for Compact X-Ray FEL Laser Based Undulator.",553 553,
thob3,"Y. Hao, V. Litvinenko, BNL, Upton, Long Island, New York","Preliminary Study for the OFFELO",554 557,
thob4,"B.W.J. McNeil, USTRAT/SUPA, Glasgow; N. Thompson, STFC/DL/ASTeC, Daresbury, Warrington, Cheshire","Mode Locked Optical Klystron Configuration in an FEL Cavity Resonator",558 561,
thob5,"E. Schneidmiller, M.V. Yurkov, DESY, Hamburg","Using the Longitudinal Space Charge Instability for Generation of VUV and X-Ray Radiation",562 565,
thobi1,"M. Fuchs, S. Becker, F.J. Grüner, D. Habs, LMU, München; S.M. Hooker, University of Oxford, Clarendon Laboratory, Oxford; S. Karsch, F. Krausz, Z. Major, MPQ, Garching, Munich; J. Osterhoff, LBNL, Berkeley, California; A. Popp, MPQ, Garching, Munich; U. Schramm, FZD, Dresden; R. Weingartner, LMU, Garching","Laser-Wakefield Accelerators as Drivers for Undulator-Based Light Sources",552 552,
thoc3,"N. Vinokurov, O.A. Shevchenko, V.G. Tcheskidov, BINP SB RAS, Novosibirsk","Variable-period Permanent Magnet Undulators",696 699,
thoc4,"H. Aoyagi, JASRI/SPring-8, Hyogo-ken; Y. Asano, RIKEN/SPring-8, Hyogo; T. Bizen, JASRI/SPring-8, Hyogo-ken; T. Itoga, H. Kitamura, RIKEN/SPring-8, Hyogo; N. Nariyama, JASRI/SPring-8, Hyogo-ken; T. Tanaka, RIKEN/SPring-8, Hyogo","Improvement in High-Frequency Properties of Beam Halo Monitor Using Dimond Detectors for SPring-8 XFEL",700 703,
thoci1,"H. Sinn, S. Dastjani-Farahan, I. Freijo-Martin, G. Galasso, J. Gaudin, L. Samoylova, A. Trapp, F. Yang, European XFEL GmbH, Hamburg","Design of Photon Beamlines at the European XFEL",683 689,
thoci2,"H.-D. Nuhn, F.-J. Decker, Y.T. Ding, P. Emma, J.C. Frisch, Z. Huang, R.H. Iverson, Yu.I. Levashov, H. Loos, M. Messerschmidt, D.F. Ratner, J.L. Turner, J.J. Welch, Z.R. Wolf, J. Wu, SLAC, Menlo Park, California","Characterization of Second Harmonic Afterburner Radiation at the LCLS*",690 695,
thpa01,"Y. Otake, N. Hosoda, H. Maesaka, RIKEN/SPring-8, Hyogo; S. Matsubara, JASRI/SPring-8, Hyogo-ken; T. Ohshima, RIKEN/SPring-8, Hyogo","Development of a 770 Nm Pump-Probe Laser Directly Triggered by a 1540 nm Optical Master Oscillator at XFEL/SPring-8",566 569,
thpa02,"G. Geloni, European XFEL GmbH, Hamburg; V. Kocharyan, E. Saldin, DESY, Hamburg","Control of the Amplification Process in Baseline XFEL Undulators With Mechanical SASE Switchers",570 573,
thpa03,"G. Geloni, European XFEL GmbH, Hamburg; V. Kocharyan, E. Saldin, DESY, Hamburg","Scheme for Femtosecond-Resolution Pump-Probe Experiments at XFELs With Two-Color Ten GW-Level X-Ray Pulses",574 577,
thpa04,"P. Gessler, M.K. Bock, M. Felber, K.E. Hacker, W. Koprek, F. Ludwig, H. Schlarb, B. Schmidt, S. Schulz, DESY, Hamburg","Longitudinal Bunch Arrival-Time Feedback at FLASH",578 580,
thpa05,"S. Schulz, Uni HH, Hamburg; M.K. Bock, M. Felber, P. Gessler, K.E. Hacker, T. Lamb, F. Ludwig, H. Schlarb, B. Schmidt, DESY, Hamburg; L.-G. Wißmann, Uni HH, Hamburg","Performance of the FLASH Optical Synchronization System Utilizing a Commercial SESAM-Based Erbium Laser",581 584,
thpa06,"P. Gessler, M.K. Bock, M. Felber, K.E. Hacker, F. Ludwig, H. Schlarb, B. Schmidt, S. Schulz, DESY, Hamburg; J. Szewinski, Warsaw University of Technology, Institute of Electronic Systems, Warsaw","Real-Time Sampling and Processing Hardware for Bunch Arrival-Time Monitors at FLASH and XFEL",585 587,
thpa08,"M. Aiba, H.-H. Braun, M. Böge, C. Calvi, T. Garvey, B. Keil, S. Reiche, V. Schlott, T. Schmidt, PSI, Villigen","Study of Beam Based Alignment and Orbit Feedback for SwissFEL",588 591,
thpa11,"W.K. Fullagar, Monash University, Faculty of Science, Victoria; C.J. Hall, ASCo, Clayton, Victoria; D.M. Paganin, Monash University, Faculty of Science, Victoria","Transient Optical Gratings for Short Pulse, Short Wavelength Ionising Radiation Studies - Opportunities and Approaches",592 595,
thpa15,"B. Maraghechi, M.H. Rouhani, E. Salehi, AUT, Tehran","Numerical Simulation of Kolmogorov Entropy in a Free-Electron Laser with Ion-Channel Guiding",596 599,
thpa16,"B. Maraghechi, M. Olumi, M.H. Rouhani, AUT, Tehran","Nonlinear Traveling Waves in an Electromagnetically Pumped Free Electron Laser",600 603,
thpb03,"S. Di Mitri, M. Cornacchia, P. Craievich, G. Penco, ELETTRA, Basovizza; S. Spampinati, University of Nova Gorica, Nova Gorica; M. Venturini, A. Zholents, LBNL, Berkeley, California","Comparative Study of the FERMI@elettra Linac with One and Two-stage Electron Bunch Compression",604 607,
thpb04,"S. Di Mitri, ELETTRA, Basovizza; W.A. Barletta, LBNL, Berkeley, California; M. Cornacchia, ELETTRA, Basovizza","Emittance Growth Induced by Microbunching Instability in the FERMI@Elettra High Energy Transfer Line",608 610,
thpb05,"F.V. Hartemann, LLNL, Livermore, California; C. Adolphsen, SLAC, Menlo Park, California; F. Albert, S.G. Anderson, C.P.J. Barty, A.J. Bayramian, R.E. Bonnanno, LLNL, Livermore, California; A.E. Candel, SLAC, Menlo Park, California; T.S. Chu, R.R. Cross, C.A. Ebbers, D.J. Gibson, T.L. Houck, LLNL, Livermore, California; E.N. Jongewaard, Z. Li, SLAC, Menlo Park, California; R.A. Marsh, D.P. McNabb, M. J. Messerly, LLNL, Livermore, California; T.O. Raubenheimer, SLAC, Menlo Park, California; R.D. Scarpetti, LLNL, Livermore, California; V.A. Semenov, UCB, Berkeley, California; M. Shverdin, C. Siders, LLNL, Livermore, California; S.G. Tantawi, A.E. Vlieks, F. Wang, J.W. Wang, SLAC, Menlo Park, California; S.S.Q. Wu, LLNL, Livermore, California; F. Zhou, SLAC, Menlo Park, California","Velociraptor: LLNL's Precision Compton Scattering Light Source",611 613,
thpb11,"E. Sabia, G. Dattoli, M. Del Franco, L. Giannessi, M. Quattromini, V. Surrenti, ENEA C.R. Frascati, Frascati (Roma)","Free Electron Laser and Positronium Stimulated Annihilation",614 617,
thpb13,"H.H. Lee, KAIST, Daejeon; Y.U. Jeong, K. Lee, KAERI, Daejon; K. Min, KAIST, Daejeon; S. H. Park, KAERI, Daejon; H. Seo, Hanyang University, Seoul; H. Shim, Korea University, Seoul","A Simulation for the Optimization of Bremsstrahlung Radiation for Nuclear Applications Using Laser Accelerated Electron Beam",618 621,
thpb15,"L.T. Campbell, USTRAT/SUPA, Glasgow; B. Faatz, DESY, Hamburg; B.W.J. McNeil, USTRAT/SUPA, Glasgow","Generation of Variable Polarisation in a Short Wavelength FEL Amplifier",622 625,
thpb16,"C. Feng, J.H. Chen, W. Fang, Q. Gu, D. Wang, Z.T. Zhao, SINAP, Shanghai","Design of a Compact Hard X-Ray Free Electron Laser at SSRF",626 628,
thpb17,"C. Feng, D. Wang, Z.T. Zhao, SINAP, Shanghai","Pre-density Modulation of the Electron Beam for Soft X-ray FEL in the Water Window",629 631,
thpb18,"A. Gurinovich, V.G. Baryshevsky, N.A. Belous, V.A. Evdokimov, E.A. Gurnevich, P.V. Molchanov, Belarussian State University, Scientific Research Institute of Nuclear Problems, Minsk","Experimental Studies of Volume Fels With a Photonic Crystal Made of Foils",632 635,
thpb21,"D.J. Dunning, STFC/DL/ASTeC, Daresbury, Warrington, Cheshire; B.W.J. McNeil, USTRAT/SUPA, Glasgow; N. Thompson, STFC/DL/ASTeC, Daresbury, Warrington, Cheshire","Long-Scale Modulation of Electron Beam Energy in Free Electron Lasers",636 639,
thpb22,"H. Tomizawa, H. Dewa, H. Hanaki, A. Mizuno, T. Taniuchi, JASRI/SPring-8, Hyogo-ken","First Emission of Novel Photocathode Gun Gated by Laser-Induced Schottky-Effect",640 643,
thpb25,"T. Denis, K.-J. Boller, P.J.M. van der Slot, Mesa+, Enschede","Proof of Principle: The Single Beam Photonic Free-Electron Laser",644 647,
thpc02,"T. Kii, M. A. Bakr, Y.W. Choi, K. Ishida, N. Kimura, R. Kinjo, K. Masuda, H. Ohgaki, T. Sonobe, M. Takasaki, S. Ueda, K. Yoshida, Kyoto IAE, Kyoto","A Study on Field Error of Bulk HTSC Staggered Array Undulator Originated from Variation of Critical Current Density of Bulk HTSCs",648 651,
thpc04,"Y. Li, J. Pflüger, European XFEL GmbH, Hamburg","Investigation of the R56 of a Permanent Magnet Phase Shifter",652 655,
thpc05,"U. Lehnert, FZD, Dresden; A. Aksoy, Ankara University, Faculty of Engineering, Tandogan, Ankara; M. Helm, P. Michel, H. Schneider, W. Seidel, S. Winnerl, FZD, Dresden","Conceptual Design of a THz Facility at the ELBE Radiation Source",656 659,
thpc06,"C. Boffo, BNG, Würzburg; T. Baumbach, S. Casalbuoni, S. Gerstl, A.W. Grau, M. Hagelstein, D. Saez de Jauregui, Karlsruhe Institute of Technology (KIT), Karlsruhe; W. Walter, BNG, Würzburg","R&D Collaboration on Superconducting Insertion Devices Between ANKA-KIT and Babcock Noell",660 663,
thpc08,"M. Kokole, KYMA, Trieste; B. Diviacco, ELETTRA, Basovizza; T. Milharcic, KYMA, Trieste; G. Soregaroli, M. Tedeschi, Euromisure srl, Pieve S. Giacomo (CREMONA); M. Zambelli, KYMA, Trieste","Magnetic Characterization of the FEL-1 Undulators for the FERMI@Elettra Free-Electron Laser",664 666,
thpc10,"L. Froehlich, G. Cautero, ELETTRA, Basovizza; D. Di Giovenale, INFN-Roma II, Roma; D. Giuressi, R.H. Menk, ELETTRA, Basovizza","The Machine Protection System for FERMI@Elettra",667 670,
thpc11,"P. Craievich, ELETTRA, Basovizza; M. Dal Forno, DEEI, Trieste","Cavity BPM Design, Simulations and Testing for the FERMI@Elettra Project",671 674,
thpc12,"A. Hedqvist, H. Danared, MSL, Stockholm; W. Decking, DESY, Hamburg; F. Hellberg, MSL, Stockholm; S. Karabekyan, European XFEL GmbH, Hamburg; B. Krause, DESY, Hamburg; J. Pflüger, European XFEL GmbH, Hamburg","XFEL Activities at MSL: Undulator Temperature Compensation and Quadrupole Fiducialization",675 678,
thpc22,"R. Kinjo, M. A. Bakr, Y.W. Choi, K. Ishida, T. Kii, N. Kimura, K. Masuda, K. Nagasaki, H. Ohgaki, T. Sonobe, M. Takasaki, S. Ueda, K. Yoshida, Kyoto IAE, Kyoto","Performance of Bulk HTSC Staggered Array Undulator at Low Temperature",679 682,
thtui1,"J.C. Frisch, SLAC, Menlo Park, California","Diagnostics for Free Electron Lasers",704 704,
tuoa3,"K. Tsumaki, JASRI/SPring-8, Hyogo-ken","Feasibility Study of Short-Wavelength and High-Gain EFLs in an Ultimate Storage Ring",189 192,
tuoa4,"D. Douglas, W. Akers, S.V. Benson, G.H. Biallas, K. Blackburn, J.R. Boyce, D.B. Bullard, J.L. Coleman, C. Dickover, F.K. Ellingsworth, P. Evtushenko, S. Fisk, C.W. Gould, J.G. Gubeli, F.E. Hannon, D. Hardy, C. Hernandez-Garcia, K. Jordan, J.M. Klopf, J. Kortze, JLAB, Newport News, Virginia; R.A. Legg, UW-Madison/SRC, Madison, Wisconsin; R. Li, M. Marchlik, S.W. Moore, G. Neil, T. Powers, D.W. Sexton, I. Shin, M.D. Shinn, C. Tennant, B. Terzic, R.L. Walker, G.P. Williams, F.G. Wilson, S. Zhang, JLAB, Newport News, Virginia","Use Of Multipass Recirculation And Energy Recovery In CW SRF X-FEL Driver Accelerators",193 196,
tuoai1,"M. Katoh, UVSOR, Okazaki","Radiation From Laser-Modulated and Laser-Sliced Electron Bunches in UVSOR-II",183 187,
tuoai2,"G. De Ninno, E. Allaria, ELETTRA, Basovizza; M. Coreno, CNR - IMIP, Trieste; M.B. Danailov, ELETTRA, Basovizza; G. De Ninno, University of Nova Gorica, Nova Gorica; E. Ferrari, Università degli Studi di Trieste, Trieste; G. Geloni, European XFEL GmbH, Hamburg; E. Karantzoulis, C. Spezzani, M. Trovò, ELETTRA, Basovizza","The Elettra Storage-Ring Free-Electron Laser: a Source for FEL Studies and User Experiments",188 188,
tuob3,"H.X. Deng, J.H. Chen, C. Feng, D.G. Li, D. Wang, SINAP, Shanghai","A Comparison Study of High Harmonic Characterizations in EEHG Operation of SDUV-FEL",202 205,
tuob4,"D.F. Ratner, SLAC, Menlo Park, California; R.M. Bionta, LLNL, Livermore, California; A. Brachmann, F.-J. Decker, Y.T. Ding, D. Dowell, P. Emma, J.C. Frisch, Z. Huang, R.H. Iverson, J. Krzywinski, H. Loos, M. Messerschmidt, H.-D. Nuhn, T.J. Smith, J.L. Turner, J.J. Welch, W.E. White, J. Wu, SLAC, Menlo Park, California","Second and Third Harmonic Measurements at the Linac Coherent Light Source",206 209,
tuobi1,"J. Wu, SLAC, Menlo Park, California","LCLS-II: An Upgrade for the Linac Coherent Light Source",197 197,
tuobi2,"S. Schreiber, B. Faatz, J. Feldhaus, K. Honkavaara, DESY, Hamburg; J. Roßbach, Uni HH, Hamburg; R. Treusch, M. Vogt, DESY, Hamburg","FLASH Upgrade and First Results",198 201,
tuoc3,"M.D. Shinn, S.V. Benson, JLAB, Newport News, Virginia; R. Lalezari, ATF, Boulder; G. Neil, A.M. Watson, JLAB, Newport News, Virginia; P.J.M. van der Slot, Mesa+, Enschede","Modeling and Operation of an Edge-Outcoupled Free-Electron Laser",322 322,
tuoc4,"A.F.G. van der Meer, D. Oepts, FOM Rijnhuizen, Nieuwegein","Start-up and Radiation Characteristics of the FELIX Long-wavelength FEL in the Vicinity of a Tuning Gap",323 327,
tuoci1,"W. Seidel, FZD, Dresden","The THz-FEL FELBE at the Radiation Source ELBE",314 314,
