fraji1,"O. Frasciello, M. Zobov [INFN/LNF, Frascati (Roma), Italy] ","Numerical Calculations of Wake Fields and Impedances of LHC Collimators' Real Structures",178 182,
fraji3,"O. Kononenko, L. Ge, C. Ko, Z. Li, C.-K. Ng, L. Xiao [SLAC, Menlo Park, California, USA] ","Advances in Massively Parallel Electromagnetic Simulation Suite ACE3P",183 187,
frbji1,"O.I. Drivotin, D.A. Ovsyannikov [St. Petersburg State University, St. Petersburg, Russia] ","Space of Motion Integrals in Problems on Self-consistent Charged Particle Distributions",188 193,
mobji3,"Y. Hao [BNL, Upton, Long Island, New York, USA] ","Computation Requirement Towards the Future Electron Ion Collider, eRHIC",99 98,
modbc1,"Y. Li, W.X. Cheng, L. Yang [BNL, Upton, Long Island, New York, USA] ","Using Big Data in NSLS-II Storage Ring Commissioning",6 8,
modbc2,"H. Rafique, R.J. Barlow [University of Huddersfield, Huddersfield, United Kingdom] R.B. Appleby, S.C. Tygier [UMAN, Manchester, United Kingdom] R. Bruce, S. Redaelli, J.F. Wagner [CERN, Geneva, Switzerland] ","High Luminosity LHC Hollow Electron Lens Collimation using MERLIN",9 12,
modbc3,"R. Hipple, M. Berz [MSU, East Lansing, Michigan, USA] ","Implementation of Benchmarks for Precision Tracking in Storage Rings",13 16,
modbc4,"V. Senichev [FZJ, Jülich, Germany] S.N. Andrianov, A.N. Ivanov [St. Petersburg State University, St. Petersburg, Russia] M. Berz, E. Valetov [MSU, East Lansing, Michigan, USA] S. Chekmenev [RWTH, Aachen, Germany] ","Investigation of Lattice for Deuteron EDM Ring",17 19,
modwc3,"U. Locans [University of Latvia, Riga, Latvia] A. Adelmann, U. Locans, A. Suter [PSI, Villigen PSI, Switzerland] ","Dynamic Kernel Scheduler (DKS) - Accelerating the Object Oriented Particle Accelerator Library (OPAL)",20 22,
modwc4,"T. Zhang, J.H. Chen, B. Liu, D. Wang [SINAP, Shanghai, People's Republic of China] ","Python-Based High-Level Applications Development for Shanghai Soft X-Ray Free-Electron Laser",23 25,
thaji1,"A. Lehrach [FZJ, Jülich, Germany] ","Searching Electric Dipole Moments in Storage Rings - Challenges, Status and Computational Needs",128 131,
thaji2,"M. Gaisser, S. Haciomeroglu, Y.I. Kim, S. Lee, Y.K. Semertzidis [CAPP/IBS, Daejeon, Republic of Korea] Y.K. Semertzidis [KAIST, Daejeon, Republic of Korea] ","Precision Spin Tracking for Electric Dipole Moment Searches",132 135,
thbji1,"S. Russenschuck [CERN, Geneva, Switzerland] ","Establishing a Consistent Basis for Beam Physics, Accelerator Magnet Design, and Magnetic Measurements",136 141,
thbji3,"C.E. Mitchell [LBNL, Berkeley, California, USA] A. J. Dragt [UMD, College Park, Maryland, USA] ","Surface Methods for the Computation of Charged-particle Transfer Maps from Magnetic Field Data",142 146,
thcbc2,"S.A. Glukhov, E.B. Levichev [BINP SB RAS, Novosibirsk, Russia] ","Realistic Approach for Beam Dynamics Simulation with Synchrotron Radiation in High Energy Circular Lepton Colliders",147 150,
thcbc3,"K. Ohmi [KEK, Ibaraki, Japan] ","Theory and Simulation of Emittance Growth Caused by Space Charge and Lattice Induced Resonances",151 156,
thcwc1,"Y. Chen, H. De Gersem, E. Gjonaj, T. Weiland [TEMF, TU Darmstadt, Darmstadt, Germany] M. Dohlus [DESY, Hamburg, Germany] C. Hernandez-Garcia [JLab, Newport News, Virginia, USA] M. Krasilnikov, F. Stephan [DESY Zeuthen, Zeuthen, Germany] ","Modeling and Simulation of Photoemission Based Electron Sources",157 159,
thcwc3,"Y.-C. Chao [TRIUMF, Canada's National Laboratory for Particle and Nuclear Physics, Vancouver, Canada] ","Distributed Matching Scheme and a Flexible Deterministic Matching Algorithm for Arbitrary Systems",160 163,
thcwc4,"C. Gong, Y.-C. Chao [TRIUMF, Canada's National Laboratory for Particle and Nuclear Physics, Vancouver, Canada] ","A Novel Optimization Platform and its Applications to the TRIUMF Energy Recovery Linac",164 167,
thdbc1,"K. Makino, M. Berz, E. Valetov [MSU, East Lansing, Michigan, USA] ","Computation of Nonlinear Fields and Orbit and Spin Transfer Maps of Electrostatic Elements using Differential Algebras",168 171,
thdbc2,"E. Valetov, M. Berz [MSU, East Lansing, Michigan, USA] V. Senichev [FZJ, Jülich, Germany] ","Search for the Optimal Spin Decoherence Effect in a QFS Lattice",172 174,
thdwc1,"F. Massimo, A. Marocchino, A. Mostacci, L. Palumbo [University of Rome La Sapienza, Rome, Italy] E. Chiadroni, M. Ferrario [INFN/LNF, Frascati (Roma), Italy] A. Marocchino, F. Massimo, A. Mostacci, L. Palumbo [INFN-Roma, Roma, Italy] A.R. Rossi [Istituto Nazionale di Fisica Nucleare, Milano, Italy] ","Efficient Plasma Wakefield Acceleration Simulations via Kinetic-Hydro Code Architect",175 177,
tuaji1,"J. Qiang, C.E. Mitchell, R.D. Ryne, M. Venturini [LBNL, Berkeley, California, USA] ","Advanced Modeling of Accelerators for Next Generation Light Sources",26 30,
tubji2,"J.-L. Vay, R. Lehe (R. Lehé), H. Vincenti [LBNL, Berkeley, California, USA] B.B. Godfrey, I. Haber [UMD, College Park, Maryland, USA] P. Lee [Laboratoire de Physique des Gaz et des Plasmas, Universite Paris-Sud, Orsay, France] ","High-performance Modeling of Plasma-based Acceleration Using the Full PIC Method",31 36,
tucbc1,"H. Rafique, R.J. Barlow [University of Huddersfield, Huddersfield, United Kingdom] R.B. Appleby, S.C. Tygier [UMAN, Manchester, United Kingdom] R. Bruce, S. Redaelli [CERN, Geneva, Switzerland] ","MERLIN for LHC Collimation",37 39,
tucbc3,"B. Terzic (B. Terzić) [ODU, Norfolk, Virginia, USA] A. Arumugam, D. Ranjan, M. Zubair [ODU CS, Norfolk, Virginia, USA] F. Lin, V.S. Morozov, Y. Roblin, H. Zhang [JLab, Newport News, Virginia, USA] ","High-Fidelity Simulations of Long-Term Beam-Beam Dynamics on GPUs",40 43,
tucwc2,"D. Zheng, U. van Rienen [Rostock University, Faculty of Computer Science and Electrical Engineering, Rostock, Germany] J. Qiang [LBNL, Berkeley, California, USA] ","An Improved Parallel Poisson Solver for Space Charge Calculation in Beam Dynamics Simulation",44 47,
tucwc3,"U. Niedermayer, O. Boine-Frankenheim, H. De Gersem [TEMF, TU Darmstadt, Darmstadt, Germany] ","Computation of Beam Coupling Impedance in the Frequency Domain by Means of FIT and FEM",48 50,
tudbc2,"G. Shen, Z.Q. He [FRIB, East Lansing, Michigan, USA] ","Development Status of a Thin Lens Model for FRIB Online Model Service",51 54,
tudbc3,"S. Zheng [CIAE, Beijing, People's Republic of China] T. Planche, Y.-N. Rao [TRIUMF, Canada's National Laboratory for Particle and Nuclear Physics, Vancouver, Canada] ","Maximum Entropy Tomography Reconstruction",55 57,
tudwc1,"C.G. Li, J.H. Li, S. Zheng [CIAE, Beijing, People's Republic of China] ","The Electro-magnetic Field Simulation and Cavity Design of Ridgetron for High Power Electron Irradiation Accelerator",58 60,
webji1,"M. Borland, T.G. Berenc, L. Emery, R.R. Lindberg [ANL, Argonne, Ilinois, USA] ","Simultaneous Simulation of Multi-particle and Multi-bunch Collective Effects for the Aps Ultra-low Emittance Upgrade",61 65,
wecji1,"J.D. Kunz [IIT, Chicago, Illinois, USA] M. Berz [MSU, East Lansing, Michigan, USA] P. Snopok [Illinois Institute of Technology, Chicago, Illlinois, USA] ","Hybrid Methods for Muon Accelerator Simulations with Ionization Cooling",66 70,
wep03,"S. Sabounchi, H. Afarideh, R. Solhju [AUT, Tehran, Iran] M.R. Asadi [PPRC, Tehran, Iran] J.-S. Chai, M. Ghergherehchi [SKKU, Suwon, Republic of Korea] ","Stress and Strain Analysis of the 10 MeV Cyclotron Magnet",71 73,
wep08,"M. Mohamadian, H. Afarideh, S. Sabounchi, M. Salehi [AUT, Tehran, Iran] J.-S. Chai, M. Ghergherehchi [SKKU, Suwon, Republic of Korea] J.-S. Chai [KIRAMS, Seoul, Republic of Korea] ","Tuner System Optimization in 10 MeV Cyclotron Cavity",74 76,
wep09,"N. Rahimpour Kalkhoran, H. Afarideh, R. Solhju [AUT, Tehran, Iran] M. Ghergherehchi [SKKU, Suwon, Republic of Korea] ","Design and Simulation of 18 MeV Cyclotron Magnet by TOSCA Code",77 80,
wep10,"B. Yasatekin, O. Cakir, G. Turemen [Ankara University, Faculty of Sciences, Ankara, Turkey] E. Celebi [Bogazici University, Bebek / Istanbul, Turkey] G. Unel [UCI, Irvine, California, USA] B. Yasatekin [SNRTC, Ankara, Turkey] ","DEMIRCI: An RFQ Design Software",81 83,
wep11,"Y. Hu, L.R. Dalesio [BNL, Upton, Long Island, New York, USA] ","Diagnosing and Controls of NSLS-II: A Bright New Light for Science",84 86,
wep12,"L. Yang, Y. Hidaka, Y. Li [BNL, Upton, Long Island, New York, USA] G. Shen [FRIB, East Lansing, Michigan, USA] ","Single Particle Dynamics Simulation and Control for NSLS-II Commissioning",87 89,
wep13,"L. Yang [BNL, Upton, Long Island, New York, USA] ","The Complex TPSA and Normal Form Analysis in Tesla",90 92,
wep14,"J.H. Li [China Institute of Atomic Energy, Beijing, People's Republic of China] Z. Li [SCU, Chengdu, People's Republic of China] S. Zheng [CIAE, Beijing, People's Republic of China] ","The Simulation of the Room Temperature Cross-bar H Type Drift Tube Linac",93 96,
wep15,"L. Huang, Y.W. An, H.F. Ji, S. Wang [IHEP, Beijing, People's Republic of China] ","The Development of Injection and Extraction Software in the Rapid Cycling Synchrotron",97 99,
wep16,"H.F. Ji [IHEP, Beijing, People's Republic of China] ","Discussion on the Problems of the Online Optimization of the Luminosity of BEPCII With the Robust Conjugate Direction Search Method",100 102,
wep20,"Z. Zhang, D.Z. Chen, D. Li, M.R. Pan, C. Zuo [Huazhong University of Science and Technology, State Key Laboratory of Advanced Electromagnetic Engineering and Technology,, Hubei, People's Republic of China] ","3D Numerical Simulation of Extraction of a Large-power Negative Ion Source",103 105,
wep21,"Y.W. An, L. Huang, S. Wang, S.Y. Xu [IHEP, Beijing, People's Republic of China] ","Magnet Sorting of the CSNS/RCS Dipoles and Quadrupoles",106 108,
wep28,"G.A. Karamysheva, O. Karamyshev, S.A. Kostromin, N.A. Morozov, E.V. Samsonov, G. Shirkov [JINR, Dubna, Moscow Region, Russia] Y.F. Bi, Y. Song [ASIPP, Hefei, People's Republic of China] ","Design Studies of a Compact Superconducting Cyclotron for Proton Therapy",109 111,
wep32,"E. Brentegani, U. van Rienen [Rostock University, Faculty of Computer Science and Electrical Engineering, Rostock, Germany] W. Hillert, D. Sauerland [ELSA, Bonn, Germany] A. Meseck [HZB, Berlin, Germany] ","Simulation of the Distribution of Parasitic Ions in the Potential of an Electron Beam",112 114,
wep34,"S.A. Glukhov, E.B. Levichev, S.A. Nikitin, P.A. Piminov, D.N. Shatilov, S.V. Sinyatkin [BINP SB RAS, Novosibirsk, Russia] ","6D Tracking with Compute Unified Device Architecture (CUDA) Technology",115 117,
wep35,"K. Wang, B.C. Jiang, C.M. Luo, S.Q. Tian, M.Z. Zhang, Q.L. Zhang [SINAP, Shanghai, People's Republic of China] ","Parallel Optimization of Accelerator Toolbox by OpenMP and MPI",118 121,
wep36,"C. Liu, W. Ackermann, H. De Gersem, W.F.O. Müller, T. Weiland [TEMF, TU Darmstadt, Darmstadt, Germany] ","Numerical Calculation of Eigenmodes in PETRA 7-cell Cavity under precise Consideration of Coupler Structures",122 124,
wep38,"R. Huang, Q.K. Jia [USTC/NSRL, Hefei, Anhui, People's Republic of China] D. Filippetto, C.E. Mitchell, C. F. Papadopoulos, H.J. Qian, J. Qiang, F. Sannibale, J.W. Staples, M. Venturini [LBNL, Berkeley, California, USA] ","Off-axis Beam Dynamics Study in RF Photocathode Electron Sources",125 127,
