fraa01,"R. Paparella [INFN/LASA, Segrate (MI), Italy] ","Overview of Recent Tuner Development on Elliptical and Low-Beta Cavities",1425 1431,
fraa03,"E.R. Harms, C.M. Baffes, K. Carlson, B.E. Chase, D.J. Crawford, E. Cullerton, D.R. Edstrom, A. Hocker, A.L. Klebaner, M.J. Kucera, J.R. Leibfritz, J.N. Makara, D. McDowell, O.A. Nezhevenko, D.J. Nicklaus, Y.M. Pischalnikov, P.S. Prieto, J. Reid, W. Schappert, W.M. Soyars, P. Varghese, A. Warner [Fermilab, Batavia, Illinois, USA] ","High Gradient Performance in Fermilab ILC Cryomodule",1432 1436,
fraa04,"F. Furuta, B. Clasby, R.G. Eichhorn, B. Elmore, G.M. Ge, D. Gonnella, D.L. Hall, G.H. Hoffstaetter, R.P.K. Kaplan, J.J. Kaufman, M. Liepe, T.I. O'Connell, S. Posen, P. Quigley, D.M. Sabol, J. Sears, E.N. Smith, V. Veshcherevich [Cornell University (CLASSE), Cornell Laboratory for Accelerator-Based Sciences and Education, Ithaca, New York, USA] ","Performance of the Cornell ERL Main Linac Prototype Cryomodule",1437 1442,
fraa05,"F. Zhu, J.E. Chen, L.W. Feng, Y. Gao, J.K. Hao, S. Huang, L. Lin, K.X. Liu, S.W. Quan, F. Wang, X.D. Wen, D.H. Zhuang [PKU, Beijing, People's Republic of China] ","A 1.3 GHz Cryomodule with 2x9-Cell Cavity for SETF at Peking University",1443 1445,
fraa06,"S.J. Miller, B. Bird, G.D. Bryant, B. Bullock, N.K. Bultman, F. Casagrande, C. Compton, A. Facco, P.E. Gibson, J.D. Hulbert, D. Morris, J. Popielarski, L. Popielarski, M.A. Reaume, R.J. Rose, K. Saito, M. Shuptar, J.T. Simon, B.P. Tousignant, J. Wei, K. Witgen, T. Xu [FRIB, East Lansing, Michigan, USA] A. Facco [INFN/LNL, Legnaro (PD), Italy] ","Construction and Performance of FRIB Quarter Wave Prototype Cryomodule",1446 1452,
frba01,"H. Dzitko, N. Bazin, A. Bruniquel, P. Charon, S. Chel, G. Devanz, G. Disset, P. Gastinel, P. Hardy, J. Neyret, J. Relland, B. Renard, N. Sellami, M.R. Vallcorba-Carbonell [CEA/IRFU, Gif-sur-Yvette, France] N. Berton, P. Contrepois, V.M. Hennion, H. Jenhani, O. Piquet [CEA/DSM/IRFU, France] D. Gex, G. Phillips [F4E, Germany] A. Kasughai [Japan Atomic Energy Agency (JAEA), International Fusion Energy Research Center (IFERC), Rokkasho, Kamikita, Aomori, Japan] J. Knaster [IFMIF/EVEDA, Rokkasho, Japan] D. Regidor, F. Toral [CIEMAT, Madrid, Spain] ","Technical and Logistical Challenges for IFMIF-LIPAC Cryomodule Construction",1453 1459,
frba02,"F. Carra, A. Amorim Carvalho, K. Artoos, S. Atieh, I. Aviles Santillana, A.B. Boucherie, J.P. Brachet, K. Brodzinski, R. Calaga, O. Capatina, T. Capelli, L. Dassa, T. Dijoud, H.M. Durand, G. Favre, L.M.A. Ferreira, P. Freijedo Menendez, M. Garlasché (M. Garlaschè), M. Guinchard, N. Kuder, S.A.E. Langeslag, R. Leuxe, A. Macpherson, P. Minginette, E. Montesinos, F. Motschmann, C. Parente, L. Prever-Loiri, D. Pugnat, E. Rigutto, V. Rude, M. Sosin, G. Vandoni, G. Villiger, C. Zanoni [CERN, Geneva, Switzerland] S.A. Belomestnykh, S. Verdú-Andrés, Q. Wu, B. P. Xiao [BNL, Upton, Long Island, New York, USA] G. Burt [Lancaster University, Lancaster, United Kingdom] S.U. De Silva, J.R. Delayen, R.G. Olave, R.G. Olave, H. Park [ODU, Norfolk, Virginia, USA] T.J. Jones, N. Templeton [STFC/DL, Daresbury, Warrington, Cheshire, United Kingdom] Z. Li [SLAC, Menlo Park, California, USA] K.B. Marinov, S.M. Pattalwar [STFC/DL/ASTeC, Daresbury, Warrington, Cheshire, United Kingdom] T.H. Nicol [Fermilab, Batavia, Illinois, USA] A. Ratti [LBNL, Berkeley, California, USA] ","Crab Cavity and Cryomodule Development for HL-LHC",1460 1466,
frba03,"R.D. Kephart, B.E. Chase, I.V. Gonin, A. Grassellino, S. Kazakov, T.N. Khabiboulline, S. Nagaitsev, R.J. Pasquinelli, S. Posen, O.V. Pronitchev, A. Romanenko, V.P. Yakovlev [Fermilab, Batavia, Illinois, USA] S. Biedron, S.V. Milton, N. Sipahi [CSU, Fort Collins, Colorado, USA] S. Chattopadhyay [Northern Illinois Univerity, Dekalb, Illinois, USA] P. Piot [Northern Illinois University, DeKalb, Illinois, USA] ","SRF, Compact Accelerators for Industry & Society",1467 1473,
frba04,"R. Calaga, O. Brunner, A.C. Butterworth, E. Jensen [CERN, Geneva, Switzerland] ","SRF for Future Circular Colliders",1474 1480,
moaa01,"K. Saito, H. Ao, N.K. Bultman, E.E. Burkhardt, F. Casagrande, S. Chouhan, C. Compton, J.L. Crisp, K.D. Davidson, K. Elliott, F. Feyzi, A.D. Fox, P.E. Gibson, L. Hodges, K. Holland, G. Kiupel, S.M. Lidia, I.M. Malloch, D. Miller, S.J. Miller, D. Morris, D. Norton, J. Popielarski, L. Popielarski, A.P. Rauch, R.J. Rose, T. Russo, S. Shanab, M. Shuptar, S. Stark, G.J. Velianoff, D.R. Victory, J. Wei, T. Xu, T. Xu, Y. Yamazaki, Q. Zhao, Z. Zheng [FRIB, East Lansing, Michigan, USA] S.K. Chandrasekaran [Fermilab, Batavia, Illinois, USA] A. Facco [INFN/LNL, Legnaro (PD), Italy] K. Hosoyama, M. Masuzawa [KEK, Ibaraki, Japan] R.E. Laxdal [TRIUMF, Canada's National Laboratory for Particle and Nuclear Physics, Vancouver, Canada] M.X. Xu [IMP/CAS, Lanzhou, People's Republic of China] ","FRIB Project: Moving to Production Phase",99 98,
moaa02,"D. Reschke [DESY, Hamburg, Germany] ","Recent Progress with EU-XFEL",14 23,
moaa04,"S.A. Belomestnykh [BNL, Upton, Long Island, New York, USA] S.A. Belomestnykh [Stony Brook University, Stony Brook, USA] ","Overview of Recent SRF Developments for ERLs",24 30,
moaa05,"D. Jeon [IBS, Daejeon, Republic of Korea] ","Status of the RISP Superconducting Heavy Ion Accelerator",31 33,
moba03,"D. Gonnella, J.J. Kaufman, M. Liepe [Cornell University (CLASSE), Cornell Laboratory for Accelerator-Based Sciences and Education, Ithaca, New York, USA] ","Sensitivity of Niobium Superconducting RF Cavities to Magnetic Field",34 36,
moba04,"J.M. Köszegi, J. Knobloch, O. Kugeler [HZB, Berlin, Germany] ","High-Q Operation of SRF Cavities: The Impact of Thermocurrents on the RF Surface Resistance",37 40,
moba05,"M. Checchin [Fermilab, Batavia, Illinois, USA] ","Nature of Quality Factor Degradation in SRF Cavities due to Quench",41 47,
moba06,"A. Grassellino [Fermilab, Batavia, Illinois, USA] ","N Doping: Progress in Development and Understanding",48 54,
moba08,"M. Liepe, B. Clasby, R.G. Eichhorn, B. Elmore, F. Furuta, G.M. Ge, D. Gonnella, T. Gruber, D.L. Hall, G.H. Hoffstaetter, J.J. Kaufman, P.N. Koufalis, J.T. Maniscalco, T.I. O'Connell, P. Quigley, D.M. Sabol, J. Sears, E.N. Smith, V. Veshcherevich [Cornell University (CLASSE), Cornell Laboratory for Accelerator-Based Sciences and Education, Ithaca, New York, USA] ","Niobium Impurity-Doping Studies at Cornell and CM Cool-Down Dynamic Effect on Q0",55 60,
mopb001,"G. Ciovati, P. Dhakal, P. Kneisel, G.R. Myneni, J.K. Spradlin [JLab, Newport News, Virginia, USA] ","RF Performance of Ingot Niobium Cavities of Medium-Low Purity",61 65,
mopb002,"G.V. Eremeev, F.E. Hannon [JLab, Newport News, Virginia, USA] ","Observation of High Field Q-Slope in 3 GHz Nb Cavities",66 69,
mopb003,"H. Park, S.U. De Silva, J.R. Delayen [ODU, Norfolk, Virginia, USA] H. Park [JLab, Newport News, Virginia, USA] ","Superconducting Cavity for the Measurements of Frequency, Temperature, RF Field Dependence of the Surface Resistance",70 73,
mopb004,"P.N. Koufalis, D. Gonnella, M. Liepe, J.T. Maniscalco, I. Packtor [Cornell University (CLASSE), Cornell Laboratory for Accelerator-Based Sciences and Education, Ithaca, New York, USA] ","Understanding the Field Dependence of the Surface Resistance in Nitrogen-Doped Cavities",74 76,
mopb005,"J.T. Maniscalco, M. Liepe [Cornell University (CLASSE), Cornell Laboratory for Accelerator-Based Sciences and Education, Ithaca, New York, USA] ","Developing a Setup to Measure Field Dependence of BCS Surface Resistance",77 78,
mopb006,"J.T. Maniscalco, D. Gonnella, D.L. Hall, M. Liepe, E.N. Smith [Cornell University (CLASSE), Cornell Laboratory for Accelerator-Based Sciences and Education, Ithaca, New York, USA] ","Hc2 Measurements of Superconductors",79 81,
mopb007,"P. Xu, N.T. Wright [MSU, East Lansing, Michigan, USA] T.R. Bieler [Michigan State University, East Lansing, Michigan, USA] C. Compton [FRIB, East Lansing, Michigan, USA] ","Temperature Excursions in Nb Sheets With Imbedded Delamination Cracks",82 85,
mopb008,"T. Kubo [KEK, Ibaraki, Japan] ","Theoretical Field Limit and Cavity Surface Conditions: Nano-Scale Topography and Sub-millimeter Pit",86 89,
mopb009,"T. Kubo [KEK, Ibaraki, Japan] ","Model of Flux Trapping in Cooling Down Process",90 94,
mopb010,"W. Weingarten [Private Address, SERGY, France] R.G. Eichhorn [Cornell University (CLASSE), Cornell Laboratory for Accelerator-Based Sciences and Education, Ithaca, New York, USA] ","Field-Dependent Surface Resistance for Superconducting Niobium Accelerating Cavities: The Case of N-Doping",95 99,
mopb011,"J.A. Robbins, R.G. Eichhorn [Cornell University (CLASSE), Cornell Laboratory for Accelerator-Based Sciences and Education, Ithaca, New York, USA] ","How Uniform Are Cool-Downs?",100 104,
mopb013,"J. May-Mann, R.G. Eichhorn [Cornell University (CLASSE), Cornell Laboratory for Accelerator-Based Sciences and Education, Ithaca, New York, USA] ","Simulation of Geometry Dependent Flux Trapping",105 109,
mopb014,"M. Martinello, M. Checchin, A. Grassellino, O.S. Melnychuk, A. Romanenko, D.A. Sergatskov [Fermilab, Batavia, Illinois, USA] M. Checchin [Illinois Institute of Technology, Chicago, Illlinois, USA] J. Zasadzinski [IIT, Chicago, Illinois, USA] ","Magnetic Flux Expulsion in Horizontally Cooled Cavities",110 114,
mopb015,"M. Martinello, M. Checchin, A. Grassellino, O.S. Melnychuk, S. Posen, A. Romanenko, D.A. Sergatskov [Fermilab, Batavia, Illinois, USA] M. Checchin [Illinois Institute of Technology, Chicago, Illlinois, USA] J. Zasadzinski [IIT, Chicago, Illinois, USA] ","Trapped Flux Surface Resistance Analysis for Different Surface Treatments",115 119,
mopb018,"M. Wang, T.R. Bieler, D. Kang [Michigan State University, East Lansing, Michigan, USA] C. Compton [FRIB, East Lansing, Michigan, USA] D.C. Larbalestier, A. Polyanskii, Z-H. Sung [ASC, Tallahassee, Florida, USA] P.J. Lee [NHMFL, Tallahassee, Florida, USA] ","Introduction of Precisely Controlled Microstructural Defects into SRF Cavity Niobium Sheets and Their Impact on Local Superconducting Properties",120 124,
mopb019,"O. Kugeler, J. Knobloch, J.M. Köszegi [HZB, Berlin, Germany] A. Grassellino, O.S. Melnychuk, A. Romanenko, D.A. Sergatskov [Fermilab, Batavia, Illinois, USA] ","Horizontal Testing and Thermal Cycling of an N-Doped Tesla Type Cavity",125 128,
mopb020,"M. Checchin, A. Grassellino, M. Martinello, A. Romanenko [Fermilab, Batavia, Illinois, USA] M. Martinello [Illinois Institute of Technology, Chicago, Illlinois, USA] J. Zasadzinski [IIT, Chicago, Illinois, USA] ","Mean Free Path Dependence of the Trapped Flux Surface Resistance",129 134,
mopb023,"M. Fouaidy, F. Dubois, D. Longuevergne, O. Pochon, J.-F. Yaniche [IPN, Orsay, France] ","Detectors Sensing Second Events Induced by Thermal Quenches of SRF Cavities in He II",135 139,
mopb024,"R.A. Kostin, A. Kanareykin [Euclid TechLabs, LLC, Solon, Ohio, USA] I.V. Gonin [Fermilab, Batavia, Illinois, USA] E.N. Zaplatin [FZJ, Jülich, Germany] ","SRF Cavity Breakdown Calculation Procedure Using FEA-Software",140 143,
mopb027,"A. Vostrikov, A. Grassellino, A. Romanenko [Fermilab, Batavia, Illinois, USA] L. Horyn, Y.K. Kim, A. Vostrikov [University of Chicago, Chicago, Illinois, USA] T. Murat [University of Wisconsin-Madison, Madison, USA] ","Modifications of Superconducting Properties of Niobium Caused by Nitrogen Doping of Ultra-High Quality Factor Cavities",144 148,
mopb028,"A. Grassellino, S. Aderhold, M. Checchin, A.C. Crawford, C.J. Grimm, A. Hocker, M. Martinello, O.S. Melnychuk, J.P. Ozelis, S. Posen, A.M. Rowe, D.A. Sergatskov, N. Solyak, R.P. Stanek, G. Wu [Fermilab, Batavia, Illinois, USA] D. Gonnella [Cornell University (CLASSE), Cornell Laboratory for Accelerator-Based Sciences and Education, Ithaca, New York, USA] J.M. Köszegi [HZB, Berlin, Germany] M. Liepe [Cornell University, Ithaca, New York, USA] ","Preservation of Very High Quality Factors of 1.3 GHz Nine Cell Cavities From Bare Vertical Test to Dressed Horizontal Test",149 153,
mopb030,"P. Dhakal, G. Ciovati, G.R. Myneni [JLab, Newport News, Virginia, USA] ","Measurements of Thermal Impedance on Superconducting Radiofrequency Cavities",154 158,
mopb033,"M. Liepe, P. Bishop, H. Conklin, R.G. Eichhorn, F. Furuta, G.M. Ge, D. Gonnella, T. Gruber, D.L. Hall, G.H. Hoffstaetter, J.J. Kaufman, G. Kulina, J.T. Maniscalco, T.I. O'Connell, P. Quigley, D.M. Sabol, J. Sears, V. Veshcherevich [Cornell University (CLASSE), Cornell Laboratory for Accelerator-Based Sciences and Education, Ithaca, New York, USA] M. Checchin, A.C. Crawford, A. Grassellino, C.J. Grimm, A. Hocker, M. Martinello, O.S. Melnychuk, J.P. Ozelis, A. Romanenko, A.M. Rowe, D.A. Sergatskov, W.M. Soyars, R.P. Stanek, G. Wu [Fermilab, Batavia, Illinois, USA] E. Daly, G.K. Davis, M.A. Drury, J.F. Fischer, A.D. Palczewski, C.E. Reece [JLab, Newport News, Virginia, USA] M.C. Ross [SLAC, Menlo Park, California, USA] ","LCLS-II SRF Cavity Processing Protocol Development and Baseline Cavity Performance Demonstration",159 163,
mopb035,"R.L. Geng, J.F. Fischer, E.A. McEwen, O. Trofimova [JLab, Newport News, Virginia, USA] ","Nature and Implication of Found Actual Particulates on the Inner Surface of Cavities in a Full-Scale Cryomodule Previously Operated With Beams",164 168,
mopb036,"Z.Q. Yang, L. Lin, X.Y. Lu, W.W. Tan, D.Y. Yang, J. Zhao [PKU, Beijing, People's Republic of China] ","TOF-SIMS Study of Nitrogen Doping Niobium Samples",169 173,
mopb039,"A.D. Palczewski, P. Dhakal, C.E. Reece [JLab, Newport News, Virginia, USA] ","Analysis of BCS RF Loss Dependence on N-Doping Protocols",174 177,
mopb040,"A.D. Palczewski, G.K. Davis [JLab, Newport News, Virginia, USA] F. Furuta, G.M. Ge, D. Gonnella, M. Liepe [Cornell University (CLASSE), Cornell Laboratory for Accelerator-Based Sciences and Education, Ithaca, New York, USA] ","Performance of Dressed Cavities for the Jefferson Laboratory LCLS-II Prototype Cryomodule - With Comparison to the Pre-Dressed Performance",178 181,
mopb041,"D. Gonnella, B. Clasby, R.G. Eichhorn, B. Elmore, F. Furuta, G.M. Ge, D.L. Hall, Y. He, G.H. Hoffstaetter, J.J. Kaufman, P.N. Koufalis, M. Liepe, J.T. Maniscalco, T.I. O'Connell, P. Quigley, D.M. Sabol, E.N. Smith, V. Veshcherevich [Cornell University (CLASSE), Cornell Laboratory for Accelerator-Based Sciences and Education, Ithaca, New York, USA] A. Grassellino, C.J. Grimm, J.P. Holzbauer, O.S. Melnychuk, Y.M. Pischalnikov, A. Romanenko, W. Schappert, D.A. Sergatskov [Fermilab, Batavia, Illinois, USA] A.D. Palczewski, C.E. Reece [JLab, Newport News, Virginia, USA] ","Cryomodule Testing of Nitrogen-Doped Cavities",182 186,
mopb042,"D. Gonnella, T. Gruber, J.J. Kaufman, P.N. Koufalis, M. Liepe, J.T. Maniscalco, B. Yu [Cornell University (CLASSE), Cornell Laboratory for Accelerator-Based Sciences and Education, Ithaca, New York, USA] ","Fundamental Studies on Doped SRF Cavities",187 190,
mopb045,"D. Kang, D.C. Baars, T.R. Bieler [Michigan State University, East Lansing, Michigan, USA] C. Compton [FRIB, East Lansing, Michigan, USA] A. Mapar, F. Pourboghrat [MSU, East Lansing, Michigan, USA] ","Study of Slip and Deformation in High Purity Single Crystal Nb for Accelerator Cavities",191 195,
mopb047,"M. Basovic, S. Popovic (S. Popović), M. Tomovic, L. Vuskovic (L. Vušković) [ODU, Norfolk, Virginia, USA] F. Cuckov (F. Čučkov), A. Samolov [University of Massachusetts Boston, Boston, Massachusetts, USA] ","Secondary Electron Yield of Electron Beam Welded Areas of SRF Cavities",196 200,
mopb049,"T. Junginger [TRIUMF, Canada's National Laboratory for Particle and Nuclear Physics, Vancouver, Canada] P. Horn [TU Dresden, Dresden, Germany] T. Koettig, K.C. Liao, A. Macpherson [CERN, Geneva, Switzerland] B.J. Peters [KIT, Karlsruhe, Germany] ","High Flux Three Dimensional Heat Transport in Superfluid Helium and Its Application to a Trilateration Algorithm for Quench Localization With OSTs",201 204,
mopb050,"R.E. Laxdal, T.J. Buck, T. Junginger, P. Kolb, Y.Y. Ma, L. Yang, Z.Y. Yao [TRIUMF, Canada's National Laboratory for Particle and Nuclear Physics, Vancouver, Canada] S.H. Abidi [University of Toronto, Toronto, Ontario, Canada] R. Kiefl [UBC  TRIUMF, Vancouver, British Columbia, Canada] ","Characterization of SRF Materials at the TRIUMF muSR Facility",205 209,
mopb051,"S. Gheidi [UBC, Vancouver, B.C., Canada] T.J. Buck, T. Junginger, R.E. Laxdal, G. Morris [TRIUMF, Canada's National Laboratory for Particle and Nuclear Physics, Vancouver, Canada] M. Dehn [TUM/Physik, Garching bei München, Germany] R. Kiefl [UBC  TRIUMF, Vancouver, British Columbia, Canada] ","Muon Spin Rotation on Treated Nb Samples in Parallel Field Geometry",210 213,
mopb052,"S. Chetri, D.C. Larbalestier, Z-H. Sung [ASC, Tallahassee, Florida, USA] P. Dhakal [JLab, Newport News, Virginia, USA] P.J. Lee [NHMFL, Tallahassee, Florida, USA] ","Determination of Bulk and Surface Superconducting Properties of N2-Doped Cold Worked, Heat Treated and Electro-polished SRF Grade Niobium",214 218,
mopb054,"Z. Zhao, T.R. Bieler, D. Kang [Michigan State University, East Lansing, Michigan, USA] C. Compton [FRIB, East Lansing, Michigan, USA] ","An Investigation of Correlations Between Mechanical and Microstructural Properties of High Purity Polycrystalline Niobium",219 222,
mopb055,"Y. Trenikhina, A. Grassellino, O.S. Melnychuk, A. Romanenko [Fermilab, Batavia, Illinois, USA] ","Characterization of Nitrogen Doping Recipes for the Nb SRF Cavities",223 227,
mopb057,"A. Mapar, F. Pourboghrat [MSU, East Lansing, Michigan, USA] T.R. Bieler, D. Kang [Michigan State University, East Lansing, Michigan, USA] C. Compton [FRIB, East Lansing, Michigan, USA] ","Crystal Plasticity Modeling of Single Crystal Nb",228 232,
mopb058,"S. Lagotzky, G. Mueller (G. Müller) [Bergische Universitaet Wuppertal, Wuppertal, Germany] ","Field Emission From a Thermally Oxidized Nb Sample",233 236,
mopb059,"S. Lagotzky, G. Mueller (G. Müller) [Bergische Universitaet Wuppertal, Wuppertal, Germany] A. Navitski [DESY, Hamburg, Germany] A.L. Prudnikava, Y. Tamashevich [University of Hamburg, Institut fuer Experimentalphysik, Hamburg, Germany] ","Field Emission Investigation of Centrifugal-Barrel-Polished Nb Samples",237 241,
mopb060,"T. Xin [Stony Brook University, Stony Brook, USA] S.A. Belomestnykh, I. Ben-Zvi, J.C. Brutus, V. Litvinenko, I. Pinayev, J. Skaritka, Q. Wu, B. P. Xiao [BNL, Upton, Long Island, New York, USA] ","A GPU Based 3D Particle Tracking Code for Multipacting Simulation",242 245,
mopb061,"F. Marhauser, S.V. Benson, D. Douglas [JLab, Newport News, Virginia, USA] L.J.P. Ament [ASML US Inc., Wilton, CT, USA] ","Suppression of Upstream Field Emission in RF Accelerators",246 249,
mopb063,"C. Madec [CEA, Gif-sur-Yvette, France] N. Bazin, L. Boudjaoui, R. Cubizolles, G. Ferrand, P. Hardy, C. Pes, N. Sellami [CEA/IRFU, Gif-sur-Yvette, France] P. Bertrand [GANIL, Caen, France] P. Bredy (P. Brédy), B. Gastineau, N. Pichoff [CEA/DSM/IRFU, France] ","Design of the Superconducting LINAC for SARAF",250 254,
mopb065,"M. Busch, M. Amberg, M. Basten, F.D. Dziuba, H. Podlech, U. Ratzinger [IAP, Frankfurt am Main, Germany] M. Amberg [HIM, Mainz, Germany] ","Recent Measurements on the SC 325 MHz CH-Cavity",255 257,
mopb066,"M. Basten, M. Busch, F.D. Dziuba, D. Mäder, H. Podlech, M. Schwarz [IAP, Frankfurt am Main, Germany] M. Amberg, K. Aulenbacher, M. Miski-Oglu [HIM, Mainz, Germany] W.A. Barth, V. Gettmann, M. Heilmann, S. Mickat [GSI, Darmstadt, Germany] ","R&D Status of the New Superconducting CW Heavy Ion LINAC@GSI",258 261,
mopb067,"M. Miski-Oglu, M. Amberg, K. Aulenbacher, V. Gettmann [HIM, Mainz, Germany] W.A. Barth, M. Heilmann, S. Mickat, S. Yaramyshev [GSI, Darmstadt, Germany] M. Basten, D. Bänsch, F.D. Dziuba, H. Podlech, U. Ratzinger [IAP, Frankfurt am Main, Germany] ","Steps Towards Superconducting CW-LINAC for Heavy Ions at GSI",262 264,
mopb068,"P.N. Ostroumov, Z.A. Conway, B. Mustapha [ANL, Argonne, USA] B. Erdelyi [Northern Illinois University, DeKalb, Illinois, USA] ","Pulsed SC Ion Linac as an Injector to Booster of Electron Ion Collider",265 267,
mopb069,"S.-H. Kim, M. Doleans, J. Galambos, M.P. Howell [ORNL, Oak Ridge, Tennessee, USA] J.D. Mammosser [ORNL RAD, Oak Ridge, Tennessee, USA] ","Superconducting Linac Upgrade Plan for the Second Target Station Project at SNS",268 271,
mopb070,"J.Y. Zhai, J. Gao, T.M. Huang, Z.C. Liu, Z.H. Mi, P. Sha, Y. Sun, H.J. Zheng [IHEP, Beijing, People's Republic of China] S.A. Belomestnykh [BNL, Upton, Long Island, New York, USA] S.A. Belomestnykh [Stony Brook University, Stony Brook, USA] C. Pagani [INFN/LASA, Segrate (MI), Italy] C. Pagani [Università degli Studi di Milano  INFN, Segrate, Italy] ","Preliminary Conceptual Design of the CEPC SRF System",272 275,
mopb071,"R. Edinger [PAVAC, Richmond, B.C., Canada] R.E. Laxdal, L. Yang [TRIUMF, Canada's National Laboratory for Particle and Nuclear Physics, Vancouver, Canada] ","Technology Readiness Levels Applied to Current SRF Accelerator Technology for ADS",276 280,
mopb072,"A. Navitski, E. Elsen, V. Myronenko, J. Schaffran, O. Turkot [DESY, Hamburg, Germany] Y. Tamashevich [University of Hamburg, Institut fuer Experimentalphysik, Hamburg, Germany] ","Characterization of Surface Defects on EXFEL Series and ILC-Higrade Cavities",281 285,
mopb073,"A. Navitski, E. Elsen, B. Foster [DESY, Hamburg, Germany] B. Foster, A.L. Prudnikava, Y. Tamashevich [University of Hamburg, Institut fuer Experimentalphysik, Hamburg, Germany] ","Surface Analyses and Optimization of Centrifugal Barrel Polishing of Nb Cavities",286 290,
mopb074,"A. Macpherson, K.G. Hernández-Chahín, C. Jarrige, P. Maesen, F. Pillon, K.M. Schirm, R. Torres-Sanchez, N. Valverde Alonso [CERN, Geneva, Switzerland] K.G. Hernández-Chahín [DCI-UG, León, Mexico] ","CERN's Bulk Niobium High Gradient SRF Programme: Developments and Recent Cold Test Results",291 295,
mopb075,"A. Matheisen, N. Krupka, S. Saegebarth, P. Schilling, N. Steinhau-Kuehl (N. Steinhau-Kühl), B. van der Horst [DESY, Hamburg, Germany] ","Experiences on Retreatment of EU-XFEL Series Cavities at DESY",296 300,
mopb076,"C.G. Maiano, C. Albrecht, R. Bospflug, J. Branlard, L. Butkowski (Ł. Butkowski), T. Delfs, J. Eschke, A. Goessel (A. Gössel), F. Hoffmann, M. Huening (M. Hüning), K. Jensch, R. Jonas, R. Klos, D. Kostin, W. Maschmann, A. Matheisen, U. Mavric (U. Mavrič), W.-D. Moeller (W.-D. Möller), C. Mueller (C. Müller), K. Mueller, B. Petersen, P. Pierini, J. Rothenburg, O. Sawlanski, M. Schmoekel (M. Schmökel), A.A. Sulimov, E. Vogel [DESY, Hamburg, Germany] A. Bosotti, M. Moretti, R. Paparella, P. Pierini, D. Sertore [INFN/LASA, Segrate (MI), Italy] E.R. Harms [Fermilab, Batavia, Illinois, USA] C.R. Montiel [ANL, Argonne, Illinois, USA] S. Pivovarov [BINP SB RAS, Novosibirsk, Russia] ","Horizontal RF Test of a Fully Equipped 3.9 GHz Cavity for the European XFEL in the DESY AMTF",301 305,
mopb077,"D. Sertore, M. Bertucci, A. Bosotti, J.F. Chen, C.G. Maiano, P. Michelato, L. Monaco, M. Moretti, R. Paparella, P. Pierini [INFN/LASA, Segrate (MI), Italy] A. Matheisen, M. Schmoekel (M. Schmökel) [DESY, Hamburg, Germany] C. Pagani [Università degli Studi di Milano  INFN, Segrate, Italy] ","Vertical Tests of XFEL 3rd Harmonic Cavities",306 310,
mopb078,"K. Papke, F. Gerigk, S. Horvath-Mikulas, S. Papadopoulos, E. Pilicer, F. Pillon [CERN, Geneva, Switzerland] U. van Rienen [Rostock University, Faculty of Computer Science and Electrical Engineering, Rostock, Germany] ","Mode Sensitivity Analysis of 704.4 MHz Superconducting RF Cavities",311 315,
mopb079,"J. Schaffran, S. Aderhold, D. Reschke, L. Steder, N. Walker [DESY, Hamburg, Germany] L. Monaco [INFN/LASA, Segrate (MI), Italy] ","Analysis of the Test Rate for European XFEL Series Cavities",316 318,
mopb080,"M. Wiencek, K. Kasprzak, A. Zwozniak [IFJ-PAN, Kraków, Poland] D. Kostin, D. Reschke, N. Walker [DESY, Hamburg, Germany] ","Update and Status of Test Results of the XFEL Series Accelerator Modules",319 323,
mopb083,"G.M. Ge, R.G. Eichhorn, F. Furuta [Cornell University (CLASSE), Cornell Laboratory for Accelerator-Based Sciences and Education, Ithaca, New York, USA] ","Cooling Front Measurement of a 9-Cell Cavity via the Multi-Cell Temperature-Mapping System at Cornell University",324 327,
mopb084,"G.M. Ge, R.G. Eichhorn, B. Elmore, F. Furuta, D. Gonnella, T. Gruber, G.H. Hoffstaetter, J.J. Kaufman, M. Liepe, T.I. O'Connell, J. Sears, E.N. Smith [Cornell University (CLASSE), Cornell Laboratory for Accelerator-Based Sciences and Education, Ithaca, New York, USA] ","Performance of Nitrogen-Doped 9-Cell SRF Cavities in Vertical Tests at Cornell University",328 332,
mopb085,"G.M. Ge, F. Furuta, G.H. Hoffstaetter, M. Liepe, J. Sears, V. Veshcherevich [Cornell University (CLASSE), Cornell Laboratory for Accelerator-Based Sciences and Education, Ithaca, New York, USA] ","Efforts of the Improvement of Cavity Q-Value by Plasma Cleaning Technology: Plan and Results From Cornell University",333 336,
mopb086,"N. Walker, D. Reschke, J. Schaffran, L. Steder [DESY, Hamburg, Germany] L. Monaco [INFN/LASA, Segrate (MI), Italy] M. Wiencek [IFJ-PAN, Kraków, Poland] ","Update and Status of Vertical Test Results of the European XFEL Series Cavities",337 341,
mopb087,"N. Solyak, T.T. Arkan, B.E. Chase, A.C. Crawford, E. Cullerton, I.V. Gonin, A. Grassellino, C.J. Grimm, A. Hocker, J.P. Holzbauer, T.N. Khabiboulline, O.S. Melnychuk, J.P. Ozelis, T.J. Peterson, Y.M. Pischalnikov, K.S. Premo, A. Romanenko, A.M. Rowe, W. Schappert, D.A. Sergatskov, R.P. Stanek, G. Wu [Fermilab, Batavia, Illinois, USA] ","Integrated High-Power Tests of Dressed N-doped 1.3 GHz SRF Cavities for LCLS-II",342 346,
mopb088,"P. Kolb, R.E. Laxdal, Y. Ma, Z.Y. Yao, V. Zvyagintsev [TRIUMF, Canada's National Laboratory for Particle and Nuclear Physics, Vancouver, Canada] ","HOM Measurements on the ARIEL eLINAC Cryomodules",347 349,
